,publishedAt,channelId,title,description,thumbnails,channelTitle,liveBroadcastContent,publishTime,videoID,embeds,category
39,2025-09-28T16:12:46Z,UCPk29gUc_ltOGQ6f3Lh5kCg,Reelblack Live - Assata Shakur Tribute (9/27/2025),"Reelblack Founder Mike D. is hanging out live on a Saturday night. Discussing current events, answering questions and watching ...","{'default': {'url': 'https://i.ytimg.com/vi/xfVeT_TdJCs/default.jpg', 'width': 120, 'height': 90}, 'medium': {'url': 'https://i.ytimg.com/vi/xfVeT_TdJCs/mqdefault.jpg', 'width': 320, 'height': 180}, 'high': {'url': 'https://i.ytimg.com/vi/xfVeT_TdJCs/hqdefault.jpg', 'width': 480, 'height': 360}}",Reelblack One,none,2025-09-28T16:12:46Z,xfVeT_TdJCs,"<iframe width=""480"" height=""270"" src=""//www.youtube.com/embed/xfVeT_TdJCs"" frameborder=""0"" allow=""accelerometer; autoplay; clipboard-write; encrypted-media; gyroscope; picture-in-picture; web-share"" referrerpolicy=""strict-origin-when-cross-origin"" allowfullscreen></iframe>",Entertainment
51,2025-09-28T06:10:09Z,UCHVBLMcvOgDtFEF2bToQLqw,Skip to content Charlie Kirk snake eyes assassination scene MK Ultra,Skip to content Charlie Kirk snake eyes assassination scene MK Ultra.,"{'default': {'url': 'https://i.ytimg.com/vi/Y_AheGyEhBM/default.jpg', 'width': 120, 'height': 90}, 'medium': {'url': 'https://i.ytimg.com/vi/Y_AheGyEhBM/mqdefault.jpg', 'width': 320, 'height': 180}, 'high': {'url': 'https://i.ytimg.com/vi/Y_AheGyEhBM/hqdefault.jpg', 'width': 480, 'height': 360}}",We Woke Now,none,2025-09-28T06:10:09Z,Y_AheGyEhBM,"<iframe width=""480"" height=""270"" src=""//www.youtube.com/embed/Y_AheGyEhBM"" frameborder=""0"" allow=""accelerometer; autoplay; clipboard-write; encrypted-media; gyroscope; picture-in-picture; web-share"" referrerpolicy=""strict-origin-when-cross-origin"" allowfullscreen></iframe>",Social Issues
37,2025-09-27T21:17:08Z,UCMe6CgCi6TSZX1tUxuUvCGg,Remembering ASSATA SHAKUR with Proffessor Bayyinah Bello,"WHO WAS ASSATA SHAKUR? Assata Shakur (born JoAnne Deborah Byron, later known as JoAnne Chesimard) is an African ...","{'default': {'url': 'https://i.ytimg.com/vi/PRUPubN0iC0/default.jpg', 'width': 120, 'height': 90}, 'medium': {'url': 'https://i.ytimg.com/vi/PRUPubN0iC0/mqdefault.jpg', 'width': 320, 'height': 180}, 'high': {'url': 'https://i.ytimg.com/vi/PRUPubN0iC0/hqdefault.jpg', 'width': 480, 'height': 360}}",Pan-African Daily TV -PADTV,none,2025-09-27T21:17:08Z,PRUPubN0iC0,"<iframe width=""480"" height=""270"" src=""//www.youtube.com/embed/PRUPubN0iC0"" frameborder=""0"" allow=""accelerometer; autoplay; clipboard-write; encrypted-media; gyroscope; picture-in-picture; web-share"" referrerpolicy=""strict-origin-when-cross-origin"" allowfullscreen></iframe>",Current Events
53,2025-09-27T19:15:06Z,UCIwGnOXoSXEI7Tooz3iKq5w,EP 62. DISGRACEFUL ! Experts CAUGHT Lying in their paper about Phoenicians...,Join this channel to get access to perks: https://www.youtube.com/channel/UCIwGnOXoSXEI7Tooz3iKq5w/join ...,"{'default': {'url': 'https://i.ytimg.com/vi/yvSLnQvqvW4/default.jpg', 'width': 120, 'height': 90}, 'medium': {'url': 'https://i.ytimg.com/vi/yvSLnQvqvW4/mqdefault.jpg', 'width': 320, 'height': 180}, 'high': {'url': 'https://i.ytimg.com/vi/yvSLnQvqvW4/hqdefault.jpg', 'width': 480, 'height': 360}}",Without History,none,2025-09-27T19:15:06Z,yvSLnQvqvW4,"<iframe width=""480"" height=""270"" src=""//www.youtube.com/embed/yvSLnQvqvW4"" frameborder=""0"" allow=""accelerometer; autoplay; clipboard-write; encrypted-media; gyroscope; picture-in-picture; web-share"" referrerpolicy=""strict-origin-when-cross-origin"" allowfullscreen></iframe>",History
42,2025-09-27T15:53:08Z,UC4lH-odQ5ll-85fkpWxDYmA,Inside the richest west African country you didn’t know existed,,"{'default': {'url': 'https://i.ytimg.com/vi/s4nVjrPGy94/default.jpg', 'width': 120, 'height': 90}, 'medium': {'url': 'https://i.ytimg.com/vi/s4nVjrPGy94/mqdefault.jpg', 'width': 320, 'height': 180}, 'high': {'url': 'https://i.ytimg.com/vi/s4nVjrPGy94/hqdefault.jpg', 'width': 480, 'height': 360}}",Steven Ndukwu,none,2025-09-27T15:53:08Z,s4nVjrPGy94,"<iframe width=""480"" height=""270"" src=""//www.youtube.com/embed/s4nVjrPGy94"" frameborder=""0"" allow=""accelerometer; autoplay; clipboard-write; encrypted-media; gyroscope; picture-in-picture; web-share"" referrerpolicy=""strict-origin-when-cross-origin"" allowfullscreen></iframe>",Productivity
29,2025-09-27T15:41:10Z,UC__wkIWEfbnTAYVT8j6gfPg,Origins of Ancient Egypt #kemet #africanhistory #ancientegypt #history,,"{'default': {'url': 'https://i.ytimg.com/vi/6_GbuDpE_bk/default.jpg', 'width': 120, 'height': 90}, 'medium': {'url': 'https://i.ytimg.com/vi/6_GbuDpE_bk/mqdefault.jpg', 'width': 320, 'height': 180}, 'high': {'url': 'https://i.ytimg.com/vi/6_GbuDpE_bk/hqdefault.jpg', 'width': 480, 'height': 360}}",Know Thyself,none,2025-09-27T15:41:10Z,6_GbuDpE_bk,"<iframe width=""480"" height=""270"" src=""//www.youtube.com/embed/6_GbuDpE_bk"" frameborder=""0"" allow=""accelerometer; autoplay; clipboard-write; encrypted-media; gyroscope; picture-in-picture; web-share"" referrerpolicy=""strict-origin-when-cross-origin"" allowfullscreen></iframe>",History
23,2025-09-26T18:20:14Z,UCOhiR-6Y-MZtMERKRENrcRw,GoBlack is Alive! Headed back to Africa for a wife,"This channel is to bring the awareness to the world of the beautiful continent of Africa. My intentions are to show the development, ...","{'default': {'url': 'https://i.ytimg.com/vi/Qyff_KbxsH0/default.jpg', 'width': 120, 'height': 90}, 'medium': {'url': 'https://i.ytimg.com/vi/Qyff_KbxsH0/mqdefault.jpg', 'width': 320, 'height': 180}, 'high': {'url': 'https://i.ytimg.com/vi/Qyff_KbxsH0/hqdefault.jpg', 'width': 480, 'height': 360}}",GoBlack2Africa ,none,2025-09-26T18:20:14Z,Qyff_KbxsH0,"<iframe width=""480"" height=""270"" src=""//www.youtube.com/embed/Qyff_KbxsH0"" frameborder=""0"" allow=""accelerometer; autoplay; clipboard-write; encrypted-media; gyroscope; picture-in-picture; web-share"" referrerpolicy=""strict-origin-when-cross-origin"" allowfullscreen></iframe>",Travel
41,2025-09-25T13:32:53Z,UCDsOKnUQnQek7-G7Xc5kB8Q,Freedom of Speech vs. Freedom of Consequences | Social Proof Podcast #541,"Entrepreneurs are told to “stick to business”… but should we really stay quiet about politics, relationships, and life? In this ...","{'default': {'url': 'https://i.ytimg.com/vi/_UGcw1CMoI4/default.jpg', 'width': 120, 'height': 90}, 'medium': {'url': 'https://i.ytimg.com/vi/_UGcw1CMoI4/mqdefault.jpg', 'width': 320, 'height': 180}, 'high': {'url': 'https://i.ytimg.com/vi/_UGcw1CMoI4/hqdefault.jpg', 'width': 480, 'height': 360}}",Social Proof,none,2025-09-25T13:32:53Z,_UGcw1CMoI4,"<iframe width=""480"" height=""270"" src=""//www.youtube.com/embed/_UGcw1CMoI4"" frameborder=""0"" allow=""accelerometer; autoplay; clipboard-write; encrypted-media; gyroscope; picture-in-picture; web-share"" referrerpolicy=""strict-origin-when-cross-origin"" allowfullscreen></iframe>",Productivity
25,2025-09-24T15:13:56Z,UC12lU5ymIvSpgl8KntDQUQA,The King Who Made The World Recognize Africa [Kickstarter Promo],Kickstarter: https://www.kickstarter.com/projects/83432348/home-team-history-presents-kings-of-africa Patreon: ...,"{'default': {'url': 'https://i.ytimg.com/vi/Dk5mEdB3x1w/default.jpg', 'width': 120, 'height': 90}, 'medium': {'url': 'https://i.ytimg.com/vi/Dk5mEdB3x1w/mqdefault.jpg', 'width': 320, 'height': 180}, 'high': {'url': 'https://i.ytimg.com/vi/Dk5mEdB3x1w/hqdefault.jpg', 'width': 480, 'height': 360}}",HomeTeam History,none,2025-09-24T15:13:56Z,Dk5mEdB3x1w,"<iframe width=""480"" height=""270"" src=""//www.youtube.com/embed/Dk5mEdB3x1w"" frameborder=""0"" allow=""accelerometer; autoplay; clipboard-write; encrypted-media; gyroscope; picture-in-picture; web-share"" referrerpolicy=""strict-origin-when-cross-origin"" allowfullscreen></iframe>",History
2,2025-09-21T15:08:50Z,UCW5NNtTSY5z5mENZ8dt-RCw,This Country Knows How To Party - PNG 50th Anniversary,"Papua New Guinea 50th anniversary. Join me in Port Moresby, the capital of Papua New Guinea, as the nation celebrates its 50th ...","{'default': {'url': 'https://i.ytimg.com/vi/kYtLe34T9mA/default.jpg', 'width': 120, 'height': 90}, 'medium': {'url': 'https://i.ytimg.com/vi/kYtLe34T9mA/mqdefault.jpg', 'width': 320, 'height': 180}, 'high': {'url': 'https://i.ytimg.com/vi/kYtLe34T9mA/hqdefault.jpg', 'width': 480, 'height': 360}}",ACE ,none,2025-09-21T15:08:50Z,kYtLe34T9mA,"<iframe width=""480"" height=""270"" src=""//www.youtube.com/embed/kYtLe34T9mA"" frameborder=""0"" allow=""accelerometer; autoplay; clipboard-write; encrypted-media; gyroscope; picture-in-picture; web-share"" referrerpolicy=""strict-origin-when-cross-origin"" allowfullscreen></iframe>",Travel
4,2025-09-20T17:00:52Z,UCJmmxwdAsR7lD8fBA_qbEMw,The Man Apartheid Feared More Than Mandela,"On the morning of March 21, 1960, Robert Sobukwe rose before dawn in his modest Soweto home. His wife, Veronica, boiled ...","{'default': {'url': 'https://i.ytimg.com/vi/bTE47TVeC4M/default.jpg', 'width': 120, 'height': 90}, 'medium': {'url': 'https://i.ytimg.com/vi/bTE47TVeC4M/mqdefault.jpg', 'width': 320, 'height': 180}, 'high': {'url': 'https://i.ytimg.com/vi/bTE47TVeC4M/hqdefault.jpg', 'width': 480, 'height': 360}}",African Biographics,none,2025-09-20T17:00:52Z,bTE47TVeC4M,"<iframe width=""480"" height=""270"" src=""//www.youtube.com/embed/bTE47TVeC4M"" frameborder=""0"" allow=""accelerometer; autoplay; clipboard-write; encrypted-media; gyroscope; picture-in-picture; web-share"" referrerpolicy=""strict-origin-when-cross-origin"" allowfullscreen></iframe>",History
47,2025-09-11T21:16:39Z,UCjBw2SidW7wFElbmj9bgDjw,The Most Beautiful Woman in History?  #Nefertiti,,"{'default': {'url': 'https://i.ytimg.com/vi/edA0pyIuheo/default.jpg', 'width': 120, 'height': 90}, 'medium': {'url': 'https://i.ytimg.com/vi/edA0pyIuheo/mqdefault.jpg', 'width': 320, 'height': 180}, 'high': {'url': 'https://i.ytimg.com/vi/edA0pyIuheo/hqdefault.jpg', 'width': 480, 'height': 360}}",The Kings Monologue,none,2025-09-11T21:16:39Z,edA0pyIuheo,"<iframe width=""480"" height=""270"" src=""//www.youtube.com/embed/edA0pyIuheo"" frameborder=""0"" allow=""accelerometer; autoplay; clipboard-write; encrypted-media; gyroscope; picture-in-picture; web-share"" referrerpolicy=""strict-origin-when-cross-origin"" allowfullscreen></iframe>",History
8,2025-09-01T07:52:17Z,UCbvE_5m8kmm9U58gDHtzYrA,FUT DRAFT TIME!,Afro Ballers!,"{'default': {'url': 'https://i.ytimg.com/vi/UcEVjoHa4zM/default.jpg', 'width': 120, 'height': 90}, 'medium': {'url': 'https://i.ytimg.com/vi/UcEVjoHa4zM/mqdefault.jpg', 'width': 320, 'height': 180}, 'high': {'url': 'https://i.ytimg.com/vi/UcEVjoHa4zM/hqdefault.jpg', 'width': 480, 'height': 360}}",AfroBallers,none,2025-09-01T07:52:17Z,UcEVjoHa4zM,"<iframe width=""480"" height=""270"" src=""//www.youtube.com/embed/UcEVjoHa4zM"" frameborder=""0"" allow=""accelerometer; autoplay; clipboard-write; encrypted-media; gyroscope; picture-in-picture; web-share"" referrerpolicy=""strict-origin-when-cross-origin"" allowfullscreen></iframe>",Sports
40,2025-08-15T15:01:35Z,UCCfgU1Dgpz0MzA-4vP_gRuQ,Why do African Presidents Die Overseas?,"Across Africa, a disturbing trend is emerging: presidents and political elites leaving their nations for medical treatment abroad, ...","{'default': {'url': 'https://i.ytimg.com/vi/uY20B5KH6vo/default.jpg', 'width': 120, 'height': 90}, 'medium': {'url': 'https://i.ytimg.com/vi/uY20B5KH6vo/mqdefault.jpg', 'width': 320, 'height': 180}, 'high': {'url': 'https://i.ytimg.com/vi/uY20B5KH6vo/hqdefault.jpg', 'width': 480, 'height': 360}}",Risen Africa,none,2025-08-15T15:01:35Z,uY20B5KH6vo,"<iframe width=""480"" height=""270"" src=""//www.youtube.com/embed/uY20B5KH6vo"" frameborder=""0"" allow=""accelerometer; autoplay; clipboard-write; encrypted-media; gyroscope; picture-in-picture; web-share"" referrerpolicy=""strict-origin-when-cross-origin"" allowfullscreen></iframe>",Current Events
49,2025-08-07T21:00:39Z,UCPQsrvUJzs1INc2hroy3nHw,Can you propose to a stranger using sign languages?,,"{'default': {'url': 'https://i.ytimg.com/vi/X462d95qNKs/default.jpg', 'width': 120, 'height': 90}, 'medium': {'url': 'https://i.ytimg.com/vi/X462d95qNKs/mqdefault.jpg', 'width': 320, 'height': 180}, 'high': {'url': 'https://i.ytimg.com/vi/X462d95qNKs/hqdefault.jpg', 'width': 480, 'height': 360}}",The Pan African Dating Show (The-PDS),none,2025-08-07T21:00:39Z,X462d95qNKs,"<iframe width=""480"" height=""270"" src=""//www.youtube.com/embed/X462d95qNKs"" frameborder=""0"" allow=""accelerometer; autoplay; clipboard-write; encrypted-media; gyroscope; picture-in-picture; web-share"" referrerpolicy=""strict-origin-when-cross-origin"" allowfullscreen></iframe>",Social Issues
54,2025-07-17T18:24:22Z,UClwrpH_Np9zk8uMwnMwu8Nw,"We Bought a $100,000 Apartment In Ghana 🇬🇭",The Image of AFRICA has been DISTORTED around the WORLD & We are CHANGING the NARRATIVE via YOUTUBE videos ...,"{'default': {'url': 'https://i.ytimg.com/vi/tImUQpZzLwY/default.jpg', 'width': 120, 'height': 90}, 'medium': {'url': 'https://i.ytimg.com/vi/tImUQpZzLwY/mqdefault.jpg', 'width': 320, 'height': 180}, 'high': {'url': 'https://i.ytimg.com/vi/tImUQpZzLwY/hqdefault.jpg', 'width': 480, 'height': 360}}",WODE MAYA,none,2025-07-17T18:24:22Z,tImUQpZzLwY,"<iframe width=""480"" height=""270"" src=""//www.youtube.com/embed/tImUQpZzLwY"" frameborder=""0"" allow=""accelerometer; autoplay; clipboard-write; encrypted-media; gyroscope; picture-in-picture; web-share"" referrerpolicy=""strict-origin-when-cross-origin"" allowfullscreen></iframe>",Travel
10,2025-07-07T22:57:22Z,UCx5Y5d5KgibkG9KAyknCdFA,How the Education System Produces Sellouts,"In this powerful episode of our series on the miseducation of Black children, we confront a painful but necessary truth: the system ...","{'default': {'url': 'https://i.ytimg.com/vi/3moeyjUIf8c/default.jpg', 'width': 120, 'height': 90}, 'medium': {'url': 'https://i.ytimg.com/vi/3moeyjUIf8c/mqdefault.jpg', 'width': 320, 'height': 180}, 'high': {'url': 'https://i.ytimg.com/vi/3moeyjUIf8c/hqdefault.jpg', 'width': 480, 'height': 360}}",Afromation Digital,none,2025-07-07T22:57:22Z,3moeyjUIf8c,"<iframe width=""480"" height=""270"" src=""//www.youtube.com/embed/3moeyjUIf8c"" frameborder=""0"" allow=""accelerometer; autoplay; clipboard-write; encrypted-media; gyroscope; picture-in-picture; web-share"" referrerpolicy=""strict-origin-when-cross-origin"" allowfullscreen></iframe>",Social Issues
38,2025-06-29T14:00:07Z,UCF71yDQwxfw0QcYb2JnkB5Q,What $105K Gets You When You’re Done with America 🇺🇸,America feels more chaotic than ever The rising costs. The politics. The constant pressure. A lot of people are wondering if there's ...,"{'default': {'url': 'https://i.ytimg.com/vi/xMtFJz9f8LI/default.jpg', 'width': 120, 'height': 90}, 'medium': {'url': 'https://i.ytimg.com/vi/xMtFJz9f8LI/mqdefault.jpg', 'width': 320, 'height': 180}, 'high': {'url': 'https://i.ytimg.com/vi/xMtFJz9f8LI/hqdefault.jpg', 'width': 480, 'height': 360}}",PassportHeavy,none,2025-06-29T14:00:07Z,xMtFJz9f8LI,"<iframe width=""480"" height=""270"" src=""//www.youtube.com/embed/xMtFJz9f8LI"" frameborder=""0"" allow=""accelerometer; autoplay; clipboard-write; encrypted-media; gyroscope; picture-in-picture; web-share"" referrerpolicy=""strict-origin-when-cross-origin"" allowfullscreen></iframe>",Travel
35,2025-01-11T16:00:06Z,UCJH-fn0wLu5uwXX33jNToQw,Samora Machel&#39;s Struggle | How Mozambique’s Revolution Ended Portugal&#39;s Empire,"The most beautiful thing about a man's life is his freedom. He may not have any food, and he may not have any clothing, but at ...","{'default': {'url': 'https://i.ytimg.com/vi/wTwI48jN-fY/default.jpg', 'width': 120, 'height': 90}, 'medium': {'url': 'https://i.ytimg.com/vi/wTwI48jN-fY/mqdefault.jpg', 'width': 320, 'height': 180}, 'high': {'url': 'https://i.ytimg.com/vi/wTwI48jN-fY/hqdefault.jpg', 'width': 480, 'height': 360}}",NewAfrica,none,2025-01-11T16:00:06Z,wTwI48jN-fY,"<iframe width=""480"" height=""270"" src=""//www.youtube.com/embed/wTwI48jN-fY"" frameborder=""0"" allow=""accelerometer; autoplay; clipboard-write; encrypted-media; gyroscope; picture-in-picture; web-share"" referrerpolicy=""strict-origin-when-cross-origin"" allowfullscreen></iframe>",Current Events
9,2024-08-31T16:32:50Z,UC2xX2FI6s4i9xz3t9qjayhg,The San Quentin Six (1972),"A documentary on the six Black and Chicano prisoners who, following George Jackson's death, were charged on charges of ...","{'default': {'url': 'https://i.ytimg.com/vi/E-4CUaaSo4I/default.jpg', 'width': 120, 'height': 90}, 'medium': {'url': 'https://i.ytimg.com/vi/E-4CUaaSo4I/mqdefault.jpg', 'width': 320, 'height': 180}, 'high': {'url': 'https://i.ytimg.com/vi/E-4CUaaSo4I/hqdefault.jpg', 'width': 480, 'height': 360}}",AfroMarxist,none,2024-08-31T16:32:50Z,E-4CUaaSo4I,"<iframe width=""480"" height=""360"" src=""//www.youtube.com/embed/E-4CUaaSo4I"" frameborder=""0"" allow=""accelerometer; autoplay; clipboard-write; encrypted-media; gyroscope; picture-in-picture; web-share"" referrerpolicy=""strict-origin-when-cross-origin"" allowfullscreen></iframe>",History
34,2024-08-25T18:19:19Z,UCh2ANLALdN1OZUJKmvchkkg,The INSANE True Story of Cleopatra in Pop Culture | Documentary,"Cleopatra is one of the most iconic figures associated with ancient Egypt, but our perception of the queen is not correct.","{'default': {'url': 'https://i.ytimg.com/vi/dwSSQFS-OQY/default.jpg', 'width': 120, 'height': 90}, 'medium': {'url': 'https://i.ytimg.com/vi/dwSSQFS-OQY/mqdefault.jpg', 'width': 320, 'height': 180}, 'high': {'url': 'https://i.ytimg.com/vi/dwSSQFS-OQY/hqdefault.jpg', 'width': 480, 'height': 360}}",Mr. Imhotep,none,2024-08-25T18:19:19Z,dwSSQFS-OQY,"<iframe width=""480"" height=""270"" src=""//www.youtube.com/embed/dwSSQFS-OQY"" frameborder=""0"" allow=""accelerometer; autoplay; clipboard-write; encrypted-media; gyroscope; picture-in-picture; web-share"" referrerpolicy=""strict-origin-when-cross-origin"" allowfullscreen></iframe>",History
16,2024-08-25T18:00:03Z,UCMMTYgqKEgCgy1pR6Axlf0A,"Ex-model moved to Ghana to build a 5 bedroom home, set up 7 businesses and live her dream life",Our guest today left behind her 15 year career in the modelling industry to move to Ghana and start a new life here. This amazing ...,"{'default': {'url': 'https://i.ytimg.com/vi/6TMZcRoGZi4/default.jpg', 'width': 120, 'height': 90}, 'medium': {'url': 'https://i.ytimg.com/vi/6TMZcRoGZi4/mqdefault.jpg', 'width': 320, 'height': 180}, 'high': {'url': 'https://i.ytimg.com/vi/6TMZcRoGZi4/hqdefault.jpg', 'width': 480, 'height': 360}}",Build with Amoaa,none,2024-08-25T18:00:03Z,6TMZcRoGZi4,"<iframe width=""480"" height=""270"" src=""//www.youtube.com/embed/6TMZcRoGZi4"" frameborder=""0"" allow=""accelerometer; autoplay; clipboard-write; encrypted-media; gyroscope; picture-in-picture; web-share"" referrerpolicy=""strict-origin-when-cross-origin"" allowfullscreen></iframe>",Travel
7,2024-07-12T12:15:30Z,UCl6to6J7oVltnhHEVm1s87A,AFRICAN ORIGIN OF MORDEN HAIRSTYLES,theperspective #africanhistory #africanews #africax5 Traditional African hairstyles are back in fashion and making a real ...,"{'default': {'url': 'https://i.ytimg.com/vi/AGyMe_XB3mQ/default.jpg', 'width': 120, 'height': 90}, 'medium': {'url': 'https://i.ytimg.com/vi/AGyMe_XB3mQ/mqdefault.jpg', 'width': 320, 'height': 180}, 'high': {'url': 'https://i.ytimg.com/vi/AGyMe_XB3mQ/hqdefault.jpg', 'width': 480, 'height': 360}}",Africax5 Network,none,2024-07-12T12:15:30Z,AGyMe_XB3mQ,"<iframe width=""480"" height=""360"" src=""//www.youtube.com/embed/AGyMe_XB3mQ"" frameborder=""0"" allow=""accelerometer; autoplay; clipboard-write; encrypted-media; gyroscope; picture-in-picture; web-share"" referrerpolicy=""strict-origin-when-cross-origin"" allowfullscreen></iframe>",Social Issues
30,2024-07-08T12:10:25Z,UCHbmePHjGH3pklvSla6szWw,You Wouldn&#39;t Survive In Ancient Egypt | REACTION - KueliMika,Today we are reacting to the video You Wouldn't Survive In Ancient Egypt.,"{'default': {'url': 'https://i.ytimg.com/vi/qFbr17zUKYE/default.jpg', 'width': 120, 'height': 90}, 'medium': {'url': 'https://i.ytimg.com/vi/qFbr17zUKYE/mqdefault.jpg', 'width': 320, 'height': 180}, 'high': {'url': 'https://i.ytimg.com/vi/qFbr17zUKYE/hqdefault.jpg', 'width': 480, 'height': 360}}",KueliMika,none,2024-07-08T12:10:25Z,qFbr17zUKYE,"<iframe width=""480"" height=""270"" src=""//www.youtube.com/embed/qFbr17zUKYE"" frameborder=""0"" allow=""accelerometer; autoplay; clipboard-write; encrypted-media; gyroscope; picture-in-picture; web-share"" referrerpolicy=""strict-origin-when-cross-origin"" allowfullscreen></iframe>",History
3,2024-04-25T23:00:06Z,UCTTQWaoGloNuhunZevQ2F6g,"Kuubwa Transforming African Businesses: Fabric Weaver, Fish Farmers","Kuubwa Transforms African Businesses: Fish Farmers, Fabric Manufacturers and more.","{'default': {'url': 'https://i.ytimg.com/vi/gC02Wht1UQQ/default.jpg', 'width': 120, 'height': 90}, 'medium': {'url': 'https://i.ytimg.com/vi/gC02Wht1UQQ/mqdefault.jpg', 'width': 320, 'height': 180}, 'high': {'url': 'https://i.ytimg.com/vi/gC02Wht1UQQ/hqdefault.jpg', 'width': 480, 'height': 360}}",Africa Business Channel TV,none,2024-04-25T23:00:06Z,gC02Wht1UQQ,"<iframe width=""480"" height=""270"" src=""//www.youtube.com/embed/gC02Wht1UQQ"" frameborder=""0"" allow=""accelerometer; autoplay; clipboard-write; encrypted-media; gyroscope; picture-in-picture; web-share"" referrerpolicy=""strict-origin-when-cross-origin"" allowfullscreen></iframe>",Productivity
43,2024-04-11T05:04:02Z,UCuvO0y2EU_kRfYzlhGJNOKA,How Did America&#39;s Wealthy Elite Re Write World History,"The United States was supposed to be a democratically run country. However, that has not been the case since the turn of the ...","{'default': {'url': 'https://i.ytimg.com/vi/RPSnS-ucmOA/default.jpg', 'width': 120, 'height': 90}, 'medium': {'url': 'https://i.ytimg.com/vi/RPSnS-ucmOA/mqdefault.jpg', 'width': 320, 'height': 180}, 'high': {'url': 'https://i.ytimg.com/vi/RPSnS-ucmOA/hqdefault.jpg', 'width': 480, 'height': 360}}",Straight UP,none,2024-04-11T05:04:02Z,RPSnS-ucmOA,"<iframe width=""480"" height=""270"" src=""//www.youtube.com/embed/RPSnS-ucmOA"" frameborder=""0"" allow=""accelerometer; autoplay; clipboard-write; encrypted-media; gyroscope; picture-in-picture; web-share"" referrerpolicy=""strict-origin-when-cross-origin"" allowfullscreen></iframe>",History
44,2024-04-11T05:04:02Z,UCuvO0y2EU_kRfYzlhGJNOKA,How Did America&#39;s Wealthy Elite Re Write World History,"The United States was supposed to be a democratically run country. However, that has not been the case since the turn of the ...","{'default': {'url': 'https://i.ytimg.com/vi/RPSnS-ucmOA/default.jpg', 'width': 120, 'height': 90}, 'medium': {'url': 'https://i.ytimg.com/vi/RPSnS-ucmOA/mqdefault.jpg', 'width': 320, 'height': 180}, 'high': {'url': 'https://i.ytimg.com/vi/RPSnS-ucmOA/hqdefault.jpg', 'width': 480, 'height': 360}}",Straight UP,none,2024-04-11T05:04:02Z,RPSnS-ucmOA,"<iframe width=""480"" height=""270"" src=""//www.youtube.com/embed/RPSnS-ucmOA"" frameborder=""0"" allow=""accelerometer; autoplay; clipboard-write; encrypted-media; gyroscope; picture-in-picture; web-share"" referrerpolicy=""strict-origin-when-cross-origin"" allowfullscreen></iframe>",History
