,publishedAt,channelId,title,description,thumbnails,channelTitle,liveBroadcastContent,publishTime,videoID,embeds,category
17,2025-09-30T03:08:06Z,UCL0u5uz7KZ9q-pe-VC8TY-w,The Media Is Lying About Tyler Robinson.,,"{'default': {'url': 'https://i.ytimg.com/vi/njDJB873bRQ/default.jpg', 'width': 120, 'height': 90}, 'medium': {'url': 'https://i.ytimg.com/vi/njDJB873bRQ/mqdefault.jpg', 'width': 320, 'height': 180}, 'high': {'url': 'https://i.ytimg.com/vi/njDJB873bRQ/hqdefault.jpg', 'width': 480, 'height': 360}}",Candace Owens,none,2025-09-30T03:08:06Z,njDJB873bRQ,"<iframe width=""480"" height=""270"" src=""//www.youtube.com/embed/njDJB873bRQ"" frameborder=""0"" allow=""accelerometer; autoplay; clipboard-write; encrypted-media; gyroscope; picture-in-picture; web-share"" referrerpolicy=""strict-origin-when-cross-origin"" allowfullscreen></iframe>",Current Events
46,2025-09-30T02:43:42Z,UCLjzzg-cFWpEEjnWCOpXp3Q,Assata Shakur &amp; Cuba  A Revolutionary Legacy,,"{'default': {'url': 'https://i.ytimg.com/vi/xPkJc449gGU/default.jpg', 'width': 120, 'height': 90}, 'medium': {'url': 'https://i.ytimg.com/vi/xPkJc449gGU/mqdefault.jpg', 'width': 320, 'height': 180}, 'high': {'url': 'https://i.ytimg.com/vi/xPkJc449gGU/hqdefault.jpg', 'width': 480, 'height': 360}}",The Burning Spear TV,none,2025-09-30T02:43:42Z,xPkJc449gGU,"<iframe width=""480"" height=""270"" src=""//www.youtube.com/embed/xPkJc449gGU"" frameborder=""0"" allow=""accelerometer; autoplay; clipboard-write; encrypted-media; gyroscope; picture-in-picture; web-share"" referrerpolicy=""strict-origin-when-cross-origin"" allowfullscreen></iframe>",Current Events
21,2025-09-30T02:11:03Z,UCRVsqvXIdgyPVS-a6fGa1lA,"Government Shutdown, New Trump Tariffs, Nvidia’s Big Threat, &amp; $55B EA Sports Deal",Timestamps • 8:00 – Healthcare stocks outlook • 24:00 – Government shutdown and its impact on the market • 33:00 – Trump's ...,"{'default': {'url': 'https://i.ytimg.com/vi/CBr-ZooWXXM/default.jpg', 'width': 120, 'height': 90}, 'medium': {'url': 'https://i.ytimg.com/vi/CBr-ZooWXXM/mqdefault.jpg', 'width': 320, 'height': 180}, 'high': {'url': 'https://i.ytimg.com/vi/CBr-ZooWXXM/hqdefault.jpg', 'width': 480, 'height': 360}}",Earn Your Leisure,none,2025-09-30T02:11:03Z,CBr-ZooWXXM,"<iframe width=""480"" height=""270"" src=""//www.youtube.com/embed/CBr-ZooWXXM"" frameborder=""0"" allow=""accelerometer; autoplay; clipboard-write; encrypted-media; gyroscope; picture-in-picture; web-share"" referrerpolicy=""strict-origin-when-cross-origin"" allowfullscreen></iframe>",Productivity
55,2025-09-30T02:07:42Z,UCHvnMsLnyQZscrq-fOckiiw,Inside Disney’s Zootopia 2 | Filmmakers Byron Howard &amp; Jared Bush Talk New Worlds,Step back into the wild world of Zootopia 2 with Disney Animation filmmakers Byron Howard and Jared Bush in this exclusive ...,"{'default': {'url': 'https://i.ytimg.com/vi/t4KcdMWWYeU/default.jpg', 'width': 120, 'height': 90}, 'medium': {'url': 'https://i.ytimg.com/vi/t4KcdMWWYeU/mqdefault.jpg', 'width': 320, 'height': 180}, 'high': {'url': 'https://i.ytimg.com/vi/t4KcdMWWYeU/hqdefault.jpg', 'width': 480, 'height': 360}}",BlackTree TV,none,2025-09-30T02:07:42Z,t4KcdMWWYeU,"<iframe width=""480"" height=""270"" src=""//www.youtube.com/embed/t4KcdMWWYeU"" frameborder=""0"" allow=""accelerometer; autoplay; clipboard-write; encrypted-media; gyroscope; picture-in-picture; web-share"" referrerpolicy=""strict-origin-when-cross-origin"" allowfullscreen></iframe>",Entertainment
45,2025-09-30T01:25:50Z,UC4m46pCBkMEyy8gk26WKqbA,"Cashville, Tennekkee | The 85 South Show Live Oct 12th","Nashville here's your chance to meet Karlous Miller, Chico Bean and DCYoung Fly and see them perform at The Bridgestone ...","{'default': {'url': 'https://i.ytimg.com/vi/xi2zxKl5tUM/default.jpg', 'width': 120, 'height': 90}, 'medium': {'url': 'https://i.ytimg.com/vi/xi2zxKl5tUM/mqdefault.jpg', 'width': 320, 'height': 180}, 'high': {'url': 'https://i.ytimg.com/vi/xi2zxKl5tUM/hqdefault.jpg', 'width': 480, 'height': 360}}",The 85 South Comedy Show,none,2025-09-30T01:25:50Z,xi2zxKl5tUM,"<iframe width=""480"" height=""270"" src=""//www.youtube.com/embed/xi2zxKl5tUM"" frameborder=""0"" allow=""accelerometer; autoplay; clipboard-write; encrypted-media; gyroscope; picture-in-picture; web-share"" referrerpolicy=""strict-origin-when-cross-origin"" allowfullscreen></iframe>",Entertainment
5,2025-09-30T01:02:41Z,UCKZGcrxRAhdUi58Mdr565mw,2 Mass Shootings This Weekend — But Them Folks Still Blames Black Crime,Welcome to African Diaspora News Channel — Where We Speak Truth to Power. We bring you unapologetic news and ...,"{'default': {'url': 'https://i.ytimg.com/vi/SejzaoFu2v4/default.jpg', 'width': 120, 'height': 90}, 'medium': {'url': 'https://i.ytimg.com/vi/SejzaoFu2v4/mqdefault.jpg', 'width': 320, 'height': 180}, 'high': {'url': 'https://i.ytimg.com/vi/SejzaoFu2v4/hqdefault.jpg', 'width': 480, 'height': 360}}",African Diaspora News Channel,none,2025-09-30T01:02:41Z,SejzaoFu2v4,"<iframe width=""480"" height=""270"" src=""//www.youtube.com/embed/SejzaoFu2v4"" frameborder=""0"" allow=""accelerometer; autoplay; clipboard-write; encrypted-media; gyroscope; picture-in-picture; web-share"" referrerpolicy=""strict-origin-when-cross-origin"" allowfullscreen></iframe>",Current Events
36,2025-09-30T01:02:10Z,UCrPq2ekHx2vZtuyG3wUx0_g,"Breana Nicole&#39;s Invention Was Colonized, Then The Colonizer Sued Her | OTSOG Live!!",Join this channel to get access to perks: https://www.youtube.com/channel/UCrPq2ekHx2vZtuyG3wUx0_g/join OTSOG Book ...,"{'default': {'url': 'https://i.ytimg.com/vi/1SehrbHOcE4/default_live.jpg', 'width': 120, 'height': 90}, 'medium': {'url': 'https://i.ytimg.com/vi/1SehrbHOcE4/mqdefault_live.jpg', 'width': 320, 'height': 180}, 'high': {'url': 'https://i.ytimg.com/vi/1SehrbHOcE4/hqdefault_live.jpg', 'width': 480, 'height': 360}}",On the Shoulders of Giants ,upcoming,2025-09-30T01:02:10Z,1SehrbHOcE4,"<iframe width=""480"" height=""270"" src=""//www.youtube.com/embed/1SehrbHOcE4"" frameborder=""0"" allow=""accelerometer; autoplay; clipboard-write; encrypted-media; gyroscope; picture-in-picture; web-share"" referrerpolicy=""strict-origin-when-cross-origin"" allowfullscreen></iframe>",Social Issues
22,2025-09-29T23:40:16Z,UCF-A_4x9-bLrxXrmgBOWuJA,"CIC Julius Malema, East London Magistrate’s Court Appearance","President Julius Malema's appearance at the East London Magistrate's Court, where handing down the verdict in the politically ...","{'default': {'url': 'https://i.ytimg.com/vi/NcqvTLYfZVw/default.jpg', 'width': 120, 'height': 90}, 'medium': {'url': 'https://i.ytimg.com/vi/NcqvTLYfZVw/mqdefault.jpg', 'width': 320, 'height': 180}, 'high': {'url': 'https://i.ytimg.com/vi/NcqvTLYfZVw/hqdefault.jpg', 'width': 480, 'height': 360}}",Economic Freedom Fighters,none,2025-09-29T23:40:16Z,NcqvTLYfZVw,"<iframe width=""480"" height=""270"" src=""//www.youtube.com/embed/NcqvTLYfZVw"" frameborder=""0"" allow=""accelerometer; autoplay; clipboard-write; encrypted-media; gyroscope; picture-in-picture; web-share"" referrerpolicy=""strict-origin-when-cross-origin"" allowfullscreen></iframe>",Current Events
19,2025-09-29T23:01:29Z,UCABZ7Z6SBTp4IsARDceOq7w,DL Hughley ‘Calls Out’ MAGA Over ‘MAGA Shooter’ At Michigan Church: &quot;One Of Y&#39;all&quot; - HP News,https://hypersclub.com/ - DL Hughley and others are now responding to the identity of a man who has been said to be the shooter ...,"{'default': {'url': 'https://i.ytimg.com/vi/tjFDzS9yPqY/default.jpg', 'width': 120, 'height': 90}, 'medium': {'url': 'https://i.ytimg.com/vi/tjFDzS9yPqY/mqdefault.jpg', 'width': 320, 'height': 180}, 'high': {'url': 'https://i.ytimg.com/vi/tjFDzS9yPqY/hqdefault.jpg', 'width': 480, 'height': 360}}",HYPE+,none,2025-09-29T23:01:29Z,tjFDzS9yPqY,"<iframe width=""480"" height=""270"" src=""//www.youtube.com/embed/tjFDzS9yPqY"" frameborder=""0"" allow=""accelerometer; autoplay; clipboard-write; encrypted-media; gyroscope; picture-in-picture; web-share"" referrerpolicy=""strict-origin-when-cross-origin"" allowfullscreen></iframe>",Entertainment
20,2025-09-29T23:00:06Z,UCwbP4USYrniJGROwQNiwH-Q,"Delusional Woman EXPECTS A MAN To Buy Her A $2,000 CHANEL BAG While Dating Her!",Delusional Woman EXPECTS A MAN To Buy Her A $2000 CHANEL BAG While Dating Her! Order Merch Here: ...,"{'default': {'url': 'https://i.ytimg.com/vi/fEtj1-xrWaQ/default.jpg', 'width': 120, 'height': 90}, 'medium': {'url': 'https://i.ytimg.com/vi/fEtj1-xrWaQ/mqdefault.jpg', 'width': 320, 'height': 180}, 'high': {'url': 'https://i.ytimg.com/vi/fEtj1-xrWaQ/hqdefault.jpg', 'width': 480, 'height': 360}}",DeeDee,none,2025-09-29T23:00:06Z,fEtj1-xrWaQ,"<iframe width=""480"" height=""270"" src=""//www.youtube.com/embed/fEtj1-xrWaQ"" frameborder=""0"" allow=""accelerometer; autoplay; clipboard-write; encrypted-media; gyroscope; picture-in-picture; web-share"" referrerpolicy=""strict-origin-when-cross-origin"" allowfullscreen></iframe>",Social Issues
15,2025-09-29T22:50:30Z,UCiinSjWS3E0vtAa3DCvp7iA,Dozens of ICE agents were driven out of downtown Chicago by spontaneous protests on Sunday,,"{'default': {'url': 'https://i.ytimg.com/vi/-kl5S6kypDk/default.jpg', 'width': 120, 'height': 90}, 'medium': {'url': 'https://i.ytimg.com/vi/-kl5S6kypDk/mqdefault.jpg', 'width': 320, 'height': 180}, 'high': {'url': 'https://i.ytimg.com/vi/-kl5S6kypDk/hqdefault.jpg', 'width': 480, 'height': 360}}",BreakThrough News,none,2025-09-29T22:50:30Z,-kl5S6kypDk,"<iframe width=""480"" height=""270"" src=""//www.youtube.com/embed/-kl5S6kypDk"" frameborder=""0"" allow=""accelerometer; autoplay; clipboard-write; encrypted-media; gyroscope; picture-in-picture; web-share"" referrerpolicy=""strict-origin-when-cross-origin"" allowfullscreen></iframe>",Current Events
12,2025-09-29T22:30:03Z,UCTNr0N__QwstBhgCtvQcjhA,People FIRED for Their Opinions?! Speaking Out on Charlie Kirk Sparks Backlash,Join our channel to get access to perks: https://www.youtube.com/channel/UCTNr0N__QwstBhgCtvQcjhA/join Let's talk about how ...,"{'default': {'url': 'https://i.ytimg.com/vi/6dpZa3BDdcE/default.jpg', 'width': 120, 'height': 90}, 'medium': {'url': 'https://i.ytimg.com/vi/6dpZa3BDdcE/mqdefault.jpg', 'width': 320, 'height': 180}, 'high': {'url': 'https://i.ytimg.com/vi/6dpZa3BDdcE/hqdefault.jpg', 'width': 480, 'height': 360}}",Black Discoveries,none,2025-09-29T22:30:03Z,6dpZa3BDdcE,"<iframe width=""480"" height=""270"" src=""//www.youtube.com/embed/6dpZa3BDdcE"" frameborder=""0"" allow=""accelerometer; autoplay; clipboard-write; encrypted-media; gyroscope; picture-in-picture; web-share"" referrerpolicy=""strict-origin-when-cross-origin"" allowfullscreen></iframe>",History
18,2025-09-29T22:01:01Z,UCv8G-xZ_BBGufjbN6jbvLMQ,My Dad Doesn&#39;t Do Feelings - Comedian Ron G - Chocolate Sundaes Stand Up Comedy,Anyone else have a family member that doesn't express how they feel? Follow @ComedianRonG on social media ...,"{'default': {'url': 'https://i.ytimg.com/vi/llyQjMflkq0/default.jpg', 'width': 120, 'height': 90}, 'medium': {'url': 'https://i.ytimg.com/vi/llyQjMflkq0/mqdefault.jpg', 'width': 320, 'height': 180}, 'high': {'url': 'https://i.ytimg.com/vi/llyQjMflkq0/hqdefault.jpg', 'width': 480, 'height': 360}}",Chocolate Sundaes Comedy,none,2025-09-29T22:01:01Z,llyQjMflkq0,"<iframe width=""480"" height=""270"" src=""//www.youtube.com/embed/llyQjMflkq0"" frameborder=""0"" allow=""accelerometer; autoplay; clipboard-write; encrypted-media; gyroscope; picture-in-picture; web-share"" referrerpolicy=""strict-origin-when-cross-origin"" allowfullscreen></iframe>",Entertainment
6,2025-09-29T22:00:42Z,UCJa58Tf70HC5q2oQDNBrJ2g,Effective Storytelling Tips | Sharing the African Diaspora Experience Through Stories,"Discover powerful storytelling tips to share the rich experiences of the African Diaspora. In this episode, we explore how stories ...","{'default': {'url': 'https://i.ytimg.com/vi/XJ-XKmQdCXk/default.jpg', 'width': 120, 'height': 90}, 'medium': {'url': 'https://i.ytimg.com/vi/XJ-XKmQdCXk/mqdefault.jpg', 'width': 320, 'height': 180}, 'high': {'url': 'https://i.ytimg.com/vi/XJ-XKmQdCXk/hqdefault.jpg', 'width': 480, 'height': 360}}",AClasses Media,none,2025-09-29T22:00:42Z,XJ-XKmQdCXk,"<iframe width=""480"" height=""270"" src=""//www.youtube.com/embed/XJ-XKmQdCXk"" frameborder=""0"" allow=""accelerometer; autoplay; clipboard-write; encrypted-media; gyroscope; picture-in-picture; web-share"" referrerpolicy=""strict-origin-when-cross-origin"" allowfullscreen></iframe>",History
26,2025-09-29T21:59:16Z,UCwZ2vurIl_X8rv0Dv4mu12A,Agree or Disagree ? #dad #parent #parenting  #ineverknewtv,,"{'default': {'url': 'https://i.ytimg.com/vi/rFeiZSfyt5s/default.jpg', 'width': 120, 'height': 90}, 'medium': {'url': 'https://i.ytimg.com/vi/rFeiZSfyt5s/mqdefault.jpg', 'width': 320, 'height': 180}, 'high': {'url': 'https://i.ytimg.com/vi/rFeiZSfyt5s/hqdefault.jpg', 'width': 480, 'height': 360}}",I Never Knew Tv,none,2025-09-29T21:59:16Z,rFeiZSfyt5s,"<iframe width=""480"" height=""270"" src=""//www.youtube.com/embed/rFeiZSfyt5s"" frameborder=""0"" allow=""accelerometer; autoplay; clipboard-write; encrypted-media; gyroscope; picture-in-picture; web-share"" referrerpolicy=""strict-origin-when-cross-origin"" allowfullscreen></iframe>",Social Issues
0,2025-09-29T19:27:55Z,UCG7uFJVZsxQRwDssom9Pavw,Final Day of United Nations General Assembly World Leaders Speeches #UNGA80,The high-level General Debate for the 80th session of the UN General Assembly (UNGA 80) kicks off in New York City on Tuesday ...,"{'default': {'url': 'https://i.ytimg.com/vi/5UAWpM61oPo/default.jpg', 'width': 120, 'height': 90}, 'medium': {'url': 'https://i.ytimg.com/vi/5UAWpM61oPo/mqdefault.jpg', 'width': 320, 'height': 180}, 'high': {'url': 'https://i.ytimg.com/vi/5UAWpM61oPo/hqdefault.jpg', 'width': 480, 'height': 360}}",2nacheki,none,2025-09-29T19:27:55Z,5UAWpM61oPo,"<iframe width=""480"" height=""270"" src=""//www.youtube.com/embed/5UAWpM61oPo"" frameborder=""0"" allow=""accelerometer; autoplay; clipboard-write; encrypted-media; gyroscope; picture-in-picture; web-share"" referrerpolicy=""strict-origin-when-cross-origin"" allowfullscreen></iframe>",Current Events
52,2025-09-29T19:11:32Z,UCXyHjFIKz9D8ofxObOuYBbg,Female Loneliness Epidemic,WeNeedToTalk #BlackLove To support our ministry: https://cash.app/$wnttalk Please SUBSCRIBE for more content!,"{'default': {'url': 'https://i.ytimg.com/vi/t4CUDgbVEe8/default.jpg', 'width': 120, 'height': 90}, 'medium': {'url': 'https://i.ytimg.com/vi/t4CUDgbVEe8/mqdefault.jpg', 'width': 320, 'height': 180}, 'high': {'url': 'https://i.ytimg.com/vi/t4CUDgbVEe8/hqdefault.jpg', 'width': 480, 'height': 360}}",WeNeedToTalk,none,2025-09-29T19:11:32Z,t4CUDgbVEe8,"<iframe width=""480"" height=""270"" src=""//www.youtube.com/embed/t4CUDgbVEe8"" frameborder=""0"" allow=""accelerometer; autoplay; clipboard-write; encrypted-media; gyroscope; picture-in-picture; web-share"" referrerpolicy=""strict-origin-when-cross-origin"" allowfullscreen></iframe>",Social Issues
27,2025-09-29T18:38:11Z,UCi2uaWdy6OTf4Ty7DVC_7lw,VERY DISSAPOINTED  !!! (Kenya Africa )!!!,"Hello family , welcome to my YouTube channel iam_marwa ,""Luxurying"" AT GRANDMA HOUSE as VISTORS !!! (Kenya Africa )!","{'default': {'url': 'https://i.ytimg.com/vi/NBqom5bCTvk/default.jpg', 'width': 120, 'height': 90}, 'medium': {'url': 'https://i.ytimg.com/vi/NBqom5bCTvk/mqdefault.jpg', 'width': 320, 'height': 180}, 'high': {'url': 'https://i.ytimg.com/vi/NBqom5bCTvk/hqdefault.jpg', 'width': 480, 'height': 360}}",iam_marwa,none,2025-09-29T18:38:11Z,NBqom5bCTvk,"<iframe width=""480"" height=""270"" src=""//www.youtube.com/embed/NBqom5bCTvk"" frameborder=""0"" allow=""accelerometer; autoplay; clipboard-write; encrypted-media; gyroscope; picture-in-picture; web-share"" referrerpolicy=""strict-origin-when-cross-origin"" allowfullscreen></iframe>",Travel
28,2025-09-29T17:00:21Z,UCpEf2jEfyAEbQesGgl1HOWA,"DAYS IN MY LIFE IN GHANA | SHOPPING, BEAUTY MAINTENANCE, COOKING| LIVING CONDITIONS IN GHANA","livinginghana Spend a few days with me in Ghana. We go shopping, we participate in kids activities and also do some beauty ...","{'default': {'url': 'https://i.ytimg.com/vi/Hy5KioOI6KE/default.jpg', 'width': 120, 'height': 90}, 'medium': {'url': 'https://i.ytimg.com/vi/Hy5KioOI6KE/mqdefault.jpg', 'width': 320, 'height': 180}, 'high': {'url': 'https://i.ytimg.com/vi/Hy5KioOI6KE/hqdefault.jpg', 'width': 480, 'height': 360}}",Jasmine Ama,none,2025-09-29T17:00:21Z,Hy5KioOI6KE,"<iframe width=""480"" height=""270"" src=""//www.youtube.com/embed/Hy5KioOI6KE"" frameborder=""0"" allow=""accelerometer; autoplay; clipboard-write; encrypted-media; gyroscope; picture-in-picture; web-share"" referrerpolicy=""strict-origin-when-cross-origin"" allowfullscreen></iframe>",Travel
32,2025-09-29T16:00:14Z,UCKLSjhp6XZUEYDT1DMcrj8w,"Embarrassing! Uganda Politician Turns to French While Sahel Rises with Traoré, Goïta &amp; Tchiani","Africa is rising—but not everywhere. While Burkina Faso, Mali, and Niger break free from French colonialism and embrace African ...","{'default': {'url': 'https://i.ytimg.com/vi/0Nt9S0H6rrs/default.jpg', 'width': 120, 'height': 90}, 'medium': {'url': 'https://i.ytimg.com/vi/0Nt9S0H6rrs/mqdefault.jpg', 'width': 320, 'height': 180}, 'high': {'url': 'https://i.ytimg.com/vi/0Nt9S0H6rrs/hqdefault.jpg', 'width': 480, 'height': 360}}",Make Afrika Great ,none,2025-09-29T16:00:14Z,0Nt9S0H6rrs,"<iframe width=""480"" height=""270"" src=""//www.youtube.com/embed/0Nt9S0H6rrs"" frameborder=""0"" allow=""accelerometer; autoplay; clipboard-write; encrypted-media; gyroscope; picture-in-picture; web-share"" referrerpolicy=""strict-origin-when-cross-origin"" allowfullscreen></iframe>",Current Events
48,2025-09-29T15:45:00Z,UC-4h1XQ47sf0vbFwJvuBhEA,Daily Quiz - The Makishi masquerade tradition is practiced by peoples in which country?,Daily Quiz - The Makishi masquerade tradition is practiced by peoples in which country? ▭▭▭▭▭▭▭▭▭ The New African ...,"{'default': {'url': 'https://i.ytimg.com/vi/6iIg1Lx_PSM/default.jpg', 'width': 120, 'height': 90}, 'medium': {'url': 'https://i.ytimg.com/vi/6iIg1Lx_PSM/mqdefault.jpg', 'width': 320, 'height': 180}, 'high': {'url': 'https://i.ytimg.com/vi/6iIg1Lx_PSM/hqdefault.jpg', 'width': 480, 'height': 360}}",The New Africa Channel,none,2025-09-29T15:45:00Z,6iIg1Lx_PSM,"<iframe width=""480"" height=""270"" src=""//www.youtube.com/embed/6iIg1Lx_PSM"" frameborder=""0"" allow=""accelerometer; autoplay; clipboard-write; encrypted-media; gyroscope; picture-in-picture; web-share"" referrerpolicy=""strict-origin-when-cross-origin"" allowfullscreen></iframe>",Current Events
14,2025-09-29T15:30:31Z,UCIxrFTHZybtTgq8X7itOAkQ,I Can&#39;t Believe Life In This Uk City ( Is This England?),"I Can't Believe Life In This UK City (Is This England?) I took a trip to Southend-on-Sea, and what I discovered absolutely blew my ...","{'default': {'url': 'https://i.ytimg.com/vi/iUF7Dn0liFg/default.jpg', 'width': 120, 'height': 90}, 'medium': {'url': 'https://i.ytimg.com/vi/iUF7Dn0liFg/mqdefault.jpg', 'width': 320, 'height': 180}, 'high': {'url': 'https://i.ytimg.com/vi/iUF7Dn0liFg/hqdefault.jpg', 'width': 480, 'height': 360}}",Blackman Da Traveller,none,2025-09-29T15:30:31Z,iUF7Dn0liFg,"<iframe width=""480"" height=""270"" src=""//www.youtube.com/embed/iUF7Dn0liFg"" frameborder=""0"" allow=""accelerometer; autoplay; clipboard-write; encrypted-media; gyroscope; picture-in-picture; web-share"" referrerpolicy=""strict-origin-when-cross-origin"" allowfullscreen></iframe>",Travel
33,2025-09-29T13:40:12Z,UC4YZVeGnDXzEfjGcZG-d6oQ,"Take Me Down A Rabbithole Ep 44 - w/ Special Guest Michael Henderson, Jr.","In this episode, we will delve into testimony regarding UFOs, NDEs, spiritism in the music industry, astral projection, and more!","{'default': {'url': 'https://i.ytimg.com/vi/jX6x7JodH00/default.jpg', 'width': 120, 'height': 90}, 'medium': {'url': 'https://i.ytimg.com/vi/jX6x7JodH00/mqdefault.jpg', 'width': 320, 'height': 180}, 'high': {'url': 'https://i.ytimg.com/vi/jX6x7JodH00/hqdefault.jpg', 'width': 480, 'height': 360}}",meandepiphany,none,2025-09-29T13:40:12Z,jX6x7JodH00,"<iframe width=""480"" height=""270"" src=""//www.youtube.com/embed/jX6x7JodH00"" frameborder=""0"" allow=""accelerometer; autoplay; clipboard-write; encrypted-media; gyroscope; picture-in-picture; web-share"" referrerpolicy=""strict-origin-when-cross-origin"" allowfullscreen></iframe>",Social Issues
24,2025-09-29T12:00:01Z,UCC0XWOgSBcwNstXbPX2cbpg,France&#39;s Economy is CRUMBLlNG And Its Far Worse Than You Expect - A MUST SEE!!,"For copyright matters, takedown, or complaint please contact: historicalafrika@gmail.com France has just dropped a budget ...","{'default': {'url': 'https://i.ytimg.com/vi/0c8wKogRKH0/default.jpg', 'width': 120, 'height': 90}, 'medium': {'url': 'https://i.ytimg.com/vi/0c8wKogRKH0/mqdefault.jpg', 'width': 320, 'height': 180}, 'high': {'url': 'https://i.ytimg.com/vi/0c8wKogRKH0/hqdefault.jpg', 'width': 480, 'height': 360}}",Historical Africa,none,2025-09-29T12:00:01Z,0c8wKogRKH0,"<iframe width=""480"" height=""270"" src=""//www.youtube.com/embed/0c8wKogRKH0"" frameborder=""0"" allow=""accelerometer; autoplay; clipboard-write; encrypted-media; gyroscope; picture-in-picture; web-share"" referrerpolicy=""strict-origin-when-cross-origin"" allowfullscreen></iframe>",History
50,2025-09-29T08:44:55Z,UC2-nif4wvOqT6QVsBX3NOpA,Explore The Galaxy! #ad,"https://strms.net/startrek_theyarbros Download Star Trek Fleet Command now - Build your fleet, explore the galaxy, and battle for ...","{'default': {'url': 'https://i.ytimg.com/vi/oVhdYvJCUgE/default.jpg', 'width': 120, 'height': 90}, 'medium': {'url': 'https://i.ytimg.com/vi/oVhdYvJCUgE/mqdefault.jpg', 'width': 320, 'height': 180}, 'high': {'url': 'https://i.ytimg.com/vi/oVhdYvJCUgE/hqdefault.jpg', 'width': 480, 'height': 360}}",The Yarbros,none,2025-09-29T08:44:55Z,oVhdYvJCUgE,"<iframe width=""480"" height=""270"" src=""//www.youtube.com/embed/oVhdYvJCUgE"" frameborder=""0"" allow=""accelerometer; autoplay; clipboard-write; encrypted-media; gyroscope; picture-in-picture; web-share"" referrerpolicy=""strict-origin-when-cross-origin"" allowfullscreen></iframe>",Travel
31,2025-09-29T06:03:44Z,UC1ettU5YSf_nIOJWffCKGQw,Ghana King reveals the true world map,,"{'default': {'url': 'https://i.ytimg.com/vi/QG5aHOlYIKk/default.jpg', 'width': 120, 'height': 90}, 'medium': {'url': 'https://i.ytimg.com/vi/QG5aHOlYIKk/mqdefault.jpg', 'width': 320, 'height': 180}, 'high': {'url': 'https://i.ytimg.com/vi/QG5aHOlYIKk/hqdefault.jpg', 'width': 480, 'height': 360}}",LuiSpot,none,2025-09-29T06:03:44Z,QG5aHOlYIKk,"<iframe width=""480"" height=""270"" src=""//www.youtube.com/embed/QG5aHOlYIKk"" frameborder=""0"" allow=""accelerometer; autoplay; clipboard-write; encrypted-media; gyroscope; picture-in-picture; web-share"" referrerpolicy=""strict-origin-when-cross-origin"" allowfullscreen></iframe>",Current Events
11,2025-09-28T20:15:03Z,UCZEMyEeGRnkGERZTWEGLGPg,The Black Soldiers That Terrified White America,Black Culture Unlocked is a movement focused on bringing the raw truth and real history to the culture. Our mission is to write our ...,"{'default': {'url': 'https://i.ytimg.com/vi/kNOOx8fG3Ys/default.jpg', 'width': 120, 'height': 90}, 'medium': {'url': 'https://i.ytimg.com/vi/kNOOx8fG3Ys/mqdefault.jpg', 'width': 320, 'height': 180}, 'high': {'url': 'https://i.ytimg.com/vi/kNOOx8fG3Ys/hqdefault.jpg', 'width': 480, 'height': 360}}",Black Culture Unlocked,none,2025-09-28T20:15:03Z,kNOOx8fG3Ys,"<iframe width=""480"" height=""270"" src=""//www.youtube.com/embed/kNOOx8fG3Ys"" frameborder=""0"" allow=""accelerometer; autoplay; clipboard-write; encrypted-media; gyroscope; picture-in-picture; web-share"" referrerpolicy=""strict-origin-when-cross-origin"" allowfullscreen></iframe>",Social Issues
13,2025-09-28T18:40:44Z,UCWCreFX8bTVLJ6Y9lh6eZ5A,Rosa Of Savannah! Slave Who Axed Her Master and His 3 Brothers to Death On Christmas Eve,We need your support! Please consider buying us a coffee to help sustain and grow our content. Your contribution directly fuels ...,"{'default': {'url': 'https://i.ytimg.com/vi/SlyScJJJYnQ/default.jpg', 'width': 120, 'height': 90}, 'medium': {'url': 'https://i.ytimg.com/vi/SlyScJJJYnQ/mqdefault.jpg', 'width': 320, 'height': 180}, 'high': {'url': 'https://i.ytimg.com/vi/SlyScJJJYnQ/hqdefault.jpg', 'width': 480, 'height': 360}}",Black Journals,none,2025-09-28T18:40:44Z,SlyScJJJYnQ,"<iframe width=""480"" height=""270"" src=""//www.youtube.com/embed/SlyScJJJYnQ"" frameborder=""0"" allow=""accelerometer; autoplay; clipboard-write; encrypted-media; gyroscope; picture-in-picture; web-share"" referrerpolicy=""strict-origin-when-cross-origin"" allowfullscreen></iframe>",Social Issues
1,2025-09-28T16:33:21Z,UCTis64XH8HrxE7GhEkA6YmA,BALLON D&#39;OR RECAP | DEMBELE MAKES BLACK HISTORY | RAPHINHA UNDERRATED | ARSENAL WINNING UCL? +MORE,"In Episode 96, the guys recap the Ballon d'Or winners of this week, talk about all the cultural significance, where voters got it ...","{'default': {'url': 'https://i.ytimg.com/vi/9SlNYfzjajg/default.jpg', 'width': 120, 'height': 90}, 'medium': {'url': 'https://i.ytimg.com/vi/9SlNYfzjajg/mqdefault.jpg', 'width': 320, 'height': 180}, 'high': {'url': 'https://i.ytimg.com/vi/9SlNYfzjajg/hqdefault.jpg', 'width': 480, 'height': 360}}",5ASIDE Media,none,2025-09-28T16:33:21Z,9SlNYfzjajg,"<iframe width=""480"" height=""270"" src=""//www.youtube.com/embed/9SlNYfzjajg"" frameborder=""0"" allow=""accelerometer; autoplay; clipboard-write; encrypted-media; gyroscope; picture-in-picture; web-share"" referrerpolicy=""strict-origin-when-cross-origin"" allowfullscreen></iframe>",Sports
