,publishedAt,channelId,title,description,thumbnails,channelTitle,liveBroadcastContent,publishTime,videoID,embeds,category
21,2025-02-20T12:30:15Z,UCC0XWOgSBcwNstXbPX2cbpg,ANGRY Ramaphosa lectures Trump how WHlTES folks like EL0N MUSK Stole lands from South Africans.,"For copyright matters, takedown, or complaint please contact: historicalafrika@gmail.com Land. It represents more than just soil ...","{'default': {'url': 'https://i.ytimg.com/vi/HMteGZvC68o/default.jpg', 'width': 120, 'height': 90}, 'medium': {'url': 'https://i.ytimg.com/vi/HMteGZvC68o/mqdefault.jpg', 'width': 320, 'height': 180}, 'high': {'url': 'https://i.ytimg.com/vi/HMteGZvC68o/hqdefault.jpg', 'width': 480, 'height': 360}}",Historical Africa,none,2025-02-20T12:30:15Z,HMteGZvC68o,"<iframe width=""480"" height=""270"" src=""//www.youtube.com/embed/HMteGZvC68o"" frameborder=""0"" allow=""accelerometer; autoplay; clipboard-write; encrypted-media; gyroscope; picture-in-picture; web-share"" referrerpolicy=""strict-origin-when-cross-origin"" allowfullscreen></iframe>",History
0,2025-02-19T18:54:35Z,UCG7uFJVZsxQRwDssom9Pavw,DRC MinisterSays Rwanda&#39;s Sucess is Only Due to Looting Congo&#39;s Wealth,"he DRC Minister of Communication and Government Spokesman, Patrick Muyaya, stated that the war in eastern DRC is being ...","{'default': {'url': 'https://i.ytimg.com/vi/lQHYUuAJZdI/default.jpg', 'width': 120, 'height': 90}, 'medium': {'url': 'https://i.ytimg.com/vi/lQHYUuAJZdI/mqdefault.jpg', 'width': 320, 'height': 180}, 'high': {'url': 'https://i.ytimg.com/vi/lQHYUuAJZdI/hqdefault.jpg', 'width': 480, 'height': 360}}",2nacheki,none,2025-02-19T18:54:35Z,lQHYUuAJZdI,"<iframe width=""480"" height=""270"" src=""//www.youtube.com/embed/lQHYUuAJZdI"" frameborder=""0"" allow=""accelerometer; autoplay; clipboard-write; encrypted-media; gyroscope; picture-in-picture; web-share"" referrerpolicy=""strict-origin-when-cross-origin"" allowfullscreen></iframe>",Current Events
54,2025-02-18T21:15:01Z,UCZEMyEeGRnkGERZTWEGLGPg,The DARK TRUTH Why The US Government Murdered Fred Hampton!,Black Culture Unlocked is a movement focused on bringing the raw truth and real history to the culture. Our mission is to write our ...,"{'default': {'url': 'https://i.ytimg.com/vi/iU9E6YdxSL8/default.jpg', 'width': 120, 'height': 90}, 'medium': {'url': 'https://i.ytimg.com/vi/iU9E6YdxSL8/mqdefault.jpg', 'width': 320, 'height': 180}, 'high': {'url': 'https://i.ytimg.com/vi/iU9E6YdxSL8/hqdefault.jpg', 'width': 480, 'height': 360}}",Black Culture Unlocked,none,2025-02-18T21:15:01Z,iU9E6YdxSL8,"<iframe width=""480"" height=""270"" src=""//www.youtube.com/embed/iU9E6YdxSL8"" frameborder=""0"" allow=""accelerometer; autoplay; clipboard-write; encrypted-media; gyroscope; picture-in-picture; web-share"" referrerpolicy=""strict-origin-when-cross-origin"" allowfullscreen></iframe>",Social Issues
25,2025-02-17T17:01:00Z,UCpEf2jEfyAEbQesGgl1HOWA,8 THINGS I DID NOT BELIEVE ABOUT GHANA UNTIL I MOVED HERE,"livinginghana So what are living conditions in Ghana like? As it is anywhere around the world, generally the living conditions of a ...","{'default': {'url': 'https://i.ytimg.com/vi/gNVYZNklL0Q/default.jpg', 'width': 120, 'height': 90}, 'medium': {'url': 'https://i.ytimg.com/vi/gNVYZNklL0Q/mqdefault.jpg', 'width': 320, 'height': 180}, 'high': {'url': 'https://i.ytimg.com/vi/gNVYZNklL0Q/hqdefault.jpg', 'width': 480, 'height': 360}}",Jasmine Ama,none,2025-02-17T17:01:00Z,gNVYZNklL0Q,"<iframe width=""480"" height=""270"" src=""//www.youtube.com/embed/gNVYZNklL0Q"" frameborder=""0"" allow=""accelerometer; autoplay; clipboard-write; encrypted-media; gyroscope; picture-in-picture; web-share"" referrerpolicy=""strict-origin-when-cross-origin"" allowfullscreen></iframe>",Travel
50,2025-02-17T14:25:15Z,UCXyHjFIKz9D8ofxObOuYBbg,Managing Expectations,WeNeedToTalk #BlackLove To support our ministry: https://cash.app/$wnttalk Please SUBSCRIBE for more content!,"{'default': {'url': 'https://i.ytimg.com/vi/SGM-Z2dcVI0/default.jpg', 'width': 120, 'height': 90}, 'medium': {'url': 'https://i.ytimg.com/vi/SGM-Z2dcVI0/mqdefault.jpg', 'width': 320, 'height': 180}, 'high': {'url': 'https://i.ytimg.com/vi/SGM-Z2dcVI0/hqdefault.jpg', 'width': 480, 'height': 360}}",WeNeedToTalk,none,2025-02-17T14:25:15Z,SGM-Z2dcVI0,"<iframe width=""480"" height=""270"" src=""//www.youtube.com/embed/SGM-Z2dcVI0"" frameborder=""0"" allow=""accelerometer; autoplay; clipboard-write; encrypted-media; gyroscope; picture-in-picture; web-share"" referrerpolicy=""strict-origin-when-cross-origin"" allowfullscreen></iframe>",Social Issues
36,2025-02-17T04:58:33Z,UCPk29gUc_ltOGQ6f3Lh5kCg,Naked Acts (1996) is out now on Blu-Ray and DVD | Charles Woods Mike D. #moviesyoushouldknowabout,"Reelblack Podcast Co-hosts Mike D. and Charles Woods talks Bridgett M. Davis' NAKED ACTS (1996), which was recently ...","{'default': {'url': 'https://i.ytimg.com/vi/Xx2vHwEQgGY/default.jpg', 'width': 120, 'height': 90}, 'medium': {'url': 'https://i.ytimg.com/vi/Xx2vHwEQgGY/mqdefault.jpg', 'width': 320, 'height': 180}, 'high': {'url': 'https://i.ytimg.com/vi/Xx2vHwEQgGY/hqdefault.jpg', 'width': 480, 'height': 360}}",Reelblack One,none,2025-02-17T04:58:33Z,Xx2vHwEQgGY,"<iframe width=""480"" height=""270"" src=""//www.youtube.com/embed/Xx2vHwEQgGY"" frameborder=""0"" allow=""accelerometer; autoplay; clipboard-write; encrypted-media; gyroscope; picture-in-picture; web-share"" referrerpolicy=""strict-origin-when-cross-origin"" allowfullscreen></iframe>",Entertainment
30,2025-02-17T04:39:29Z,UC4YZVeGnDXzEfjGcZG-d6oQ,Take Me Down A Rabbithole Ep. 17,New to streaming or looking to level up? Check out StreamYard and get $10 discount!,"{'default': {'url': 'https://i.ytimg.com/vi/XVtRrECezco/default.jpg', 'width': 120, 'height': 90}, 'medium': {'url': 'https://i.ytimg.com/vi/XVtRrECezco/mqdefault.jpg', 'width': 320, 'height': 180}, 'high': {'url': 'https://i.ytimg.com/vi/XVtRrECezco/hqdefault.jpg', 'width': 480, 'height': 360}}",meandepiphany,none,2025-02-17T04:39:29Z,XVtRrECezco,"<iframe width=""480"" height=""270"" src=""//www.youtube.com/embed/XVtRrECezco"" frameborder=""0"" allow=""accelerometer; autoplay; clipboard-write; encrypted-media; gyroscope; picture-in-picture; web-share"" referrerpolicy=""strict-origin-when-cross-origin"" allowfullscreen></iframe>",Social Issues
53,2025-02-17T03:46:44Z,UCx5Y5d5KgibkG9KAyknCdFA,How Black History Month Is Used Against Us,"Black History Month is celebrated every year, but are we really learning the full story? In this video, we break down how Black ...","{'default': {'url': 'https://i.ytimg.com/vi/6_2bG8U1MdY/default.jpg', 'width': 120, 'height': 90}, 'medium': {'url': 'https://i.ytimg.com/vi/6_2bG8U1MdY/mqdefault.jpg', 'width': 320, 'height': 180}, 'high': {'url': 'https://i.ytimg.com/vi/6_2bG8U1MdY/hqdefault.jpg', 'width': 480, 'height': 360}}",Afromation Digital,none,2025-02-17T03:46:44Z,6_2bG8U1MdY,"<iframe width=""480"" height=""270"" src=""//www.youtube.com/embed/6_2bG8U1MdY"" frameborder=""0"" allow=""accelerometer; autoplay; clipboard-write; encrypted-media; gyroscope; picture-in-picture; web-share"" referrerpolicy=""strict-origin-when-cross-origin"" allowfullscreen></iframe>",Social Issues
34,2025-02-16T21:08:32Z,UCMe6CgCi6TSZX1tUxuUvCGg,Coming up Live tonight Baba Nijala Amhose Bajano Mwata Nubian,"Welcome Baba NIJALA AMHOSE BAJANO MWATA NUBIAN, Panamanian scholar and PanAfricanist. Topic: Neo-Colonialism in ...","{'default': {'url': 'https://i.ytimg.com/vi/pGf_ArFlOAY/default.jpg', 'width': 120, 'height': 90}, 'medium': {'url': 'https://i.ytimg.com/vi/pGf_ArFlOAY/mqdefault.jpg', 'width': 320, 'height': 180}, 'high': {'url': 'https://i.ytimg.com/vi/pGf_ArFlOAY/hqdefault.jpg', 'width': 480, 'height': 360}}","Pan-African Daily TV, PADTV",none,2025-02-16T21:08:32Z,pGf_ArFlOAY,"<iframe width=""480"" height=""270"" src=""//www.youtube.com/embed/pGf_ArFlOAY"" frameborder=""0"" allow=""accelerometer; autoplay; clipboard-write; encrypted-media; gyroscope; picture-in-picture; web-share"" referrerpolicy=""strict-origin-when-cross-origin"" allowfullscreen></iframe>",Current Events
4,2025-02-15T16:00:42Z,UCJmmxwdAsR7lD8fBA_qbEMw,Africa&#39;s Most Dangerous Mercenaries: EXECUTIVE OUTCOMES,"Throughout history, mercenaries have played a pivotal role in the ambitions of imperial powers and opportunistic individuals ...","{'default': {'url': 'https://i.ytimg.com/vi/dluaSkF7zmE/default.jpg', 'width': 120, 'height': 90}, 'medium': {'url': 'https://i.ytimg.com/vi/dluaSkF7zmE/mqdefault.jpg', 'width': 320, 'height': 180}, 'high': {'url': 'https://i.ytimg.com/vi/dluaSkF7zmE/hqdefault.jpg', 'width': 480, 'height': 360}}",African Biographics,none,2025-02-15T16:00:42Z,dluaSkF7zmE,"<iframe width=""480"" height=""270"" src=""//www.youtube.com/embed/dluaSkF7zmE"" frameborder=""0"" allow=""accelerometer; autoplay; clipboard-write; encrypted-media; gyroscope; picture-in-picture; web-share"" referrerpolicy=""strict-origin-when-cross-origin"" allowfullscreen></iframe>",History
35,2025-02-13T15:00:06Z,UCF71yDQwxfw0QcYb2JnkB5Q,I Thought Cruises Were TRASH… So I Took One to Prove It! Virgin Voyages,"We've avoided cruises our whole lives—overcrowded buffets, tourist traps, and feeling stuck at sea? Not for us. But one of our ...","{'default': {'url': 'https://i.ytimg.com/vi/4XADlrNkg_Q/default.jpg', 'width': 120, 'height': 90}, 'medium': {'url': 'https://i.ytimg.com/vi/4XADlrNkg_Q/mqdefault.jpg', 'width': 320, 'height': 180}, 'high': {'url': 'https://i.ytimg.com/vi/4XADlrNkg_Q/hqdefault.jpg', 'width': 480, 'height': 360}}",PassportHeavy,none,2025-02-13T15:00:06Z,4XADlrNkg_Q,"<iframe width=""480"" height=""270"" src=""//www.youtube.com/embed/4XADlrNkg_Q"" frameborder=""0"" allow=""accelerometer; autoplay; clipboard-write; encrypted-media; gyroscope; picture-in-picture; web-share"" referrerpolicy=""strict-origin-when-cross-origin"" allowfullscreen></iframe>",Travel
45,2025-02-13T11:59:25Z,UCjBw2SidW7wFElbmj9bgDjw,The faces of Thuya and Yuya DECODED,Join us as we recreate the faces of these 18th Dynasty monarchs from over 3000 years ago by using their available artwork as a ...,"{'default': {'url': 'https://i.ytimg.com/vi/Qe2QdsfZvqI/default.jpg', 'width': 120, 'height': 90}, 'medium': {'url': 'https://i.ytimg.com/vi/Qe2QdsfZvqI/mqdefault.jpg', 'width': 320, 'height': 180}, 'high': {'url': 'https://i.ytimg.com/vi/Qe2QdsfZvqI/hqdefault.jpg', 'width': 480, 'height': 360}}",The Kings Monologue,none,2025-02-13T11:59:25Z,Qe2QdsfZvqI,"<iframe width=""480"" height=""270"" src=""//www.youtube.com/embed/Qe2QdsfZvqI"" frameborder=""0"" allow=""accelerometer; autoplay; clipboard-write; encrypted-media; gyroscope; picture-in-picture; web-share"" referrerpolicy=""strict-origin-when-cross-origin"" allowfullscreen></iframe>",History
52,2025-02-08T17:14:18Z,UClwrpH_Np9zk8uMwnMwu8Nw,The Beauty Of This African Country Will Shock You (Lesotho🇱🇸),The Image of AFRICA has been DISTORTED around the WORLD & We are CHANGING the NARRATIVE via YOUTUBE videos ...,"{'default': {'url': 'https://i.ytimg.com/vi/99YIRJWf3n0/default.jpg', 'width': 120, 'height': 90}, 'medium': {'url': 'https://i.ytimg.com/vi/99YIRJWf3n0/mqdefault.jpg', 'width': 320, 'height': 180}, 'high': {'url': 'https://i.ytimg.com/vi/99YIRJWf3n0/hqdefault.jpg', 'width': 480, 'height': 360}}",WODE MAYA,none,2025-02-08T17:14:18Z,99YIRJWf3n0,"<iframe width=""480"" height=""270"" src=""//www.youtube.com/embed/99YIRJWf3n0"" frameborder=""0"" allow=""accelerometer; autoplay; clipboard-write; encrypted-media; gyroscope; picture-in-picture; web-share"" referrerpolicy=""strict-origin-when-cross-origin"" allowfullscreen></iframe>",Travel
48,2025-01-13T16:33:06Z,UC2-nif4wvOqT6QVsBX3NOpA,What EVERYONE Needs to Know About NAIROBI,"This is the truth about why you should visit Nairobi. After our first impressions, it was time to explore more of the city. Favorite ...","{'default': {'url': 'https://i.ytimg.com/vi/LaYBojPsJio/default.jpg', 'width': 120, 'height': 90}, 'medium': {'url': 'https://i.ytimg.com/vi/LaYBojPsJio/mqdefault.jpg', 'width': 320, 'height': 180}, 'high': {'url': 'https://i.ytimg.com/vi/LaYBojPsJio/hqdefault.jpg', 'width': 480, 'height': 360}}",The Yarbros,none,2025-01-13T16:33:06Z,LaYBojPsJio,"<iframe width=""480"" height=""270"" src=""//www.youtube.com/embed/LaYBojPsJio"" frameborder=""0"" allow=""accelerometer; autoplay; clipboard-write; encrypted-media; gyroscope; picture-in-picture; web-share"" referrerpolicy=""strict-origin-when-cross-origin"" allowfullscreen></iframe>",Travel
32,2025-01-11T16:00:06Z,UCJH-fn0wLu5uwXX33jNToQw,Samora Machel&#39;s Struggle | How Mozambique’s Revolution Ended Portugal&#39;s Empire,"The most beautiful thing about a man's life is his freedom. He may not have any food, and he may not have any clothing, but at ...","{'default': {'url': 'https://i.ytimg.com/vi/wTwI48jN-fY/default.jpg', 'width': 120, 'height': 90}, 'medium': {'url': 'https://i.ytimg.com/vi/wTwI48jN-fY/mqdefault.jpg', 'width': 320, 'height': 180}, 'high': {'url': 'https://i.ytimg.com/vi/wTwI48jN-fY/hqdefault.jpg', 'width': 480, 'height': 360}}",NewAfrica,none,2025-01-11T16:00:06Z,wTwI48jN-fY,"<iframe width=""480"" height=""270"" src=""//www.youtube.com/embed/wTwI48jN-fY"" frameborder=""0"" allow=""accelerometer; autoplay; clipboard-write; encrypted-media; gyroscope; picture-in-picture; web-share"" referrerpolicy=""strict-origin-when-cross-origin"" allowfullscreen></iframe>",Current Events
26,2024-12-29T11:40:48Z,UC__wkIWEfbnTAYVT8j6gfPg,Modern Egyptian&#39;s DNA results,,"{'default': {'url': 'https://i.ytimg.com/vi/dCUtLFenWGg/default.jpg', 'width': 120, 'height': 90}, 'medium': {'url': 'https://i.ytimg.com/vi/dCUtLFenWGg/mqdefault.jpg', 'width': 320, 'height': 180}, 'high': {'url': 'https://i.ytimg.com/vi/dCUtLFenWGg/hqdefault.jpg', 'width': 480, 'height': 360}}",Know Thyself,none,2024-12-29T11:40:48Z,dCUtLFenWGg,"<iframe width=""480"" height=""270"" src=""//www.youtube.com/embed/dCUtLFenWGg"" frameborder=""0"" allow=""accelerometer; autoplay; clipboard-write; encrypted-media; gyroscope; picture-in-picture; web-share"" referrerpolicy=""strict-origin-when-cross-origin"" allowfullscreen></iframe>",History
8,2024-11-10T05:30:00Z,UCbvE_5m8kmm9U58gDHtzYrA,Nigeria has been named the best Jollof rice maker‼️🇳🇬🍚,,"{'default': {'url': 'https://i.ytimg.com/vi/ZkdyXscEAFI/default.jpg', 'width': 120, 'height': 90}, 'medium': {'url': 'https://i.ytimg.com/vi/ZkdyXscEAFI/mqdefault.jpg', 'width': 320, 'height': 180}, 'high': {'url': 'https://i.ytimg.com/vi/ZkdyXscEAFI/hqdefault.jpg', 'width': 480, 'height': 360}}",AfroBallers,none,2024-11-10T05:30:00Z,ZkdyXscEAFI,"<iframe width=""480"" height=""360"" src=""//www.youtube.com/embed/ZkdyXscEAFI"" frameborder=""0"" allow=""accelerometer; autoplay; clipboard-write; encrypted-media; gyroscope; picture-in-picture; web-share"" referrerpolicy=""strict-origin-when-cross-origin"" allowfullscreen></iframe>",Sports
9,2024-08-31T16:32:50Z,UC2xX2FI6s4i9xz3t9qjayhg,The San Quentin Six (1972),"A documentary on the six Black and Chicano prisoners who, following George Jackson's death, were charged on charges of ...","{'default': {'url': 'https://i.ytimg.com/vi/E-4CUaaSo4I/default.jpg', 'width': 120, 'height': 90}, 'medium': {'url': 'https://i.ytimg.com/vi/E-4CUaaSo4I/mqdefault.jpg', 'width': 320, 'height': 180}, 'high': {'url': 'https://i.ytimg.com/vi/E-4CUaaSo4I/hqdefault.jpg', 'width': 480, 'height': 360}}",AfroMarxist,none,2024-08-31T16:32:50Z,E-4CUaaSo4I,"<iframe width=""480"" height=""360"" src=""//www.youtube.com/embed/E-4CUaaSo4I"" frameborder=""0"" allow=""accelerometer; autoplay; clipboard-write; encrypted-media; gyroscope; picture-in-picture; web-share"" referrerpolicy=""strict-origin-when-cross-origin"" allowfullscreen></iframe>",History
31,2024-08-25T18:19:19Z,UCh2ANLALdN1OZUJKmvchkkg,The INSANE True Story of Cleopatra in Pop Culture | Documentary,"Cleopatra is one of the most iconic figures associated with ancient Egypt, but our perception of the queen is not correct.","{'default': {'url': 'https://i.ytimg.com/vi/dwSSQFS-OQY/default.jpg', 'width': 120, 'height': 90}, 'medium': {'url': 'https://i.ytimg.com/vi/dwSSQFS-OQY/mqdefault.jpg', 'width': 320, 'height': 180}, 'high': {'url': 'https://i.ytimg.com/vi/dwSSQFS-OQY/hqdefault.jpg', 'width': 480, 'height': 360}}",Mr. Imhotep,none,2024-08-25T18:19:19Z,dwSSQFS-OQY,"<iframe width=""480"" height=""270"" src=""//www.youtube.com/embed/dwSSQFS-OQY"" frameborder=""0"" allow=""accelerometer; autoplay; clipboard-write; encrypted-media; gyroscope; picture-in-picture; web-share"" referrerpolicy=""strict-origin-when-cross-origin"" allowfullscreen></iframe>",History
14,2024-08-25T18:00:03Z,UCMMTYgqKEgCgy1pR6Axlf0A,"Ex-model moved to Ghana to build a 5 bedroom home, set up 7 businesses and live her dream life",Our guest today left behind her 15 year career in the modelling industry to move to Ghana and start a new life here. This amazing ...,"{'default': {'url': 'https://i.ytimg.com/vi/6TMZcRoGZi4/default.jpg', 'width': 120, 'height': 90}, 'medium': {'url': 'https://i.ytimg.com/vi/6TMZcRoGZi4/mqdefault.jpg', 'width': 320, 'height': 180}, 'high': {'url': 'https://i.ytimg.com/vi/6TMZcRoGZi4/hqdefault.jpg', 'width': 480, 'height': 360}}",Build with Amoaa,none,2024-08-25T18:00:03Z,6TMZcRoGZi4,"<iframe width=""480"" height=""270"" src=""//www.youtube.com/embed/6TMZcRoGZi4"" frameborder=""0"" allow=""accelerometer; autoplay; clipboard-write; encrypted-media; gyroscope; picture-in-picture; web-share"" referrerpolicy=""strict-origin-when-cross-origin"" allowfullscreen></iframe>",Travel
37,2024-08-14T15:00:22Z,UCCfgU1Dgpz0MzA-4vP_gRuQ,Africa&#39;s Last Emperor | Jean-Bédel Bokassa,Jean-Bédel Bokassa will perhaps mostly be remembered chiefly for an oversized Napoleon complex and his love for everything ...,"{'default': {'url': 'https://i.ytimg.com/vi/LbXKaOqyUiE/default.jpg', 'width': 120, 'height': 90}, 'medium': {'url': 'https://i.ytimg.com/vi/LbXKaOqyUiE/mqdefault.jpg', 'width': 320, 'height': 180}, 'high': {'url': 'https://i.ytimg.com/vi/LbXKaOqyUiE/hqdefault.jpg', 'width': 480, 'height': 360}}",Risen Africa,none,2024-08-14T15:00:22Z,LbXKaOqyUiE,"<iframe width=""480"" height=""270"" src=""//www.youtube.com/embed/LbXKaOqyUiE"" frameborder=""0"" allow=""accelerometer; autoplay; clipboard-write; encrypted-media; gyroscope; picture-in-picture; web-share"" referrerpolicy=""strict-origin-when-cross-origin"" allowfullscreen></iframe>",Current Events
7,2024-07-12T12:15:30Z,UCl6to6J7oVltnhHEVm1s87A,AFRICAN ORIGIN OF MORDEN HAIRSTYLES,theperspective #africanhistory #africanews #africax5 Traditional African hairstyles are back in fashion and making a real ...,"{'default': {'url': 'https://i.ytimg.com/vi/AGyMe_XB3mQ/default.jpg', 'width': 120, 'height': 90}, 'medium': {'url': 'https://i.ytimg.com/vi/AGyMe_XB3mQ/mqdefault.jpg', 'width': 320, 'height': 180}, 'high': {'url': 'https://i.ytimg.com/vi/AGyMe_XB3mQ/hqdefault.jpg', 'width': 480, 'height': 360}}",Africax5 Network,none,2024-07-12T12:15:30Z,AGyMe_XB3mQ,"<iframe width=""480"" height=""360"" src=""//www.youtube.com/embed/AGyMe_XB3mQ"" frameborder=""0"" allow=""accelerometer; autoplay; clipboard-write; encrypted-media; gyroscope; picture-in-picture; web-share"" referrerpolicy=""strict-origin-when-cross-origin"" allowfullscreen></iframe>",Social Issues
27,2024-07-08T12:10:25Z,UCHbmePHjGH3pklvSla6szWw,You Wouldn&#39;t Survive In Ancient Egypt | REACTION - KueliMika,Today we are reacting to the video You Wouldn't Survive In Ancient Egypt.,"{'default': {'url': 'https://i.ytimg.com/vi/qFbr17zUKYE/default.jpg', 'width': 120, 'height': 90}, 'medium': {'url': 'https://i.ytimg.com/vi/qFbr17zUKYE/mqdefault.jpg', 'width': 320, 'height': 180}, 'high': {'url': 'https://i.ytimg.com/vi/qFbr17zUKYE/hqdefault.jpg', 'width': 480, 'height': 360}}",KueliMika,none,2024-07-08T12:10:25Z,qFbr17zUKYE,"<iframe width=""480"" height=""270"" src=""//www.youtube.com/embed/qFbr17zUKYE"" frameborder=""0"" allow=""accelerometer; autoplay; clipboard-write; encrypted-media; gyroscope; picture-in-picture; web-share"" referrerpolicy=""strict-origin-when-cross-origin"" allowfullscreen></iframe>",History
3,2024-04-25T23:00:06Z,UCTTQWaoGloNuhunZevQ2F6g,"Kuubwa Transforming African Businesses: Fabric Weaver, Fish Farmers","Kuubwa Transforms African Businesses: Fish Farmers, Fabric Manufacturers and more.","{'default': {'url': 'https://i.ytimg.com/vi/gC02Wht1UQQ/default.jpg', 'width': 120, 'height': 90}, 'medium': {'url': 'https://i.ytimg.com/vi/gC02Wht1UQQ/mqdefault.jpg', 'width': 320, 'height': 180}, 'high': {'url': 'https://i.ytimg.com/vi/gC02Wht1UQQ/hqdefault.jpg', 'width': 480, 'height': 360}}",Africa Business Channel TV,none,2024-04-25T23:00:06Z,gC02Wht1UQQ,"<iframe width=""480"" height=""270"" src=""//www.youtube.com/embed/gC02Wht1UQQ"" frameborder=""0"" allow=""accelerometer; autoplay; clipboard-write; encrypted-media; gyroscope; picture-in-picture; web-share"" referrerpolicy=""strict-origin-when-cross-origin"" allowfullscreen></iframe>",Productivity
42,2024-04-11T05:04:02Z,UCuvO0y2EU_kRfYzlhGJNOKA,How Did America&#39;s Wealthy Elite Re Write World History,"The United States was supposed to be a democratically run country. However, that has not been the case since the turn of the ...","{'default': {'url': 'https://i.ytimg.com/vi/RPSnS-ucmOA/default.jpg', 'width': 120, 'height': 90}, 'medium': {'url': 'https://i.ytimg.com/vi/RPSnS-ucmOA/mqdefault.jpg', 'width': 320, 'height': 180}, 'high': {'url': 'https://i.ytimg.com/vi/RPSnS-ucmOA/hqdefault.jpg', 'width': 480, 'height': 360}}",Straight UP,none,2024-04-11T05:04:02Z,RPSnS-ucmOA,"<iframe width=""480"" height=""270"" src=""//www.youtube.com/embed/RPSnS-ucmOA"" frameborder=""0"" allow=""accelerometer; autoplay; clipboard-write; encrypted-media; gyroscope; picture-in-picture; web-share"" referrerpolicy=""strict-origin-when-cross-origin"" allowfullscreen></iframe>",History
41,2024-04-11T05:04:02Z,UCuvO0y2EU_kRfYzlhGJNOKA,How Did America&#39;s Wealthy Elite Re Write World History,"The United States was supposed to be a democratically run country. However, that has not been the case since the turn of the ...","{'default': {'url': 'https://i.ytimg.com/vi/RPSnS-ucmOA/default.jpg', 'width': 120, 'height': 90}, 'medium': {'url': 'https://i.ytimg.com/vi/RPSnS-ucmOA/mqdefault.jpg', 'width': 320, 'height': 180}, 'high': {'url': 'https://i.ytimg.com/vi/RPSnS-ucmOA/hqdefault.jpg', 'width': 480, 'height': 360}}",Straight UP,none,2024-04-11T05:04:02Z,RPSnS-ucmOA,"<iframe width=""480"" height=""270"" src=""//www.youtube.com/embed/RPSnS-ucmOA"" frameborder=""0"" allow=""accelerometer; autoplay; clipboard-write; encrypted-media; gyroscope; picture-in-picture; web-share"" referrerpolicy=""strict-origin-when-cross-origin"" allowfullscreen></iframe>",History
