,publishedAt,channelId,title,description,thumbnails,channelTitle,liveBroadcastContent,publishTime,videoID,embeds,category
49,2025-02-22T03:00:06Z,UCHVBLMcvOgDtFEF2bToQLqw,GENETICIST fear this TRUTH about you,"GENETICIST fear this TRUTH about you Genesis 2:19-20 And out of the ground the LORD God formed every beast of the field, ...","{'default': {'url': 'https://i.ytimg.com/vi/P19fhgUC3Ao/default.jpg', 'width': 120, 'height': 90}, 'medium': {'url': 'https://i.ytimg.com/vi/P19fhgUC3Ao/mqdefault.jpg', 'width': 320, 'height': 180}, 'high': {'url': 'https://i.ytimg.com/vi/P19fhgUC3Ao/hqdefault.jpg', 'width': 480, 'height': 360}}",We Woke Now,none,2025-02-22T03:00:06Z,P19fhgUC3Ao,"<iframe width=""480"" height=""270"" src=""//www.youtube.com/embed/P19fhgUC3Ao"" frameborder=""0"" allow=""accelerometer; autoplay; clipboard-write; encrypted-media; gyroscope; picture-in-picture; web-share"" referrerpolicy=""strict-origin-when-cross-origin"" allowfullscreen></iframe>",Social Issues
17,2025-02-22T01:00:23Z,UCwbP4USYrniJGROwQNiwH-Q,Are Black Women THE BEST To Marry?!,Order Merch Here: https://deedees-apparel.creator-spring.com Join My Patreon Here: https://www.patreon.com/deedeesreactions ...,"{'default': {'url': 'https://i.ytimg.com/vi/UjQh6-jV2LE/default.jpg', 'width': 120, 'height': 90}, 'medium': {'url': 'https://i.ytimg.com/vi/UjQh6-jV2LE/mqdefault.jpg', 'width': 320, 'height': 180}, 'high': {'url': 'https://i.ytimg.com/vi/UjQh6-jV2LE/hqdefault.jpg', 'width': 480, 'height': 360}}",DeeDee,none,2025-02-22T01:00:23Z,UjQh6-jV2LE,"<iframe width=""480"" height=""270"" src=""//www.youtube.com/embed/UjQh6-jV2LE"" frameborder=""0"" allow=""accelerometer; autoplay; clipboard-write; encrypted-media; gyroscope; picture-in-picture; web-share"" referrerpolicy=""strict-origin-when-cross-origin"" allowfullscreen></iframe>",Social Issues
16,2025-02-22T00:25:33Z,UCABZ7Z6SBTp4IsARDceOq7w,Notorious B.I.G.&#39;s Mom &#39;Suddenly&#39; Passes Away At 72 - HP News,"https://hypersclub.com/ - Today it has been announced that Biggie's Smalls mother, Voletta Wallace, has passed away at 72 after ...","{'default': {'url': 'https://i.ytimg.com/vi/40Pvss_xIjQ/default.jpg', 'width': 120, 'height': 90}, 'medium': {'url': 'https://i.ytimg.com/vi/40Pvss_xIjQ/mqdefault.jpg', 'width': 320, 'height': 180}, 'high': {'url': 'https://i.ytimg.com/vi/40Pvss_xIjQ/hqdefault.jpg', 'width': 480, 'height': 360}}",HYPE+,none,2025-02-22T00:25:33Z,40Pvss_xIjQ,"<iframe width=""480"" height=""270"" src=""//www.youtube.com/embed/40Pvss_xIjQ"" frameborder=""0"" allow=""accelerometer; autoplay; clipboard-write; encrypted-media; gyroscope; picture-in-picture; web-share"" referrerpolicy=""strict-origin-when-cross-origin"" allowfullscreen></iframe>",Entertainment
43,2025-02-21T23:17:15Z,UC4m46pCBkMEyy8gk26WKqbA,A POUR MIND&#39;S VALENTINES | 85 SOUTH SHOW PODCAST | 02.21.25,85southshow Watch the real now on https://www.channeleightyfive.com/ Get the latest 85 South Gear from Eighty Five Apparel Co ...,"{'default': {'url': 'https://i.ytimg.com/vi/xEW4ttXTTyA/default.jpg', 'width': 120, 'height': 90}, 'medium': {'url': 'https://i.ytimg.com/vi/xEW4ttXTTyA/mqdefault.jpg', 'width': 320, 'height': 180}, 'high': {'url': 'https://i.ytimg.com/vi/xEW4ttXTTyA/hqdefault.jpg', 'width': 480, 'height': 360}}",The 85 South Comedy Show,none,2025-02-21T23:17:15Z,xEW4ttXTTyA,"<iframe width=""480"" height=""270"" src=""//www.youtube.com/embed/xEW4ttXTTyA"" frameborder=""0"" allow=""accelerometer; autoplay; clipboard-write; encrypted-media; gyroscope; picture-in-picture; web-share"" referrerpolicy=""strict-origin-when-cross-origin"" allowfullscreen></iframe>",Entertainment
51,2025-02-21T23:00:46Z,UCIwGnOXoSXEI7Tooz3iKq5w,She just exposed the UN for what they really are,,"{'default': {'url': 'https://i.ytimg.com/vi/qiZ3D8r6N68/default.jpg', 'width': 120, 'height': 90}, 'medium': {'url': 'https://i.ytimg.com/vi/qiZ3D8r6N68/mqdefault.jpg', 'width': 320, 'height': 180}, 'high': {'url': 'https://i.ytimg.com/vi/qiZ3D8r6N68/hqdefault.jpg', 'width': 480, 'height': 360}}",Without History,none,2025-02-21T23:00:46Z,qiZ3D8r6N68,"<iframe width=""480"" height=""360"" src=""//www.youtube.com/embed/qiZ3D8r6N68"" frameborder=""0"" allow=""accelerometer; autoplay; clipboard-write; encrypted-media; gyroscope; picture-in-picture; web-share"" referrerpolicy=""strict-origin-when-cross-origin"" allowfullscreen></iframe>",History
5,2025-02-21T22:38:12Z,UCKZGcrxRAhdUi58Mdr565mw,White Man Says Hebrew Israelite March During NOLA Super Bowl Stopped a Whooping,LIVE: Vicki Dillard on Hebrew Israelites' Powerful Super Bowl March! Vicki Dillard breaks down the viral moment when ...,"{'default': {'url': 'https://i.ytimg.com/vi/_hdaF63jAeA/default.jpg', 'width': 120, 'height': 90}, 'medium': {'url': 'https://i.ytimg.com/vi/_hdaF63jAeA/mqdefault.jpg', 'width': 320, 'height': 180}, 'high': {'url': 'https://i.ytimg.com/vi/_hdaF63jAeA/hqdefault.jpg', 'width': 480, 'height': 360}}",African Diaspora News Channel,none,2025-02-21T22:38:12Z,_hdaF63jAeA,"<iframe width=""480"" height=""270"" src=""//www.youtube.com/embed/_hdaF63jAeA"" frameborder=""0"" allow=""accelerometer; autoplay; clipboard-write; encrypted-media; gyroscope; picture-in-picture; web-share"" referrerpolicy=""strict-origin-when-cross-origin"" allowfullscreen></iframe>",Current Events
33,2025-02-21T22:28:31Z,UCrPq2ekHx2vZtuyG3wUx0_g,Black History Is Keeping Black People In The Past?,,"{'default': {'url': 'https://i.ytimg.com/vi/f08ttk5UwLc/default.jpg', 'width': 120, 'height': 90}, 'medium': {'url': 'https://i.ytimg.com/vi/f08ttk5UwLc/mqdefault.jpg', 'width': 320, 'height': 180}, 'high': {'url': 'https://i.ytimg.com/vi/f08ttk5UwLc/hqdefault.jpg', 'width': 480, 'height': 360}}",On the Shoulders of Giants ,none,2025-02-21T22:28:31Z,f08ttk5UwLc,"<iframe width=""480"" height=""270"" src=""//www.youtube.com/embed/f08ttk5UwLc"" frameborder=""0"" allow=""accelerometer; autoplay; clipboard-write; encrypted-media; gyroscope; picture-in-picture; web-share"" referrerpolicy=""strict-origin-when-cross-origin"" allowfullscreen></iframe>",Social Issues
13,2025-02-21T22:07:20Z,UCiinSjWS3E0vtAa3DCvp7iA,Vigil for Palestinian Journalists at National Press Foundation Awards,"2024 was the ""deadliest year for journalists,"" according to The Committee to Protect Journalists, with 70% killed by Israel.","{'default': {'url': 'https://i.ytimg.com/vi/a8RxDbibXpY/default.jpg', 'width': 120, 'height': 90}, 'medium': {'url': 'https://i.ytimg.com/vi/a8RxDbibXpY/mqdefault.jpg', 'width': 320, 'height': 180}, 'high': {'url': 'https://i.ytimg.com/vi/a8RxDbibXpY/hqdefault.jpg', 'width': 480, 'height': 360}}",BreakThrough News,none,2025-02-21T22:07:20Z,a8RxDbibXpY,"<iframe width=""480"" height=""270"" src=""//www.youtube.com/embed/a8RxDbibXpY"" frameborder=""0"" allow=""accelerometer; autoplay; clipboard-write; encrypted-media; gyroscope; picture-in-picture; web-share"" referrerpolicy=""strict-origin-when-cross-origin"" allowfullscreen></iframe>",Current Events
29,2025-02-21T21:19:30Z,UCKLSjhp6XZUEYDT1DMcrj8w,Just In: The President of the Republic of Chad arrived in Burkina Faso,"Please SUBSCRIBE, LIKE, COMMENT and Share, Thank for Watching #Love #Peace #AfricanSolutions.","{'default': {'url': 'https://i.ytimg.com/vi/zcWDXOFl-Yg/default.jpg', 'width': 120, 'height': 90}, 'medium': {'url': 'https://i.ytimg.com/vi/zcWDXOFl-Yg/mqdefault.jpg', 'width': 320, 'height': 180}, 'high': {'url': 'https://i.ytimg.com/vi/zcWDXOFl-Yg/hqdefault.jpg', 'width': 480, 'height': 360}}",Make Afrika Great ,none,2025-02-21T21:19:30Z,zcWDXOFl-Yg,"<iframe width=""480"" height=""270"" src=""//www.youtube.com/embed/zcWDXOFl-Yg"" frameborder=""0"" allow=""accelerometer; autoplay; clipboard-write; encrypted-media; gyroscope; picture-in-picture; web-share"" referrerpolicy=""strict-origin-when-cross-origin"" allowfullscreen></iframe>",Current Events
23,2025-02-21T21:09:02Z,UCwZ2vurIl_X8rv0Dv4mu12A,What The Dank Demoss Lyft Lawsuit Teaches Us About The &#39;F&#39; Word | Ask Dave Anderson,"Dave Anderson is a multi-time bestselling author, business coach, and motivational speaker. In this informative clip, Dave ...","{'default': {'url': 'https://i.ytimg.com/vi/PVGznEZbV6E/default.jpg', 'width': 120, 'height': 90}, 'medium': {'url': 'https://i.ytimg.com/vi/PVGznEZbV6E/mqdefault.jpg', 'width': 320, 'height': 180}, 'high': {'url': 'https://i.ytimg.com/vi/PVGznEZbV6E/hqdefault.jpg', 'width': 480, 'height': 360}}",I Never Knew Tv,none,2025-02-21T21:09:02Z,PVGznEZbV6E,"<iframe width=""480"" height=""270"" src=""//www.youtube.com/embed/PVGznEZbV6E"" frameborder=""0"" allow=""accelerometer; autoplay; clipboard-write; encrypted-media; gyroscope; picture-in-picture; web-share"" referrerpolicy=""strict-origin-when-cross-origin"" allowfullscreen></iframe>",Social Issues
47,2025-02-21T21:00:26Z,UCPQsrvUJzs1INc2hroy3nHw,Most Embarrassing Health Secret You Hid from Your Doctor? #shorts #short,,"{'default': {'url': 'https://i.ytimg.com/vi/bQIc4ZYSpjE/default.jpg', 'width': 120, 'height': 90}, 'medium': {'url': 'https://i.ytimg.com/vi/bQIc4ZYSpjE/mqdefault.jpg', 'width': 320, 'height': 180}, 'high': {'url': 'https://i.ytimg.com/vi/bQIc4ZYSpjE/hqdefault.jpg', 'width': 480, 'height': 360}}",The Pan African Dating Show (The-PDS),none,2025-02-21T21:00:26Z,bQIc4ZYSpjE,"<iframe width=""480"" height=""270"" src=""//www.youtube.com/embed/bQIc4ZYSpjE"" frameborder=""0"" allow=""accelerometer; autoplay; clipboard-write; encrypted-media; gyroscope; picture-in-picture; web-share"" referrerpolicy=""strict-origin-when-cross-origin"" allowfullscreen></iframe>",Social Issues
11,2025-02-21T20:49:40Z,UCWCreFX8bTVLJ6Y9lh6eZ5A,Genius Black Man Wins 26 Court Cases Without A Law Degree,Please SUPPORT Our African Journal Channel https://www.youtube.com/@TheAfricanJournal/videos Powerful Asian spring ...,"{'default': {'url': 'https://i.ytimg.com/vi/kZL1YNcSR1I/default.jpg', 'width': 120, 'height': 90}, 'medium': {'url': 'https://i.ytimg.com/vi/kZL1YNcSR1I/mqdefault.jpg', 'width': 320, 'height': 180}, 'high': {'url': 'https://i.ytimg.com/vi/kZL1YNcSR1I/hqdefault.jpg', 'width': 480, 'height': 360}}",Black Journals,none,2025-02-21T20:49:40Z,kZL1YNcSR1I,"<iframe width=""480"" height=""270"" src=""//www.youtube.com/embed/kZL1YNcSR1I"" frameborder=""0"" allow=""accelerometer; autoplay; clipboard-write; encrypted-media; gyroscope; picture-in-picture; web-share"" referrerpolicy=""strict-origin-when-cross-origin"" allowfullscreen></iframe>",Social Issues
12,2025-02-21T20:49:27Z,UCIxrFTHZybtTgq8X7itOAkQ,First Time Doing This In Pakistan,"pakistan #travelvlog #pakistani In This travel vlog i decided to take a pub transportation in Pakistan for the first time , what you will ...","{'default': {'url': 'https://i.ytimg.com/vi/51P9o42fNS8/default.jpg', 'width': 120, 'height': 90}, 'medium': {'url': 'https://i.ytimg.com/vi/51P9o42fNS8/mqdefault.jpg', 'width': 320, 'height': 180}, 'high': {'url': 'https://i.ytimg.com/vi/51P9o42fNS8/hqdefault.jpg', 'width': 480, 'height': 360}}",Blackman Da Traveller,none,2025-02-21T20:49:27Z,51P9o42fNS8,"<iframe width=""480"" height=""270"" src=""//www.youtube.com/embed/51P9o42fNS8"" frameborder=""0"" allow=""accelerometer; autoplay; clipboard-write; encrypted-media; gyroscope; picture-in-picture; web-share"" referrerpolicy=""strict-origin-when-cross-origin"" allowfullscreen></iframe>",Travel
46,2025-02-21T20:06:04Z,UC-4h1XQ47sf0vbFwJvuBhEA,Rwanda angered by US sanctions over DR Congo Conflict,"Rwanda angered by US sanctions over DR Congo Conflict - In a dramatic escalation of tensions, the United States has imposed ...","{'default': {'url': 'https://i.ytimg.com/vi/VRmGOrpcbzY/default.jpg', 'width': 120, 'height': 90}, 'medium': {'url': 'https://i.ytimg.com/vi/VRmGOrpcbzY/mqdefault.jpg', 'width': 320, 'height': 180}, 'high': {'url': 'https://i.ytimg.com/vi/VRmGOrpcbzY/hqdefault.jpg', 'width': 480, 'height': 360}}",The New Africa Channel,none,2025-02-21T20:06:04Z,VRmGOrpcbzY,"<iframe width=""480"" height=""270"" src=""//www.youtube.com/embed/VRmGOrpcbzY"" frameborder=""0"" allow=""accelerometer; autoplay; clipboard-write; encrypted-media; gyroscope; picture-in-picture; web-share"" referrerpolicy=""strict-origin-when-cross-origin"" allowfullscreen></iframe>",Current Events
44,2025-02-21T19:03:46Z,UCLjzzg-cFWpEEjnWCOpXp3Q,African Martrys Day,"In 1981, the First Congress of the African People's Socialist Party passed a resolution proclaiming February 21 as an annual Day ...","{'default': {'url': 'https://i.ytimg.com/vi/tRwM5aNt2g4/default.jpg', 'width': 120, 'height': 90}, 'medium': {'url': 'https://i.ytimg.com/vi/tRwM5aNt2g4/mqdefault.jpg', 'width': 320, 'height': 180}, 'high': {'url': 'https://i.ytimg.com/vi/tRwM5aNt2g4/hqdefault.jpg', 'width': 480, 'height': 360}}",The Burning Spear TV,none,2025-02-21T19:03:46Z,tRwM5aNt2g4,"<iframe width=""480"" height=""270"" src=""//www.youtube.com/embed/tRwM5aNt2g4"" frameborder=""0"" allow=""accelerometer; autoplay; clipboard-write; encrypted-media; gyroscope; picture-in-picture; web-share"" referrerpolicy=""strict-origin-when-cross-origin"" allowfullscreen></iframe>",Current Events
10,2025-02-21T19:00:17Z,UCTNr0N__QwstBhgCtvQcjhA,1919: The Year Alice H. Parker Changed the Furnace Game,"Did you know a Black woman named Alice H. Parker changed how we heat our homes? In 1919, she invented a natural gas ...","{'default': {'url': 'https://i.ytimg.com/vi/Q7rz6ANOAA8/default.jpg', 'width': 120, 'height': 90}, 'medium': {'url': 'https://i.ytimg.com/vi/Q7rz6ANOAA8/mqdefault.jpg', 'width': 320, 'height': 180}, 'high': {'url': 'https://i.ytimg.com/vi/Q7rz6ANOAA8/hqdefault.jpg', 'width': 480, 'height': 360}}",Black Discoveries,none,2025-02-21T19:00:17Z,Q7rz6ANOAA8,"<iframe width=""480"" height=""270"" src=""//www.youtube.com/embed/Q7rz6ANOAA8"" frameborder=""0"" allow=""accelerometer; autoplay; clipboard-write; encrypted-media; gyroscope; picture-in-picture; web-share"" referrerpolicy=""strict-origin-when-cross-origin"" allowfullscreen></iframe>",History
20,2025-02-21T17:46:38Z,UCOhiR-6Y-MZtMERKRENrcRw,Elon Musk explains the private sector take over from Government to Arabs?,"This channel is to bring the awareness to the world of the beautiful continent of Africa. My intentions are to show the development, ...","{'default': {'url': 'https://i.ytimg.com/vi/Kv1aSAbdHdY/default.jpg', 'width': 120, 'height': 90}, 'medium': {'url': 'https://i.ytimg.com/vi/Kv1aSAbdHdY/mqdefault.jpg', 'width': 320, 'height': 180}, 'high': {'url': 'https://i.ytimg.com/vi/Kv1aSAbdHdY/hqdefault.jpg', 'width': 480, 'height': 360}}",GoBlack2Africa ,none,2025-02-21T17:46:38Z,Kv1aSAbdHdY,"<iframe width=""480"" height=""270"" src=""//www.youtube.com/embed/Kv1aSAbdHdY"" frameborder=""0"" allow=""accelerometer; autoplay; clipboard-write; encrypted-media; gyroscope; picture-in-picture; web-share"" referrerpolicy=""strict-origin-when-cross-origin"" allowfullscreen></iframe>",Travel
22,2025-02-21T17:01:12Z,UC12lU5ymIvSpgl8KntDQUQA,The Exploitation Of African Men In The Establishment Of Other Civilizations,Patreon: https://www.patreon.com/HomeTeamHistory.,"{'default': {'url': 'https://i.ytimg.com/vi/ra-D5lQnVmI/default.jpg', 'width': 120, 'height': 90}, 'medium': {'url': 'https://i.ytimg.com/vi/ra-D5lQnVmI/mqdefault.jpg', 'width': 320, 'height': 180}, 'high': {'url': 'https://i.ytimg.com/vi/ra-D5lQnVmI/hqdefault.jpg', 'width': 480, 'height': 360}}",HomeTeam History,none,2025-02-21T17:01:12Z,ra-D5lQnVmI,"<iframe width=""480"" height=""270"" src=""//www.youtube.com/embed/ra-D5lQnVmI"" frameborder=""0"" allow=""accelerometer; autoplay; clipboard-write; encrypted-media; gyroscope; picture-in-picture; web-share"" referrerpolicy=""strict-origin-when-cross-origin"" allowfullscreen></iframe>",History
24,2025-02-21T17:00:06Z,UCi2uaWdy6OTf4Ty7DVC_7lw,ROSARIO ARGENTINA is NOT What You Think || iam_marwa,"Hello family , welcome to my YouTube channel iam_marwa , i hope you have enjoyed this video. Rosario is the largest city in the ...","{'default': {'url': 'https://i.ytimg.com/vi/bE_s1B3-RZs/default.jpg', 'width': 120, 'height': 90}, 'medium': {'url': 'https://i.ytimg.com/vi/bE_s1B3-RZs/mqdefault.jpg', 'width': 320, 'height': 180}, 'high': {'url': 'https://i.ytimg.com/vi/bE_s1B3-RZs/hqdefault.jpg', 'width': 480, 'height': 360}}",iam_marwa,none,2025-02-21T17:00:06Z,bE_s1B3-RZs,"<iframe width=""480"" height=""270"" src=""//www.youtube.com/embed/bE_s1B3-RZs"" frameborder=""0"" allow=""accelerometer; autoplay; clipboard-write; encrypted-media; gyroscope; picture-in-picture; web-share"" referrerpolicy=""strict-origin-when-cross-origin"" allowfullscreen></iframe>",Travel
19,2025-02-21T08:00:06Z,UCF-A_4x9-bLrxXrmgBOWuJA,"EFF PODCAST | Patrick Bond, Tshidi Lecoanca &amp; Duma Gqubule Unpack The Postponed 2025 Budget Speech","The EFF Podcast is joined by Economic Experts Professor Patrick Bond, Budget Analyst Matshidiso Lencoasa and Independent ...","{'default': {'url': 'https://i.ytimg.com/vi/EyJnbRNmsuk/default.jpg', 'width': 120, 'height': 90}, 'medium': {'url': 'https://i.ytimg.com/vi/EyJnbRNmsuk/mqdefault.jpg', 'width': 320, 'height': 180}, 'high': {'url': 'https://i.ytimg.com/vi/EyJnbRNmsuk/hqdefault.jpg', 'width': 480, 'height': 360}}",Economic Freedom Fighters,none,2025-02-21T08:00:06Z,EyJnbRNmsuk,"<iframe width=""480"" height=""270"" src=""//www.youtube.com/embed/EyJnbRNmsuk"" frameborder=""0"" allow=""accelerometer; autoplay; clipboard-write; encrypted-media; gyroscope; picture-in-picture; web-share"" referrerpolicy=""strict-origin-when-cross-origin"" allowfullscreen></iframe>",Current Events
18,2025-02-21T02:00:26Z,UCRVsqvXIdgyPVS-a6fGa1lA,"Car Buying SECRETS You NEED to Know! Buy vs. Lease, Tips for Best Deals, &amp; Hidden Dealer Hacks","Buying a car can be overwhelming, but we've got you covered! In this episode of Black Out, we sit down with car expert Christian ...","{'default': {'url': 'https://i.ytimg.com/vi/SInZ_q6gPBE/default.jpg', 'width': 120, 'height': 90}, 'medium': {'url': 'https://i.ytimg.com/vi/SInZ_q6gPBE/mqdefault.jpg', 'width': 320, 'height': 180}, 'high': {'url': 'https://i.ytimg.com/vi/SInZ_q6gPBE/hqdefault.jpg', 'width': 480, 'height': 360}}",Earn Your Leisure,none,2025-02-21T02:00:26Z,SInZ_q6gPBE,"<iframe width=""480"" height=""270"" src=""//www.youtube.com/embed/SInZ_q6gPBE"" frameborder=""0"" allow=""accelerometer; autoplay; clipboard-write; encrypted-media; gyroscope; picture-in-picture; web-share"" referrerpolicy=""strict-origin-when-cross-origin"" allowfullscreen></iframe>",Productivity
2,2025-02-21T00:30:41Z,UCW5NNtTSY5z5mENZ8dt-RCw,Surviving America&#39;s Drug Zombieland - Kensington Philadelphia,Kensington and Zombie Land—these terms have become synonymous with one of the most infamous areas affected by the opioid ...,"{'default': {'url': 'https://i.ytimg.com/vi/tLrf22klP6o/default.jpg', 'width': 120, 'height': 90}, 'medium': {'url': 'https://i.ytimg.com/vi/tLrf22klP6o/mqdefault.jpg', 'width': 320, 'height': 180}, 'high': {'url': 'https://i.ytimg.com/vi/tLrf22klP6o/hqdefault.jpg', 'width': 480, 'height': 360}}",ACE ,none,2025-02-21T00:30:41Z,tLrf22klP6o,"<iframe width=""480"" height=""270"" src=""//www.youtube.com/embed/tLrf22klP6o"" frameborder=""0"" allow=""accelerometer; autoplay; clipboard-write; encrypted-media; gyroscope; picture-in-picture; web-share"" referrerpolicy=""strict-origin-when-cross-origin"" allowfullscreen></iframe>",Travel
38,2025-02-21T00:08:54Z,UC2rmgVaijnf92nixlIZWGmg,America Needs To Stay Out Of The Rwanda/ Congo Conflict...Here&#39;s Why,America Needs To Stay Out Of The Rwanda/ Congo Conflict...Here's Why Patreon: https://www.patreon.com/searchforuhuru ...,"{'default': {'url': 'https://i.ytimg.com/vi/r87IMyKA7ig/default.jpg', 'width': 120, 'height': 90}, 'medium': {'url': 'https://i.ytimg.com/vi/r87IMyKA7ig/mqdefault.jpg', 'width': 320, 'height': 180}, 'high': {'url': 'https://i.ytimg.com/vi/r87IMyKA7ig/hqdefault.jpg', 'width': 480, 'height': 360}}",Search For Uhuru,none,2025-02-21T00:08:54Z,r87IMyKA7ig,"<iframe width=""480"" height=""270"" src=""//www.youtube.com/embed/r87IMyKA7ig"" frameborder=""0"" allow=""accelerometer; autoplay; clipboard-write; encrypted-media; gyroscope; picture-in-picture; web-share"" referrerpolicy=""strict-origin-when-cross-origin"" allowfullscreen></iframe>",Travel
15,2025-02-20T20:00:16Z,UCv8G-xZ_BBGufjbN6jbvLMQ,Sales Engineer Isn&#39;t A Real Job - Comedian BT Kingsley - Chocolate Sundaes Standup Comedy,"A job is a job, you ain't gotta lie. Follow @BTKingsley5225 on social media: @btkingsley Originally filmed 1/19/24 Videographer: ...","{'default': {'url': 'https://i.ytimg.com/vi/SAjUk6rsd5w/default.jpg', 'width': 120, 'height': 90}, 'medium': {'url': 'https://i.ytimg.com/vi/SAjUk6rsd5w/mqdefault.jpg', 'width': 320, 'height': 180}, 'high': {'url': 'https://i.ytimg.com/vi/SAjUk6rsd5w/hqdefault.jpg', 'width': 480, 'height': 360}}",Chocolate Sundaes Comedy,none,2025-02-20T20:00:16Z,SAjUk6rsd5w,"<iframe width=""480"" height=""270"" src=""//www.youtube.com/embed/SAjUk6rsd5w"" frameborder=""0"" allow=""accelerometer; autoplay; clipboard-write; encrypted-media; gyroscope; picture-in-picture; web-share"" referrerpolicy=""strict-origin-when-cross-origin"" allowfullscreen></iframe>",Entertainment
28,2025-02-20T19:12:50Z,UC1ettU5YSf_nIOJWffCKGQw,black people belong to the senior branch of the human race,"Dr. John Henrik Clarke lecture on african and black people's importance of preserving traditions, as they belong to the senior ...","{'default': {'url': 'https://i.ytimg.com/vi/VRuGXvL61qI/default.jpg', 'width': 120, 'height': 90}, 'medium': {'url': 'https://i.ytimg.com/vi/VRuGXvL61qI/mqdefault.jpg', 'width': 320, 'height': 180}, 'high': {'url': 'https://i.ytimg.com/vi/VRuGXvL61qI/hqdefault.jpg', 'width': 480, 'height': 360}}",LuiSpot,none,2025-02-20T19:12:50Z,VRuGXvL61qI,"<iframe width=""480"" height=""270"" src=""//www.youtube.com/embed/VRuGXvL61qI"" frameborder=""0"" allow=""accelerometer; autoplay; clipboard-write; encrypted-media; gyroscope; picture-in-picture; web-share"" referrerpolicy=""strict-origin-when-cross-origin"" allowfullscreen></iframe>",Current Events
1,2025-02-20T18:23:52Z,UCTis64XH8HrxE7GhEkA6YmA,AC MILAN FAN LOSES BET AS THEY CRASH OUT OF UCL 🤣 #football #soccer #acmilan,,"{'default': {'url': 'https://i.ytimg.com/vi/cZB86lnhCN0/default.jpg', 'width': 120, 'height': 90}, 'medium': {'url': 'https://i.ytimg.com/vi/cZB86lnhCN0/mqdefault.jpg', 'width': 320, 'height': 180}, 'high': {'url': 'https://i.ytimg.com/vi/cZB86lnhCN0/hqdefault.jpg', 'width': 480, 'height': 360}}",5ASIDE Media,none,2025-02-20T18:23:52Z,cZB86lnhCN0,"<iframe width=""480"" height=""270"" src=""//www.youtube.com/embed/cZB86lnhCN0"" frameborder=""0"" allow=""accelerometer; autoplay; clipboard-write; encrypted-media; gyroscope; picture-in-picture; web-share"" referrerpolicy=""strict-origin-when-cross-origin"" allowfullscreen></iframe>",Sports
40,2025-02-20T17:41:15Z,UC4lH-odQ5ll-85fkpWxDYmA,"Inside this $240,000 Zanzibar villa will surprise you",,"{'default': {'url': 'https://i.ytimg.com/vi/rTMJjlzhjeI/default.jpg', 'width': 120, 'height': 90}, 'medium': {'url': 'https://i.ytimg.com/vi/rTMJjlzhjeI/mqdefault.jpg', 'width': 320, 'height': 180}, 'high': {'url': 'https://i.ytimg.com/vi/rTMJjlzhjeI/hqdefault.jpg', 'width': 480, 'height': 360}}",Steven Ndukwu,none,2025-02-20T17:41:15Z,rTMJjlzhjeI,"<iframe width=""480"" height=""270"" src=""//www.youtube.com/embed/rTMJjlzhjeI"" frameborder=""0"" allow=""accelerometer; autoplay; clipboard-write; encrypted-media; gyroscope; picture-in-picture; web-share"" referrerpolicy=""strict-origin-when-cross-origin"" allowfullscreen></iframe>",Productivity
6,2025-02-20T17:29:44Z,UCJa58Tf70HC5q2oQDNBrJ2g,What does it mean to be healthy? #health #healthy #mentalhealth,,"{'default': {'url': 'https://i.ytimg.com/vi/essLxWgTRcI/default.jpg', 'width': 120, 'height': 90}, 'medium': {'url': 'https://i.ytimg.com/vi/essLxWgTRcI/mqdefault.jpg', 'width': 320, 'height': 180}, 'high': {'url': 'https://i.ytimg.com/vi/essLxWgTRcI/hqdefault.jpg', 'width': 480, 'height': 360}}",AClasses Media,none,2025-02-20T17:29:44Z,essLxWgTRcI,"<iframe width=""480"" height=""270"" src=""//www.youtube.com/embed/essLxWgTRcI"" frameborder=""0"" allow=""accelerometer; autoplay; clipboard-write; encrypted-media; gyroscope; picture-in-picture; web-share"" referrerpolicy=""strict-origin-when-cross-origin"" allowfullscreen></iframe>",History
39,2025-02-20T13:01:06Z,UCDsOKnUQnQek7-G7Xc5kB8Q,How This Entrepreneur Is Helping Kids Overcome Eczema! - @realsocialproof #502,"Our main guest for this episode is Jocelyne Fiume, the founder of Kiyamel Skincare Solutions. Jocelyne shares her inspiring ...","{'default': {'url': 'https://i.ytimg.com/vi/jdcfu5RsIJQ/default.jpg', 'width': 120, 'height': 90}, 'medium': {'url': 'https://i.ytimg.com/vi/jdcfu5RsIJQ/mqdefault.jpg', 'width': 320, 'height': 180}, 'high': {'url': 'https://i.ytimg.com/vi/jdcfu5RsIJQ/hqdefault.jpg', 'width': 480, 'height': 360}}",Social Proof,none,2025-02-20T13:01:06Z,jdcfu5RsIJQ,"<iframe width=""480"" height=""270"" src=""//www.youtube.com/embed/jdcfu5RsIJQ"" frameborder=""0"" allow=""accelerometer; autoplay; clipboard-write; encrypted-media; gyroscope; picture-in-picture; web-share"" referrerpolicy=""strict-origin-when-cross-origin"" allowfullscreen></iframe>",Productivity
