,publishedAt,channelId,title,description,thumbnails,channelTitle,liveBroadcastContent,publishTime,videoID,embeds,category
50,2024-12-21T15:23:45Z,UCXyHjFIKz9D8ofxObOuYBbg,We Need To Talk About Travis Hunter,Wnttalk Mug: https://zq2kte-gq.myshopify.com/products/wntt-exclusive-mug Leanna Lenee Godfrey Bow Wow Anthony Edwards ...,"{'default': {'url': 'https://i.ytimg.com/vi/8f02w1aihwQ/default.jpg', 'width': 120, 'height': 90}, 'medium': {'url': 'https://i.ytimg.com/vi/8f02w1aihwQ/mqdefault.jpg', 'width': 320, 'height': 180}, 'high': {'url': 'https://i.ytimg.com/vi/8f02w1aihwQ/hqdefault.jpg', 'width': 480, 'height': 360}}",WeNeedToTalk,none,2024-12-21T15:23:45Z,8f02w1aihwQ,"<iframe width=""480"" height=""270"" src=""//www.youtube.com/embed/8f02w1aihwQ"" frameborder=""0"" allow=""accelerometer; autoplay; clipboard-write; encrypted-media; gyroscope; picture-in-picture; web-share"" referrerpolicy=""strict-origin-when-cross-origin"" allowfullscreen></iframe>",Social Issues
16,2024-12-19T21:19:39Z,UCABZ7Z6SBTp4IsARDceOq7w,Corey Holcomb Responds To Assault Claims By Female Comedian: &quot;Lies!&quot; - CH News,https://hypersclub.com/ - Corey Holcomb has now responded to assault allegations made against him last week by a fellow ...,"{'default': {'url': 'https://i.ytimg.com/vi/U39rVT-mgOY/default.jpg', 'width': 120, 'height': 90}, 'medium': {'url': 'https://i.ytimg.com/vi/U39rVT-mgOY/mqdefault.jpg', 'width': 320, 'height': 180}, 'high': {'url': 'https://i.ytimg.com/vi/U39rVT-mgOY/hqdefault.jpg', 'width': 480, 'height': 360}}",Comedy Hype,none,2024-12-19T21:19:39Z,U39rVT-mgOY,"<iframe width=""480"" height=""270"" src=""//www.youtube.com/embed/U39rVT-mgOY"" frameborder=""0"" allow=""accelerometer; autoplay; clipboard-write; encrypted-media; gyroscope; picture-in-picture; web-share"" referrerpolicy=""strict-origin-when-cross-origin"" allowfullscreen></iframe>",Entertainment
39,2024-12-19T15:01:02Z,UCDsOKnUQnQek7-G7Xc5kB8Q,How To Intentionally Evolve Your Brand Into GOLD!!!,"In this episode, we dive deep into the realities of running a seven-figure business, the stress that comes with it, and the importance ...","{'default': {'url': 'https://i.ytimg.com/vi/nLk30XXTrW0/default.jpg', 'width': 120, 'height': 90}, 'medium': {'url': 'https://i.ytimg.com/vi/nLk30XXTrW0/mqdefault.jpg', 'width': 320, 'height': 180}, 'high': {'url': 'https://i.ytimg.com/vi/nLk30XXTrW0/hqdefault.jpg', 'width': 480, 'height': 360}}",Social Proof,none,2024-12-19T15:01:02Z,nLk30XXTrW0,"<iframe width=""480"" height=""270"" src=""//www.youtube.com/embed/nLk30XXTrW0"" frameborder=""0"" allow=""accelerometer; autoplay; clipboard-write; encrypted-media; gyroscope; picture-in-picture; web-share"" referrerpolicy=""strict-origin-when-cross-origin"" allowfullscreen></iframe>",Productivity
35,2024-12-19T03:23:53Z,UCF71yDQwxfw0QcYb2JnkB5Q,Rum Was Invented by Africans 🥃,"Did You Know Rum's True Origins? Rum, often associated with the Caribbean, was actually created by enslaved Africans on ...","{'default': {'url': 'https://i.ytimg.com/vi/Gf6GtTzHBGA/default.jpg', 'width': 120, 'height': 90}, 'medium': {'url': 'https://i.ytimg.com/vi/Gf6GtTzHBGA/mqdefault.jpg', 'width': 320, 'height': 180}, 'high': {'url': 'https://i.ytimg.com/vi/Gf6GtTzHBGA/hqdefault.jpg', 'width': 480, 'height': 360}}",PassportHeavy,none,2024-12-19T03:23:53Z,Gf6GtTzHBGA,"<iframe width=""480"" height=""270"" src=""//www.youtube.com/embed/Gf6GtTzHBGA"" frameborder=""0"" allow=""accelerometer; autoplay; clipboard-write; encrypted-media; gyroscope; picture-in-picture; web-share"" referrerpolicy=""strict-origin-when-cross-origin"" allowfullscreen></iframe>",Travel
28,2024-12-18T12:50:32Z,UC1ettU5YSf_nIOJWffCKGQw,No conquerer in history had came to civilize,,"{'default': {'url': 'https://i.ytimg.com/vi/fAGbUJJ-wJI/default.jpg', 'width': 120, 'height': 90}, 'medium': {'url': 'https://i.ytimg.com/vi/fAGbUJJ-wJI/mqdefault.jpg', 'width': 320, 'height': 180}, 'high': {'url': 'https://i.ytimg.com/vi/fAGbUJJ-wJI/hqdefault.jpg', 'width': 480, 'height': 360}}",LuiSpot,none,2024-12-18T12:50:32Z,fAGbUJJ-wJI,"<iframe width=""480"" height=""270"" src=""//www.youtube.com/embed/fAGbUJJ-wJI"" frameborder=""0"" allow=""accelerometer; autoplay; clipboard-write; encrypted-media; gyroscope; picture-in-picture; web-share"" referrerpolicy=""strict-origin-when-cross-origin"" allowfullscreen></iframe>",Current Events
40,2024-12-18T12:19:58Z,UC4lH-odQ5ll-85fkpWxDYmA,Inside the most Advanced African country,,"{'default': {'url': 'https://i.ytimg.com/vi/cVDD37Wqrzo/default.jpg', 'width': 120, 'height': 90}, 'medium': {'url': 'https://i.ytimg.com/vi/cVDD37Wqrzo/mqdefault.jpg', 'width': 320, 'height': 180}, 'high': {'url': 'https://i.ytimg.com/vi/cVDD37Wqrzo/hqdefault.jpg', 'width': 480, 'height': 360}}",Steven Ndukwu,none,2024-12-18T12:19:58Z,cVDD37Wqrzo,"<iframe width=""480"" height=""270"" src=""//www.youtube.com/embed/cVDD37Wqrzo"" frameborder=""0"" allow=""accelerometer; autoplay; clipboard-write; encrypted-media; gyroscope; picture-in-picture; web-share"" referrerpolicy=""strict-origin-when-cross-origin"" allowfullscreen></iframe>",Productivity
0,2024-12-16T19:23:58Z,UCG7uFJVZsxQRwDssom9Pavw,"ECOWAS Begs AES States Niger, Mali &amp; Burkina Faso to Stay for 6 More Months",A summit of the Economic Community of West African States (ECOWAS) was held in Abuja on Sunday following decisions by ...,"{'default': {'url': 'https://i.ytimg.com/vi/rdwywaaVyjU/default.jpg', 'width': 120, 'height': 90}, 'medium': {'url': 'https://i.ytimg.com/vi/rdwywaaVyjU/mqdefault.jpg', 'width': 320, 'height': 180}, 'high': {'url': 'https://i.ytimg.com/vi/rdwywaaVyjU/hqdefault.jpg', 'width': 480, 'height': 360}}",2nacheki,none,2024-12-16T19:23:58Z,rdwywaaVyjU,"<iframe width=""480"" height=""270"" src=""//www.youtube.com/embed/rdwywaaVyjU"" frameborder=""0"" allow=""accelerometer; autoplay; clipboard-write; encrypted-media; gyroscope; picture-in-picture; web-share"" referrerpolicy=""strict-origin-when-cross-origin"" allowfullscreen></iframe>",Current Events
19,2024-12-15T00:13:43Z,UCF-A_4x9-bLrxXrmgBOWuJA,Top 6 Nominations At The EFF 3rd NPA,Top 6 Nominations At The EFF 3rd NPA.,"{'default': {'url': 'https://i.ytimg.com/vi/yuyUa7j_m3k/default.jpg', 'width': 120, 'height': 90}, 'medium': {'url': 'https://i.ytimg.com/vi/yuyUa7j_m3k/mqdefault.jpg', 'width': 320, 'height': 180}, 'high': {'url': 'https://i.ytimg.com/vi/yuyUa7j_m3k/hqdefault.jpg', 'width': 480, 'height': 360}}",Economic Freedom Fighters,none,2024-12-15T00:13:43Z,yuyUa7j_m3k,"<iframe width=""480"" height=""270"" src=""//www.youtube.com/embed/yuyUa7j_m3k"" frameborder=""0"" allow=""accelerometer; autoplay; clipboard-write; encrypted-media; gyroscope; picture-in-picture; web-share"" referrerpolicy=""strict-origin-when-cross-origin"" allowfullscreen></iframe>",Current Events
53,2024-12-12T07:36:42Z,UCx5Y5d5KgibkG9KAyknCdFA,Black Students: Why Closing the Dept. of Education Will Be a Game-Changer,"Spoiler alert: the current education system doesn't work for Black students. But instead of relying on it, what if we built something ...","{'default': {'url': 'https://i.ytimg.com/vi/kb-8rpkHjyA/default.jpg', 'width': 120, 'height': 90}, 'medium': {'url': 'https://i.ytimg.com/vi/kb-8rpkHjyA/mqdefault.jpg', 'width': 320, 'height': 180}, 'high': {'url': 'https://i.ytimg.com/vi/kb-8rpkHjyA/hqdefault.jpg', 'width': 480, 'height': 360}}",Afromation Digital,none,2024-12-12T07:36:42Z,kb-8rpkHjyA,"<iframe width=""480"" height=""270"" src=""//www.youtube.com/embed/kb-8rpkHjyA"" frameborder=""0"" allow=""accelerometer; autoplay; clipboard-write; encrypted-media; gyroscope; picture-in-picture; web-share"" referrerpolicy=""strict-origin-when-cross-origin"" allowfullscreen></iframe>",Social Issues
20,2024-12-05T12:02:17Z,UCOhiR-6Y-MZtMERKRENrcRw,Going  back to Africa you must know the truth,"This channel is to bring the awareness to the world of the beautiful continent of Africa. My intentions are to show the development, ...","{'default': {'url': 'https://i.ytimg.com/vi/QLuMngOA04U/default.jpg', 'width': 120, 'height': 90}, 'medium': {'url': 'https://i.ytimg.com/vi/QLuMngOA04U/mqdefault.jpg', 'width': 320, 'height': 180}, 'high': {'url': 'https://i.ytimg.com/vi/QLuMngOA04U/hqdefault.jpg', 'width': 480, 'height': 360}}",GoBlack2Africa ,none,2024-12-05T12:02:17Z,QLuMngOA04U,"<iframe width=""480"" height=""270"" src=""//www.youtube.com/embed/QLuMngOA04U"" frameborder=""0"" allow=""accelerometer; autoplay; clipboard-write; encrypted-media; gyroscope; picture-in-picture; web-share"" referrerpolicy=""strict-origin-when-cross-origin"" allowfullscreen></iframe>",Travel
52,2024-11-24T17:27:15Z,UClwrpH_Np9zk8uMwnMwu8Nw,This Company Built 7000 Dry Toilet In Informal Settlement In Kenya 🇰🇪,The Image of AFRICA has been DISTORTED around the WORLD & We are CHANGING the NARRATIVE via YOUTUBE videos ...,"{'default': {'url': 'https://i.ytimg.com/vi/XykA6BkZB5Y/default.jpg', 'width': 120, 'height': 90}, 'medium': {'url': 'https://i.ytimg.com/vi/XykA6BkZB5Y/mqdefault.jpg', 'width': 320, 'height': 180}, 'high': {'url': 'https://i.ytimg.com/vi/XykA6BkZB5Y/hqdefault.jpg', 'width': 480, 'height': 360}}",WODE MAYA,none,2024-11-24T17:27:15Z,XykA6BkZB5Y,"<iframe width=""480"" height=""270"" src=""//www.youtube.com/embed/XykA6BkZB5Y"" frameborder=""0"" allow=""accelerometer; autoplay; clipboard-write; encrypted-media; gyroscope; picture-in-picture; web-share"" referrerpolicy=""strict-origin-when-cross-origin"" allowfullscreen></iframe>",Travel
22,2024-11-22T17:00:54Z,UC12lU5ymIvSpgl8KntDQUQA,The Role Of Africans In The Greco Roman World,Patreon: https://www.patreon.com/HomeTeamHistory.,"{'default': {'url': 'https://i.ytimg.com/vi/sDsJ6NwUxI8/default.jpg', 'width': 120, 'height': 90}, 'medium': {'url': 'https://i.ytimg.com/vi/sDsJ6NwUxI8/mqdefault.jpg', 'width': 320, 'height': 180}, 'high': {'url': 'https://i.ytimg.com/vi/sDsJ6NwUxI8/hqdefault.jpg', 'width': 480, 'height': 360}}",HomeTeam History,none,2024-11-22T17:00:54Z,sDsJ6NwUxI8,"<iframe width=""480"" height=""270"" src=""//www.youtube.com/embed/sDsJ6NwUxI8"" frameborder=""0"" allow=""accelerometer; autoplay; clipboard-write; encrypted-media; gyroscope; picture-in-picture; web-share"" referrerpolicy=""strict-origin-when-cross-origin"" allowfullscreen></iframe>",History
8,2024-11-10T05:30:00Z,UCbvE_5m8kmm9U58gDHtzYrA,Nigeria has been named the best Jollof rice maker‼️🇳🇬🍚,,"{'default': {'url': 'https://i.ytimg.com/vi/ZkdyXscEAFI/default.jpg', 'width': 120, 'height': 90}, 'medium': {'url': 'https://i.ytimg.com/vi/ZkdyXscEAFI/mqdefault.jpg', 'width': 320, 'height': 180}, 'high': {'url': 'https://i.ytimg.com/vi/ZkdyXscEAFI/hqdefault.jpg', 'width': 480, 'height': 360}}",AfroBallers,none,2024-11-10T05:30:00Z,ZkdyXscEAFI,"<iframe width=""480"" height=""360"" src=""//www.youtube.com/embed/ZkdyXscEAFI"" frameborder=""0"" allow=""accelerometer; autoplay; clipboard-write; encrypted-media; gyroscope; picture-in-picture; web-share"" referrerpolicy=""strict-origin-when-cross-origin"" allowfullscreen></iframe>",Sports
9,2024-08-31T16:32:50Z,UC2xX2FI6s4i9xz3t9qjayhg,The San Quentin Six (1972),"A documentary on the six Black and Chicano prisoners who, following George Jackson's death, were charged on charges of ...","{'default': {'url': 'https://i.ytimg.com/vi/E-4CUaaSo4I/default.jpg', 'width': 120, 'height': 90}, 'medium': {'url': 'https://i.ytimg.com/vi/E-4CUaaSo4I/mqdefault.jpg', 'width': 320, 'height': 180}, 'high': {'url': 'https://i.ytimg.com/vi/E-4CUaaSo4I/hqdefault.jpg', 'width': 480, 'height': 360}}",AfroMarxist,none,2024-08-31T16:32:50Z,E-4CUaaSo4I,"<iframe width=""480"" height=""360"" src=""//www.youtube.com/embed/E-4CUaaSo4I"" frameborder=""0"" allow=""accelerometer; autoplay; clipboard-write; encrypted-media; gyroscope; picture-in-picture; web-share"" referrerpolicy=""strict-origin-when-cross-origin"" allowfullscreen></iframe>",History
31,2024-08-25T18:19:19Z,UCh2ANLALdN1OZUJKmvchkkg,The INSANE True Story of Cleopatra in Pop Culture | Documentary,"Cleopatra is one of the most iconic figures associated with ancient Egypt, but our perception of the queen is not correct.","{'default': {'url': 'https://i.ytimg.com/vi/dwSSQFS-OQY/default.jpg', 'width': 120, 'height': 90}, 'medium': {'url': 'https://i.ytimg.com/vi/dwSSQFS-OQY/mqdefault.jpg', 'width': 320, 'height': 180}, 'high': {'url': 'https://i.ytimg.com/vi/dwSSQFS-OQY/hqdefault.jpg', 'width': 480, 'height': 360}}",Mr. Imhotep,none,2024-08-25T18:19:19Z,dwSSQFS-OQY,"<iframe width=""480"" height=""270"" src=""//www.youtube.com/embed/dwSSQFS-OQY"" frameborder=""0"" allow=""accelerometer; autoplay; clipboard-write; encrypted-media; gyroscope; picture-in-picture; web-share"" referrerpolicy=""strict-origin-when-cross-origin"" allowfullscreen></iframe>",History
14,2024-08-25T18:00:03Z,UCMMTYgqKEgCgy1pR6Axlf0A,"Ex-model moved to Ghana to build a 5 bedroom home, set up 7 businesses and live her dream life",Our guest today left behind her 15 year career in the modelling industry to move to Ghana and start a new life here. This amazing ...,"{'default': {'url': 'https://i.ytimg.com/vi/6TMZcRoGZi4/default.jpg', 'width': 120, 'height': 90}, 'medium': {'url': 'https://i.ytimg.com/vi/6TMZcRoGZi4/mqdefault.jpg', 'width': 320, 'height': 180}, 'high': {'url': 'https://i.ytimg.com/vi/6TMZcRoGZi4/hqdefault.jpg', 'width': 480, 'height': 360}}",Build with Amoaa,none,2024-08-25T18:00:03Z,6TMZcRoGZi4,"<iframe width=""480"" height=""270"" src=""//www.youtube.com/embed/6TMZcRoGZi4"" frameborder=""0"" allow=""accelerometer; autoplay; clipboard-write; encrypted-media; gyroscope; picture-in-picture; web-share"" referrerpolicy=""strict-origin-when-cross-origin"" allowfullscreen></iframe>",Travel
37,2024-08-14T15:00:22Z,UCCfgU1Dgpz0MzA-4vP_gRuQ,Africa&#39;s Last Emperor | Jean-Bédel Bokassa,Jean-Bédel Bokassa will perhaps mostly be remembered chiefly for an oversized Napoleon complex and his love for everything ...,"{'default': {'url': 'https://i.ytimg.com/vi/LbXKaOqyUiE/default.jpg', 'width': 120, 'height': 90}, 'medium': {'url': 'https://i.ytimg.com/vi/LbXKaOqyUiE/mqdefault.jpg', 'width': 320, 'height': 180}, 'high': {'url': 'https://i.ytimg.com/vi/LbXKaOqyUiE/hqdefault.jpg', 'width': 480, 'height': 360}}",Risen Africa,none,2024-08-14T15:00:22Z,LbXKaOqyUiE,"<iframe width=""480"" height=""270"" src=""//www.youtube.com/embed/LbXKaOqyUiE"" frameborder=""0"" allow=""accelerometer; autoplay; clipboard-write; encrypted-media; gyroscope; picture-in-picture; web-share"" referrerpolicy=""strict-origin-when-cross-origin"" allowfullscreen></iframe>",Current Events
7,2024-07-12T12:15:30Z,UCl6to6J7oVltnhHEVm1s87A,AFRICAN ORIGIN OF MORDEN HAIRSTYLES,theperspective #africanhistory #africanews #africax5 Traditional African hairstyles are back in fashion and making a real ...,"{'default': {'url': 'https://i.ytimg.com/vi/AGyMe_XB3mQ/default.jpg', 'width': 120, 'height': 90}, 'medium': {'url': 'https://i.ytimg.com/vi/AGyMe_XB3mQ/mqdefault.jpg', 'width': 320, 'height': 180}, 'high': {'url': 'https://i.ytimg.com/vi/AGyMe_XB3mQ/hqdefault.jpg', 'width': 480, 'height': 360}}",Africax5 Network,none,2024-07-12T12:15:30Z,AGyMe_XB3mQ,"<iframe width=""480"" height=""360"" src=""//www.youtube.com/embed/AGyMe_XB3mQ"" frameborder=""0"" allow=""accelerometer; autoplay; clipboard-write; encrypted-media; gyroscope; picture-in-picture; web-share"" referrerpolicy=""strict-origin-when-cross-origin"" allowfullscreen></iframe>",Social Issues
26,2024-07-11T18:11:16Z,UC__wkIWEfbnTAYVT8j6gfPg,@metatronyt vs Know Thyself Debate: Disingenuous arguments made by Metatron #blackegypt #Kemet,,"{'default': {'url': 'https://i.ytimg.com/vi/msKLkd7vQnA/default.jpg', 'width': 120, 'height': 90}, 'medium': {'url': 'https://i.ytimg.com/vi/msKLkd7vQnA/mqdefault.jpg', 'width': 320, 'height': 180}, 'high': {'url': 'https://i.ytimg.com/vi/msKLkd7vQnA/hqdefault.jpg', 'width': 480, 'height': 360}}",Know Thyself,none,2024-07-11T18:11:16Z,msKLkd7vQnA,"<iframe width=""480"" height=""270"" src=""//www.youtube.com/embed/msKLkd7vQnA"" frameborder=""0"" allow=""accelerometer; autoplay; clipboard-write; encrypted-media; gyroscope; picture-in-picture; web-share"" referrerpolicy=""strict-origin-when-cross-origin"" allowfullscreen></iframe>",History
27,2024-07-08T12:10:25Z,UCHbmePHjGH3pklvSla6szWw,You Wouldn&#39;t Survive In Ancient Egypt | REACTION - KueliMika,Today we are reacting to the video You Wouldn't Survive In Ancient Egypt.,"{'default': {'url': 'https://i.ytimg.com/vi/qFbr17zUKYE/default.jpg', 'width': 120, 'height': 90}, 'medium': {'url': 'https://i.ytimg.com/vi/qFbr17zUKYE/mqdefault.jpg', 'width': 320, 'height': 180}, 'high': {'url': 'https://i.ytimg.com/vi/qFbr17zUKYE/hqdefault.jpg', 'width': 480, 'height': 360}}",KueliMika,none,2024-07-08T12:10:25Z,qFbr17zUKYE,"<iframe width=""480"" height=""270"" src=""//www.youtube.com/embed/qFbr17zUKYE"" frameborder=""0"" allow=""accelerometer; autoplay; clipboard-write; encrypted-media; gyroscope; picture-in-picture; web-share"" referrerpolicy=""strict-origin-when-cross-origin"" allowfullscreen></iframe>",History
3,2024-04-25T23:00:06Z,UCTTQWaoGloNuhunZevQ2F6g,"Kuubwa Transforming African Businesses: Fabric Weaver, Fish Farmers","Kuubwa Transforms African Businesses: Fish Farmers, Fabric Manufacturers and more.","{'default': {'url': 'https://i.ytimg.com/vi/gC02Wht1UQQ/default.jpg', 'width': 120, 'height': 90}, 'medium': {'url': 'https://i.ytimg.com/vi/gC02Wht1UQQ/mqdefault.jpg', 'width': 320, 'height': 180}, 'high': {'url': 'https://i.ytimg.com/vi/gC02Wht1UQQ/hqdefault.jpg', 'width': 480, 'height': 360}}",Africa Business Channel TV,none,2024-04-25T23:00:06Z,gC02Wht1UQQ,"<iframe width=""480"" height=""270"" src=""//www.youtube.com/embed/gC02Wht1UQQ"" frameborder=""0"" allow=""accelerometer; autoplay; clipboard-write; encrypted-media; gyroscope; picture-in-picture; web-share"" referrerpolicy=""strict-origin-when-cross-origin"" allowfullscreen></iframe>",Productivity
42,2024-04-11T05:04:02Z,UCuvO0y2EU_kRfYzlhGJNOKA,How Did America&#39;s Wealthy Elite Re Write World History,"The United States was supposed to be a democratically run country. However, that has not been the case since the turn of the ...","{'default': {'url': 'https://i.ytimg.com/vi/RPSnS-ucmOA/default.jpg', 'width': 120, 'height': 90}, 'medium': {'url': 'https://i.ytimg.com/vi/RPSnS-ucmOA/mqdefault.jpg', 'width': 320, 'height': 180}, 'high': {'url': 'https://i.ytimg.com/vi/RPSnS-ucmOA/hqdefault.jpg', 'width': 480, 'height': 360}}",Straight UP,none,2024-04-11T05:04:02Z,RPSnS-ucmOA,"<iframe width=""480"" height=""270"" src=""//www.youtube.com/embed/RPSnS-ucmOA"" frameborder=""0"" allow=""accelerometer; autoplay; clipboard-write; encrypted-media; gyroscope; picture-in-picture; web-share"" referrerpolicy=""strict-origin-when-cross-origin"" allowfullscreen></iframe>",History
41,2024-04-11T05:04:02Z,UCuvO0y2EU_kRfYzlhGJNOKA,How Did America&#39;s Wealthy Elite Re Write World History,"The United States was supposed to be a democratically run country. However, that has not been the case since the turn of the ...","{'default': {'url': 'https://i.ytimg.com/vi/RPSnS-ucmOA/default.jpg', 'width': 120, 'height': 90}, 'medium': {'url': 'https://i.ytimg.com/vi/RPSnS-ucmOA/mqdefault.jpg', 'width': 320, 'height': 180}, 'high': {'url': 'https://i.ytimg.com/vi/RPSnS-ucmOA/hqdefault.jpg', 'width': 480, 'height': 360}}",Straight UP,none,2024-04-11T05:04:02Z,RPSnS-ucmOA,"<iframe width=""480"" height=""270"" src=""//www.youtube.com/embed/RPSnS-ucmOA"" frameborder=""0"" allow=""accelerometer; autoplay; clipboard-write; encrypted-media; gyroscope; picture-in-picture; web-share"" referrerpolicy=""strict-origin-when-cross-origin"" allowfullscreen></iframe>",History
36,2023-06-27T20:30:07Z,UCPk29gUc_ltOGQ6f3Lh5kCg,Dr. Umar on Black Protest (2022) | See More at Reelblack Two,"To see more of this lecture, please subscribe to @ReelblackTwo and hit the notification bell. ---- REELBLACK TWO, is our backup ...","{'default': {'url': 'https://i.ytimg.com/vi/xNkpDTF6Y7Q/default.jpg', 'width': 120, 'height': 90}, 'medium': {'url': 'https://i.ytimg.com/vi/xNkpDTF6Y7Q/mqdefault.jpg', 'width': 320, 'height': 180}, 'high': {'url': 'https://i.ytimg.com/vi/xNkpDTF6Y7Q/hqdefault.jpg', 'width': 480, 'height': 360}}",Reelblack One,none,2023-06-27T20:30:07Z,xNkpDTF6Y7Q,"<iframe width=""480"" height=""270"" src=""//www.youtube.com/embed/xNkpDTF6Y7Q"" frameborder=""0"" allow=""accelerometer; autoplay; clipboard-write; encrypted-media; gyroscope; picture-in-picture; web-share"" referrerpolicy=""strict-origin-when-cross-origin"" allowfullscreen></iframe>",Entertainment
32,2021-11-09T18:26:31Z,UCJH-fn0wLu5uwXX33jNToQw,"Haile Selassie I: The Man, the Myth, the Legacy | Ethiopia&#39;s Last Emperor","King of Kings, Lord of Lords, Conquering Lion of the Tribe of Judah and Elect of God, His Imperial Majesty Haile Selassie I. These ...","{'default': {'url': 'https://i.ytimg.com/vi/V2tHakK7muU/default.jpg', 'width': 120, 'height': 90}, 'medium': {'url': 'https://i.ytimg.com/vi/V2tHakK7muU/mqdefault.jpg', 'width': 320, 'height': 180}, 'high': {'url': 'https://i.ytimg.com/vi/V2tHakK7muU/hqdefault.jpg', 'width': 480, 'height': 360}}",NewAfrica,none,2021-11-09T18:26:31Z,V2tHakK7muU,"<iframe width=""480"" height=""270"" src=""//www.youtube.com/embed/V2tHakK7muU"" frameborder=""0"" allow=""accelerometer; autoplay; clipboard-write; encrypted-media; gyroscope; picture-in-picture; web-share"" referrerpolicy=""strict-origin-when-cross-origin"" allowfullscreen></iframe>",Current Events
