,publishedAt,channelId,title,description,thumbnails,channelTitle,liveBroadcastContent,publishTime,videID,embeds,category
7,2024-06-17T02:15:01Z,UCepJ2MwkHah89uXokQVgUrA,Pushing Back The Sahara,"The world's largest hot desert is growing. But an ambitious plan to grow an 8000 km long, 15 km wide Great Green Wall of Africa ...","{'default': {'url': 'https://i.ytimg.com/vi/R8Y6Aed_iJg/default.jpg', 'width': 120, 'height': 90}, 'medium': {'url': 'https://i.ytimg.com/vi/R8Y6Aed_iJg/mqdefault.jpg', 'width': 320, 'height': 180}, 'high': {'url': 'https://i.ytimg.com/vi/R8Y6Aed_iJg/hqdefault.jpg', 'width': 480, 'height': 360}}",African Stream,none,2024-06-17T02:15:01Z,R8Y6Aed_iJg,"<iframe width=""480"" height=""270"" src=""//www.youtube.com/embed/R8Y6Aed_iJg"" frameborder=""0"" allow=""accelerometer; autoplay; clipboard-write; encrypted-media; gyroscope; picture-in-picture; web-share"" referrerpolicy=""strict-origin-when-cross-origin"" allowfullscreen></iframe>",Current Events
39,2024-06-17T00:12:14Z,UC2rmgVaijnf92nixlIZWGmg,Ghana Has Given More Reparations To Black Americans Than America Ever Will.,Ghana Has Given More Reparations To Black Americans Than America Ever Will. Cash App: $amirdynast Please Subscribe ...,"{'default': {'url': 'https://i.ytimg.com/vi/m4xs68Jn-Xs/default.jpg', 'width': 120, 'height': 90}, 'medium': {'url': 'https://i.ytimg.com/vi/m4xs68Jn-Xs/mqdefault.jpg', 'width': 320, 'height': 180}, 'high': {'url': 'https://i.ytimg.com/vi/m4xs68Jn-Xs/hqdefault.jpg', 'width': 480, 'height': 360}}",Search For Uhuru,none,2024-06-17T00:12:14Z,m4xs68Jn-Xs,"<iframe width=""480"" height=""270"" src=""//www.youtube.com/embed/m4xs68Jn-Xs"" frameborder=""0"" allow=""accelerometer; autoplay; clipboard-write; encrypted-media; gyroscope; picture-in-picture; web-share"" referrerpolicy=""strict-origin-when-cross-origin"" allowfullscreen></iframe>",Travel
17,2024-06-17T00:01:07Z,UCABZ7Z6SBTp4IsARDceOq7w,Atlanta&#39;s Water Outage Almost Killed Our Festival - Behind The Hype Episode 4  (Teaser),"https://hypersclub.com/ - For an exclusive teaser of 'Behind The Hype', our lead Jon Aba shares a recent obstacle after a water ...","{'default': {'url': 'https://i.ytimg.com/vi/0tr4XCwZOiE/default.jpg', 'width': 120, 'height': 90}, 'medium': {'url': 'https://i.ytimg.com/vi/0tr4XCwZOiE/mqdefault.jpg', 'width': 320, 'height': 180}, 'high': {'url': 'https://i.ytimg.com/vi/0tr4XCwZOiE/hqdefault.jpg', 'width': 480, 'height': 360}}",Comedy Hype,none,2024-06-17T00:01:07Z,0tr4XCwZOiE,"<iframe width=""480"" height=""270"" src=""//www.youtube.com/embed/0tr4XCwZOiE"" frameborder=""0"" allow=""accelerometer; autoplay; clipboard-write; encrypted-media; gyroscope; picture-in-picture; web-share"" referrerpolicy=""strict-origin-when-cross-origin"" allowfullscreen></iframe>",Entertainment
5,2024-06-16T22:30:05Z,UCKZGcrxRAhdUi58Mdr565mw,Councillor Nick Turner Makes Racist Remarks About Afro-Caribbean Heritage,Shermaine Williams reports that Councillor Nick Turner speaks negatively about Caribbean people.,"{'default': {'url': 'https://i.ytimg.com/vi/wPrxtX2HSiY/default.jpg', 'width': 120, 'height': 90}, 'medium': {'url': 'https://i.ytimg.com/vi/wPrxtX2HSiY/mqdefault.jpg', 'width': 320, 'height': 180}, 'high': {'url': 'https://i.ytimg.com/vi/wPrxtX2HSiY/hqdefault.jpg', 'width': 480, 'height': 360}}",African Diaspora News Channel,none,2024-06-16T22:30:05Z,wPrxtX2HSiY,"<iframe width=""480"" height=""270"" src=""//www.youtube.com/embed/wPrxtX2HSiY"" frameborder=""0"" allow=""accelerometer; autoplay; clipboard-write; encrypted-media; gyroscope; picture-in-picture; web-share"" referrerpolicy=""strict-origin-when-cross-origin"" allowfullscreen></iframe>",Current Events
19,2024-06-16T22:00:15Z,UCRVsqvXIdgyPVS-a6fGa1lA,Analyzing Celsius Stock Performance 📈🥤,"Welcome to another informative clip of Market Mondays! In this clip, our host Rashad Bilal dives deep into the recent performance ...","{'default': {'url': 'https://i.ytimg.com/vi/Ur4nEIkPZak/default.jpg', 'width': 120, 'height': 90}, 'medium': {'url': 'https://i.ytimg.com/vi/Ur4nEIkPZak/mqdefault.jpg', 'width': 320, 'height': 180}, 'high': {'url': 'https://i.ytimg.com/vi/Ur4nEIkPZak/hqdefault.jpg', 'width': 480, 'height': 360}}",Earn Your Leisure,none,2024-06-16T22:00:15Z,Ur4nEIkPZak,"<iframe width=""480"" height=""270"" src=""//www.youtube.com/embed/Ur4nEIkPZak"" frameborder=""0"" allow=""accelerometer; autoplay; clipboard-write; encrypted-media; gyroscope; picture-in-picture; web-share"" referrerpolicy=""strict-origin-when-cross-origin"" allowfullscreen></iframe>",Productivity
14,2024-06-16T21:29:29Z,UCiinSjWS3E0vtAa3DCvp7iA,Stanford students walk out of commencement during Pres. Richard Saller’s speech to demand divestment,,"{'default': {'url': 'https://i.ytimg.com/vi/sf6X-SJILow/default.jpg', 'width': 120, 'height': 90}, 'medium': {'url': 'https://i.ytimg.com/vi/sf6X-SJILow/mqdefault.jpg', 'width': 320, 'height': 180}, 'high': {'url': 'https://i.ytimg.com/vi/sf6X-SJILow/hqdefault.jpg', 'width': 480, 'height': 360}}",BreakThrough News,none,2024-06-16T21:29:29Z,sf6X-SJILow,"<iframe width=""480"" height=""270"" src=""//www.youtube.com/embed/sf6X-SJILow"" frameborder=""0"" allow=""accelerometer; autoplay; clipboard-write; encrypted-media; gyroscope; picture-in-picture; web-share"" referrerpolicy=""strict-origin-when-cross-origin"" allowfullscreen></iframe>",Current Events
50,2024-06-16T20:48:40Z,UCHVBLMcvOgDtFEF2bToQLqw,Father&#39;s Day and Juneteenth connection,Father's Day and Juneteenth connection.,"{'default': {'url': 'https://i.ytimg.com/vi/ZXHSSUIa-A0/default_live.jpg', 'width': 120, 'height': 90}, 'medium': {'url': 'https://i.ytimg.com/vi/ZXHSSUIa-A0/mqdefault_live.jpg', 'width': 320, 'height': 180}, 'high': {'url': 'https://i.ytimg.com/vi/ZXHSSUIa-A0/hqdefault_live.jpg', 'width': 480, 'height': 360}}",We Woke Now,live,2024-06-16T20:48:40Z,ZXHSSUIa-A0,"<iframe width=""480"" height=""270"" src=""//www.youtube.com/embed/ZXHSSUIa-A0"" frameborder=""0"" allow=""accelerometer; autoplay; clipboard-write; encrypted-media; gyroscope; picture-in-picture; web-share"" referrerpolicy=""strict-origin-when-cross-origin"" allowfullscreen></iframe>",Social Issues
35,2024-06-16T20:41:09Z,UCMe6CgCi6TSZX1tUxuUvCGg,PROF BAYYINAH BELLO LIVE TONIGHT,"Prof BAYYINAH BELLO, Queen of Haiti ( Ayiti) Live tonight on Pan-African Daily TV with Dr Susan Tatah: RECLAIM YOUR ...","{'default': {'url': 'https://i.ytimg.com/vi/WuwNKw3pagE/default.jpg', 'width': 120, 'height': 90}, 'medium': {'url': 'https://i.ytimg.com/vi/WuwNKw3pagE/mqdefault.jpg', 'width': 320, 'height': 180}, 'high': {'url': 'https://i.ytimg.com/vi/WuwNKw3pagE/hqdefault.jpg', 'width': 480, 'height': 360}}",Pan-African Daily TV,none,2024-06-16T20:41:09Z,WuwNKw3pagE,"<iframe width=""480"" height=""270"" src=""//www.youtube.com/embed/WuwNKw3pagE"" frameborder=""0"" allow=""accelerometer; autoplay; clipboard-write; encrypted-media; gyroscope; picture-in-picture; web-share"" referrerpolicy=""strict-origin-when-cross-origin"" allowfullscreen></iframe>",Current Events
53,2024-06-16T20:24:19Z,UClwrpH_Np9zk8uMwnMwu8Nw,Attending 2 African Weddings In 2 Countries Within 48 Hours!,The Image of AFRICA has been DISTORTED around the WORLD & We are CHANGING the NARRATIVE via YOUTUBE videos ...,"{'default': {'url': 'https://i.ytimg.com/vi/1fjcLjvRbCY/default.jpg', 'width': 120, 'height': 90}, 'medium': {'url': 'https://i.ytimg.com/vi/1fjcLjvRbCY/mqdefault.jpg', 'width': 320, 'height': 180}, 'high': {'url': 'https://i.ytimg.com/vi/1fjcLjvRbCY/hqdefault.jpg', 'width': 480, 'height': 360}}",WODE MAYA,none,2024-06-16T20:24:19Z,1fjcLjvRbCY,"<iframe width=""480"" height=""270"" src=""//www.youtube.com/embed/1fjcLjvRbCY"" frameborder=""0"" allow=""accelerometer; autoplay; clipboard-write; encrypted-media; gyroscope; picture-in-picture; web-share"" referrerpolicy=""strict-origin-when-cross-origin"" allowfullscreen></iframe>",Travel
12,2024-06-16T19:30:02Z,UCWCreFX8bTVLJ6Y9lh6eZ5A,Diddy Update: NEW Shocking Revelations Unveiled,We need your support! Please consider buying us a coffee to help sustain and grow our content. Your contribution directly fuels ...,"{'default': {'url': 'https://i.ytimg.com/vi/BQdj2-VZWmI/default.jpg', 'width': 120, 'height': 90}, 'medium': {'url': 'https://i.ytimg.com/vi/BQdj2-VZWmI/mqdefault.jpg', 'width': 320, 'height': 180}, 'high': {'url': 'https://i.ytimg.com/vi/BQdj2-VZWmI/hqdefault.jpg', 'width': 480, 'height': 360}}",Black Journals,none,2024-06-16T19:30:02Z,BQdj2-VZWmI,"<iframe width=""480"" height=""270"" src=""//www.youtube.com/embed/BQdj2-VZWmI"" frameborder=""0"" allow=""accelerometer; autoplay; clipboard-write; encrypted-media; gyroscope; picture-in-picture; web-share"" referrerpolicy=""strict-origin-when-cross-origin"" allowfullscreen></iframe>",Social Issues
16,2024-06-16T19:20:49Z,UCv8G-xZ_BBGufjbN6jbvLMQ,Dads Are the Worst | Dad Jokes Compilation  | Chocolate Sundaes Standup Comedy,What's Father's Day without a few jokes about Dad Each of these jokes and more are streaming on our channel now! Compilation ...,"{'default': {'url': 'https://i.ytimg.com/vi/cBOw4NDdJwk/default.jpg', 'width': 120, 'height': 90}, 'medium': {'url': 'https://i.ytimg.com/vi/cBOw4NDdJwk/mqdefault.jpg', 'width': 320, 'height': 180}, 'high': {'url': 'https://i.ytimg.com/vi/cBOw4NDdJwk/hqdefault.jpg', 'width': 480, 'height': 360}}",Chocolate Sundaes Comedy,none,2024-06-16T19:20:49Z,cBOw4NDdJwk,"<iframe width=""480"" height=""270"" src=""//www.youtube.com/embed/cBOw4NDdJwk"" frameborder=""0"" allow=""accelerometer; autoplay; clipboard-write; encrypted-media; gyroscope; picture-in-picture; web-share"" referrerpolicy=""strict-origin-when-cross-origin"" allowfullscreen></iframe>",Entertainment
0,2024-06-16T18:34:34Z,UCG7uFJVZsxQRwDssom9Pavw,Pan-African Leader Seba Hails Sahel&#39;s AES Countries for Fighting Neo-Colonialism Head-On,Beninese pan-African activist Kemi Seba voiced his support towards the 'fight' that Burkina Faso and other members of the ...,"{'default': {'url': 'https://i.ytimg.com/vi/bXvxwdo7Jow/default.jpg', 'width': 120, 'height': 90}, 'medium': {'url': 'https://i.ytimg.com/vi/bXvxwdo7Jow/mqdefault.jpg', 'width': 320, 'height': 180}, 'high': {'url': 'https://i.ytimg.com/vi/bXvxwdo7Jow/hqdefault.jpg', 'width': 480, 'height': 360}}",2nacheki,none,2024-06-16T18:34:34Z,bXvxwdo7Jow,"<iframe width=""480"" height=""270"" src=""//www.youtube.com/embed/bXvxwdo7Jow"" frameborder=""0"" allow=""accelerometer; autoplay; clipboard-write; encrypted-media; gyroscope; picture-in-picture; web-share"" referrerpolicy=""strict-origin-when-cross-origin"" allowfullscreen></iframe>",Current Events
37,2024-06-16T17:45:51Z,UCPk29gUc_ltOGQ6f3Lh5kCg,Reelblack One is live! Saturday Night Hang 6/15/2024,Cash App $Reelblack PayPal @Reelblack.,"{'default': {'url': 'https://i.ytimg.com/vi/zsHGDjRzEzo/default.jpg', 'width': 120, 'height': 90}, 'medium': {'url': 'https://i.ytimg.com/vi/zsHGDjRzEzo/mqdefault.jpg', 'width': 320, 'height': 180}, 'high': {'url': 'https://i.ytimg.com/vi/zsHGDjRzEzo/hqdefault.jpg', 'width': 480, 'height': 360}}",Reelblack One,none,2024-06-16T17:45:51Z,zsHGDjRzEzo,"<iframe width=""480"" height=""270"" src=""//www.youtube.com/embed/zsHGDjRzEzo"" frameborder=""0"" allow=""accelerometer; autoplay; clipboard-write; encrypted-media; gyroscope; picture-in-picture; web-share"" referrerpolicy=""strict-origin-when-cross-origin"" allowfullscreen></iframe>",Entertainment
30,2024-06-16T17:23:02Z,UCKLSjhp6XZUEYDT1DMcrj8w,"South African Zuma and MKP Rejecting Election in SA, to take out Ramaphosa","Please SUBSCRIBE, LIKE, COMMENT and Share, Thank for Watching #Love #Peace #AfricanSolutions.","{'default': {'url': 'https://i.ytimg.com/vi/_nCBJNWh1T4/default.jpg', 'width': 120, 'height': 90}, 'medium': {'url': 'https://i.ytimg.com/vi/_nCBJNWh1T4/mqdefault.jpg', 'width': 320, 'height': 180}, 'high': {'url': 'https://i.ytimg.com/vi/_nCBJNWh1T4/hqdefault.jpg', 'width': 480, 'height': 360}}",Make Afrika Great ,none,2024-06-16T17:23:02Z,_nCBJNWh1T4,"<iframe width=""480"" height=""270"" src=""//www.youtube.com/embed/_nCBJNWh1T4"" frameborder=""0"" allow=""accelerometer; autoplay; clipboard-write; encrypted-media; gyroscope; picture-in-picture; web-share"" referrerpolicy=""strict-origin-when-cross-origin"" allowfullscreen></iframe>",Current Events
34,2024-06-16T17:04:43Z,UCrPq2ekHx2vZtuyG3wUx0_g,He Helped Transform Jazz Into A Respected Art Form,,"{'default': {'url': 'https://i.ytimg.com/vi/W6Ry6A9XVOY/default.jpg', 'width': 120, 'height': 90}, 'medium': {'url': 'https://i.ytimg.com/vi/W6Ry6A9XVOY/mqdefault.jpg', 'width': 320, 'height': 180}, 'high': {'url': 'https://i.ytimg.com/vi/W6Ry6A9XVOY/hqdefault.jpg', 'width': 480, 'height': 360}}",On the Shoulders of Giants,none,2024-06-16T17:04:43Z,W6Ry6A9XVOY,"<iframe width=""480"" height=""270"" src=""//www.youtube.com/embed/W6Ry6A9XVOY"" frameborder=""0"" allow=""accelerometer; autoplay; clipboard-write; encrypted-media; gyroscope; picture-in-picture; web-share"" referrerpolicy=""strict-origin-when-cross-origin"" allowfullscreen></iframe>",Social Issues
47,2024-06-16T16:17:19Z,UC-4h1XQ47sf0vbFwJvuBhEA,Dangote Steel Production Game-Changer for Africa&#39;s Economy!,"Dangote Steel Production Game-Changer for Africa's Economy! - Aliko Dangote, the richest man in Africa, isn't just wealthy - he's ...","{'default': {'url': 'https://i.ytimg.com/vi/JsQNm1965PQ/default.jpg', 'width': 120, 'height': 90}, 'medium': {'url': 'https://i.ytimg.com/vi/JsQNm1965PQ/mqdefault.jpg', 'width': 320, 'height': 180}, 'high': {'url': 'https://i.ytimg.com/vi/JsQNm1965PQ/hqdefault.jpg', 'width': 480, 'height': 360}}",The New Africa Channel,none,2024-06-16T16:17:19Z,JsQNm1965PQ,"<iframe width=""480"" height=""270"" src=""//www.youtube.com/embed/JsQNm1965PQ"" frameborder=""0"" allow=""accelerometer; autoplay; clipboard-write; encrypted-media; gyroscope; picture-in-picture; web-share"" referrerpolicy=""strict-origin-when-cross-origin"" allowfullscreen></iframe>",Current Events
44,2024-06-16T16:00:40Z,UC4m46pCBkMEyy8gk26WKqbA,Tia Corine | DreamVille Festival | Episode 008 | Season 003,85southshow Watch the real now on https://www.channeleightyfive.com/,"{'default': {'url': 'https://i.ytimg.com/vi/oKhWh9-_rbk/default.jpg', 'width': 120, 'height': 90}, 'medium': {'url': 'https://i.ytimg.com/vi/oKhWh9-_rbk/mqdefault.jpg', 'width': 320, 'height': 180}, 'high': {'url': 'https://i.ytimg.com/vi/oKhWh9-_rbk/hqdefault.jpg', 'width': 480, 'height': 360}}",The 85 South Comedy Show,none,2024-06-16T16:00:40Z,oKhWh9-_rbk,"<iframe width=""480"" height=""270"" src=""//www.youtube.com/embed/oKhWh9-_rbk"" frameborder=""0"" allow=""accelerometer; autoplay; clipboard-write; encrypted-media; gyroscope; picture-in-picture; web-share"" referrerpolicy=""strict-origin-when-cross-origin"" allowfullscreen></iframe>",Entertainment
1,2024-06-16T14:48:24Z,UCTis64XH8HrxE7GhEkA6YmA,"EURO GROUP B PREDICTIONS, HOW WE DOING SO FAR #euro #uefa #spain #italy #football #soccer",,"{'default': {'url': 'https://i.ytimg.com/vi/dKSmS4iWOVY/default.jpg', 'width': 120, 'height': 90}, 'medium': {'url': 'https://i.ytimg.com/vi/dKSmS4iWOVY/mqdefault.jpg', 'width': 320, 'height': 180}, 'high': {'url': 'https://i.ytimg.com/vi/dKSmS4iWOVY/hqdefault.jpg', 'width': 480, 'height': 360}}",5ASIDE Media,none,2024-06-16T14:48:24Z,dKSmS4iWOVY,"<iframe width=""480"" height=""270"" src=""//www.youtube.com/embed/dKSmS4iWOVY"" frameborder=""0"" allow=""accelerometer; autoplay; clipboard-write; encrypted-media; gyroscope; picture-in-picture; web-share"" referrerpolicy=""strict-origin-when-cross-origin"" allowfullscreen></iframe>",Sports
25,2024-06-16T14:30:06Z,UCi2uaWdy6OTf4Ty7DVC_7lw,WHY Lesotho is Known as the Kingdom of Snow !!!,"Lesotho, a high-altitude, landlocked kingdom encircled by South Africa, Lesotho is a small kingdom landlocked in the gigantic ...","{'default': {'url': 'https://i.ytimg.com/vi/Uw__WFXSr0o/default.jpg', 'width': 120, 'height': 90}, 'medium': {'url': 'https://i.ytimg.com/vi/Uw__WFXSr0o/mqdefault.jpg', 'width': 320, 'height': 180}, 'high': {'url': 'https://i.ytimg.com/vi/Uw__WFXSr0o/hqdefault.jpg', 'width': 480, 'height': 360}}",iam_marwa,none,2024-06-16T14:30:06Z,Uw__WFXSr0o,"<iframe width=""480"" height=""270"" src=""//www.youtube.com/embed/Uw__WFXSr0o"" frameborder=""0"" allow=""accelerometer; autoplay; clipboard-write; encrypted-media; gyroscope; picture-in-picture; web-share"" referrerpolicy=""strict-origin-when-cross-origin"" allowfullscreen></iframe>",Travel
45,2024-06-16T14:01:36Z,UCLjzzg-cFWpEEjnWCOpXp3Q,#OmaliTaughtMe Sunday Study: Complete the Black Revolution - How the Party Survived Counterinsurg…,"This week on #OmaliTaughtMe, the Chairman continues reading from the book Vanguard: The Advanced Detachment of the ...","{'default': {'url': 'https://i.ytimg.com/vi/RPhtRpPijkc/default.jpg', 'width': 120, 'height': 90}, 'medium': {'url': 'https://i.ytimg.com/vi/RPhtRpPijkc/mqdefault.jpg', 'width': 320, 'height': 180}, 'high': {'url': 'https://i.ytimg.com/vi/RPhtRpPijkc/hqdefault.jpg', 'width': 480, 'height': 360}}",The Burning Spear TV,none,2024-06-16T14:01:36Z,RPhtRpPijkc,"<iframe width=""480"" height=""270"" src=""//www.youtube.com/embed/RPhtRpPijkc"" frameborder=""0"" allow=""accelerometer; autoplay; clipboard-write; encrypted-media; gyroscope; picture-in-picture; web-share"" referrerpolicy=""strict-origin-when-cross-origin"" allowfullscreen></iframe>",Current Events
13,2024-06-16T14:00:06Z,UCIxrFTHZybtTgq8X7itOAkQ,Why Won&#39;t The Media Show You This Side Of Trinidad &amp; Tobago!!!,trinidad #trinidadandtobago #trinidadian Experience the hidden side of Trinidad & Tobago that the media won't show you in this ...,"{'default': {'url': 'https://i.ytimg.com/vi/e2M_9Z9KDFg/default.jpg', 'width': 120, 'height': 90}, 'medium': {'url': 'https://i.ytimg.com/vi/e2M_9Z9KDFg/mqdefault.jpg', 'width': 320, 'height': 180}, 'high': {'url': 'https://i.ytimg.com/vi/e2M_9Z9KDFg/hqdefault.jpg', 'width': 480, 'height': 360}}",Blackman Da Traveller,none,2024-06-16T14:00:06Z,e2M_9Z9KDFg,"<iframe width=""480"" height=""270"" src=""//www.youtube.com/embed/e2M_9Z9KDFg"" frameborder=""0"" allow=""accelerometer; autoplay; clipboard-write; encrypted-media; gyroscope; picture-in-picture; web-share"" referrerpolicy=""strict-origin-when-cross-origin"" allowfullscreen></iframe>",Travel
22,2024-06-16T13:00:33Z,UCC0XWOgSBcwNstXbPX2cbpg,Why Michael Jackson&#39;s Skin Color Turned White as He Got Older.,"For copyright matters, takedown, or complaint please contact: historicalafrika@gmail.com Michael Jackson's relationship with his ...","{'default': {'url': 'https://i.ytimg.com/vi/U_uyiPTnAcQ/default.jpg', 'width': 120, 'height': 90}, 'medium': {'url': 'https://i.ytimg.com/vi/U_uyiPTnAcQ/mqdefault.jpg', 'width': 320, 'height': 180}, 'high': {'url': 'https://i.ytimg.com/vi/U_uyiPTnAcQ/hqdefault.jpg', 'width': 480, 'height': 360}}",Historical Africa,none,2024-06-16T13:00:33Z,U_uyiPTnAcQ,"<iframe width=""480"" height=""270"" src=""//www.youtube.com/embed/U_uyiPTnAcQ"" frameborder=""0"" allow=""accelerometer; autoplay; clipboard-write; encrypted-media; gyroscope; picture-in-picture; web-share"" referrerpolicy=""strict-origin-when-cross-origin"" allowfullscreen></iframe>",History
24,2024-06-16T12:01:35Z,UCwZ2vurIl_X8rv0Dv4mu12A,"Curly Loxx On The Modern Man Problem, Understanding Life, Death Of Son, And The Real Bob Marley","Patrick 'Curly Loxx' Gaynor is a charismatic Jamaican voice over specialist, singer, Grammy-nominated songwriter, actor, and ...","{'default': {'url': 'https://i.ytimg.com/vi/GMlnECVGzzw/default.jpg', 'width': 120, 'height': 90}, 'medium': {'url': 'https://i.ytimg.com/vi/GMlnECVGzzw/mqdefault.jpg', 'width': 320, 'height': 180}, 'high': {'url': 'https://i.ytimg.com/vi/GMlnECVGzzw/hqdefault.jpg', 'width': 480, 'height': 360}}",I Never Knew Tv,none,2024-06-16T12:01:35Z,GMlnECVGzzw,"<iframe width=""480"" height=""270"" src=""//www.youtube.com/embed/GMlnECVGzzw"" frameborder=""0"" allow=""accelerometer; autoplay; clipboard-write; encrypted-media; gyroscope; picture-in-picture; web-share"" referrerpolicy=""strict-origin-when-cross-origin"" allowfullscreen></iframe>",Social Issues
2,2024-06-15T18:15:12Z,UCW5NNtTSY5z5mENZ8dt-RCw,Hot Springs Trip Gone Horribly Wrong,"In this video, I took a trip to Colina, Chile to visit the world-famous Termas Valle de Colina Hot Springs. Unfortunately, our transport ...","{'default': {'url': 'https://i.ytimg.com/vi/S_zg-O5MJGY/default.jpg', 'width': 120, 'height': 90}, 'medium': {'url': 'https://i.ytimg.com/vi/S_zg-O5MJGY/mqdefault.jpg', 'width': 320, 'height': 180}, 'high': {'url': 'https://i.ytimg.com/vi/S_zg-O5MJGY/hqdefault.jpg', 'width': 480, 'height': 360}}",ACE ,none,2024-06-15T18:15:12Z,S_zg-O5MJGY,"<iframe width=""480"" height=""270"" src=""//www.youtube.com/embed/S_zg-O5MJGY"" frameborder=""0"" allow=""accelerometer; autoplay; clipboard-write; encrypted-media; gyroscope; picture-in-picture; web-share"" referrerpolicy=""strict-origin-when-cross-origin"" allowfullscreen></iframe>",Travel
18,2024-06-15T17:00:09Z,UCwbP4USYrniJGROwQNiwH-Q,This Is Why Women Need To Be Held Accountable | Actor Michael Rainey Jr  INAPPROPRIATELY TOUCHED,Book Your 1-On-1 60-Minute Advice Consultations Here: https://calendly.com/deedeewoods4real Join My Patreon Here: ...,"{'default': {'url': 'https://i.ytimg.com/vi/BO1Q9ILfcro/default.jpg', 'width': 120, 'height': 90}, 'medium': {'url': 'https://i.ytimg.com/vi/BO1Q9ILfcro/mqdefault.jpg', 'width': 320, 'height': 180}, 'high': {'url': 'https://i.ytimg.com/vi/BO1Q9ILfcro/hqdefault.jpg', 'width': 480, 'height': 360}}",DeeDee,none,2024-06-15T17:00:09Z,BO1Q9ILfcro,"<iframe width=""480"" height=""270"" src=""//www.youtube.com/embed/BO1Q9ILfcro"" frameborder=""0"" allow=""accelerometer; autoplay; clipboard-write; encrypted-media; gyroscope; picture-in-picture; web-share"" referrerpolicy=""strict-origin-when-cross-origin"" allowfullscreen></iframe>",Social Issues
10,2024-06-15T15:30:09Z,UC2xX2FI6s4i9xz3t9qjayhg,Edward W. Said Interview (2002),,"{'default': {'url': 'https://i.ytimg.com/vi/KHTh07Q-SWc/default.jpg', 'width': 120, 'height': 90}, 'medium': {'url': 'https://i.ytimg.com/vi/KHTh07Q-SWc/mqdefault.jpg', 'width': 320, 'height': 180}, 'high': {'url': 'https://i.ytimg.com/vi/KHTh07Q-SWc/hqdefault.jpg', 'width': 480, 'height': 360}}",AfroMarxist,none,2024-06-15T15:30:09Z,KHTh07Q-SWc,"<iframe width=""480"" height=""360"" src=""//www.youtube.com/embed/KHTh07Q-SWc"" frameborder=""0"" allow=""accelerometer; autoplay; clipboard-write; encrypted-media; gyroscope; picture-in-picture; web-share"" referrerpolicy=""strict-origin-when-cross-origin"" allowfullscreen></iframe>",History
29,2024-06-14T19:39:47Z,UC1ettU5YSf_nIOJWffCKGQw,Parliament nominates Julius Malema for president of South Africa,"Julius Malema accepts nomination by a member of parliament from the IFP party for election as the president of South Africa, He ...","{'default': {'url': 'https://i.ytimg.com/vi/ssbhfO6lsSo/default.jpg', 'width': 120, 'height': 90}, 'medium': {'url': 'https://i.ytimg.com/vi/ssbhfO6lsSo/mqdefault.jpg', 'width': 320, 'height': 180}, 'high': {'url': 'https://i.ytimg.com/vi/ssbhfO6lsSo/hqdefault.jpg', 'width': 480, 'height': 360}}",LuiSpot,none,2024-06-14T19:39:47Z,ssbhfO6lsSo,"<iframe width=""480"" height=""270"" src=""//www.youtube.com/embed/ssbhfO6lsSo"" frameborder=""0"" allow=""accelerometer; autoplay; clipboard-write; encrypted-media; gyroscope; picture-in-picture; web-share"" referrerpolicy=""strict-origin-when-cross-origin"" allowfullscreen></iframe>",Current Events
4,2024-06-14T18:00:23Z,UCJmmxwdAsR7lD8fBA_qbEMw,Black Hawk Down: Battle of Mogadishu,"On October 3, 1993, the streets of Mogadishu plunged into chaos as U.S. forces clashed in a deadly battle that would be ...","{'default': {'url': 'https://i.ytimg.com/vi/mvj3JguX9XM/default.jpg', 'width': 120, 'height': 90}, 'medium': {'url': 'https://i.ytimg.com/vi/mvj3JguX9XM/mqdefault.jpg', 'width': 320, 'height': 180}, 'high': {'url': 'https://i.ytimg.com/vi/mvj3JguX9XM/hqdefault.jpg', 'width': 480, 'height': 360}}",African Biographics,none,2024-06-14T18:00:23Z,mvj3JguX9XM,"<iframe width=""480"" height=""270"" src=""//www.youtube.com/embed/mvj3JguX9XM"" frameborder=""0"" allow=""accelerometer; autoplay; clipboard-write; encrypted-media; gyroscope; picture-in-picture; web-share"" referrerpolicy=""strict-origin-when-cross-origin"" allowfullscreen></iframe>",History
11,2024-06-14T14:55:53Z,UCTNr0N__QwstBhgCtvQcjhA,Jasmine Crockett: The Feud with MTG and Clap Back Collection,"Welcome to our latest video on the dynamic and outspoken Jasmine Crockett, the Texas representative who's been making waves ...","{'default': {'url': 'https://i.ytimg.com/vi/QF4TUzN-HOA/default.jpg', 'width': 120, 'height': 90}, 'medium': {'url': 'https://i.ytimg.com/vi/QF4TUzN-HOA/mqdefault.jpg', 'width': 320, 'height': 180}, 'high': {'url': 'https://i.ytimg.com/vi/QF4TUzN-HOA/hqdefault.jpg', 'width': 480, 'height': 360}}",Black Discoveries,none,2024-06-14T14:55:53Z,QF4TUzN-HOA,"<iframe width=""480"" height=""270"" src=""//www.youtube.com/embed/QF4TUzN-HOA"" frameborder=""0"" allow=""accelerometer; autoplay; clipboard-write; encrypted-media; gyroscope; picture-in-picture; web-share"" referrerpolicy=""strict-origin-when-cross-origin"" allowfullscreen></iframe>",History
