,publishedAt,channelId,title,description,thumbnails,channelTitle,liveBroadcastContent,publishTime,videoID,embeds,category
16,2025-07-17T03:46:52Z,UCL0u5uz7KZ9q-pe-VC8TY-w,"If they don&#39;t want to investigate Jeffrey Epstein, we will.",,"{'default': {'url': 'https://i.ytimg.com/vi/aI2TaEEjyLE/default.jpg', 'width': 120, 'height': 90}, 'medium': {'url': 'https://i.ytimg.com/vi/aI2TaEEjyLE/mqdefault.jpg', 'width': 320, 'height': 180}, 'high': {'url': 'https://i.ytimg.com/vi/aI2TaEEjyLE/hqdefault.jpg', 'width': 480, 'height': 360}}",Candace Owens,none,2025-07-17T03:46:52Z,aI2TaEEjyLE,"<iframe width=""480"" height=""270"" src=""//www.youtube.com/embed/aI2TaEEjyLE"" frameborder=""0"" allow=""accelerometer; autoplay; clipboard-write; encrypted-media; gyroscope; picture-in-picture; web-share"" referrerpolicy=""strict-origin-when-cross-origin"" allowfullscreen></iframe>",Current Events
20,2025-07-17T03:46:02Z,UCRVsqvXIdgyPVS-a6fGa1lA,Where to Invest Your Money Before AI Takes Your Job | Top USA Cities for Women &amp; Life in Dubai,"On this episode of Black Out, we pose a major question: If you were given $1 million and had to invest it by next week—but ...","{'default': {'url': 'https://i.ytimg.com/vi/Xjrsej9xYEw/default.jpg', 'width': 120, 'height': 90}, 'medium': {'url': 'https://i.ytimg.com/vi/Xjrsej9xYEw/mqdefault.jpg', 'width': 320, 'height': 180}, 'high': {'url': 'https://i.ytimg.com/vi/Xjrsej9xYEw/hqdefault.jpg', 'width': 480, 'height': 360}}",Earn Your Leisure,none,2025-07-17T03:46:02Z,Xjrsej9xYEw,"<iframe width=""480"" height=""270"" src=""//www.youtube.com/embed/Xjrsej9xYEw"" frameborder=""0"" allow=""accelerometer; autoplay; clipboard-write; encrypted-media; gyroscope; picture-in-picture; web-share"" referrerpolicy=""strict-origin-when-cross-origin"" allowfullscreen></iframe>",Productivity
19,2025-07-17T02:01:25Z,UCwbP4USYrniJGROwQNiwH-Q,Men Are Being SHAMED For Not Wanting BIG WOMEN!,Order Merch Here: https://deedees-apparel.creator-spring.com Follow Me On Tiktok Here: www.tiktok.com/@deedeesreactions ...,"{'default': {'url': 'https://i.ytimg.com/vi/59xTMvrYBkE/default.jpg', 'width': 120, 'height': 90}, 'medium': {'url': 'https://i.ytimg.com/vi/59xTMvrYBkE/mqdefault.jpg', 'width': 320, 'height': 180}, 'high': {'url': 'https://i.ytimg.com/vi/59xTMvrYBkE/hqdefault.jpg', 'width': 480, 'height': 360}}",DeeDee,none,2025-07-17T02:01:25Z,59xTMvrYBkE,"<iframe width=""480"" height=""270"" src=""//www.youtube.com/embed/59xTMvrYBkE"" frameborder=""0"" allow=""accelerometer; autoplay; clipboard-write; encrypted-media; gyroscope; picture-in-picture; web-share"" referrerpolicy=""strict-origin-when-cross-origin"" allowfullscreen></iframe>",Social Issues
4,2025-07-17T01:35:37Z,UCKZGcrxRAhdUi58Mdr565mw,Are African Migrants Being Trafficked Through the Caribbean? 11 Dead Bodies Washed Ashore,11 African Migrants Found Dead in Boat Off St. Vincent Authorities in St. Vincent and the Grenadines have discovered a tragic ...,"{'default': {'url': 'https://i.ytimg.com/vi/avNmwM0kLSo/default.jpg', 'width': 120, 'height': 90}, 'medium': {'url': 'https://i.ytimg.com/vi/avNmwM0kLSo/mqdefault.jpg', 'width': 320, 'height': 180}, 'high': {'url': 'https://i.ytimg.com/vi/avNmwM0kLSo/hqdefault.jpg', 'width': 480, 'height': 360}}",African Diaspora News Channel,none,2025-07-17T01:35:37Z,avNmwM0kLSo,"<iframe width=""480"" height=""270"" src=""//www.youtube.com/embed/avNmwM0kLSo"" frameborder=""0"" allow=""accelerometer; autoplay; clipboard-write; encrypted-media; gyroscope; picture-in-picture; web-share"" referrerpolicy=""strict-origin-when-cross-origin"" allowfullscreen></iframe>",Current Events
18,2025-07-16T23:04:02Z,UCABZ7Z6SBTp4IsARDceOq7w,Black People &quot;Defend&quot; Jennifer Love Hewitt&#39;s &#39;Weight Gain&#39; From White &#39;Fat Shamers&#39; - HP News,https://hypersclub.com/ - Actress Jennifer Love Hewitt would have the internet react to her recent appearance on the red carpet for ...,"{'default': {'url': 'https://i.ytimg.com/vi/I7tk_G6kZaM/default.jpg', 'width': 120, 'height': 90}, 'medium': {'url': 'https://i.ytimg.com/vi/I7tk_G6kZaM/mqdefault.jpg', 'width': 320, 'height': 180}, 'high': {'url': 'https://i.ytimg.com/vi/I7tk_G6kZaM/hqdefault.jpg', 'width': 480, 'height': 360}}",HYPE+,none,2025-07-16T23:04:02Z,I7tk_G6kZaM,"<iframe width=""480"" height=""270"" src=""//www.youtube.com/embed/I7tk_G6kZaM"" frameborder=""0"" allow=""accelerometer; autoplay; clipboard-write; encrypted-media; gyroscope; picture-in-picture; web-share"" referrerpolicy=""strict-origin-when-cross-origin"" allowfullscreen></iframe>",Entertainment
31,2025-07-16T23:00:43Z,UCKLSjhp6XZUEYDT1DMcrj8w,Africa’s Untapped TRILLION-DOLLAR Ocean Opportunity: The Blue Economy No One Is Talking About!,Beneath Africa's waves lies a hidden treasure — and it's not oil or diamonds. It's the Blue Economy. From fisheries and coastal ...,"{'default': {'url': 'https://i.ytimg.com/vi/hxDsl6Y7hLg/default.jpg', 'width': 120, 'height': 90}, 'medium': {'url': 'https://i.ytimg.com/vi/hxDsl6Y7hLg/mqdefault.jpg', 'width': 320, 'height': 180}, 'high': {'url': 'https://i.ytimg.com/vi/hxDsl6Y7hLg/hqdefault.jpg', 'width': 480, 'height': 360}}",Make Afrika Great ,none,2025-07-16T23:00:43Z,hxDsl6Y7hLg,"<iframe width=""480"" height=""270"" src=""//www.youtube.com/embed/hxDsl6Y7hLg"" frameborder=""0"" allow=""accelerometer; autoplay; clipboard-write; encrypted-media; gyroscope; picture-in-picture; web-share"" referrerpolicy=""strict-origin-when-cross-origin"" allowfullscreen></iframe>",Current Events
14,2025-07-16T23:00:06Z,UCiinSjWS3E0vtAa3DCvp7iA,ICE Chases Farmworker Off Roof to His Death. Now His Community Is Chasing Out ICE,"ICE conducted one of the largest raids since Trump took office in Ventura County, California, with agents chasing farmworker ...","{'default': {'url': 'https://i.ytimg.com/vi/DC53jxjn8YA/default.jpg', 'width': 120, 'height': 90}, 'medium': {'url': 'https://i.ytimg.com/vi/DC53jxjn8YA/mqdefault.jpg', 'width': 320, 'height': 180}, 'high': {'url': 'https://i.ytimg.com/vi/DC53jxjn8YA/hqdefault.jpg', 'width': 480, 'height': 360}}",BreakThrough News,none,2025-07-16T23:00:06Z,DC53jxjn8YA,"<iframe width=""480"" height=""270"" src=""//www.youtube.com/embed/DC53jxjn8YA"" frameborder=""0"" allow=""accelerometer; autoplay; clipboard-write; encrypted-media; gyroscope; picture-in-picture; web-share"" referrerpolicy=""strict-origin-when-cross-origin"" allowfullscreen></iframe>",Current Events
47,2025-07-16T22:33:08Z,UCjBw2SidW7wFElbmj9bgDjw,Reconstructing Egypt (The LIVE Event) ft. @kaprooki @smashrockwell @trillblk @kuelimika,You do not want to miss this opportunity to particpate in the biggest livestream event EVER on this channel.,"{'default': {'url': 'https://i.ytimg.com/vi/JjRlxa1Rc-s/default.jpg', 'width': 120, 'height': 90}, 'medium': {'url': 'https://i.ytimg.com/vi/JjRlxa1Rc-s/mqdefault.jpg', 'width': 320, 'height': 180}, 'high': {'url': 'https://i.ytimg.com/vi/JjRlxa1Rc-s/hqdefault.jpg', 'width': 480, 'height': 360}}",The Kings Monologue,none,2025-07-16T22:33:08Z,JjRlxa1Rc-s,"<iframe width=""480"" height=""270"" src=""//www.youtube.com/embed/JjRlxa1Rc-s"" frameborder=""0"" allow=""accelerometer; autoplay; clipboard-write; encrypted-media; gyroscope; picture-in-picture; web-share"" referrerpolicy=""strict-origin-when-cross-origin"" allowfullscreen></iframe>",History
11,2025-07-16T21:45:00Z,UCTNr0N__QwstBhgCtvQcjhA,Former Raycist Sends Strong Message After Learning This About Black People - Must Watch!,Join our channel to get access to perks: https://www.youtube.com/channel/UCTNr0N__QwstBhgCtvQcjhA/join Former Raycist ...,"{'default': {'url': 'https://i.ytimg.com/vi/Aeh0qSYSnk0/default.jpg', 'width': 120, 'height': 90}, 'medium': {'url': 'https://i.ytimg.com/vi/Aeh0qSYSnk0/mqdefault.jpg', 'width': 320, 'height': 180}, 'high': {'url': 'https://i.ytimg.com/vi/Aeh0qSYSnk0/hqdefault.jpg', 'width': 480, 'height': 360}}",Black Discoveries,none,2025-07-16T21:45:00Z,Aeh0qSYSnk0,"<iframe width=""480"" height=""270"" src=""//www.youtube.com/embed/Aeh0qSYSnk0"" frameborder=""0"" allow=""accelerometer; autoplay; clipboard-write; encrypted-media; gyroscope; picture-in-picture; web-share"" referrerpolicy=""strict-origin-when-cross-origin"" allowfullscreen></iframe>",History
7,2025-07-16T21:25:18Z,UCbvE_5m8kmm9U58gDHtzYrA,PACK OPENING &amp; RUSH!,Afro Ballers!,"{'default': {'url': 'https://i.ytimg.com/vi/L2092M7vuUc/default.jpg', 'width': 120, 'height': 90}, 'medium': {'url': 'https://i.ytimg.com/vi/L2092M7vuUc/mqdefault.jpg', 'width': 320, 'height': 180}, 'high': {'url': 'https://i.ytimg.com/vi/L2092M7vuUc/hqdefault.jpg', 'width': 480, 'height': 360}}",AfroBallers,none,2025-07-16T21:25:18Z,L2092M7vuUc,"<iframe width=""480"" height=""270"" src=""//www.youtube.com/embed/L2092M7vuUc"" frameborder=""0"" allow=""accelerometer; autoplay; clipboard-write; encrypted-media; gyroscope; picture-in-picture; web-share"" referrerpolicy=""strict-origin-when-cross-origin"" allowfullscreen></iframe>",Sports
42,2025-07-16T21:15:56Z,UC4lH-odQ5ll-85fkpWxDYmA,Life in Africa’s coldest country -10 degrees | Lesotho 🇱🇸,,"{'default': {'url': 'https://i.ytimg.com/vi/m7feA5f_4Cw/default.jpg', 'width': 120, 'height': 90}, 'medium': {'url': 'https://i.ytimg.com/vi/m7feA5f_4Cw/mqdefault.jpg', 'width': 320, 'height': 180}, 'high': {'url': 'https://i.ytimg.com/vi/m7feA5f_4Cw/hqdefault.jpg', 'width': 480, 'height': 360}}",Steven Ndukwu,none,2025-07-16T21:15:56Z,m7feA5f_4Cw,"<iframe width=""480"" height=""270"" src=""//www.youtube.com/embed/m7feA5f_4Cw"" frameborder=""0"" allow=""accelerometer; autoplay; clipboard-write; encrypted-media; gyroscope; picture-in-picture; web-share"" referrerpolicy=""strict-origin-when-cross-origin"" allowfullscreen></iframe>",Productivity
26,2025-07-16T21:06:52Z,UCi2uaWdy6OTf4Ty7DVC_7lw,"I AM VERY SAD , WHAT A BAD DAY !!!","Hello family , welcome to my YouTube channel iam_marwa , i hope you have enjoyed this video, I AM VERY SAD , WHAT A BAD ...","{'default': {'url': 'https://i.ytimg.com/vi/GMaWPA8TlAA/default.jpg', 'width': 120, 'height': 90}, 'medium': {'url': 'https://i.ytimg.com/vi/GMaWPA8TlAA/mqdefault.jpg', 'width': 320, 'height': 180}, 'high': {'url': 'https://i.ytimg.com/vi/GMaWPA8TlAA/hqdefault.jpg', 'width': 480, 'height': 360}}",iam_marwa,none,2025-07-16T21:06:52Z,GMaWPA8TlAA,"<iframe width=""480"" height=""270"" src=""//www.youtube.com/embed/GMaWPA8TlAA"" frameborder=""0"" allow=""accelerometer; autoplay; clipboard-write; encrypted-media; gyroscope; picture-in-picture; web-share"" referrerpolicy=""strict-origin-when-cross-origin"" allowfullscreen></iframe>",Travel
52,2025-07-16T20:00:42Z,UCXyHjFIKz9D8ofxObOuYBbg,Date men you’d be proud to raise,WeNeedToTalk #BlackLove To support our ministry: https://cash.app/$wnttalk Please SUBSCRIBE for more content!,"{'default': {'url': 'https://i.ytimg.com/vi/bAUa-n6t8Ck/default.jpg', 'width': 120, 'height': 90}, 'medium': {'url': 'https://i.ytimg.com/vi/bAUa-n6t8Ck/mqdefault.jpg', 'width': 320, 'height': 180}, 'high': {'url': 'https://i.ytimg.com/vi/bAUa-n6t8Ck/hqdefault.jpg', 'width': 480, 'height': 360}}",WeNeedToTalk,none,2025-07-16T20:00:42Z,bAUa-n6t8Ck,"<iframe width=""480"" height=""270"" src=""//www.youtube.com/embed/bAUa-n6t8Ck"" frameborder=""0"" allow=""accelerometer; autoplay; clipboard-write; encrypted-media; gyroscope; picture-in-picture; web-share"" referrerpolicy=""strict-origin-when-cross-origin"" allowfullscreen></iframe>",Social Issues
10,2025-07-16T19:45:02Z,UCZEMyEeGRnkGERZTWEGLGPg,"If You’re Black, Watch This Before It Gets Deleted",Black Culture Unlocked is a movement focused on bringing the raw truth and real history to the culture. Our mission is to write our ...,"{'default': {'url': 'https://i.ytimg.com/vi/l8AGAzrTcSc/default.jpg', 'width': 120, 'height': 90}, 'medium': {'url': 'https://i.ytimg.com/vi/l8AGAzrTcSc/mqdefault.jpg', 'width': 320, 'height': 180}, 'high': {'url': 'https://i.ytimg.com/vi/l8AGAzrTcSc/hqdefault.jpg', 'width': 480, 'height': 360}}",Black Culture Unlocked,none,2025-07-16T19:45:02Z,l8AGAzrTcSc,"<iframe width=""480"" height=""270"" src=""//www.youtube.com/embed/l8AGAzrTcSc"" frameborder=""0"" allow=""accelerometer; autoplay; clipboard-write; encrypted-media; gyroscope; picture-in-picture; web-share"" referrerpolicy=""strict-origin-when-cross-origin"" allowfullscreen></iframe>",Social Issues
17,2025-07-16T19:00:09Z,UCv8G-xZ_BBGufjbN6jbvLMQ,My Husband Made Me Delusional  - Comedian Kelly Kellz - Chocolate Sundaes Standup Comedy,One good date led to a lifetime of delusion! Follow Kelly Kellz on social media @kellykellz Originally filmed 6/22/25 Videographer: ...,"{'default': {'url': 'https://i.ytimg.com/vi/Bg-0lxzIaMc/default.jpg', 'width': 120, 'height': 90}, 'medium': {'url': 'https://i.ytimg.com/vi/Bg-0lxzIaMc/mqdefault.jpg', 'width': 320, 'height': 180}, 'high': {'url': 'https://i.ytimg.com/vi/Bg-0lxzIaMc/hqdefault.jpg', 'width': 480, 'height': 360}}",Chocolate Sundaes Comedy,none,2025-07-16T19:00:09Z,Bg-0lxzIaMc,"<iframe width=""480"" height=""270"" src=""//www.youtube.com/embed/Bg-0lxzIaMc"" frameborder=""0"" allow=""accelerometer; autoplay; clipboard-write; encrypted-media; gyroscope; picture-in-picture; web-share"" referrerpolicy=""strict-origin-when-cross-origin"" allowfullscreen></iframe>",Entertainment
46,2025-07-16T18:57:45Z,UCLjzzg-cFWpEEjnWCOpXp3Q,"The Breakdown: White Power in Black Face: Diddy, Democrats, and the Black Petit Boo","Join us as we breakdown the Big Ugly Bill. From Medicaid cuts to Democrats' theater of ""opposition."" We'll expose how the African ...","{'default': {'url': 'https://i.ytimg.com/vi/ptWLqvjEWAw/default_live.jpg', 'width': 120, 'height': 90}, 'medium': {'url': 'https://i.ytimg.com/vi/ptWLqvjEWAw/mqdefault_live.jpg', 'width': 320, 'height': 180}, 'high': {'url': 'https://i.ytimg.com/vi/ptWLqvjEWAw/hqdefault_live.jpg', 'width': 480, 'height': 360}}",The Burning Spear TV,upcoming,2025-07-16T18:57:45Z,ptWLqvjEWAw,"<iframe width=""480"" height=""270"" src=""//www.youtube.com/embed/ptWLqvjEWAw"" frameborder=""0"" allow=""accelerometer; autoplay; clipboard-write; encrypted-media; gyroscope; picture-in-picture; web-share"" referrerpolicy=""strict-origin-when-cross-origin"" allowfullscreen></iframe>",Current Events
35,2025-07-16T18:30:52Z,UCrPq2ekHx2vZtuyG3wUx0_g,Dr. Frances Cress Welsing Taught Us This About Racism,,"{'default': {'url': 'https://i.ytimg.com/vi/fMu2-uOzRh0/default.jpg', 'width': 120, 'height': 90}, 'medium': {'url': 'https://i.ytimg.com/vi/fMu2-uOzRh0/mqdefault.jpg', 'width': 320, 'height': 180}, 'high': {'url': 'https://i.ytimg.com/vi/fMu2-uOzRh0/hqdefault.jpg', 'width': 480, 'height': 360}}",On the Shoulders of Giants ,none,2025-07-16T18:30:52Z,fMu2-uOzRh0,"<iframe width=""480"" height=""270"" src=""//www.youtube.com/embed/fMu2-uOzRh0"" frameborder=""0"" allow=""accelerometer; autoplay; clipboard-write; encrypted-media; gyroscope; picture-in-picture; web-share"" referrerpolicy=""strict-origin-when-cross-origin"" allowfullscreen></iframe>",Social Issues
21,2025-07-16T17:37:35Z,UCF-A_4x9-bLrxXrmgBOWuJA,"The EFF Leadership, led by President Julius_S_Malema, visited Fighter Sello Mamabolo",to assess his living conditions and determine how best to provide meaningful assistance. This visit is part of the EFF's continued ...,"{'default': {'url': 'https://i.ytimg.com/vi/faJxlSx6dhk/default.jpg', 'width': 120, 'height': 90}, 'medium': {'url': 'https://i.ytimg.com/vi/faJxlSx6dhk/mqdefault.jpg', 'width': 320, 'height': 180}, 'high': {'url': 'https://i.ytimg.com/vi/faJxlSx6dhk/hqdefault.jpg', 'width': 480, 'height': 360}}",Economic Freedom Fighters,none,2025-07-16T17:37:35Z,faJxlSx6dhk,"<iframe width=""480"" height=""270"" src=""//www.youtube.com/embed/faJxlSx6dhk"" frameborder=""0"" allow=""accelerometer; autoplay; clipboard-write; encrypted-media; gyroscope; picture-in-picture; web-share"" referrerpolicy=""strict-origin-when-cross-origin"" allowfullscreen></iframe>",Current Events
13,2025-07-16T16:44:54Z,UCIxrFTHZybtTgq8X7itOAkQ,Would You Do This In Chechnya Russia ?,,"{'default': {'url': 'https://i.ytimg.com/vi/Atnz9D5aN2k/default.jpg', 'width': 120, 'height': 90}, 'medium': {'url': 'https://i.ytimg.com/vi/Atnz9D5aN2k/mqdefault.jpg', 'width': 320, 'height': 180}, 'high': {'url': 'https://i.ytimg.com/vi/Atnz9D5aN2k/hqdefault.jpg', 'width': 480, 'height': 360}}",Blackman Da Traveller,none,2025-07-16T16:44:54Z,Atnz9D5aN2k,"<iframe width=""480"" height=""270"" src=""//www.youtube.com/embed/Atnz9D5aN2k"" frameborder=""0"" allow=""accelerometer; autoplay; clipboard-write; encrypted-media; gyroscope; picture-in-picture; web-share"" referrerpolicy=""strict-origin-when-cross-origin"" allowfullscreen></iframe>",Travel
0,2025-07-16T16:44:37Z,UCTis64XH8HrxE7GhEkA6YmA,2014 the last genuine World Cup? Football all about the money now? Full convo on Ep. 89 💭,,"{'default': {'url': 'https://i.ytimg.com/vi/nxWQtRVbIVE/default.jpg', 'width': 120, 'height': 90}, 'medium': {'url': 'https://i.ytimg.com/vi/nxWQtRVbIVE/mqdefault.jpg', 'width': 320, 'height': 180}, 'high': {'url': 'https://i.ytimg.com/vi/nxWQtRVbIVE/hqdefault.jpg', 'width': 480, 'height': 360}}",5ASIDE Media,none,2025-07-16T16:44:37Z,nxWQtRVbIVE,"<iframe width=""480"" height=""270"" src=""//www.youtube.com/embed/nxWQtRVbIVE"" frameborder=""0"" allow=""accelerometer; autoplay; clipboard-write; encrypted-media; gyroscope; picture-in-picture; web-share"" referrerpolicy=""strict-origin-when-cross-origin"" allowfullscreen></iframe>",Sports
25,2025-07-16T14:06:27Z,UCwZ2vurIl_X8rv0Dv4mu12A,Ice Cube Exposes the Dark Connection Between Record Labels and Prisons | Ask Dave Anderson,RAW. REAL. NO AGENDA. JUST TRUTH. UNCUT INTERVIEWS. DEEP REASONINGS. NOTHING WATERED DOWN.,"{'default': {'url': 'https://i.ytimg.com/vi/sBPWUoWY4mk/default.jpg', 'width': 120, 'height': 90}, 'medium': {'url': 'https://i.ytimg.com/vi/sBPWUoWY4mk/mqdefault.jpg', 'width': 320, 'height': 180}, 'high': {'url': 'https://i.ytimg.com/vi/sBPWUoWY4mk/hqdefault.jpg', 'width': 480, 'height': 360}}",I Never Knew Tv,none,2025-07-16T14:06:27Z,sBPWUoWY4mk,"<iframe width=""480"" height=""270"" src=""//www.youtube.com/embed/sBPWUoWY4mk"" frameborder=""0"" allow=""accelerometer; autoplay; clipboard-write; encrypted-media; gyroscope; picture-in-picture; web-share"" referrerpolicy=""strict-origin-when-cross-origin"" allowfullscreen></iframe>",Social Issues
23,2025-07-16T12:00:58Z,UCC0XWOgSBcwNstXbPX2cbpg,American Professor Carol Anderson EXP0SES Secrets About WHlTE RAGE Against Black Americans.,"For copyright matters, takedown, or complaint please contact: historicalafrika@gmail.com She's not holding back. Carol Anderson ...","{'default': {'url': 'https://i.ytimg.com/vi/V075ngBaKkU/default.jpg', 'width': 120, 'height': 90}, 'medium': {'url': 'https://i.ytimg.com/vi/V075ngBaKkU/mqdefault.jpg', 'width': 320, 'height': 180}, 'high': {'url': 'https://i.ytimg.com/vi/V075ngBaKkU/hqdefault.jpg', 'width': 480, 'height': 360}}",Historical Africa,none,2025-07-16T12:00:58Z,V075ngBaKkU,"<iframe width=""480"" height=""270"" src=""//www.youtube.com/embed/V075ngBaKkU"" frameborder=""0"" allow=""accelerometer; autoplay; clipboard-write; encrypted-media; gyroscope; picture-in-picture; web-share"" referrerpolicy=""strict-origin-when-cross-origin"" allowfullscreen></iframe>",History
40,2025-07-16T01:30:29Z,UC2rmgVaijnf92nixlIZWGmg,"Black People Give Their Money To Koreans, Indians and Vietnamese..Why Not Richelieu Dennis?",Black People Give Their Money To Koreans and Vietnamese..Why Not Richelieu Dennis? Patreon: ...,"{'default': {'url': 'https://i.ytimg.com/vi/xFoatHnkgrw/default.jpg', 'width': 120, 'height': 90}, 'medium': {'url': 'https://i.ytimg.com/vi/xFoatHnkgrw/mqdefault.jpg', 'width': 320, 'height': 180}, 'high': {'url': 'https://i.ytimg.com/vi/xFoatHnkgrw/hqdefault.jpg', 'width': 480, 'height': 360}}",Search For Uhuru,none,2025-07-16T01:30:29Z,xFoatHnkgrw,"<iframe width=""480"" height=""270"" src=""//www.youtube.com/embed/xFoatHnkgrw"" frameborder=""0"" allow=""accelerometer; autoplay; clipboard-write; encrypted-media; gyroscope; picture-in-picture; web-share"" referrerpolicy=""strict-origin-when-cross-origin"" allowfullscreen></iframe>",Travel
55,2025-07-16T00:21:46Z,UCHvnMsLnyQZscrq-fOckiiw,Gordon&#39;s War Shows some old pimp tight cars in the 70s with TVs installed in them!,"You can now become a member of this channel to get access to exclusive perks, including behind-the-scenes content and early ...","{'default': {'url': 'https://i.ytimg.com/vi/k4SFQr1O3CA/default.jpg', 'width': 120, 'height': 90}, 'medium': {'url': 'https://i.ytimg.com/vi/k4SFQr1O3CA/mqdefault.jpg', 'width': 320, 'height': 180}, 'high': {'url': 'https://i.ytimg.com/vi/k4SFQr1O3CA/hqdefault.jpg', 'width': 480, 'height': 360}}",BlackTree TV,none,2025-07-16T00:21:46Z,k4SFQr1O3CA,"<iframe width=""480"" height=""270"" src=""//www.youtube.com/embed/k4SFQr1O3CA"" frameborder=""0"" allow=""accelerometer; autoplay; clipboard-write; encrypted-media; gyroscope; picture-in-picture; web-share"" referrerpolicy=""strict-origin-when-cross-origin"" allowfullscreen></iframe>",Entertainment
5,2025-07-15T18:48:26Z,UCJa58Tf70HC5q2oQDNBrJ2g,Embracing your Unique Identity:- The African Diaspora Through Storytelling,"In a world where over 100 billion people have lived on this earth, each with their unique experiences and perspectives, it's time to ...","{'default': {'url': 'https://i.ytimg.com/vi/9H7Z5-fbJ1E/default.jpg', 'width': 120, 'height': 90}, 'medium': {'url': 'https://i.ytimg.com/vi/9H7Z5-fbJ1E/mqdefault.jpg', 'width': 320, 'height': 180}, 'high': {'url': 'https://i.ytimg.com/vi/9H7Z5-fbJ1E/hqdefault.jpg', 'width': 480, 'height': 360}}",AClasses Media,none,2025-07-15T18:48:26Z,9H7Z5-fbJ1E,"<iframe width=""480"" height=""270"" src=""//www.youtube.com/embed/9H7Z5-fbJ1E"" frameborder=""0"" allow=""accelerometer; autoplay; clipboard-write; encrypted-media; gyroscope; picture-in-picture; web-share"" referrerpolicy=""strict-origin-when-cross-origin"" allowfullscreen></iframe>",History
51,2025-07-15T18:37:51Z,UCHVBLMcvOgDtFEF2bToQLqw,Candace Owens debated two Rabbis,Candace Owens debated two Rabbis #candaceowenspodcast #piersmorgan.,"{'default': {'url': 'https://i.ytimg.com/vi/rLmpucRDozE/default.jpg', 'width': 120, 'height': 90}, 'medium': {'url': 'https://i.ytimg.com/vi/rLmpucRDozE/mqdefault.jpg', 'width': 320, 'height': 180}, 'high': {'url': 'https://i.ytimg.com/vi/rLmpucRDozE/hqdefault.jpg', 'width': 480, 'height': 360}}",We Woke Now,none,2025-07-15T18:37:51Z,rLmpucRDozE,"<iframe width=""480"" height=""270"" src=""//www.youtube.com/embed/rLmpucRDozE"" frameborder=""0"" allow=""accelerometer; autoplay; clipboard-write; encrypted-media; gyroscope; picture-in-picture; web-share"" referrerpolicy=""strict-origin-when-cross-origin"" allowfullscreen></iframe>",Social Issues
24,2025-07-15T17:32:10Z,UC12lU5ymIvSpgl8KntDQUQA,“We Will No Longer Be Exploited”: Africa’s Mineral Revolution,"Patreon: https://www.patreon.com/HomeTeamHistory For decades, Africa has supplied the world with critical minerals while ...","{'default': {'url': 'https://i.ytimg.com/vi/lSxki1FKZJk/default.jpg', 'width': 120, 'height': 90}, 'medium': {'url': 'https://i.ytimg.com/vi/lSxki1FKZJk/mqdefault.jpg', 'width': 320, 'height': 180}, 'high': {'url': 'https://i.ytimg.com/vi/lSxki1FKZJk/hqdefault.jpg', 'width': 480, 'height': 360}}",HomeTeam History,none,2025-07-15T17:32:10Z,lSxki1FKZJk,"<iframe width=""480"" height=""270"" src=""//www.youtube.com/embed/lSxki1FKZJk"" frameborder=""0"" allow=""accelerometer; autoplay; clipboard-write; encrypted-media; gyroscope; picture-in-picture; web-share"" referrerpolicy=""strict-origin-when-cross-origin"" allowfullscreen></iframe>",History
12,2025-07-14T23:11:14Z,UCWCreFX8bTVLJ6Y9lh6eZ5A,The Black Diaspora: Tracing Our ANCESTRY Across The Globe,"The Black Diaspora: Tracing Our Ancestry Across the Globe From the African continent to the Americas, Europe, and beyond, the ...","{'default': {'url': 'https://i.ytimg.com/vi/z90O0lzQwUs/default.jpg', 'width': 120, 'height': 90}, 'medium': {'url': 'https://i.ytimg.com/vi/z90O0lzQwUs/mqdefault.jpg', 'width': 320, 'height': 180}, 'high': {'url': 'https://i.ytimg.com/vi/z90O0lzQwUs/hqdefault.jpg', 'width': 480, 'height': 360}}",Black Journals,none,2025-07-14T23:11:14Z,z90O0lzQwUs,"<iframe width=""480"" height=""270"" src=""//www.youtube.com/embed/z90O0lzQwUs"" frameborder=""0"" allow=""accelerometer; autoplay; clipboard-write; encrypted-media; gyroscope; picture-in-picture; web-share"" referrerpolicy=""strict-origin-when-cross-origin"" allowfullscreen></iframe>",Social Issues
49,2025-07-14T21:01:09Z,UCPQsrvUJzs1INc2hroy3nHw,Can You Speed Date A Stranger in 30 seconds?,,"{'default': {'url': 'https://i.ytimg.com/vi/wD0uFNoRGQc/default.jpg', 'width': 120, 'height': 90}, 'medium': {'url': 'https://i.ytimg.com/vi/wD0uFNoRGQc/mqdefault.jpg', 'width': 320, 'height': 180}, 'high': {'url': 'https://i.ytimg.com/vi/wD0uFNoRGQc/hqdefault.jpg', 'width': 480, 'height': 360}}",The Pan African Dating Show (The-PDS),none,2025-07-14T21:01:09Z,wD0uFNoRGQc,"<iframe width=""480"" height=""270"" src=""//www.youtube.com/embed/wD0uFNoRGQc"" frameborder=""0"" allow=""accelerometer; autoplay; clipboard-write; encrypted-media; gyroscope; picture-in-picture; web-share"" referrerpolicy=""strict-origin-when-cross-origin"" allowfullscreen></iframe>",Social Issues
