,publishedAt,channelId,title,description,thumbnails,channelTitle,liveBroadcastContent,publishTime,videoID,embeds,category
44,2025-05-13T10:08:31Z,UCLjzzg-cFWpEEjnWCOpXp3Q,Join the Fight for Anti-colonial Free Speech - One Africa Worldview Episode 1,"Burning Spear Media presents: The One Africa Worldview Podcast, bringing you weekly news updates and analysis on the critical ...","{'default': {'url': 'https://i.ytimg.com/vi/pFfPQGamnbU/default.jpg', 'width': 120, 'height': 90}, 'medium': {'url': 'https://i.ytimg.com/vi/pFfPQGamnbU/mqdefault.jpg', 'width': 320, 'height': 180}, 'high': {'url': 'https://i.ytimg.com/vi/pFfPQGamnbU/hqdefault.jpg', 'width': 480, 'height': 360}}",The Burning Spear TV,none,2025-05-13T10:08:31Z,pFfPQGamnbU,"<iframe width=""480"" height=""270"" src=""//www.youtube.com/embed/pFfPQGamnbU"" frameborder=""0"" allow=""accelerometer; autoplay; clipboard-write; encrypted-media; gyroscope; picture-in-picture; web-share"" referrerpolicy=""strict-origin-when-cross-origin"" allowfullscreen></iframe>",Current Events
25,2025-05-12T17:01:06Z,UCpEf2jEfyAEbQesGgl1HOWA,"IS GHANA A GOOD PLACE TO LIVE IN? | COOKING GHANA FOOD, SHOPPING, TIME WITH FRIENDS AND FAMILY","livinginghana #lifeinghana LIVING IN GHANA | COOKING, SHOPPING, TIME WITH FRIENDS AND FAMILY I haven't shared these ...","{'default': {'url': 'https://i.ytimg.com/vi/t5rKTUSY4-M/default.jpg', 'width': 120, 'height': 90}, 'medium': {'url': 'https://i.ytimg.com/vi/t5rKTUSY4-M/mqdefault.jpg', 'width': 320, 'height': 180}, 'high': {'url': 'https://i.ytimg.com/vi/t5rKTUSY4-M/hqdefault.jpg', 'width': 480, 'height': 360}}",Jasmine Ama,none,2025-05-12T17:01:06Z,t5rKTUSY4-M,"<iframe width=""480"" height=""270"" src=""//www.youtube.com/embed/t5rKTUSY4-M"" frameborder=""0"" allow=""accelerometer; autoplay; clipboard-write; encrypted-media; gyroscope; picture-in-picture; web-share"" referrerpolicy=""strict-origin-when-cross-origin"" allowfullscreen></iframe>",Travel
30,2025-05-12T03:38:35Z,UC4YZVeGnDXzEfjGcZG-d6oQ,"Take Me Down A Rabbithole Ep. 28 Suspending Habeas Corpus, Slavery, Statue of Black Woman Symbolism",New to streaming or looking to level up? Check out StreamYard and get $10 discount!,"{'default': {'url': 'https://i.ytimg.com/vi/-kCqtkw3OM0/default.jpg', 'width': 120, 'height': 90}, 'medium': {'url': 'https://i.ytimg.com/vi/-kCqtkw3OM0/mqdefault.jpg', 'width': 320, 'height': 180}, 'high': {'url': 'https://i.ytimg.com/vi/-kCqtkw3OM0/hqdefault.jpg', 'width': 480, 'height': 360}}",meandepiphany,none,2025-05-12T03:38:35Z,-kCqtkw3OM0,"<iframe width=""480"" height=""270"" src=""//www.youtube.com/embed/-kCqtkw3OM0"" frameborder=""0"" allow=""accelerometer; autoplay; clipboard-write; encrypted-media; gyroscope; picture-in-picture; web-share"" referrerpolicy=""strict-origin-when-cross-origin"" allowfullscreen></iframe>",Social Issues
52,2025-05-11T12:20:09Z,UClwrpH_Np9zk8uMwnMwu8Nw,Civilians Sleep On The Street To Protect The President Of Burkina Faso 🇧🇫,,"{'default': {'url': 'https://i.ytimg.com/vi/pOxmuiYhtmw/default.jpg', 'width': 120, 'height': 90}, 'medium': {'url': 'https://i.ytimg.com/vi/pOxmuiYhtmw/mqdefault.jpg', 'width': 320, 'height': 180}, 'high': {'url': 'https://i.ytimg.com/vi/pOxmuiYhtmw/hqdefault.jpg', 'width': 480, 'height': 360}}",WODE MAYA,none,2025-05-11T12:20:09Z,pOxmuiYhtmw,"<iframe width=""480"" height=""270"" src=""//www.youtube.com/embed/pOxmuiYhtmw"" frameborder=""0"" allow=""accelerometer; autoplay; clipboard-write; encrypted-media; gyroscope; picture-in-picture; web-share"" referrerpolicy=""strict-origin-when-cross-origin"" allowfullscreen></iframe>",Travel
26,2025-05-11T00:58:56Z,UC__wkIWEfbnTAYVT8j6gfPg,Original Black populations of the Middle East,,"{'default': {'url': 'https://i.ytimg.com/vi/JID-VHG-bXc/default.jpg', 'width': 120, 'height': 90}, 'medium': {'url': 'https://i.ytimg.com/vi/JID-VHG-bXc/mqdefault.jpg', 'width': 320, 'height': 180}, 'high': {'url': 'https://i.ytimg.com/vi/JID-VHG-bXc/hqdefault.jpg', 'width': 480, 'height': 360}}",Know Thyself,none,2025-05-11T00:58:56Z,JID-VHG-bXc,"<iframe width=""480"" height=""270"" src=""//www.youtube.com/embed/JID-VHG-bXc"" frameborder=""0"" allow=""accelerometer; autoplay; clipboard-write; encrypted-media; gyroscope; picture-in-picture; web-share"" referrerpolicy=""strict-origin-when-cross-origin"" allowfullscreen></iframe>",History
47,2025-05-10T21:00:30Z,UCPQsrvUJzs1INc2hroy3nHw,What would you do If you suspected your Partner was Cheating? #shorts,,"{'default': {'url': 'https://i.ytimg.com/vi/dROwRLaokXk/default.jpg', 'width': 120, 'height': 90}, 'medium': {'url': 'https://i.ytimg.com/vi/dROwRLaokXk/mqdefault.jpg', 'width': 320, 'height': 180}, 'high': {'url': 'https://i.ytimg.com/vi/dROwRLaokXk/hqdefault.jpg', 'width': 480, 'height': 360}}",The Pan African Dating Show (The-PDS),none,2025-05-10T21:00:30Z,dROwRLaokXk,"<iframe width=""480"" height=""270"" src=""//www.youtube.com/embed/dROwRLaokXk"" frameborder=""0"" allow=""accelerometer; autoplay; clipboard-write; encrypted-media; gyroscope; picture-in-picture; web-share"" referrerpolicy=""strict-origin-when-cross-origin"" allowfullscreen></iframe>",Social Issues
37,2025-05-10T15:00:45Z,UCCfgU1Dgpz0MzA-4vP_gRuQ,Why Anti-Blackness Runs Deep in Japan,"Why does a country as admired as Japan struggle with deeply rooted anti-Blackness? This video unpacks the hidden history, ...","{'default': {'url': 'https://i.ytimg.com/vi/S5QAwxiZkek/default.jpg', 'width': 120, 'height': 90}, 'medium': {'url': 'https://i.ytimg.com/vi/S5QAwxiZkek/mqdefault.jpg', 'width': 320, 'height': 180}, 'high': {'url': 'https://i.ytimg.com/vi/S5QAwxiZkek/hqdefault.jpg', 'width': 480, 'height': 360}}",Risen Africa,none,2025-05-10T15:00:45Z,S5QAwxiZkek,"<iframe width=""480"" height=""270"" src=""//www.youtube.com/embed/S5QAwxiZkek"" frameborder=""0"" allow=""accelerometer; autoplay; clipboard-write; encrypted-media; gyroscope; picture-in-picture; web-share"" referrerpolicy=""strict-origin-when-cross-origin"" allowfullscreen></iframe>",Current Events
40,2025-05-09T16:57:30Z,UC4lH-odQ5ll-85fkpWxDYmA,"I investigated Africa&#39;s Richest City, i couldn&#39;t believe my eyes","in todays episode, i visited and experienced life in Africa's richest city to answer questions like, what makes this city the richest, ...","{'default': {'url': 'https://i.ytimg.com/vi/E0NOfRMO2jI/default.jpg', 'width': 120, 'height': 90}, 'medium': {'url': 'https://i.ytimg.com/vi/E0NOfRMO2jI/mqdefault.jpg', 'width': 320, 'height': 180}, 'high': {'url': 'https://i.ytimg.com/vi/E0NOfRMO2jI/hqdefault.jpg', 'width': 480, 'height': 360}}",Steven Ndukwu,none,2025-05-09T16:57:30Z,E0NOfRMO2jI,"<iframe width=""480"" height=""270"" src=""//www.youtube.com/embed/E0NOfRMO2jI"" frameborder=""0"" allow=""accelerometer; autoplay; clipboard-write; encrypted-media; gyroscope; picture-in-picture; web-share"" referrerpolicy=""strict-origin-when-cross-origin"" allowfullscreen></iframe>",Productivity
12,2025-05-08T16:00:06Z,UCIxrFTHZybtTgq8X7itOAkQ,YouTube Will Never Show You This Side Of Indonesia,"YouTube Will Never Show You This Side Of Indonesia In this video, I explore a side of Indonesia that truly surprised me! , i went to ...","{'default': {'url': 'https://i.ytimg.com/vi/3m86VYjslzg/default.jpg', 'width': 120, 'height': 90}, 'medium': {'url': 'https://i.ytimg.com/vi/3m86VYjslzg/mqdefault.jpg', 'width': 320, 'height': 180}, 'high': {'url': 'https://i.ytimg.com/vi/3m86VYjslzg/hqdefault.jpg', 'width': 480, 'height': 360}}",Blackman Da Traveller,none,2025-05-08T16:00:06Z,3m86VYjslzg,"<iframe width=""480"" height=""270"" src=""//www.youtube.com/embed/3m86VYjslzg"" frameborder=""0"" allow=""accelerometer; autoplay; clipboard-write; encrypted-media; gyroscope; picture-in-picture; web-share"" referrerpolicy=""strict-origin-when-cross-origin"" allowfullscreen></iframe>",Travel
45,2025-05-06T10:40:41Z,UCjBw2SidW7wFElbmj9bgDjw,Can ANYONE explain this?  #marytudor #queenmary #hiddenhistory,,"{'default': {'url': 'https://i.ytimg.com/vi/oz1fQC3zei8/default.jpg', 'width': 120, 'height': 90}, 'medium': {'url': 'https://i.ytimg.com/vi/oz1fQC3zei8/mqdefault.jpg', 'width': 320, 'height': 180}, 'high': {'url': 'https://i.ytimg.com/vi/oz1fQC3zei8/hqdefault.jpg', 'width': 480, 'height': 360}}",The Kings Monologue,none,2025-05-06T10:40:41Z,oz1fQC3zei8,"<iframe width=""480"" height=""270"" src=""//www.youtube.com/embed/oz1fQC3zei8"" frameborder=""0"" allow=""accelerometer; autoplay; clipboard-write; encrypted-media; gyroscope; picture-in-picture; web-share"" referrerpolicy=""strict-origin-when-cross-origin"" allowfullscreen></iframe>",History
34,2025-04-30T07:33:43Z,UCMe6CgCi6TSZX1tUxuUvCGg,COMING UP LIVE TONIGHT WITH DR TONY JAJA - AFRICA&#39;S YOUTH IS RISING NOW MORE THAN BEFORE,Join the Conversation 🎙️ New to streaming or looking to level up? Check out StreamYard and get $10 discount!,"{'default': {'url': 'https://i.ytimg.com/vi/v5rXP8faz5w/default.jpg', 'width': 120, 'height': 90}, 'medium': {'url': 'https://i.ytimg.com/vi/v5rXP8faz5w/mqdefault.jpg', 'width': 320, 'height': 180}, 'high': {'url': 'https://i.ytimg.com/vi/v5rXP8faz5w/hqdefault.jpg', 'width': 480, 'height': 360}}","Pan-African Daily TV, PADTV",none,2025-04-30T07:33:43Z,v5rXP8faz5w,"<iframe width=""480"" height=""270"" src=""//www.youtube.com/embed/v5rXP8faz5w"" frameborder=""0"" allow=""accelerometer; autoplay; clipboard-write; encrypted-media; gyroscope; picture-in-picture; web-share"" referrerpolicy=""strict-origin-when-cross-origin"" allowfullscreen></iframe>",Current Events
4,2025-04-28T16:00:38Z,UCJmmxwdAsR7lD8fBA_qbEMw,Operation Kitona: How Rwanda Almost Took Over Congo,"In August 1998, something strange happened at a quiet airstrip in western Congo. A Boeing 727—completely unmarked and ...","{'default': {'url': 'https://i.ytimg.com/vi/NUZ9IL7zux0/default.jpg', 'width': 120, 'height': 90}, 'medium': {'url': 'https://i.ytimg.com/vi/NUZ9IL7zux0/mqdefault.jpg', 'width': 320, 'height': 180}, 'high': {'url': 'https://i.ytimg.com/vi/NUZ9IL7zux0/hqdefault.jpg', 'width': 480, 'height': 360}}",African Biographics,none,2025-04-28T16:00:38Z,NUZ9IL7zux0,"<iframe width=""480"" height=""270"" src=""//www.youtube.com/embed/NUZ9IL7zux0"" frameborder=""0"" allow=""accelerometer; autoplay; clipboard-write; encrypted-media; gyroscope; picture-in-picture; web-share"" referrerpolicy=""strict-origin-when-cross-origin"" allowfullscreen></iframe>",History
53,2025-03-19T05:35:00Z,UCx5Y5d5KgibkG9KAyknCdFA,Why Black People Only Seem to be Good at Sports,"Black excellence is undeniable in sports, but why don't we see the same widespread success in other industries? In this video, we ...","{'default': {'url': 'https://i.ytimg.com/vi/G1pc_mZ2yvk/default.jpg', 'width': 120, 'height': 90}, 'medium': {'url': 'https://i.ytimg.com/vi/G1pc_mZ2yvk/mqdefault.jpg', 'width': 320, 'height': 180}, 'high': {'url': 'https://i.ytimg.com/vi/G1pc_mZ2yvk/hqdefault.jpg', 'width': 480, 'height': 360}}",Afromation Digital,none,2025-03-19T05:35:00Z,G1pc_mZ2yvk,"<iframe width=""480"" height=""270"" src=""//www.youtube.com/embed/G1pc_mZ2yvk"" frameborder=""0"" allow=""accelerometer; autoplay; clipboard-write; encrypted-media; gyroscope; picture-in-picture; web-share"" referrerpolicy=""strict-origin-when-cross-origin"" allowfullscreen></iframe>",Social Issues
48,2025-03-16T21:00:38Z,UC2-nif4wvOqT6QVsBX3NOpA,5 Better Countries for Black Americans,asaptickets #cheapflights #asapticketsreview Claim your $50 discount on international flights from North America with the ...,"{'default': {'url': 'https://i.ytimg.com/vi/pKoicpXh4AI/default.jpg', 'width': 120, 'height': 90}, 'medium': {'url': 'https://i.ytimg.com/vi/pKoicpXh4AI/mqdefault.jpg', 'width': 320, 'height': 180}, 'high': {'url': 'https://i.ytimg.com/vi/pKoicpXh4AI/hqdefault.jpg', 'width': 480, 'height': 360}}",The Yarbros,none,2025-03-16T21:00:38Z,pKoicpXh4AI,"<iframe width=""480"" height=""270"" src=""//www.youtube.com/embed/pKoicpXh4AI"" frameborder=""0"" allow=""accelerometer; autoplay; clipboard-write; encrypted-media; gyroscope; picture-in-picture; web-share"" referrerpolicy=""strict-origin-when-cross-origin"" allowfullscreen></iframe>",Travel
20,2025-03-07T02:57:50Z,UCOhiR-6Y-MZtMERKRENrcRw,Reaction to Roland Martin&#39;s State of Our Union Address,This is a discussion or reaction by callers who share their opinion of the State of Our Union.,"{'default': {'url': 'https://i.ytimg.com/vi/UpOl_Ya9ffk/default.jpg', 'width': 120, 'height': 90}, 'medium': {'url': 'https://i.ytimg.com/vi/UpOl_Ya9ffk/mqdefault.jpg', 'width': 320, 'height': 180}, 'high': {'url': 'https://i.ytimg.com/vi/UpOl_Ya9ffk/hqdefault.jpg', 'width': 480, 'height': 360}}",GoBlack2Africa ,none,2025-03-07T02:57:50Z,UpOl_Ya9ffk,"<iframe width=""480"" height=""270"" src=""//www.youtube.com/embed/UpOl_Ya9ffk"" frameborder=""0"" allow=""accelerometer; autoplay; clipboard-write; encrypted-media; gyroscope; picture-in-picture; web-share"" referrerpolicy=""strict-origin-when-cross-origin"" allowfullscreen></iframe>",Travel
35,2025-02-13T15:00:06Z,UCF71yDQwxfw0QcYb2JnkB5Q,I Thought Cruises Were TRASH… So I Took One to Prove It! Virgin Voyages,"We've avoided cruises our whole lives—overcrowded buffets, tourist traps, and feeling stuck at sea? Not for us. But one of our ...","{'default': {'url': 'https://i.ytimg.com/vi/4XADlrNkg_Q/default.jpg', 'width': 120, 'height': 90}, 'medium': {'url': 'https://i.ytimg.com/vi/4XADlrNkg_Q/mqdefault.jpg', 'width': 320, 'height': 180}, 'high': {'url': 'https://i.ytimg.com/vi/4XADlrNkg_Q/hqdefault.jpg', 'width': 480, 'height': 360}}",PassportHeavy,none,2025-02-13T15:00:06Z,4XADlrNkg_Q,"<iframe width=""480"" height=""270"" src=""//www.youtube.com/embed/4XADlrNkg_Q"" frameborder=""0"" allow=""accelerometer; autoplay; clipboard-write; encrypted-media; gyroscope; picture-in-picture; web-share"" referrerpolicy=""strict-origin-when-cross-origin"" allowfullscreen></iframe>",Travel
32,2025-01-11T16:00:06Z,UCJH-fn0wLu5uwXX33jNToQw,Samora Machel&#39;s Struggle | How Mozambique’s Revolution Ended Portugal&#39;s Empire,"The most beautiful thing about a man's life is his freedom. He may not have any food, and he may not have any clothing, but at ...","{'default': {'url': 'https://i.ytimg.com/vi/wTwI48jN-fY/default.jpg', 'width': 120, 'height': 90}, 'medium': {'url': 'https://i.ytimg.com/vi/wTwI48jN-fY/mqdefault.jpg', 'width': 320, 'height': 180}, 'high': {'url': 'https://i.ytimg.com/vi/wTwI48jN-fY/hqdefault.jpg', 'width': 480, 'height': 360}}",NewAfrica,none,2025-01-11T16:00:06Z,wTwI48jN-fY,"<iframe width=""480"" height=""270"" src=""//www.youtube.com/embed/wTwI48jN-fY"" frameborder=""0"" allow=""accelerometer; autoplay; clipboard-write; encrypted-media; gyroscope; picture-in-picture; web-share"" referrerpolicy=""strict-origin-when-cross-origin"" allowfullscreen></iframe>",Current Events
8,2024-11-10T05:30:00Z,UCbvE_5m8kmm9U58gDHtzYrA,Nigeria has been named the best Jollof rice maker‼️🇳🇬🍚,,"{'default': {'url': 'https://i.ytimg.com/vi/ZkdyXscEAFI/default.jpg', 'width': 120, 'height': 90}, 'medium': {'url': 'https://i.ytimg.com/vi/ZkdyXscEAFI/mqdefault.jpg', 'width': 320, 'height': 180}, 'high': {'url': 'https://i.ytimg.com/vi/ZkdyXscEAFI/hqdefault.jpg', 'width': 480, 'height': 360}}",AfroBallers,none,2024-11-10T05:30:00Z,ZkdyXscEAFI,"<iframe width=""480"" height=""360"" src=""//www.youtube.com/embed/ZkdyXscEAFI"" frameborder=""0"" allow=""accelerometer; autoplay; clipboard-write; encrypted-media; gyroscope; picture-in-picture; web-share"" referrerpolicy=""strict-origin-when-cross-origin"" allowfullscreen></iframe>",Sports
9,2024-08-31T16:32:50Z,UC2xX2FI6s4i9xz3t9qjayhg,The San Quentin Six (1972),"A documentary on the six Black and Chicano prisoners who, following George Jackson's death, were charged on charges of ...","{'default': {'url': 'https://i.ytimg.com/vi/E-4CUaaSo4I/default.jpg', 'width': 120, 'height': 90}, 'medium': {'url': 'https://i.ytimg.com/vi/E-4CUaaSo4I/mqdefault.jpg', 'width': 320, 'height': 180}, 'high': {'url': 'https://i.ytimg.com/vi/E-4CUaaSo4I/hqdefault.jpg', 'width': 480, 'height': 360}}",AfroMarxist,none,2024-08-31T16:32:50Z,E-4CUaaSo4I,"<iframe width=""480"" height=""360"" src=""//www.youtube.com/embed/E-4CUaaSo4I"" frameborder=""0"" allow=""accelerometer; autoplay; clipboard-write; encrypted-media; gyroscope; picture-in-picture; web-share"" referrerpolicy=""strict-origin-when-cross-origin"" allowfullscreen></iframe>",History
31,2024-08-25T18:19:19Z,UCh2ANLALdN1OZUJKmvchkkg,The INSANE True Story of Cleopatra in Pop Culture | Documentary,"Cleopatra is one of the most iconic figures associated with ancient Egypt, but our perception of the queen is not correct.","{'default': {'url': 'https://i.ytimg.com/vi/dwSSQFS-OQY/default.jpg', 'width': 120, 'height': 90}, 'medium': {'url': 'https://i.ytimg.com/vi/dwSSQFS-OQY/mqdefault.jpg', 'width': 320, 'height': 180}, 'high': {'url': 'https://i.ytimg.com/vi/dwSSQFS-OQY/hqdefault.jpg', 'width': 480, 'height': 360}}",Mr. Imhotep,none,2024-08-25T18:19:19Z,dwSSQFS-OQY,"<iframe width=""480"" height=""270"" src=""//www.youtube.com/embed/dwSSQFS-OQY"" frameborder=""0"" allow=""accelerometer; autoplay; clipboard-write; encrypted-media; gyroscope; picture-in-picture; web-share"" referrerpolicy=""strict-origin-when-cross-origin"" allowfullscreen></iframe>",History
14,2024-08-25T18:00:03Z,UCMMTYgqKEgCgy1pR6Axlf0A,"Ex-model moved to Ghana to build a 5 bedroom home, set up 7 businesses and live her dream life",Our guest today left behind her 15 year career in the modelling industry to move to Ghana and start a new life here. This amazing ...,"{'default': {'url': 'https://i.ytimg.com/vi/6TMZcRoGZi4/default.jpg', 'width': 120, 'height': 90}, 'medium': {'url': 'https://i.ytimg.com/vi/6TMZcRoGZi4/mqdefault.jpg', 'width': 320, 'height': 180}, 'high': {'url': 'https://i.ytimg.com/vi/6TMZcRoGZi4/hqdefault.jpg', 'width': 480, 'height': 360}}",Build with Amoaa,none,2024-08-25T18:00:03Z,6TMZcRoGZi4,"<iframe width=""480"" height=""270"" src=""//www.youtube.com/embed/6TMZcRoGZi4"" frameborder=""0"" allow=""accelerometer; autoplay; clipboard-write; encrypted-media; gyroscope; picture-in-picture; web-share"" referrerpolicy=""strict-origin-when-cross-origin"" allowfullscreen></iframe>",Travel
7,2024-07-12T12:15:30Z,UCl6to6J7oVltnhHEVm1s87A,AFRICAN ORIGIN OF MORDEN HAIRSTYLES,theperspective #africanhistory #africanews #africax5 Traditional African hairstyles are back in fashion and making a real ...,"{'default': {'url': 'https://i.ytimg.com/vi/AGyMe_XB3mQ/default.jpg', 'width': 120, 'height': 90}, 'medium': {'url': 'https://i.ytimg.com/vi/AGyMe_XB3mQ/mqdefault.jpg', 'width': 320, 'height': 180}, 'high': {'url': 'https://i.ytimg.com/vi/AGyMe_XB3mQ/hqdefault.jpg', 'width': 480, 'height': 360}}",Africax5 Network,none,2024-07-12T12:15:30Z,AGyMe_XB3mQ,"<iframe width=""480"" height=""360"" src=""//www.youtube.com/embed/AGyMe_XB3mQ"" frameborder=""0"" allow=""accelerometer; autoplay; clipboard-write; encrypted-media; gyroscope; picture-in-picture; web-share"" referrerpolicy=""strict-origin-when-cross-origin"" allowfullscreen></iframe>",Social Issues
27,2024-07-08T12:10:25Z,UCHbmePHjGH3pklvSla6szWw,You Wouldn&#39;t Survive In Ancient Egypt | REACTION - KueliMika,Today we are reacting to the video You Wouldn't Survive In Ancient Egypt.,"{'default': {'url': 'https://i.ytimg.com/vi/qFbr17zUKYE/default.jpg', 'width': 120, 'height': 90}, 'medium': {'url': 'https://i.ytimg.com/vi/qFbr17zUKYE/mqdefault.jpg', 'width': 320, 'height': 180}, 'high': {'url': 'https://i.ytimg.com/vi/qFbr17zUKYE/hqdefault.jpg', 'width': 480, 'height': 360}}",KueliMika,none,2024-07-08T12:10:25Z,qFbr17zUKYE,"<iframe width=""480"" height=""270"" src=""//www.youtube.com/embed/qFbr17zUKYE"" frameborder=""0"" allow=""accelerometer; autoplay; clipboard-write; encrypted-media; gyroscope; picture-in-picture; web-share"" referrerpolicy=""strict-origin-when-cross-origin"" allowfullscreen></iframe>",History
3,2024-04-25T23:00:06Z,UCTTQWaoGloNuhunZevQ2F6g,"Kuubwa Transforming African Businesses: Fabric Weaver, Fish Farmers","Kuubwa Transforms African Businesses: Fish Farmers, Fabric Manufacturers and more.","{'default': {'url': 'https://i.ytimg.com/vi/gC02Wht1UQQ/default.jpg', 'width': 120, 'height': 90}, 'medium': {'url': 'https://i.ytimg.com/vi/gC02Wht1UQQ/mqdefault.jpg', 'width': 320, 'height': 180}, 'high': {'url': 'https://i.ytimg.com/vi/gC02Wht1UQQ/hqdefault.jpg', 'width': 480, 'height': 360}}",Africa Business Channel TV,none,2024-04-25T23:00:06Z,gC02Wht1UQQ,"<iframe width=""480"" height=""270"" src=""//www.youtube.com/embed/gC02Wht1UQQ"" frameborder=""0"" allow=""accelerometer; autoplay; clipboard-write; encrypted-media; gyroscope; picture-in-picture; web-share"" referrerpolicy=""strict-origin-when-cross-origin"" allowfullscreen></iframe>",Productivity
42,2024-04-11T05:04:02Z,UCuvO0y2EU_kRfYzlhGJNOKA,How Did America&#39;s Wealthy Elite Re Write World History,"The United States was supposed to be a democratically run country. However, that has not been the case since the turn of the ...","{'default': {'url': 'https://i.ytimg.com/vi/RPSnS-ucmOA/default.jpg', 'width': 120, 'height': 90}, 'medium': {'url': 'https://i.ytimg.com/vi/RPSnS-ucmOA/mqdefault.jpg', 'width': 320, 'height': 180}, 'high': {'url': 'https://i.ytimg.com/vi/RPSnS-ucmOA/hqdefault.jpg', 'width': 480, 'height': 360}}",Straight UP,none,2024-04-11T05:04:02Z,RPSnS-ucmOA,"<iframe width=""480"" height=""270"" src=""//www.youtube.com/embed/RPSnS-ucmOA"" frameborder=""0"" allow=""accelerometer; autoplay; clipboard-write; encrypted-media; gyroscope; picture-in-picture; web-share"" referrerpolicy=""strict-origin-when-cross-origin"" allowfullscreen></iframe>",History
41,2024-04-11T05:04:02Z,UCuvO0y2EU_kRfYzlhGJNOKA,How Did America&#39;s Wealthy Elite Re Write World History,"The United States was supposed to be a democratically run country. However, that has not been the case since the turn of the ...","{'default': {'url': 'https://i.ytimg.com/vi/RPSnS-ucmOA/default.jpg', 'width': 120, 'height': 90}, 'medium': {'url': 'https://i.ytimg.com/vi/RPSnS-ucmOA/mqdefault.jpg', 'width': 320, 'height': 180}, 'high': {'url': 'https://i.ytimg.com/vi/RPSnS-ucmOA/hqdefault.jpg', 'width': 480, 'height': 360}}",Straight UP,none,2024-04-11T05:04:02Z,RPSnS-ucmOA,"<iframe width=""480"" height=""270"" src=""//www.youtube.com/embed/RPSnS-ucmOA"" frameborder=""0"" allow=""accelerometer; autoplay; clipboard-write; encrypted-media; gyroscope; picture-in-picture; web-share"" referrerpolicy=""strict-origin-when-cross-origin"" allowfullscreen></iframe>",History
