,publishedAt,channelId,title,description,thumbnails,channelTitle,liveBroadcastContent,publishTime,videoID,embeds,category
3,2025-10-26T17:00:31Z,UCJmmxwdAsR7lD8fBA_qbEMw,The Sierra Leone Civil War Explained,"In the 1990s, Sierra Leone became a name the world spoke with sadness. A country once celebrated for its natural beauty and ...","{'default': {'url': 'https://i.ytimg.com/vi/EoBCCAuvBuk/default.jpg', 'width': 120, 'height': 90}, 'medium': {'url': 'https://i.ytimg.com/vi/EoBCCAuvBuk/mqdefault.jpg', 'width': 320, 'height': 180}, 'high': {'url': 'https://i.ytimg.com/vi/EoBCCAuvBuk/hqdefault.jpg', 'width': 480, 'height': 360}}",African Biographics,none,2025-10-26T17:00:31Z,EoBCCAuvBuk,"<iframe width=""480"" height=""270"" src=""//www.youtube.com/embed/EoBCCAuvBuk"" frameborder=""0"" allow=""accelerometer; autoplay; clipboard-write; encrypted-media; gyroscope; picture-in-picture; web-share"" referrerpolicy=""strict-origin-when-cross-origin"" allowfullscreen></iframe>",History
50,2025-10-25T18:44:14Z,UC2-nif4wvOqT6QVsBX3NOpA,It&#39;s Time To Go #expatlife #abroad #boyzinthehood,Teaser for video - 5 reasons to leave the US. Check @TheYarbros for the full video!,"{'default': {'url': 'https://i.ytimg.com/vi/gjPn7E62XF0/default.jpg', 'width': 120, 'height': 90}, 'medium': {'url': 'https://i.ytimg.com/vi/gjPn7E62XF0/mqdefault.jpg', 'width': 320, 'height': 180}, 'high': {'url': 'https://i.ytimg.com/vi/gjPn7E62XF0/hqdefault.jpg', 'width': 480, 'height': 360}}",The Yarbros,none,2025-10-25T18:44:14Z,gjPn7E62XF0,"<iframe width=""480"" height=""270"" src=""//www.youtube.com/embed/gjPn7E62XF0"" frameborder=""0"" allow=""accelerometer; autoplay; clipboard-write; encrypted-media; gyroscope; picture-in-picture; web-share"" referrerpolicy=""strict-origin-when-cross-origin"" allowfullscreen></iframe>",Travel
48,2025-10-25T15:10:20Z,UC-4h1XQ47sf0vbFwJvuBhEA,🥊Boxing Legend Mike Tyson Honors His African Roots in Powerful Return to DR Congo!,"In an emotional and historic journey, boxing legend Mike Tyson returns to DR Congo to reconnect with his African ancestry and ...","{'default': {'url': 'https://i.ytimg.com/vi/DwX3dPgaddE/default.jpg', 'width': 120, 'height': 90}, 'medium': {'url': 'https://i.ytimg.com/vi/DwX3dPgaddE/mqdefault.jpg', 'width': 320, 'height': 180}, 'high': {'url': 'https://i.ytimg.com/vi/DwX3dPgaddE/hqdefault.jpg', 'width': 480, 'height': 360}}",The New Africa Channel,none,2025-10-25T15:10:20Z,DwX3dPgaddE,"<iframe width=""480"" height=""270"" src=""//www.youtube.com/embed/DwX3dPgaddE"" frameborder=""0"" allow=""accelerometer; autoplay; clipboard-write; encrypted-media; gyroscope; picture-in-picture; web-share"" referrerpolicy=""strict-origin-when-cross-origin"" allowfullscreen></iframe>",Current Events
1,2025-10-25T12:08:46Z,UCW5NNtTSY5z5mENZ8dt-RCw,The People Who Live in Paradise,"I travel deep into New Ireland, Papua New Guinea, to visit one of its most remote and hidden gems like Tsoi Island. Life here ...","{'default': {'url': 'https://i.ytimg.com/vi/7hLwoYrYHtE/default.jpg', 'width': 120, 'height': 90}, 'medium': {'url': 'https://i.ytimg.com/vi/7hLwoYrYHtE/mqdefault.jpg', 'width': 320, 'height': 180}, 'high': {'url': 'https://i.ytimg.com/vi/7hLwoYrYHtE/hqdefault.jpg', 'width': 480, 'height': 360}}",ACE ,none,2025-10-25T12:08:46Z,7hLwoYrYHtE,"<iframe width=""480"" height=""270"" src=""//www.youtube.com/embed/7hLwoYrYHtE"" frameborder=""0"" allow=""accelerometer; autoplay; clipboard-write; encrypted-media; gyroscope; picture-in-picture; web-share"" referrerpolicy=""strict-origin-when-cross-origin"" allowfullscreen></iframe>",Travel
36,2025-10-25T07:57:32Z,UCMe6CgCi6TSZX1tUxuUvCGg,"GHANA MOURN H.E MRS RAWLINGS, Former First Lady Live tonight","Ghana Mourn Former First Lady H. E Mrs Nana Konadu Agyeman- Rawlings, Queen of Women's Heart. H. E founded 31st ...","{'default': {'url': 'https://i.ytimg.com/vi/iZPwEHZR4MQ/default.jpg', 'width': 120, 'height': 90}, 'medium': {'url': 'https://i.ytimg.com/vi/iZPwEHZR4MQ/mqdefault.jpg', 'width': 320, 'height': 180}, 'high': {'url': 'https://i.ytimg.com/vi/iZPwEHZR4MQ/hqdefault.jpg', 'width': 480, 'height': 360}}",Pan-African Daily TV -PADTV,none,2025-10-25T07:57:32Z,iZPwEHZR4MQ,"<iframe width=""480"" height=""270"" src=""//www.youtube.com/embed/iZPwEHZR4MQ"" frameborder=""0"" allow=""accelerometer; autoplay; clipboard-write; encrypted-media; gyroscope; picture-in-picture; web-share"" referrerpolicy=""strict-origin-when-cross-origin"" allowfullscreen></iframe>",Current Events
21,2025-10-24T18:39:42Z,UCF-A_4x9-bLrxXrmgBOWuJA,EFF Deputy Secretary-General Leigh-Ann Mathys’s cross-examination of Bheki Cele,"EFF Deputy Secretary-General Leigh-Ann Mathys's cross-examination of Bheki Cele, Friday, 24 October 2025.","{'default': {'url': 'https://i.ytimg.com/vi/jvRqGqLIRvc/default.jpg', 'width': 120, 'height': 90}, 'medium': {'url': 'https://i.ytimg.com/vi/jvRqGqLIRvc/mqdefault.jpg', 'width': 320, 'height': 180}, 'high': {'url': 'https://i.ytimg.com/vi/jvRqGqLIRvc/hqdefault.jpg', 'width': 480, 'height': 360}}",Economic Freedom Fighters,none,2025-10-24T18:39:42Z,jvRqGqLIRvc,"<iframe width=""480"" height=""270"" src=""//www.youtube.com/embed/jvRqGqLIRvc"" frameborder=""0"" allow=""accelerometer; autoplay; clipboard-write; encrypted-media; gyroscope; picture-in-picture; web-share"" referrerpolicy=""strict-origin-when-cross-origin"" allowfullscreen></iframe>",Current Events
46,2025-10-24T02:31:59Z,UCLjzzg-cFWpEEjnWCOpXp3Q,Nov 6 Support Black radio defunding fightback in Jacksonville Fed Court,"Black Power 96 continues the legal battle with Pinellas County on Nov 6 in Jacksonville, FL. Support the legal fightback! Donate at ...","{'default': {'url': 'https://i.ytimg.com/vi/bi0gkSk77ks/default.jpg', 'width': 120, 'height': 90}, 'medium': {'url': 'https://i.ytimg.com/vi/bi0gkSk77ks/mqdefault.jpg', 'width': 320, 'height': 180}, 'high': {'url': 'https://i.ytimg.com/vi/bi0gkSk77ks/hqdefault.jpg', 'width': 480, 'height': 360}}",The Burning Spear TV,none,2025-10-24T02:31:59Z,bi0gkSk77ks,"<iframe width=""480"" height=""270"" src=""//www.youtube.com/embed/bi0gkSk77ks"" frameborder=""0"" allow=""accelerometer; autoplay; clipboard-write; encrypted-media; gyroscope; picture-in-picture; web-share"" referrerpolicy=""strict-origin-when-cross-origin"" allowfullscreen></iframe>",Current Events
22,2025-10-17T21:24:17Z,UCOhiR-6Y-MZtMERKRENrcRw,Dr. Arikana Chihomburi exposed why she is not a voice for Pan Africans,Jessiejackson #alsharpton #arikanachihombori #stokelycarmichael #fba #ados This channel is to bring the awareness to the ...,"{'default': {'url': 'https://i.ytimg.com/vi/LC4nM2ULwf4/default.jpg', 'width': 120, 'height': 90}, 'medium': {'url': 'https://i.ytimg.com/vi/LC4nM2ULwf4/mqdefault.jpg', 'width': 320, 'height': 180}, 'high': {'url': 'https://i.ytimg.com/vi/LC4nM2ULwf4/hqdefault.jpg', 'width': 480, 'height': 360}}",GoBlack2Africa ,none,2025-10-17T21:24:17Z,LC4nM2ULwf4,"<iframe width=""480"" height=""270"" src=""//www.youtube.com/embed/LC4nM2ULwf4"" frameborder=""0"" allow=""accelerometer; autoplay; clipboard-write; encrypted-media; gyroscope; picture-in-picture; web-share"" referrerpolicy=""strict-origin-when-cross-origin"" allowfullscreen></iframe>",Travel
24,2025-10-17T16:30:07Z,UC12lU5ymIvSpgl8KntDQUQA,Yoruba Generals &amp; The Samurai Had Something In Common,Kickstarter: https://www.kickstarter.com/projects/83432348/home-team-history-presents-kings-of-africa Patreon: ...,"{'default': {'url': 'https://i.ytimg.com/vi/BFs9D0jL7lU/default.jpg', 'width': 120, 'height': 90}, 'medium': {'url': 'https://i.ytimg.com/vi/BFs9D0jL7lU/mqdefault.jpg', 'width': 320, 'height': 180}, 'high': {'url': 'https://i.ytimg.com/vi/BFs9D0jL7lU/hqdefault.jpg', 'width': 480, 'height': 360}}",HomeTeam History,none,2025-10-17T16:30:07Z,BFs9D0jL7lU,"<iframe width=""480"" height=""270"" src=""//www.youtube.com/embed/BFs9D0jL7lU"" frameborder=""0"" allow=""accelerometer; autoplay; clipboard-write; encrypted-media; gyroscope; picture-in-picture; web-share"" referrerpolicy=""strict-origin-when-cross-origin"" allowfullscreen></iframe>",History
30,2025-10-16T05:34:09Z,UC1ettU5YSf_nIOJWffCKGQw,White supremacy doesn’t want you to know ancient Africans could cross the Atlantic #blackhistory,,"{'default': {'url': 'https://i.ytimg.com/vi/4jmogBh6xHI/default.jpg', 'width': 120, 'height': 90}, 'medium': {'url': 'https://i.ytimg.com/vi/4jmogBh6xHI/mqdefault.jpg', 'width': 320, 'height': 180}, 'high': {'url': 'https://i.ytimg.com/vi/4jmogBh6xHI/hqdefault.jpg', 'width': 480, 'height': 360}}",LuiSpot,none,2025-10-16T05:34:09Z,4jmogBh6xHI,"<iframe width=""480"" height=""270"" src=""//www.youtube.com/embed/4jmogBh6xHI"" frameborder=""0"" allow=""accelerometer; autoplay; clipboard-write; encrypted-media; gyroscope; picture-in-picture; web-share"" referrerpolicy=""strict-origin-when-cross-origin"" allowfullscreen></iframe>",Current Events
42,2025-10-01T15:59:18Z,UC4lH-odQ5ll-85fkpWxDYmA,visiting Dubai to Investigate why Nigerians are banned from the UAE,in today's episode i visited Dubai in the UAE to find answers as to why Dubai shut its doors or rather is limiting Nigerians from ...,"{'default': {'url': 'https://i.ytimg.com/vi/xvijmkKJRbc/default.jpg', 'width': 120, 'height': 90}, 'medium': {'url': 'https://i.ytimg.com/vi/xvijmkKJRbc/mqdefault.jpg', 'width': 320, 'height': 180}, 'high': {'url': 'https://i.ytimg.com/vi/xvijmkKJRbc/hqdefault.jpg', 'width': 480, 'height': 360}}",Steven Ndukwu,none,2025-10-01T15:59:18Z,xvijmkKJRbc,"<iframe width=""480"" height=""270"" src=""//www.youtube.com/embed/xvijmkKJRbc"" frameborder=""0"" allow=""accelerometer; autoplay; clipboard-write; encrypted-media; gyroscope; picture-in-picture; web-share"" referrerpolicy=""strict-origin-when-cross-origin"" allowfullscreen></iframe>",Productivity
28,2025-09-27T15:41:10Z,UC__wkIWEfbnTAYVT8j6gfPg,Origins of Ancient Egypt #kemet #africanhistory #ancientegypt #history,,"{'default': {'url': 'https://i.ytimg.com/vi/6_GbuDpE_bk/default.jpg', 'width': 120, 'height': 90}, 'medium': {'url': 'https://i.ytimg.com/vi/6_GbuDpE_bk/mqdefault.jpg', 'width': 320, 'height': 180}, 'high': {'url': 'https://i.ytimg.com/vi/6_GbuDpE_bk/hqdefault.jpg', 'width': 480, 'height': 360}}",Know Thyself,none,2025-09-27T15:41:10Z,6_GbuDpE_bk,"<iframe width=""480"" height=""270"" src=""//www.youtube.com/embed/6_GbuDpE_bk"" frameborder=""0"" allow=""accelerometer; autoplay; clipboard-write; encrypted-media; gyroscope; picture-in-picture; web-share"" referrerpolicy=""strict-origin-when-cross-origin"" allowfullscreen></iframe>",History
7,2025-09-01T07:52:17Z,UCbvE_5m8kmm9U58gDHtzYrA,FUT DRAFT TIME!,Afro Ballers!,"{'default': {'url': 'https://i.ytimg.com/vi/UcEVjoHa4zM/default.jpg', 'width': 120, 'height': 90}, 'medium': {'url': 'https://i.ytimg.com/vi/UcEVjoHa4zM/mqdefault.jpg', 'width': 320, 'height': 180}, 'high': {'url': 'https://i.ytimg.com/vi/UcEVjoHa4zM/hqdefault.jpg', 'width': 480, 'height': 360}}",AfroBallers,none,2025-09-01T07:52:17Z,UcEVjoHa4zM,"<iframe width=""480"" height=""270"" src=""//www.youtube.com/embed/UcEVjoHa4zM"" frameborder=""0"" allow=""accelerometer; autoplay; clipboard-write; encrypted-media; gyroscope; picture-in-picture; web-share"" referrerpolicy=""strict-origin-when-cross-origin"" allowfullscreen></iframe>",Sports
39,2025-08-15T15:01:35Z,UCCfgU1Dgpz0MzA-4vP_gRuQ,Why do African Presidents Die Overseas?,"Across Africa, a disturbing trend is emerging: presidents and political elites leaving their nations for medical treatment abroad, ...","{'default': {'url': 'https://i.ytimg.com/vi/uY20B5KH6vo/default.jpg', 'width': 120, 'height': 90}, 'medium': {'url': 'https://i.ytimg.com/vi/uY20B5KH6vo/mqdefault.jpg', 'width': 320, 'height': 180}, 'high': {'url': 'https://i.ytimg.com/vi/uY20B5KH6vo/hqdefault.jpg', 'width': 480, 'height': 360}}",Risen Africa,none,2025-08-15T15:01:35Z,uY20B5KH6vo,"<iframe width=""480"" height=""270"" src=""//www.youtube.com/embed/uY20B5KH6vo"" frameborder=""0"" allow=""accelerometer; autoplay; clipboard-write; encrypted-media; gyroscope; picture-in-picture; web-share"" referrerpolicy=""strict-origin-when-cross-origin"" allowfullscreen></iframe>",Current Events
49,2025-08-07T21:00:39Z,UCPQsrvUJzs1INc2hroy3nHw,Can you propose to a stranger using sign languages?,,"{'default': {'url': 'https://i.ytimg.com/vi/X462d95qNKs/default.jpg', 'width': 120, 'height': 90}, 'medium': {'url': 'https://i.ytimg.com/vi/X462d95qNKs/mqdefault.jpg', 'width': 320, 'height': 180}, 'high': {'url': 'https://i.ytimg.com/vi/X462d95qNKs/hqdefault.jpg', 'width': 480, 'height': 360}}",The Pan African Dating Show (The-PDS),none,2025-08-07T21:00:39Z,X462d95qNKs,"<iframe width=""480"" height=""270"" src=""//www.youtube.com/embed/X462d95qNKs"" frameborder=""0"" allow=""accelerometer; autoplay; clipboard-write; encrypted-media; gyroscope; picture-in-picture; web-share"" referrerpolicy=""strict-origin-when-cross-origin"" allowfullscreen></iframe>",Social Issues
54,2025-07-17T18:24:22Z,UClwrpH_Np9zk8uMwnMwu8Nw,"We Bought a $100,000 Apartment In Ghana 🇬🇭",The Image of AFRICA has been DISTORTED around the WORLD & We are CHANGING the NARRATIVE via YOUTUBE videos ...,"{'default': {'url': 'https://i.ytimg.com/vi/tImUQpZzLwY/default.jpg', 'width': 120, 'height': 90}, 'medium': {'url': 'https://i.ytimg.com/vi/tImUQpZzLwY/mqdefault.jpg', 'width': 320, 'height': 180}, 'high': {'url': 'https://i.ytimg.com/vi/tImUQpZzLwY/hqdefault.jpg', 'width': 480, 'height': 360}}",WODE MAYA,none,2025-07-17T18:24:22Z,tImUQpZzLwY,"<iframe width=""480"" height=""270"" src=""//www.youtube.com/embed/tImUQpZzLwY"" frameborder=""0"" allow=""accelerometer; autoplay; clipboard-write; encrypted-media; gyroscope; picture-in-picture; web-share"" referrerpolicy=""strict-origin-when-cross-origin"" allowfullscreen></iframe>",Travel
9,2025-07-07T22:57:22Z,UCx5Y5d5KgibkG9KAyknCdFA,How the Education System Produces Sellouts,"In this powerful episode of our series on the miseducation of Black children, we confront a painful but necessary truth: the system ...","{'default': {'url': 'https://i.ytimg.com/vi/3moeyjUIf8c/default.jpg', 'width': 120, 'height': 90}, 'medium': {'url': 'https://i.ytimg.com/vi/3moeyjUIf8c/mqdefault.jpg', 'width': 320, 'height': 180}, 'high': {'url': 'https://i.ytimg.com/vi/3moeyjUIf8c/hqdefault.jpg', 'width': 480, 'height': 360}}",Afromation Digital,none,2025-07-07T22:57:22Z,3moeyjUIf8c,"<iframe width=""480"" height=""270"" src=""//www.youtube.com/embed/3moeyjUIf8c"" frameborder=""0"" allow=""accelerometer; autoplay; clipboard-write; encrypted-media; gyroscope; picture-in-picture; web-share"" referrerpolicy=""strict-origin-when-cross-origin"" allowfullscreen></iframe>",Social Issues
37,2025-06-29T14:00:07Z,UCF71yDQwxfw0QcYb2JnkB5Q,Why Americans Are Leaving the U.S. for Homes in Africa,America feels more chaotic than ever The rising costs. The politics. The constant pressure. A lot of people are wondering if there's ...,"{'default': {'url': 'https://i.ytimg.com/vi/xMtFJz9f8LI/default.jpg', 'width': 120, 'height': 90}, 'medium': {'url': 'https://i.ytimg.com/vi/xMtFJz9f8LI/mqdefault.jpg', 'width': 320, 'height': 180}, 'high': {'url': 'https://i.ytimg.com/vi/xMtFJz9f8LI/hqdefault.jpg', 'width': 480, 'height': 360}}",PassportHeavy,none,2025-06-29T14:00:07Z,xMtFJz9f8LI,"<iframe width=""480"" height=""270"" src=""//www.youtube.com/embed/xMtFJz9f8LI"" frameborder=""0"" allow=""accelerometer; autoplay; clipboard-write; encrypted-media; gyroscope; picture-in-picture; web-share"" referrerpolicy=""strict-origin-when-cross-origin"" allowfullscreen></iframe>",Travel
34,2025-01-11T16:00:06Z,UCJH-fn0wLu5uwXX33jNToQw,Samora Machel&#39;s Struggle | How Mozambique’s Revolution Ended Portugal&#39;s Empire,"The most beautiful thing about a man's life is his freedom. He may not have any food, and he may not have any clothing, but at ...","{'default': {'url': 'https://i.ytimg.com/vi/wTwI48jN-fY/default.jpg', 'width': 120, 'height': 90}, 'medium': {'url': 'https://i.ytimg.com/vi/wTwI48jN-fY/mqdefault.jpg', 'width': 320, 'height': 180}, 'high': {'url': 'https://i.ytimg.com/vi/wTwI48jN-fY/hqdefault.jpg', 'width': 480, 'height': 360}}",NewAfrica,none,2025-01-11T16:00:06Z,wTwI48jN-fY,"<iframe width=""480"" height=""270"" src=""//www.youtube.com/embed/wTwI48jN-fY"" frameborder=""0"" allow=""accelerometer; autoplay; clipboard-write; encrypted-media; gyroscope; picture-in-picture; web-share"" referrerpolicy=""strict-origin-when-cross-origin"" allowfullscreen></iframe>",Current Events
8,2024-08-31T16:32:50Z,UC2xX2FI6s4i9xz3t9qjayhg,The San Quentin Six (1972),"A documentary on the six Black and Chicano prisoners who, following George Jackson's death, were charged on charges of ...","{'default': {'url': 'https://i.ytimg.com/vi/E-4CUaaSo4I/default.jpg', 'width': 120, 'height': 90}, 'medium': {'url': 'https://i.ytimg.com/vi/E-4CUaaSo4I/mqdefault.jpg', 'width': 320, 'height': 180}, 'high': {'url': 'https://i.ytimg.com/vi/E-4CUaaSo4I/hqdefault.jpg', 'width': 480, 'height': 360}}",AfroMarxist,none,2024-08-31T16:32:50Z,E-4CUaaSo4I,"<iframe width=""480"" height=""360"" src=""//www.youtube.com/embed/E-4CUaaSo4I"" frameborder=""0"" allow=""accelerometer; autoplay; clipboard-write; encrypted-media; gyroscope; picture-in-picture; web-share"" referrerpolicy=""strict-origin-when-cross-origin"" allowfullscreen></iframe>",History
33,2024-08-25T18:19:19Z,UCh2ANLALdN1OZUJKmvchkkg,The INSANE True Story of Cleopatra in Pop Culture | Documentary,"Cleopatra is one of the most iconic figures associated with ancient Egypt, but our perception of the queen is not correct.","{'default': {'url': 'https://i.ytimg.com/vi/dwSSQFS-OQY/default.jpg', 'width': 120, 'height': 90}, 'medium': {'url': 'https://i.ytimg.com/vi/dwSSQFS-OQY/mqdefault.jpg', 'width': 320, 'height': 180}, 'high': {'url': 'https://i.ytimg.com/vi/dwSSQFS-OQY/hqdefault.jpg', 'width': 480, 'height': 360}}",Mr. Imhotep,none,2024-08-25T18:19:19Z,dwSSQFS-OQY,"<iframe width=""480"" height=""270"" src=""//www.youtube.com/embed/dwSSQFS-OQY"" frameborder=""0"" allow=""accelerometer; autoplay; clipboard-write; encrypted-media; gyroscope; picture-in-picture; web-share"" referrerpolicy=""strict-origin-when-cross-origin"" allowfullscreen></iframe>",History
15,2024-08-25T18:00:03Z,UCMMTYgqKEgCgy1pR6Axlf0A,"Ex-model moved to Ghana to build a 5 bedroom home, set up 7 businesses and live her dream life",Our guest today left behind her 15 year career in the modelling industry to move to Ghana and start a new life here. This amazing ...,"{'default': {'url': 'https://i.ytimg.com/vi/6TMZcRoGZi4/default.jpg', 'width': 120, 'height': 90}, 'medium': {'url': 'https://i.ytimg.com/vi/6TMZcRoGZi4/mqdefault.jpg', 'width': 320, 'height': 180}, 'high': {'url': 'https://i.ytimg.com/vi/6TMZcRoGZi4/hqdefault.jpg', 'width': 480, 'height': 360}}",Build with Amoaa,none,2024-08-25T18:00:03Z,6TMZcRoGZi4,"<iframe width=""480"" height=""270"" src=""//www.youtube.com/embed/6TMZcRoGZi4"" frameborder=""0"" allow=""accelerometer; autoplay; clipboard-write; encrypted-media; gyroscope; picture-in-picture; web-share"" referrerpolicy=""strict-origin-when-cross-origin"" allowfullscreen></iframe>",Travel
6,2024-07-12T12:15:30Z,UCl6to6J7oVltnhHEVm1s87A,AFRICAN ORIGIN OF MORDEN HAIRSTYLES,theperspective #africanhistory #africanews #africax5 Traditional African hairstyles are back in fashion and making a real ...,"{'default': {'url': 'https://i.ytimg.com/vi/AGyMe_XB3mQ/default.jpg', 'width': 120, 'height': 90}, 'medium': {'url': 'https://i.ytimg.com/vi/AGyMe_XB3mQ/mqdefault.jpg', 'width': 320, 'height': 180}, 'high': {'url': 'https://i.ytimg.com/vi/AGyMe_XB3mQ/hqdefault.jpg', 'width': 480, 'height': 360}}",Africax5 Network,none,2024-07-12T12:15:30Z,AGyMe_XB3mQ,"<iframe width=""480"" height=""360"" src=""//www.youtube.com/embed/AGyMe_XB3mQ"" frameborder=""0"" allow=""accelerometer; autoplay; clipboard-write; encrypted-media; gyroscope; picture-in-picture; web-share"" referrerpolicy=""strict-origin-when-cross-origin"" allowfullscreen></iframe>",Social Issues
29,2024-07-08T12:10:25Z,UCHbmePHjGH3pklvSla6szWw,You Wouldn&#39;t Survive In Ancient Egypt | REACTION - KueliMika,Today we are reacting to the video You Wouldn't Survive In Ancient Egypt.,"{'default': {'url': 'https://i.ytimg.com/vi/qFbr17zUKYE/default.jpg', 'width': 120, 'height': 90}, 'medium': {'url': 'https://i.ytimg.com/vi/qFbr17zUKYE/mqdefault.jpg', 'width': 320, 'height': 180}, 'high': {'url': 'https://i.ytimg.com/vi/qFbr17zUKYE/hqdefault.jpg', 'width': 480, 'height': 360}}",KueliMika,none,2024-07-08T12:10:25Z,qFbr17zUKYE,"<iframe width=""480"" height=""270"" src=""//www.youtube.com/embed/qFbr17zUKYE"" frameborder=""0"" allow=""accelerometer; autoplay; clipboard-write; encrypted-media; gyroscope; picture-in-picture; web-share"" referrerpolicy=""strict-origin-when-cross-origin"" allowfullscreen></iframe>",History
2,2024-04-25T23:00:06Z,UCTTQWaoGloNuhunZevQ2F6g,"Kuubwa Transforming African Businesses: Fabric Weaver, Fish Farmers","Kuubwa Transforms African Businesses: Fish Farmers, Fabric Manufacturers and more.","{'default': {'url': 'https://i.ytimg.com/vi/gC02Wht1UQQ/default.jpg', 'width': 120, 'height': 90}, 'medium': {'url': 'https://i.ytimg.com/vi/gC02Wht1UQQ/mqdefault.jpg', 'width': 320, 'height': 180}, 'high': {'url': 'https://i.ytimg.com/vi/gC02Wht1UQQ/hqdefault.jpg', 'width': 480, 'height': 360}}",Africa Business Channel TV,none,2024-04-25T23:00:06Z,gC02Wht1UQQ,"<iframe width=""480"" height=""270"" src=""//www.youtube.com/embed/gC02Wht1UQQ"" frameborder=""0"" allow=""accelerometer; autoplay; clipboard-write; encrypted-media; gyroscope; picture-in-picture; web-share"" referrerpolicy=""strict-origin-when-cross-origin"" allowfullscreen></iframe>",Productivity
44,2024-04-11T05:04:02Z,UCuvO0y2EU_kRfYzlhGJNOKA,How Did America&#39;s Wealthy Elite Re Write World History,"The United States was supposed to be a democratically run country. However, that has not been the case since the turn of the ...","{'default': {'url': 'https://i.ytimg.com/vi/RPSnS-ucmOA/default.jpg', 'width': 120, 'height': 90}, 'medium': {'url': 'https://i.ytimg.com/vi/RPSnS-ucmOA/mqdefault.jpg', 'width': 320, 'height': 180}, 'high': {'url': 'https://i.ytimg.com/vi/RPSnS-ucmOA/hqdefault.jpg', 'width': 480, 'height': 360}}",Straight UP,none,2024-04-11T05:04:02Z,RPSnS-ucmOA,"<iframe width=""480"" height=""270"" src=""//www.youtube.com/embed/RPSnS-ucmOA"" frameborder=""0"" allow=""accelerometer; autoplay; clipboard-write; encrypted-media; gyroscope; picture-in-picture; web-share"" referrerpolicy=""strict-origin-when-cross-origin"" allowfullscreen></iframe>",History
43,2024-04-11T05:04:02Z,UCuvO0y2EU_kRfYzlhGJNOKA,How Did America&#39;s Wealthy Elite Re Write World History,"The United States was supposed to be a democratically run country. However, that has not been the case since the turn of the ...","{'default': {'url': 'https://i.ytimg.com/vi/RPSnS-ucmOA/default.jpg', 'width': 120, 'height': 90}, 'medium': {'url': 'https://i.ytimg.com/vi/RPSnS-ucmOA/mqdefault.jpg', 'width': 320, 'height': 180}, 'high': {'url': 'https://i.ytimg.com/vi/RPSnS-ucmOA/hqdefault.jpg', 'width': 480, 'height': 360}}",Straight UP,none,2024-04-11T05:04:02Z,RPSnS-ucmOA,"<iframe width=""480"" height=""270"" src=""//www.youtube.com/embed/RPSnS-ucmOA"" frameborder=""0"" allow=""accelerometer; autoplay; clipboard-write; encrypted-media; gyroscope; picture-in-picture; web-share"" referrerpolicy=""strict-origin-when-cross-origin"" allowfullscreen></iframe>",History
