,publishedAt,channelId,title,description,thumbnails,channelTitle,liveBroadcastContent,publishTime,videoID,embeds,category
21,2026-03-21T23:42:03Z,UCNekbFtp9zsI-lE_OCHpq_w,When you try not to laugh in a serious situation,"Instagram: https://www.instagram.com/trarags2/?hl=en . . . Romans 8:39 Nor height nor depth, nor anything else in all creation, will ...","{'default': {'url': 'https://i.ytimg.com/vi/h-oGrUEvalY/default.jpg', 'width': 120, 'height': 90}, 'medium': {'url': 'https://i.ytimg.com/vi/h-oGrUEvalY/mqdefault.jpg', 'width': 320, 'height': 180}, 'high': {'url': 'https://i.ytimg.com/vi/h-oGrUEvalY/hqdefault.jpg', 'width': 480, 'height': 360}}",Tra Rags,none,2026-03-21T23:42:03Z,h-oGrUEvalY,"<iframe width=""480"" height=""270"" src=""//www.youtube.com/embed/h-oGrUEvalY"" frameborder=""0"" allow=""accelerometer; autoplay; clipboard-write; encrypted-media; gyroscope; picture-in-picture; web-share"" referrerpolicy=""strict-origin-when-cross-origin"" allowfullscreen></iframe>",Entertainment
65,2026-03-21T20:05:23Z,UClwrpH_Np9zk8uMwnMwu8Nw,I Survived Africa’s Coldest and Hottest Countries!,"From the freezing mountains of Lesotho to the scorching heat of the Danakil Depression in Ethiopia, this was one of the most ...","{'default': {'url': 'https://i.ytimg.com/vi/Ix9-1CpcOhQ/default.jpg', 'width': 120, 'height': 90}, 'medium': {'url': 'https://i.ytimg.com/vi/Ix9-1CpcOhQ/mqdefault.jpg', 'width': 320, 'height': 180}, 'high': {'url': 'https://i.ytimg.com/vi/Ix9-1CpcOhQ/hqdefault.jpg', 'width': 480, 'height': 360}}",WODE MAYA,none,2026-03-21T20:05:23Z,Ix9-1CpcOhQ,"<iframe width=""480"" height=""270"" src=""//www.youtube.com/embed/Ix9-1CpcOhQ"" frameborder=""0"" allow=""accelerometer; autoplay; clipboard-write; encrypted-media; gyroscope; picture-in-picture; web-share"" referrerpolicy=""strict-origin-when-cross-origin"" allowfullscreen></iframe>",Travel
17,2026-03-21T19:00:06Z,UCABZ7Z6SBTp4IsARDceOq7w,"Full Comedy Special: Dino Archie On Midlife Crisis, Fatherhood, Diddy &amp; More | Beautiful Burden",https://hypersclub.com - Dino Archie delivers his latest comedy special 'Beautiful Burden'. For this hour comedy special ...,"{'default': {'url': 'https://i.ytimg.com/vi/PbrMufTBPIo/default.jpg', 'width': 120, 'height': 90}, 'medium': {'url': 'https://i.ytimg.com/vi/PbrMufTBPIo/mqdefault.jpg', 'width': 320, 'height': 180}, 'high': {'url': 'https://i.ytimg.com/vi/PbrMufTBPIo/hqdefault.jpg', 'width': 480, 'height': 360}}",HYPE+,none,2026-03-21T19:00:06Z,PbrMufTBPIo,"<iframe width=""480"" height=""270"" src=""//www.youtube.com/embed/PbrMufTBPIo"" frameborder=""0"" allow=""accelerometer; autoplay; clipboard-write; encrypted-media; gyroscope; picture-in-picture; web-share"" referrerpolicy=""strict-origin-when-cross-origin"" allowfullscreen></iframe>",Entertainment
3,2026-03-21T17:30:12Z,UCzuqE7-t13O4NIDYJfakrhw,Report from Beirut: Growing internal division in Lebanon under Israel’s assault,"From Beirut, Kareem Chehayeb reports on the tense atmosphere in Lebanon as the population attempts to survive Israel's brutal ...","{'default': {'url': 'https://i.ytimg.com/vi/r6KXwtv5Omw/default.jpg', 'width': 120, 'height': 90}, 'medium': {'url': 'https://i.ytimg.com/vi/r6KXwtv5Omw/mqdefault.jpg', 'width': 320, 'height': 180}, 'high': {'url': 'https://i.ytimg.com/vi/r6KXwtv5Omw/hqdefault.jpg', 'width': 480, 'height': 360}}",Democracy Now!,none,2026-03-21T17:30:12Z,r6KXwtv5Omw,"<iframe width=""480"" height=""270"" src=""//www.youtube.com/embed/r6KXwtv5Omw"" frameborder=""0"" allow=""accelerometer; autoplay; clipboard-write; encrypted-media; gyroscope; picture-in-picture; web-share"" referrerpolicy=""strict-origin-when-cross-origin"" allowfullscreen></iframe>",Current Events
61,2026-03-21T17:00:18Z,UCpEf2jEfyAEbQesGgl1HOWA,"$62,500 HOUSES WITH INCREDIBLE SPACE IN GHANA",livinginghana #realestate $75000 HOUSES WITH INCREDIBLE SPACE IN GHANA I am touring a gated community within Kasoa ...,"{'default': {'url': 'https://i.ytimg.com/vi/FXc6duiJUlU/default.jpg', 'width': 120, 'height': 90}, 'medium': {'url': 'https://i.ytimg.com/vi/FXc6duiJUlU/mqdefault.jpg', 'width': 320, 'height': 180}, 'high': {'url': 'https://i.ytimg.com/vi/FXc6duiJUlU/hqdefault.jpg', 'width': 480, 'height': 360}}",Jasmine Ama,none,2026-03-21T17:00:18Z,FXc6duiJUlU,"<iframe width=""480"" height=""270"" src=""//www.youtube.com/embed/FXc6duiJUlU"" frameborder=""0"" allow=""accelerometer; autoplay; clipboard-write; encrypted-media; gyroscope; picture-in-picture; web-share"" referrerpolicy=""strict-origin-when-cross-origin"" allowfullscreen></iframe>",Travel
16,2026-03-20T22:00:13Z,UCv8G-xZ_BBGufjbN6jbvLMQ,How to Stop the Hoe Gene - Comedian Terrence Delane - Chocolate Sundaes Stand Up Comedy,Having a daughter completely changed Terrence Delane's perspective on life! Follow @TerrenceDelane on social media: ...,"{'default': {'url': 'https://i.ytimg.com/vi/CWbY0b6QSXw/default.jpg', 'width': 120, 'height': 90}, 'medium': {'url': 'https://i.ytimg.com/vi/CWbY0b6QSXw/mqdefault.jpg', 'width': 320, 'height': 180}, 'high': {'url': 'https://i.ytimg.com/vi/CWbY0b6QSXw/hqdefault.jpg', 'width': 480, 'height': 360}}",Chocolate Sundaes Comedy,none,2026-03-20T22:00:13Z,CWbY0b6QSXw,"<iframe width=""480"" height=""270"" src=""//www.youtube.com/embed/CWbY0b6QSXw"" frameborder=""0"" allow=""accelerometer; autoplay; clipboard-write; encrypted-media; gyroscope; picture-in-picture; web-share"" referrerpolicy=""strict-origin-when-cross-origin"" allowfullscreen></iframe>",Entertainment
58,2026-03-20T15:15:06Z,UCvHeh__RFFonMM8vaKda82Q,Brazil where tourist don&#39;t go-Raw and Real,Brazil where tourist don't go-Raw and Real Rio de Janeiro the streets that tourist avoid We take you on a walking tour through a ...,"{'default': {'url': 'https://i.ytimg.com/vi/3ezNxJlqp9g/default.jpg', 'width': 120, 'height': 90}, 'medium': {'url': 'https://i.ytimg.com/vi/3ezNxJlqp9g/mqdefault.jpg', 'width': 320, 'height': 180}, 'high': {'url': 'https://i.ytimg.com/vi/3ezNxJlqp9g/hqdefault.jpg', 'width': 480, 'height': 360}}",Czech in effect,none,2026-03-20T15:15:06Z,3ezNxJlqp9g,"<iframe width=""480"" height=""270"" src=""//www.youtube.com/embed/3ezNxJlqp9g"" frameborder=""0"" allow=""accelerometer; autoplay; clipboard-write; encrypted-media; gyroscope; picture-in-picture; web-share"" referrerpolicy=""strict-origin-when-cross-origin"" allowfullscreen></iframe>",Travel
18,2026-03-20T15:09:21Z,UCLuYADJ6hESLHX87JnsGbjA,Ryan Coogler &amp; Sinners,,"{'default': {'url': 'https://i.ytimg.com/vi/6JCTzHtEgak/default.jpg', 'width': 120, 'height': 90}, 'medium': {'url': 'https://i.ytimg.com/vi/6JCTzHtEgak/mqdefault.jpg', 'width': 320, 'height': 180}, 'high': {'url': 'https://i.ytimg.com/vi/6JCTzHtEgak/hqdefault.jpg', 'width': 480, 'height': 360}}",Josh Johnson,none,2026-03-20T15:09:21Z,6JCTzHtEgak,"<iframe width=""480"" height=""270"" src=""//www.youtube.com/embed/6JCTzHtEgak"" frameborder=""0"" allow=""accelerometer; autoplay; clipboard-write; encrypted-media; gyroscope; picture-in-picture; web-share"" referrerpolicy=""strict-origin-when-cross-origin"" allowfullscreen></iframe>",Entertainment
14,2026-03-20T13:33:25Z,UCehBVAPy-bxmnbNARF-_tvA,Corporations&#39; Shocking Plan for Our Food Supply,"Four former chemical lobbyists control America's pesticide regulations, letting pesticide companies pump the country full of toxins.","{'default': {'url': 'https://i.ytimg.com/vi/m7uuRBsnXR8/default.jpg', 'width': 120, 'height': 90}, 'medium': {'url': 'https://i.ytimg.com/vi/m7uuRBsnXR8/mqdefault.jpg', 'width': 320, 'height': 180}, 'high': {'url': 'https://i.ytimg.com/vi/m7uuRBsnXR8/hqdefault.jpg', 'width': 480, 'height': 360}}",More Perfect Union,none,2026-03-20T13:33:25Z,m7uuRBsnXR8,"<iframe width=""480"" height=""270"" src=""//www.youtube.com/embed/m7uuRBsnXR8"" frameborder=""0"" allow=""accelerometer; autoplay; clipboard-write; encrypted-media; gyroscope; picture-in-picture; web-share"" referrerpolicy=""strict-origin-when-cross-origin"" allowfullscreen></iframe>",Current Events
10,2026-03-19T15:00:59Z,UCCfgU1Dgpz0MzA-4vP_gRuQ,How the Nigerian Prince Scam Fooled the World,"Understanding Nigerian fraud, 419 scams, Yahoo Boys, cybercrime in Nigeria is a good place to start to grasp why Nigeria ...","{'default': {'url': 'https://i.ytimg.com/vi/WaGDL6GwFnE/default.jpg', 'width': 120, 'height': 90}, 'medium': {'url': 'https://i.ytimg.com/vi/WaGDL6GwFnE/mqdefault.jpg', 'width': 320, 'height': 180}, 'high': {'url': 'https://i.ytimg.com/vi/WaGDL6GwFnE/hqdefault.jpg', 'width': 480, 'height': 360}}",Risen Africa,none,2026-03-19T15:00:59Z,WaGDL6GwFnE,"<iframe width=""480"" height=""270"" src=""//www.youtube.com/embed/WaGDL6GwFnE"" frameborder=""0"" allow=""accelerometer; autoplay; clipboard-write; encrypted-media; gyroscope; picture-in-picture; web-share"" referrerpolicy=""strict-origin-when-cross-origin"" allowfullscreen></iframe>",Current Events
30,2026-03-19T04:40:11Z,UC11aHtNnc5bEPLI4jf6mnYg,Game Theory #14:  The Law of Proximity,"In this Thursday, March 19, 2026 lecture to his Beijing high school students, Professor Jiang explains how internal conflicts ...","{'default': {'url': 'https://i.ytimg.com/vi/nOQqGy4boBY/default.jpg', 'width': 120, 'height': 90}, 'medium': {'url': 'https://i.ytimg.com/vi/nOQqGy4boBY/mqdefault.jpg', 'width': 320, 'height': 180}, 'high': {'url': 'https://i.ytimg.com/vi/nOQqGy4boBY/hqdefault.jpg', 'width': 480, 'height': 360}}",Predictive History,none,2026-03-19T04:40:11Z,nOQqGy4boBY,"<iframe width=""480"" height=""270"" src=""//www.youtube.com/embed/nOQqGy4boBY"" frameborder=""0"" allow=""accelerometer; autoplay; clipboard-write; encrypted-media; gyroscope; picture-in-picture; web-share"" referrerpolicy=""strict-origin-when-cross-origin"" allowfullscreen></iframe>",History
47,2026-03-19T00:06:58Z,UCyRi9CRrBDeTITC211YfcMg,They Love Black Culture… Until They Don’t,"A recent comment from Jack Harlow has sparked a bigger conversation — not just about music, but about culture, identity, and ...","{'default': {'url': 'https://i.ytimg.com/vi/aCWYsAzn4Bg/default.jpg', 'width': 120, 'height': 90}, 'medium': {'url': 'https://i.ytimg.com/vi/aCWYsAzn4Bg/mqdefault.jpg', 'width': 320, 'height': 180}, 'high': {'url': 'https://i.ytimg.com/vi/aCWYsAzn4Bg/hqdefault.jpg', 'width': 480, 'height': 360}}",Pan African Updates & Reactions,none,2026-03-19T00:06:58Z,aCWYsAzn4Bg,"<iframe width=""480"" height=""270"" src=""//www.youtube.com/embed/aCWYsAzn4Bg"" frameborder=""0"" allow=""accelerometer; autoplay; clipboard-write; encrypted-media; gyroscope; picture-in-picture; web-share"" referrerpolicy=""strict-origin-when-cross-origin"" allowfullscreen></iframe>",Social Issues
13,2026-03-18T18:02:08Z,UC-4h1XQ47sf0vbFwJvuBhEA,Michael B. Jordan Reveals His African DNA After Winning an Oscar? Here’s What You Didn’t Know,Michael B Jordan Reveal His African DNA After Winning The Oscar? Here's What You Didnt Know - Hollywood star Michael B.,"{'default': {'url': 'https://i.ytimg.com/vi/2mSya5IGKdg/default.jpg', 'width': 120, 'height': 90}, 'medium': {'url': 'https://i.ytimg.com/vi/2mSya5IGKdg/mqdefault.jpg', 'width': 320, 'height': 180}, 'high': {'url': 'https://i.ytimg.com/vi/2mSya5IGKdg/hqdefault.jpg', 'width': 480, 'height': 360}}",The New Africa Channel,none,2026-03-18T18:02:08Z,2mSya5IGKdg,"<iframe width=""480"" height=""270"" src=""//www.youtube.com/embed/2mSya5IGKdg"" frameborder=""0"" allow=""accelerometer; autoplay; clipboard-write; encrypted-media; gyroscope; picture-in-picture; web-share"" referrerpolicy=""strict-origin-when-cross-origin"" allowfullscreen></iframe>",Current Events
48,2026-03-18T18:00:12Z,UCzo3jVzn-Z9LrFVwAE7iDbw,Ep 96: Pop The Balloon Or Find Love | With Arlette Amuli,Welcome back to our channel! In this episode we got singles from all across the USA! Pop that balloon if you're not feeling the ...,"{'default': {'url': 'https://i.ytimg.com/vi/eKO7aFDA_28/default.jpg', 'width': 120, 'height': 90}, 'medium': {'url': 'https://i.ytimg.com/vi/eKO7aFDA_28/mqdefault.jpg', 'width': 320, 'height': 180}, 'high': {'url': 'https://i.ytimg.com/vi/eKO7aFDA_28/hqdefault.jpg', 'width': 480, 'height': 360}}",Pop The Balloon,none,2026-03-18T18:00:12Z,eKO7aFDA_28,"<iframe width=""480"" height=""270"" src=""//www.youtube.com/embed/eKO7aFDA_28"" frameborder=""0"" allow=""accelerometer; autoplay; clipboard-write; encrypted-media; gyroscope; picture-in-picture; web-share"" referrerpolicy=""strict-origin-when-cross-origin"" allowfullscreen></iframe>",Social Issues
53,2026-03-18T14:20:02Z,UCTis64XH8HrxE7GhEkA6YmA,SENEGAL AFCON TITLE REVOKED &amp; MOROCCO CHAMPIONS?! DISCUSSION W/ DAILYPAPER COFOUNDER JEFFERSON OSEI,"In a segment from Episode 114, we break down the absolute chaos of Morocco being awarded the 2025 AFCON title nearly 2 ...","{'default': {'url': 'https://i.ytimg.com/vi/95zm36_DYKo/default.jpg', 'width': 120, 'height': 90}, 'medium': {'url': 'https://i.ytimg.com/vi/95zm36_DYKo/mqdefault.jpg', 'width': 320, 'height': 180}, 'high': {'url': 'https://i.ytimg.com/vi/95zm36_DYKo/hqdefault.jpg', 'width': 480, 'height': 360}}",5ASIDE Media,none,2026-03-18T14:20:02Z,95zm36_DYKo,"<iframe width=""480"" height=""270"" src=""//www.youtube.com/embed/95zm36_DYKo"" frameborder=""0"" allow=""accelerometer; autoplay; clipboard-write; encrypted-media; gyroscope; picture-in-picture; web-share"" referrerpolicy=""strict-origin-when-cross-origin"" allowfullscreen></iframe>",Sports
33,2026-03-17T12:01:35Z,UCIwGnOXoSXEI7Tooz3iKq5w,What They looked like,Join this channel to get access to perks: https://www.youtube.com/channel/UCIwGnOXoSXEI7Tooz3iKq5w/join ...,"{'default': {'url': 'https://i.ytimg.com/vi/qzh005WrAjg/default.jpg', 'width': 120, 'height': 90}, 'medium': {'url': 'https://i.ytimg.com/vi/qzh005WrAjg/mqdefault.jpg', 'width': 320, 'height': 180}, 'high': {'url': 'https://i.ytimg.com/vi/qzh005WrAjg/hqdefault.jpg', 'width': 480, 'height': 360}}",Without History,none,2026-03-17T12:01:35Z,qzh005WrAjg,"<iframe width=""480"" height=""270"" src=""//www.youtube.com/embed/qzh005WrAjg"" frameborder=""0"" allow=""accelerometer; autoplay; clipboard-write; encrypted-media; gyroscope; picture-in-picture; web-share"" referrerpolicy=""strict-origin-when-cross-origin"" allowfullscreen></iframe>",History
24,2026-03-16T20:30:04Z,UCTNr0N__QwstBhgCtvQcjhA,Aldi Employee Accuses Woman of Stealing… Then Pushes Her Cart &amp; Purse Outside!,"Join our channel to get access to perks: https://www.youtube.com/channel/UCTNr0N__QwstBhgCtvQcjhA/join In this video, ...","{'default': {'url': 'https://i.ytimg.com/vi/PC200VdV9bM/default.jpg', 'width': 120, 'height': 90}, 'medium': {'url': 'https://i.ytimg.com/vi/PC200VdV9bM/mqdefault.jpg', 'width': 320, 'height': 180}, 'high': {'url': 'https://i.ytimg.com/vi/PC200VdV9bM/hqdefault.jpg', 'width': 480, 'height': 360}}",Black Discoveries,none,2026-03-16T20:30:04Z,PC200VdV9bM,"<iframe width=""480"" height=""270"" src=""//www.youtube.com/embed/PC200VdV9bM"" frameborder=""0"" allow=""accelerometer; autoplay; clipboard-write; encrypted-media; gyroscope; picture-in-picture; web-share"" referrerpolicy=""strict-origin-when-cross-origin"" allowfullscreen></iframe>",History
37,2026-03-13T16:00:00Z,UC4lH-odQ5ll-85fkpWxDYmA,investigating a side of Canada they don&#39;t show you PART 2,I visited Canada in North America to meet-up with immigrants and document what life looks like and the side of Canada they don't ...,"{'default': {'url': 'https://i.ytimg.com/vi/gcX5gNRSZfQ/default.jpg', 'width': 120, 'height': 90}, 'medium': {'url': 'https://i.ytimg.com/vi/gcX5gNRSZfQ/mqdefault.jpg', 'width': 320, 'height': 180}, 'high': {'url': 'https://i.ytimg.com/vi/gcX5gNRSZfQ/hqdefault.jpg', 'width': 480, 'height': 360}}",Steven Ndukwu,none,2026-03-13T16:00:00Z,gcX5gNRSZfQ,"<iframe width=""480"" height=""270"" src=""//www.youtube.com/embed/gcX5gNRSZfQ"" frameborder=""0"" allow=""accelerometer; autoplay; clipboard-write; encrypted-media; gyroscope; picture-in-picture; web-share"" referrerpolicy=""strict-origin-when-cross-origin"" allowfullscreen></iframe>",Productivity
59,2026-03-09T17:35:43Z,UCOhiR-6Y-MZtMERKRENrcRw,Historical Event of Black Americans receiving long awaited Citizenship,"This channel is to bring the awareness to the world of the beautiful continent of Africa. My intentions are to show the development, ...","{'default': {'url': 'https://i.ytimg.com/vi/0DBoaU9PJx4/default.jpg', 'width': 120, 'height': 90}, 'medium': {'url': 'https://i.ytimg.com/vi/0DBoaU9PJx4/mqdefault.jpg', 'width': 320, 'height': 180}, 'high': {'url': 'https://i.ytimg.com/vi/0DBoaU9PJx4/hqdefault.jpg', 'width': 480, 'height': 360}}",GoBlack2Africa ,none,2026-03-09T17:35:43Z,0DBoaU9PJx4,"<iframe width=""480"" height=""270"" src=""//www.youtube.com/embed/0DBoaU9PJx4"" frameborder=""0"" allow=""accelerometer; autoplay; clipboard-write; encrypted-media; gyroscope; picture-in-picture; web-share"" referrerpolicy=""strict-origin-when-cross-origin"" allowfullscreen></iframe>",Travel
64,2026-03-08T23:42:24Z,UC2-nif4wvOqT6QVsBX3NOpA,How To Survive A War Zone,Left alone in a war zone created by their own country. A story of betrayal and incompetence and survival. We also give some great ...,"{'default': {'url': 'https://i.ytimg.com/vi/ZrE_8z8TbHM/default.jpg', 'width': 120, 'height': 90}, 'medium': {'url': 'https://i.ytimg.com/vi/ZrE_8z8TbHM/mqdefault.jpg', 'width': 320, 'height': 180}, 'high': {'url': 'https://i.ytimg.com/vi/ZrE_8z8TbHM/hqdefault.jpg', 'width': 480, 'height': 360}}",The Yarbros,none,2026-03-08T23:42:24Z,ZrE_8z8TbHM,"<iframe width=""480"" height=""270"" src=""//www.youtube.com/embed/ZrE_8z8TbHM"" frameborder=""0"" allow=""accelerometer; autoplay; clipboard-write; encrypted-media; gyroscope; picture-in-picture; web-share"" referrerpolicy=""strict-origin-when-cross-origin"" allowfullscreen></iframe>",Travel
62,2026-03-07T15:00:07Z,UCF71yDQwxfw0QcYb2JnkB5Q,The U.S. WARNED Us Not to Visit Belize...,"Belize is one of the most culturally diverse countries in the Caribbean, yet most travelers only experience the beaches and resorts.","{'default': {'url': 'https://i.ytimg.com/vi/ru859EseX90/default.jpg', 'width': 120, 'height': 90}, 'medium': {'url': 'https://i.ytimg.com/vi/ru859EseX90/mqdefault.jpg', 'width': 320, 'height': 180}, 'high': {'url': 'https://i.ytimg.com/vi/ru859EseX90/hqdefault.jpg', 'width': 480, 'height': 360}}",PassportHeavy,none,2026-03-07T15:00:07Z,ru859EseX90,"<iframe width=""480"" height=""270"" src=""//www.youtube.com/embed/ru859EseX90"" frameborder=""0"" allow=""accelerometer; autoplay; clipboard-write; encrypted-media; gyroscope; picture-in-picture; web-share"" referrerpolicy=""strict-origin-when-cross-origin"" allowfullscreen></iframe>",Travel
50,2026-03-06T21:00:38Z,UCPQsrvUJzs1INc2hroy3nHw,We Hosted A Valentine’s Singles Event… Here’s What Happened!!,"Love was definitely in the air at our Valentine's Singles Event, and let's just say… the night did not go the way we expected.","{'default': {'url': 'https://i.ytimg.com/vi/bIc4d39RCm8/default.jpg', 'width': 120, 'height': 90}, 'medium': {'url': 'https://i.ytimg.com/vi/bIc4d39RCm8/mqdefault.jpg', 'width': 320, 'height': 180}, 'high': {'url': 'https://i.ytimg.com/vi/bIc4d39RCm8/hqdefault.jpg', 'width': 480, 'height': 360}}",The Pan African Dating Show (The-PDS),none,2026-03-06T21:00:38Z,bIc4d39RCm8,"<iframe width=""480"" height=""270"" src=""//www.youtube.com/embed/bIc4d39RCm8"" frameborder=""0"" allow=""accelerometer; autoplay; clipboard-write; encrypted-media; gyroscope; picture-in-picture; web-share"" referrerpolicy=""strict-origin-when-cross-origin"" allowfullscreen></iframe>",Social Issues
26,2026-02-24T17:30:35Z,UC12lU5ymIvSpgl8KntDQUQA,How The West Turned A Sacred Color Into A Curse,Patreon: https://www.patreon.com/HomeTeamHistory Playwatch Animation: https://playwatchkids.com/ How did we get from an ...,"{'default': {'url': 'https://i.ytimg.com/vi/fJIDM1ja9oE/default.jpg', 'width': 120, 'height': 90}, 'medium': {'url': 'https://i.ytimg.com/vi/fJIDM1ja9oE/mqdefault.jpg', 'width': 320, 'height': 180}, 'high': {'url': 'https://i.ytimg.com/vi/fJIDM1ja9oE/hqdefault.jpg', 'width': 480, 'height': 360}}",HomeTeam History,none,2026-02-24T17:30:35Z,fJIDM1ja9oE,"<iframe width=""480"" height=""270"" src=""//www.youtube.com/embed/fJIDM1ja9oE"" frameborder=""0"" allow=""accelerometer; autoplay; clipboard-write; encrypted-media; gyroscope; picture-in-picture; web-share"" referrerpolicy=""strict-origin-when-cross-origin"" allowfullscreen></iframe>",History
22,2026-02-21T17:01:21Z,UCJmmxwdAsR7lD8fBA_qbEMw,The CIA Spy Scandal that Shook GHANA,"In 1985, at the height of the Cold War, the intelligence world was rocked by high-profile betrayals. Here the CIA's entire network in ...","{'default': {'url': 'https://i.ytimg.com/vi/nDYGHJiZe0Y/default.jpg', 'width': 120, 'height': 90}, 'medium': {'url': 'https://i.ytimg.com/vi/nDYGHJiZe0Y/mqdefault.jpg', 'width': 320, 'height': 180}, 'high': {'url': 'https://i.ytimg.com/vi/nDYGHJiZe0Y/hqdefault.jpg', 'width': 480, 'height': 360}}",African Biographics,none,2026-02-21T17:01:21Z,nDYGHJiZe0Y,"<iframe width=""480"" height=""270"" src=""//www.youtube.com/embed/nDYGHJiZe0Y"" frameborder=""0"" allow=""accelerometer; autoplay; clipboard-write; encrypted-media; gyroscope; picture-in-picture; web-share"" referrerpolicy=""strict-origin-when-cross-origin"" allowfullscreen></iframe>",History
5,2026-02-12T17:34:42Z,UC1ettU5YSf_nIOJWffCKGQw,malema chews up a disrespectful white previlaged witness refusing to answer questions,Julius Malema gets into a heated innerrogation with former police reservist Paul O'sullivan for being disrepectful to the committee ...,"{'default': {'url': 'https://i.ytimg.com/vi/lkN0NZeh2Fk/default.jpg', 'width': 120, 'height': 90}, 'medium': {'url': 'https://i.ytimg.com/vi/lkN0NZeh2Fk/mqdefault.jpg', 'width': 320, 'height': 180}, 'high': {'url': 'https://i.ytimg.com/vi/lkN0NZeh2Fk/hqdefault.jpg', 'width': 480, 'height': 360}}",LuiSpot,none,2026-02-12T17:34:42Z,lkN0NZeh2Fk,"<iframe width=""480"" height=""270"" src=""//www.youtube.com/embed/lkN0NZeh2Fk"" frameborder=""0"" allow=""accelerometer; autoplay; clipboard-write; encrypted-media; gyroscope; picture-in-picture; web-share"" referrerpolicy=""strict-origin-when-cross-origin"" allowfullscreen></iframe>",Current Events
23,2026-02-08T16:00:45Z,UC2xX2FI6s4i9xz3t9qjayhg,Maurice Bishop Interview (1983),,"{'default': {'url': 'https://i.ytimg.com/vi/ZpKldrtlZmg/default.jpg', 'width': 120, 'height': 90}, 'medium': {'url': 'https://i.ytimg.com/vi/ZpKldrtlZmg/mqdefault.jpg', 'width': 320, 'height': 180}, 'high': {'url': 'https://i.ytimg.com/vi/ZpKldrtlZmg/hqdefault.jpg', 'width': 480, 'height': 360}}",AfroMarxist,none,2026-02-08T16:00:45Z,ZpKldrtlZmg,"<iframe width=""480"" height=""360"" src=""//www.youtube.com/embed/ZpKldrtlZmg"" frameborder=""0"" allow=""accelerometer; autoplay; clipboard-write; encrypted-media; gyroscope; picture-in-picture; web-share"" referrerpolicy=""strict-origin-when-cross-origin"" allowfullscreen></iframe>",History
39,2025-11-05T22:16:23Z,UCx5Y5d5KgibkG9KAyknCdFA,What People Need to Realize About Charlie Kirk,,"{'default': {'url': 'https://i.ytimg.com/vi/pJ99RTTaV4U/default.jpg', 'width': 120, 'height': 90}, 'medium': {'url': 'https://i.ytimg.com/vi/pJ99RTTaV4U/mqdefault.jpg', 'width': 320, 'height': 180}, 'high': {'url': 'https://i.ytimg.com/vi/pJ99RTTaV4U/hqdefault.jpg', 'width': 480, 'height': 360}}",Afromation Digital,none,2025-11-05T22:16:23Z,pJ99RTTaV4U,"<iframe width=""480"" height=""270"" src=""//www.youtube.com/embed/pJ99RTTaV4U"" frameborder=""0"" allow=""accelerometer; autoplay; clipboard-write; encrypted-media; gyroscope; picture-in-picture; web-share"" referrerpolicy=""strict-origin-when-cross-origin"" allowfullscreen></iframe>",Social Issues
8,2025-10-25T07:57:32Z,UCMe6CgCi6TSZX1tUxuUvCGg,"GHANA MOURN H.E MRS RAWLINGS, Former First Lady Live tonight","Ghana Mourn Former First Lady H. E Mrs Nana Konadu Agyeman- Rawlings, Queen of Women's Heart. H. E founded 31st ...","{'default': {'url': 'https://i.ytimg.com/vi/iZPwEHZR4MQ/default.jpg', 'width': 120, 'height': 90}, 'medium': {'url': 'https://i.ytimg.com/vi/iZPwEHZR4MQ/mqdefault.jpg', 'width': 320, 'height': 180}, 'high': {'url': 'https://i.ytimg.com/vi/iZPwEHZR4MQ/hqdefault.jpg', 'width': 480, 'height': 360}}",Pan-African Daily TV with Dr Tatah ,none,2025-10-25T07:57:32Z,iZPwEHZR4MQ,"<iframe width=""480"" height=""270"" src=""//www.youtube.com/embed/iZPwEHZR4MQ"" frameborder=""0"" allow=""accelerometer; autoplay; clipboard-write; encrypted-media; gyroscope; picture-in-picture; web-share"" referrerpolicy=""strict-origin-when-cross-origin"" allowfullscreen></iframe>",Current Events
27,2025-09-27T15:41:10Z,UC__wkIWEfbnTAYVT8j6gfPg,Origins of Ancient Egypt #kemet #africanhistory #ancientegypt #history,,"{'default': {'url': 'https://i.ytimg.com/vi/6_GbuDpE_bk/default.jpg', 'width': 120, 'height': 90}, 'medium': {'url': 'https://i.ytimg.com/vi/6_GbuDpE_bk/mqdefault.jpg', 'width': 320, 'height': 180}, 'high': {'url': 'https://i.ytimg.com/vi/6_GbuDpE_bk/hqdefault.jpg', 'width': 480, 'height': 360}}",Know Thyself,none,2025-09-27T15:41:10Z,6_GbuDpE_bk,"<iframe width=""480"" height=""270"" src=""//www.youtube.com/embed/6_GbuDpE_bk"" frameborder=""0"" allow=""accelerometer; autoplay; clipboard-write; encrypted-media; gyroscope; picture-in-picture; web-share"" referrerpolicy=""strict-origin-when-cross-origin"" allowfullscreen></iframe>",History
