,publishedAt,channelId,title,description,thumbnails,channelTitle,liveBroadcastContent,publishTime,videoID,embeds,category
1,2026-07-03T04:00:03Z,UCKZGcrxRAhdUi58Mdr565mw,Chaos Erupts In Senegal Parliament,Wongel Zelalem reports on chaos erupting in Senegal's parliament.,"{'default': {'url': 'https://i.ytimg.com/vi/xjB4Z_S4YTw/default.jpg', 'width': 120, 'height': 90}, 'medium': {'url': 'https://i.ytimg.com/vi/xjB4Z_S4YTw/mqdefault.jpg', 'width': 320, 'height': 180}, 'high': {'url': 'https://i.ytimg.com/vi/xjB4Z_S4YTw/hqdefault.jpg', 'width': 480, 'height': 360}}",African Diaspora News Channel,none,2026-07-03T04:00:03Z,xjB4Z_S4YTw,"<iframe width=""480"" height=""270"" src=""//www.youtube.com/embed/xjB4Z_S4YTw"" frameborder=""0"" allow=""accelerometer; autoplay; clipboard-write; encrypted-media; gyroscope; picture-in-picture; web-share"" referrerpolicy=""strict-origin-when-cross-origin"" allowfullscreen></iframe>",Current Events
15,2026-07-03T03:46:15Z,UCHvnMsLnyQZscrq-fOckiiw,Trump profits $2.2 billion+ in second term and faces ethics questions | Rachel Scott reports #News,,"{'default': {'url': 'https://i.ytimg.com/vi/ZUgi_t8drCQ/default.jpg', 'width': 120, 'height': 90}, 'medium': {'url': 'https://i.ytimg.com/vi/ZUgi_t8drCQ/mqdefault.jpg', 'width': 320, 'height': 180}, 'high': {'url': 'https://i.ytimg.com/vi/ZUgi_t8drCQ/hqdefault.jpg', 'width': 480, 'height': 360}}",BlackTree TV,none,2026-07-03T03:46:15Z,ZUgi_t8drCQ,"<iframe width=""480"" height=""270"" src=""//www.youtube.com/embed/ZUgi_t8drCQ"" frameborder=""0"" allow=""accelerometer; autoplay; clipboard-write; encrypted-media; gyroscope; picture-in-picture; web-share"" referrerpolicy=""strict-origin-when-cross-origin"" allowfullscreen></iframe>",Entertainment
46,2026-07-03T03:00:39Z,UCbB_WVM-e7nuhWd_FB_8KBQ,Art Shopping In Nigeria | One54 Africa Podcast,"""I said d*mn do you all have payment plans?"" - Akbar #one54 #africa #nigeria #art FULL EPISODE: ...","{'default': {'url': 'https://i.ytimg.com/vi/HmmRq2l9tRY/default.jpg', 'width': 120, 'height': 90}, 'medium': {'url': 'https://i.ytimg.com/vi/HmmRq2l9tRY/mqdefault.jpg', 'width': 320, 'height': 180}, 'high': {'url': 'https://i.ytimg.com/vi/HmmRq2l9tRY/hqdefault.jpg', 'width': 480, 'height': 360}}",One54 Africa,none,2026-07-03T03:00:39Z,HmmRq2l9tRY,"<iframe width=""480"" height=""270"" src=""//www.youtube.com/embed/HmmRq2l9tRY"" frameborder=""0"" allow=""accelerometer; autoplay; clipboard-write; encrypted-media; gyroscope; picture-in-picture; web-share"" referrerpolicy=""strict-origin-when-cross-origin"" allowfullscreen></iframe>",Social Issues
11,2026-07-03T02:36:40Z,UCeUtB7lGgo5ZVIVzqELT-1A,"TUCKER CARLSON ANNOUNCEMENT, KAMALA REACHES OUT, TRUMP WEALTH, NEW GAZA CAMP, WALLY RASHID JOINS",Website: https://sabbysabs.com/ Patreon: https://www.patreon.com/SabrinaSalvati PayPal: ...,"{'default': {'url': 'https://i.ytimg.com/vi/k-qH66Ztsgk/default.jpg', 'width': 120, 'height': 90}, 'medium': {'url': 'https://i.ytimg.com/vi/k-qH66Ztsgk/mqdefault.jpg', 'width': 320, 'height': 180}, 'high': {'url': 'https://i.ytimg.com/vi/k-qH66Ztsgk/hqdefault.jpg', 'width': 480, 'height': 360}}",Sabby Sabs,none,2026-07-03T02:36:40Z,k-qH66Ztsgk,"<iframe width=""480"" height=""270"" src=""//www.youtube.com/embed/k-qH66Ztsgk"" frameborder=""0"" allow=""accelerometer; autoplay; clipboard-write; encrypted-media; gyroscope; picture-in-picture; web-share"" referrerpolicy=""strict-origin-when-cross-origin"" allowfullscreen></iframe>",Current Events
63,2026-07-03T01:51:01Z,UC2rmgVaijnf92nixlIZWGmg,"FBA, ADOS, Soulann, Moors, Hebrews, Indians: Is Black America Having an Identity Crisis? 📱","In this episode, we discuss one of the most sensitive and important conversations happening within Black America today: identity.","{'default': {'url': 'https://i.ytimg.com/vi/98NLxPB_wyY/default.jpg', 'width': 120, 'height': 90}, 'medium': {'url': 'https://i.ytimg.com/vi/98NLxPB_wyY/mqdefault.jpg', 'width': 320, 'height': 180}, 'high': {'url': 'https://i.ytimg.com/vi/98NLxPB_wyY/hqdefault.jpg', 'width': 480, 'height': 360}}",Search For Uhuru,none,2026-07-03T01:51:01Z,98NLxPB_wyY,"<iframe width=""480"" height=""270"" src=""//www.youtube.com/embed/98NLxPB_wyY"" frameborder=""0"" allow=""accelerometer; autoplay; clipboard-write; encrypted-media; gyroscope; picture-in-picture; web-share"" referrerpolicy=""strict-origin-when-cross-origin"" allowfullscreen></iframe>",Travel
70,2026-07-03T01:15:18Z,UCQoxJOkwaCgyzQtiuAIDcuw,LeBron Scraps Davis Blatt&#39;s Play For JR Smith &amp; Hits Game-Winner I CLUB SHAY SHAY,"LeBron Scraps Davis Blatt's Play For JR Smith & Hits Game-Winner ""LeBron said, 'Nah. I'm taking that shot.'"" - Tristan Thompson ...","{'default': {'url': 'https://i.ytimg.com/vi/Bx_rGCLXZq8/default.jpg', 'width': 120, 'height': 90}, 'medium': {'url': 'https://i.ytimg.com/vi/Bx_rGCLXZq8/mqdefault.jpg', 'width': 320, 'height': 180}, 'high': {'url': 'https://i.ytimg.com/vi/Bx_rGCLXZq8/hqdefault.jpg', 'width': 480, 'height': 360}}",Club Shay Shay,none,2026-07-03T01:15:18Z,Bx_rGCLXZq8,"<iframe width=""480"" height=""270"" src=""//www.youtube.com/embed/Bx_rGCLXZq8"" frameborder=""0"" allow=""accelerometer; autoplay; clipboard-write; encrypted-media; gyroscope; picture-in-picture; web-share"" referrerpolicy=""strict-origin-when-cross-origin"" allowfullscreen></iframe>",Social Issues
42,2026-07-03T01:11:51Z,UCwbP4USYrniJGROwQNiwH-Q,Women Should COMPLETELY SUBMIT To Men! | Bring Feminine Women Back,"Husband's NEW Singles Here: Purchase HERE: https://paigeandderson.bandcamp.com/track/lifetime-3 Hey Loves, Make Sure ...","{'default': {'url': 'https://i.ytimg.com/vi/9OPUnju1YOk/default.jpg', 'width': 120, 'height': 90}, 'medium': {'url': 'https://i.ytimg.com/vi/9OPUnju1YOk/mqdefault.jpg', 'width': 320, 'height': 180}, 'high': {'url': 'https://i.ytimg.com/vi/9OPUnju1YOk/hqdefault.jpg', 'width': 480, 'height': 360}}",DeeDeesReactions,none,2026-07-03T01:11:51Z,9OPUnju1YOk,"<iframe width=""480"" height=""270"" src=""//www.youtube.com/embed/9OPUnju1YOk"" frameborder=""0"" allow=""accelerometer; autoplay; clipboard-write; encrypted-media; gyroscope; picture-in-picture; web-share"" referrerpolicy=""strict-origin-when-cross-origin"" allowfullscreen></iframe>",Social Issues
2,2026-07-02T23:47:07Z,UCiinSjWS3E0vtAa3DCvp7iA,Is Venezuela gov&#39;t failing to respond to earthquake,"Right on cue after Venezuela's back-to-back earthquakes, the right-wing has launched an unhinged disinformation campaign ...","{'default': {'url': 'https://i.ytimg.com/vi/IkiOx2KO-_k/default.jpg', 'width': 120, 'height': 90}, 'medium': {'url': 'https://i.ytimg.com/vi/IkiOx2KO-_k/mqdefault.jpg', 'width': 320, 'height': 180}, 'high': {'url': 'https://i.ytimg.com/vi/IkiOx2KO-_k/hqdefault.jpg', 'width': 480, 'height': 360}}",BreakThrough News,none,2026-07-02T23:47:07Z,IkiOx2KO-_k,"<iframe width=""480"" height=""270"" src=""//www.youtube.com/embed/IkiOx2KO-_k"" frameborder=""0"" allow=""accelerometer; autoplay; clipboard-write; encrypted-media; gyroscope; picture-in-picture; web-share"" referrerpolicy=""strict-origin-when-cross-origin"" allowfullscreen></iframe>",Current Events
14,2026-07-02T22:11:21Z,UCehBVAPy-bxmnbNARF-_tvA,Cleveland ended its Flock contract. The cameras are still on.,"Since 2023, Cleveland has been home to 100 of Flock's license plate readers. And on June 17, the Cleveland City Council voted ...","{'default': {'url': 'https://i.ytimg.com/vi/DwRpN1-8TIs/default.jpg', 'width': 120, 'height': 90}, 'medium': {'url': 'https://i.ytimg.com/vi/DwRpN1-8TIs/mqdefault.jpg', 'width': 320, 'height': 180}, 'high': {'url': 'https://i.ytimg.com/vi/DwRpN1-8TIs/hqdefault.jpg', 'width': 480, 'height': 360}}",More Perfect Union,none,2026-07-02T22:11:21Z,DwRpN1-8TIs,"<iframe width=""480"" height=""270"" src=""//www.youtube.com/embed/DwRpN1-8TIs"" frameborder=""0"" allow=""accelerometer; autoplay; clipboard-write; encrypted-media; gyroscope; picture-in-picture; web-share"" referrerpolicy=""strict-origin-when-cross-origin"" allowfullscreen></iframe>",Current Events
26,2026-07-02T22:00:23Z,UCC0XWOgSBcwNstXbPX2cbpg,Bold Barbados Prime Minister Mia Amor Mottley EXP0SES The Danger Facing The CARIBBEAN!!,"For copyright matters, takedown, or complaint please contact: historicalafrika@gmail.com What if the future of the Caribbean ...","{'default': {'url': 'https://i.ytimg.com/vi/_0nUjgo8djU/default.jpg', 'width': 120, 'height': 90}, 'medium': {'url': 'https://i.ytimg.com/vi/_0nUjgo8djU/mqdefault.jpg', 'width': 320, 'height': 180}, 'high': {'url': 'https://i.ytimg.com/vi/_0nUjgo8djU/hqdefault.jpg', 'width': 480, 'height': 360}}",Historical Africa,none,2026-07-02T22:00:23Z,_0nUjgo8djU,"<iframe width=""480"" height=""270"" src=""//www.youtube.com/embed/_0nUjgo8djU"" frameborder=""0"" allow=""accelerometer; autoplay; clipboard-write; encrypted-media; gyroscope; picture-in-picture; web-share"" referrerpolicy=""strict-origin-when-cross-origin"" allowfullscreen></iframe>",History
51,2026-07-02T21:54:16Z,UCHVBLMcvOgDtFEF2bToQLqw,Candace Owens know your history,Candace Owens know your history #candaceowens #tuckercarlson #kanyewest #donaldtrump #megynkelly.,"{'default': {'url': 'https://i.ytimg.com/vi/3vXwpPMeGWg/default.jpg', 'width': 120, 'height': 90}, 'medium': {'url': 'https://i.ytimg.com/vi/3vXwpPMeGWg/mqdefault.jpg', 'width': 320, 'height': 180}, 'high': {'url': 'https://i.ytimg.com/vi/3vXwpPMeGWg/hqdefault.jpg', 'width': 480, 'height': 360}}",We Woke Now,none,2026-07-02T21:54:16Z,3vXwpPMeGWg,"<iframe width=""480"" height=""270"" src=""//www.youtube.com/embed/3vXwpPMeGWg"" frameborder=""0"" allow=""accelerometer; autoplay; clipboard-write; encrypted-media; gyroscope; picture-in-picture; web-share"" referrerpolicy=""strict-origin-when-cross-origin"" allowfullscreen></iframe>",Social Issues
25,2026-07-02T21:30:04Z,UCTNr0N__QwstBhgCtvQcjhA,Black Americans are No Longer Backing Down in 2026: We Will Not Be INTIMIDATED Anymore,"Join our channel to get access to perks: https://www.youtube.com/channel/UCTNr0N__QwstBhgCtvQcjhA/join In 2026, Black ...","{'default': {'url': 'https://i.ytimg.com/vi/t2UfAgYwiJI/default.jpg', 'width': 120, 'height': 90}, 'medium': {'url': 'https://i.ytimg.com/vi/t2UfAgYwiJI/mqdefault.jpg', 'width': 320, 'height': 180}, 'high': {'url': 'https://i.ytimg.com/vi/t2UfAgYwiJI/hqdefault.jpg', 'width': 480, 'height': 360}}",Black Discoveries,none,2026-07-02T21:30:04Z,t2UfAgYwiJI,"<iframe width=""480"" height=""270"" src=""//www.youtube.com/embed/t2UfAgYwiJI"" frameborder=""0"" allow=""accelerometer; autoplay; clipboard-write; encrypted-media; gyroscope; picture-in-picture; web-share"" referrerpolicy=""strict-origin-when-cross-origin"" allowfullscreen></iframe>",History
52,2026-07-02T21:30:01Z,UCXyHjFIKz9D8ofxObOuYBbg,How to know if she likes men,WeNeedToTalk #BlackLove To support our ministry: https://cash.app/$wnttalk Please SUBSCRIBE for more content!,"{'default': {'url': 'https://i.ytimg.com/vi/cQIcNgvkenY/default.jpg', 'width': 120, 'height': 90}, 'medium': {'url': 'https://i.ytimg.com/vi/cQIcNgvkenY/mqdefault.jpg', 'width': 320, 'height': 180}, 'high': {'url': 'https://i.ytimg.com/vi/cQIcNgvkenY/hqdefault.jpg', 'width': 480, 'height': 360}}",WeNeedToTalk,none,2026-07-02T21:30:01Z,cQIcNgvkenY,"<iframe width=""480"" height=""270"" src=""//www.youtube.com/embed/cQIcNgvkenY"" frameborder=""0"" allow=""accelerometer; autoplay; clipboard-write; encrypted-media; gyroscope; picture-in-picture; web-share"" referrerpolicy=""strict-origin-when-cross-origin"" allowfullscreen></iframe>",Social Issues
44,2026-07-02T21:05:33Z,UC4YZVeGnDXzEfjGcZG-d6oQ,Venezuelans Chanted &quot;Let the Earth Shake&quot; Before Earthquake,Join All Access on Patreon | https://www.patreon.com/MeandEpiphany. If you may support the channel Cash App ...,"{'default': {'url': 'https://i.ytimg.com/vi/J5ikQe_OerM/default.jpg', 'width': 120, 'height': 90}, 'medium': {'url': 'https://i.ytimg.com/vi/J5ikQe_OerM/mqdefault.jpg', 'width': 320, 'height': 180}, 'high': {'url': 'https://i.ytimg.com/vi/J5ikQe_OerM/hqdefault.jpg', 'width': 480, 'height': 360}}",meandepiphany,none,2026-07-02T21:05:33Z,J5ikQe_OerM,"<iframe width=""480"" height=""270"" src=""//www.youtube.com/embed/J5ikQe_OerM"" frameborder=""0"" allow=""accelerometer; autoplay; clipboard-write; encrypted-media; gyroscope; picture-in-picture; web-share"" referrerpolicy=""strict-origin-when-cross-origin"" allowfullscreen></iframe>",Social Issues
5,2026-07-02T21:00:13Z,UCF-A_4x9-bLrxXrmgBOWuJA,What does freedom mean for young people whose qualifications remain locked behind debt?,"Today, we're discussing an issue affecting thousands of young South Africans who have completed their studies but remain ...","{'default': {'url': 'https://i.ytimg.com/vi/EHIf4HomXLQ/default_live.jpg', 'width': 120, 'height': 90}, 'medium': {'url': 'https://i.ytimg.com/vi/EHIf4HomXLQ/mqdefault_live.jpg', 'width': 320, 'height': 180}, 'high': {'url': 'https://i.ytimg.com/vi/EHIf4HomXLQ/hqdefault_live.jpg', 'width': 480, 'height': 360}}",Economic Freedom Fighters,upcoming,2026-07-02T21:00:13Z,EHIf4HomXLQ,"<iframe width=""480"" height=""270"" src=""//www.youtube.com/embed/EHIf4HomXLQ"" frameborder=""0"" allow=""accelerometer; autoplay; clipboard-write; encrypted-media; gyroscope; picture-in-picture; web-share"" referrerpolicy=""strict-origin-when-cross-origin"" allowfullscreen></iframe>",Current Events
7,2026-07-02T20:40:00Z,UCKLSjhp6XZUEYDT1DMcrj8w,"CC PANICS as Mali, Burkina Faso &amp; Niger EXIT! Africa EXPOSES the World&#39;s Biggest Double Standard","The International Criminal Court (ICC) has expressed concern over the decision by Mali, Burkina Faso, and Niger to withdraw ...","{'default': {'url': 'https://i.ytimg.com/vi/_ckqG8gMofs/default.jpg', 'width': 120, 'height': 90}, 'medium': {'url': 'https://i.ytimg.com/vi/_ckqG8gMofs/mqdefault.jpg', 'width': 320, 'height': 180}, 'high': {'url': 'https://i.ytimg.com/vi/_ckqG8gMofs/hqdefault.jpg', 'width': 480, 'height': 360}}",Make Afrika Great ,none,2026-07-02T20:40:00Z,_ckqG8gMofs,"<iframe width=""480"" height=""270"" src=""//www.youtube.com/embed/_ckqG8gMofs"" frameborder=""0"" allow=""accelerometer; autoplay; clipboard-write; encrypted-media; gyroscope; picture-in-picture; web-share"" referrerpolicy=""strict-origin-when-cross-origin"" allowfullscreen></iframe>",Current Events
43,2026-07-02T19:51:41Z,UCwZ2vurIl_X8rv0Dv4mu12A,The Real Reason Reggae Artists Stopped Singing About Rastafari,INVEST IN INDEPENDENT BLACK MEDIA → Watch the FULL UNCENSORED interview with Aston Barrett Jr. at ...,"{'default': {'url': 'https://i.ytimg.com/vi/A8J_n9LBFXk/default.jpg', 'width': 120, 'height': 90}, 'medium': {'url': 'https://i.ytimg.com/vi/A8J_n9LBFXk/mqdefault.jpg', 'width': 320, 'height': 180}, 'high': {'url': 'https://i.ytimg.com/vi/A8J_n9LBFXk/hqdefault.jpg', 'width': 480, 'height': 360}}",I Never Knew Tv,none,2026-07-02T19:51:41Z,A8J_n9LBFXk,"<iframe width=""480"" height=""270"" src=""//www.youtube.com/embed/A8J_n9LBFXk"" frameborder=""0"" allow=""accelerometer; autoplay; clipboard-write; encrypted-media; gyroscope; picture-in-picture; web-share"" referrerpolicy=""strict-origin-when-cross-origin"" allowfullscreen></iframe>",Social Issues
4,2026-07-02T19:00:34Z,UCzuqE7-t13O4NIDYJfakrhw,"Trump makes billions while in the White House, mostly from crypto","New filings show that President Trump made more than $2.2 billion last year, most of it fueled by profits from his new ...","{'default': {'url': 'https://i.ytimg.com/vi/aHVEUw045rw/default.jpg', 'width': 120, 'height': 90}, 'medium': {'url': 'https://i.ytimg.com/vi/aHVEUw045rw/mqdefault.jpg', 'width': 320, 'height': 180}, 'high': {'url': 'https://i.ytimg.com/vi/aHVEUw045rw/hqdefault.jpg', 'width': 480, 'height': 360}}",Democracy Now!,none,2026-07-02T19:00:34Z,aHVEUw045rw,"<iframe width=""480"" height=""270"" src=""//www.youtube.com/embed/aHVEUw045rw"" frameborder=""0"" allow=""accelerometer; autoplay; clipboard-write; encrypted-media; gyroscope; picture-in-picture; web-share"" referrerpolicy=""strict-origin-when-cross-origin"" allowfullscreen></iframe>",Current Events
10,2026-07-02T19:00:28Z,UChq-BD2afpGbtMUtCxq2YFw,The Secret Treaty France Used To Control Burkina Faso for 60 Years,Thanks so much for tuning in! Get Sandra's State of Africa 2026 Report: https://sandrababuboateng.com/soa2026/. Join the Ghana ...,"{'default': {'url': 'https://i.ytimg.com/vi/9LS2Hs-7J_A/default.jpg', 'width': 120, 'height': 90}, 'medium': {'url': 'https://i.ytimg.com/vi/9LS2Hs-7J_A/mqdefault.jpg', 'width': 320, 'height': 180}, 'high': {'url': 'https://i.ytimg.com/vi/9LS2Hs-7J_A/hqdefault.jpg', 'width': 480, 'height': 360}}",PanaGenius TV,none,2026-07-02T19:00:28Z,9LS2Hs-7J_A,"<iframe width=""480"" height=""270"" src=""//www.youtube.com/embed/9LS2Hs-7J_A"" frameborder=""0"" allow=""accelerometer; autoplay; clipboard-write; encrypted-media; gyroscope; picture-in-picture; web-share"" referrerpolicy=""strict-origin-when-cross-origin"" allowfullscreen></iframe>",Current Events
37,2026-07-02T18:58:02Z,UCDsOKnUQnQek7-G7Xc5kB8Q,Live at Podcast Summit🔥 TUNE IN NOW❗️,,"{'default': {'url': 'https://i.ytimg.com/vi/4juqWibpN1M/default.jpg', 'width': 120, 'height': 90}, 'medium': {'url': 'https://i.ytimg.com/vi/4juqWibpN1M/mqdefault.jpg', 'width': 320, 'height': 180}, 'high': {'url': 'https://i.ytimg.com/vi/4juqWibpN1M/hqdefault.jpg', 'width': 480, 'height': 360}}",Social Proof,none,2026-07-02T18:58:02Z,4juqWibpN1M,"<iframe width=""480"" height=""270"" src=""//www.youtube.com/embed/4juqWibpN1M"" frameborder=""0"" allow=""accelerometer; autoplay; clipboard-write; encrypted-media; gyroscope; picture-in-picture; web-share"" referrerpolicy=""strict-origin-when-cross-origin"" allowfullscreen></iframe>",Productivity
13,2026-07-02T18:44:45Z,UC-4h1XQ47sf0vbFwJvuBhEA,⚽🔥 SWITZERLAND vs ALGERIA 🇨🇭🇩🇿 | FIFA WORLD CUP 2026 LIVE,"SWITZERLAND vs ALGERIA LIVE | FIFA WORLD CUP 2026 Welcome to our live coverage, analysis, and discussion of ...","{'default': {'url': 'https://i.ytimg.com/vi/PVpKnSB1-GY/default.jpg', 'width': 120, 'height': 90}, 'medium': {'url': 'https://i.ytimg.com/vi/PVpKnSB1-GY/mqdefault.jpg', 'width': 320, 'height': 180}, 'high': {'url': 'https://i.ytimg.com/vi/PVpKnSB1-GY/hqdefault.jpg', 'width': 480, 'height': 360}}",The New Africa Channel,none,2026-07-02T18:44:45Z,PVpKnSB1-GY,"<iframe width=""480"" height=""270"" src=""//www.youtube.com/embed/PVpKnSB1-GY"" frameborder=""0"" allow=""accelerometer; autoplay; clipboard-write; encrypted-media; gyroscope; picture-in-picture; web-share"" referrerpolicy=""strict-origin-when-cross-origin"" allowfullscreen></iframe>",Current Events
47,2026-07-02T18:17:50Z,UCyRi9CRrBDeTITC211YfcMg,African Teams Had Everything But Lost Anyway—Here&#39;s Why,"Africa entered the World Cup with more teams, more talent, and more optimism than ever before. But after a historic group stage ...","{'default': {'url': 'https://i.ytimg.com/vi/GwTx6GK2ryg/default.jpg', 'width': 120, 'height': 90}, 'medium': {'url': 'https://i.ytimg.com/vi/GwTx6GK2ryg/mqdefault.jpg', 'width': 320, 'height': 180}, 'high': {'url': 'https://i.ytimg.com/vi/GwTx6GK2ryg/hqdefault.jpg', 'width': 480, 'height': 360}}",Pan African Updates & Reactions,none,2026-07-02T18:17:50Z,GwTx6GK2ryg,"<iframe width=""480"" height=""270"" src=""//www.youtube.com/embed/GwTx6GK2ryg"" frameborder=""0"" allow=""accelerometer; autoplay; clipboard-write; encrypted-media; gyroscope; picture-in-picture; web-share"" referrerpolicy=""strict-origin-when-cross-origin"" allowfullscreen></iframe>",Social Issues
0,2026-07-02T18:01:28Z,UCG7uFJVZsxQRwDssom9Pavw,Colonisation Divided Us! — Burundi’s President Drops an Absolute Truth Bomb,President Evariste Ndayishimiye urged Burundians to strengthen national unity as the country marked the 64th anniversary of its ...,"{'default': {'url': 'https://i.ytimg.com/vi/83nhj-F8BE4/default.jpg', 'width': 120, 'height': 90}, 'medium': {'url': 'https://i.ytimg.com/vi/83nhj-F8BE4/mqdefault.jpg', 'width': 320, 'height': 180}, 'high': {'url': 'https://i.ytimg.com/vi/83nhj-F8BE4/hqdefault.jpg', 'width': 480, 'height': 360}}",2nacheki,none,2026-07-02T18:01:28Z,83nhj-F8BE4,"<iframe width=""480"" height=""270"" src=""//www.youtube.com/embed/83nhj-F8BE4"" frameborder=""0"" allow=""accelerometer; autoplay; clipboard-write; encrypted-media; gyroscope; picture-in-picture; web-share"" referrerpolicy=""strict-origin-when-cross-origin"" allowfullscreen></iframe>",Current Events
58,2026-07-02T18:00:06Z,UCvHeh__RFFonMM8vaKda82Q,Didn&#39;t know South Africa had a place like this WOW!!,Didn't know South Africa had a place like this Don't miss out on the HoverAir X1 Pro Max — your personal self-flying drone.,"{'default': {'url': 'https://i.ytimg.com/vi/G4l5g0IYcCc/default.jpg', 'width': 120, 'height': 90}, 'medium': {'url': 'https://i.ytimg.com/vi/G4l5g0IYcCc/mqdefault.jpg', 'width': 320, 'height': 180}, 'high': {'url': 'https://i.ytimg.com/vi/G4l5g0IYcCc/hqdefault.jpg', 'width': 480, 'height': 360}}",Czech in effect,none,2026-07-02T18:00:06Z,G4l5g0IYcCc,"<iframe width=""480"" height=""270"" src=""//www.youtube.com/embed/G4l5g0IYcCc"" frameborder=""0"" allow=""accelerometer; autoplay; clipboard-write; encrypted-media; gyroscope; picture-in-picture; web-share"" referrerpolicy=""strict-origin-when-cross-origin"" allowfullscreen></iframe>",Travel
73,2026-07-02T17:17:02Z,UCSlLff7uX8i8uUpB1MnhN2Q,The Citizenship Case That Rewrote Race #substack #shorts,This is a clip from https://theconsciouslee.substack.com/p/the-border-crossed-us-anzaldua-the?utm_source=youtube_shorts ...,"{'default': {'url': 'https://i.ytimg.com/vi/Log7JdnJVR0/default.jpg', 'width': 120, 'height': 90}, 'medium': {'url': 'https://i.ytimg.com/vi/Log7JdnJVR0/mqdefault.jpg', 'width': 320, 'height': 180}, 'high': {'url': 'https://i.ytimg.com/vi/Log7JdnJVR0/hqdefault.jpg', 'width': 480, 'height': 360}}",The Conscious Lee,none,2026-07-02T17:17:02Z,Log7JdnJVR0,"<iframe width=""480"" height=""270"" src=""//www.youtube.com/embed/Log7JdnJVR0"" frameborder=""0"" allow=""accelerometer; autoplay; clipboard-write; encrypted-media; gyroscope; picture-in-picture; web-share"" referrerpolicy=""strict-origin-when-cross-origin"" allowfullscreen></iframe>",Social Issues
60,2026-07-02T17:07:16Z,UCi2uaWdy6OTf4Ty7DVC_7lw,SPECIAL ANNOUNCEMENT  !!!,"Hello family , welcome to my YouTube channel iam_marwa , SPECIAL ANNOUNCEMENT !!! AFRICAN Vlog !!!, thank you TEAM ...","{'default': {'url': 'https://i.ytimg.com/vi/AArjwHKia8Y/default.jpg', 'width': 120, 'height': 90}, 'medium': {'url': 'https://i.ytimg.com/vi/AArjwHKia8Y/mqdefault.jpg', 'width': 320, 'height': 180}, 'high': {'url': 'https://i.ytimg.com/vi/AArjwHKia8Y/hqdefault.jpg', 'width': 480, 'height': 360}}",iam_marwa,none,2026-07-02T17:07:16Z,AArjwHKia8Y,"<iframe width=""480"" height=""270"" src=""//www.youtube.com/embed/AArjwHKia8Y"" frameborder=""0"" allow=""accelerometer; autoplay; clipboard-write; encrypted-media; gyroscope; picture-in-picture; web-share"" referrerpolicy=""strict-origin-when-cross-origin"" allowfullscreen></iframe>",Travel
45,2026-07-02T17:00:29Z,UCrPq2ekHx2vZtuyG3wUx0_g,The Power of Black Independent Media | The Tony Brown&#39;s Journal Story ,https://www.tonybrownsjournal.com/ https://www.youtube.com/@TonyBrownsJournal Join this channel to get access to perks: ...,"{'default': {'url': 'https://i.ytimg.com/vi/VEPZdzEudHw/default.jpg', 'width': 120, 'height': 90}, 'medium': {'url': 'https://i.ytimg.com/vi/VEPZdzEudHw/mqdefault.jpg', 'width': 320, 'height': 180}, 'high': {'url': 'https://i.ytimg.com/vi/VEPZdzEudHw/hqdefault.jpg', 'width': 480, 'height': 360}}",On the Shoulders of Giants ,none,2026-07-02T17:00:29Z,VEPZdzEudHw,"<iframe width=""480"" height=""270"" src=""//www.youtube.com/embed/VEPZdzEudHw"" frameborder=""0"" allow=""accelerometer; autoplay; clipboard-write; encrypted-media; gyroscope; picture-in-picture; web-share"" referrerpolicy=""strict-origin-when-cross-origin"" allowfullscreen></iframe>",Social Issues
16,2026-07-02T16:00:21Z,UCv8G-xZ_BBGufjbN6jbvLMQ,I don&#39;t wear my wedding ring! @jasoncheny,Join our channel to get access to perks: https://www.youtube.com/channel/UCv8G-xZ_BBGufjbN6jbvLMQ/join Chocolate Sundaes ...,"{'default': {'url': 'https://i.ytimg.com/vi/BTX7WUaUpdk/default.jpg', 'width': 120, 'height': 90}, 'medium': {'url': 'https://i.ytimg.com/vi/BTX7WUaUpdk/mqdefault.jpg', 'width': 320, 'height': 180}, 'high': {'url': 'https://i.ytimg.com/vi/BTX7WUaUpdk/hqdefault.jpg', 'width': 480, 'height': 360}}",Chocolate Sundaes Comedy,none,2026-07-02T16:00:21Z,BTX7WUaUpdk,"<iframe width=""480"" height=""270"" src=""//www.youtube.com/embed/BTX7WUaUpdk"" frameborder=""0"" allow=""accelerometer; autoplay; clipboard-write; encrypted-media; gyroscope; picture-in-picture; web-share"" referrerpolicy=""strict-origin-when-cross-origin"" allowfullscreen></iframe>",Entertainment
36,2026-07-02T16:00:03Z,UCRVsqvXIdgyPVS-a6fGa1lA,SHE TURNED $67 INTO AN 8-FIGURE BUSINESS 🤯,TIMESTAMPS: 00:00 Wellness Starts Within 02:01 Campus Soap Origin Story 03:48 Learning to Make Soap 04:37 Trust and ...,"{'default': {'url': 'https://i.ytimg.com/vi/73nPH9x6TKo/default.jpg', 'width': 120, 'height': 90}, 'medium': {'url': 'https://i.ytimg.com/vi/73nPH9x6TKo/mqdefault.jpg', 'width': 320, 'height': 180}, 'high': {'url': 'https://i.ytimg.com/vi/73nPH9x6TKo/hqdefault.jpg', 'width': 480, 'height': 360}}",Earn Your Leisure,none,2026-07-02T16:00:03Z,73nPH9x6TKo,"<iframe width=""480"" height=""270"" src=""//www.youtube.com/embed/73nPH9x6TKo"" frameborder=""0"" allow=""accelerometer; autoplay; clipboard-write; encrypted-media; gyroscope; picture-in-picture; web-share"" referrerpolicy=""strict-origin-when-cross-origin"" allowfullscreen></iframe>",Productivity
