,publishedAt,channelId,title,description,thumbnails,channelTitle,liveBroadcastContent,publishTime,videoID,embeds,category
20,2026-07-02T15:08:38Z,UC4m46pCBkMEyy8gk26WKqbA,BROKEN PLAY | NAVV GREENE FT. JOJO ALONSO &amp; REGGIE BALL  | S04 | EP 44,Subscribe To Our Streaming Service Channel 85 https://bit.ly/SubscribeToChannel85 Shop Our Merch! https://bit.ly/85Jetlife2024.,"{'default': {'url': 'https://i.ytimg.com/vi/47tv4yel7lI/default.jpg', 'width': 120, 'height': 90}, 'medium': {'url': 'https://i.ytimg.com/vi/47tv4yel7lI/mqdefault.jpg', 'width': 320, 'height': 180}, 'high': {'url': 'https://i.ytimg.com/vi/47tv4yel7lI/hqdefault.jpg', 'width': 480, 'height': 360}}",The 85 South Comedy Show,none,2026-07-02T15:08:38Z,47tv4yel7lI,"<iframe width=""480"" height=""270"" src=""//www.youtube.com/embed/47tv4yel7lI"" frameborder=""0"" allow=""accelerometer; autoplay; clipboard-write; encrypted-media; gyroscope; picture-in-picture; web-share"" referrerpolicy=""strict-origin-when-cross-origin"" allowfullscreen></iframe>",Entertainment
3,2026-07-02T14:50:16Z,UCL0u5uz7KZ9q-pe-VC8TY-w,THE WIDOW!,,"{'default': {'url': 'https://i.ytimg.com/vi/oOnWeS-z1U0/default.jpg', 'width': 120, 'height': 90}, 'medium': {'url': 'https://i.ytimg.com/vi/oOnWeS-z1U0/mqdefault.jpg', 'width': 320, 'height': 180}, 'high': {'url': 'https://i.ytimg.com/vi/oOnWeS-z1U0/hqdefault.jpg', 'width': 480, 'height': 360}}",Candace Owens,none,2026-07-02T14:50:16Z,oOnWeS-z1U0,"<iframe width=""480"" height=""270"" src=""//www.youtube.com/embed/oOnWeS-z1U0"" frameborder=""0"" allow=""accelerometer; autoplay; clipboard-write; encrypted-media; gyroscope; picture-in-picture; web-share"" referrerpolicy=""strict-origin-when-cross-origin"" allowfullscreen></iframe>",Current Events
18,2026-07-02T14:10:03Z,UCLuYADJ6hESLHX87JnsGbjA,How do you lose a giraffe?,,"{'default': {'url': 'https://i.ytimg.com/vi/fwwqsTbvUhY/default.jpg', 'width': 120, 'height': 90}, 'medium': {'url': 'https://i.ytimg.com/vi/fwwqsTbvUhY/mqdefault.jpg', 'width': 320, 'height': 180}, 'high': {'url': 'https://i.ytimg.com/vi/fwwqsTbvUhY/hqdefault.jpg', 'width': 480, 'height': 360}}",Josh Johnson,none,2026-07-02T14:10:03Z,fwwqsTbvUhY,"<iframe width=""480"" height=""270"" src=""//www.youtube.com/embed/fwwqsTbvUhY"" frameborder=""0"" allow=""accelerometer; autoplay; clipboard-write; encrypted-media; gyroscope; picture-in-picture; web-share"" referrerpolicy=""strict-origin-when-cross-origin"" allowfullscreen></iframe>",Entertainment
17,2026-07-02T12:19:05Z,UCABZ7Z6SBTp4IsARDceOq7w,Yung Miami ‘Responds’ To ‘India Arie Diss’ And ‘Spend Dat’ Hurting The Black Community - HP News,https://hypersclub.com - Yung Miami is now responding to India Arie and others critcizing her song 'Spend Dat' which people are ...,"{'default': {'url': 'https://i.ytimg.com/vi/kE0fQKNLlOc/default.jpg', 'width': 120, 'height': 90}, 'medium': {'url': 'https://i.ytimg.com/vi/kE0fQKNLlOc/mqdefault.jpg', 'width': 320, 'height': 180}, 'high': {'url': 'https://i.ytimg.com/vi/kE0fQKNLlOc/hqdefault.jpg', 'width': 480, 'height': 360}}",HYPE+,none,2026-07-02T12:19:05Z,kE0fQKNLlOc,"<iframe width=""480"" height=""270"" src=""//www.youtube.com/embed/kE0fQKNLlOc"" frameborder=""0"" allow=""accelerometer; autoplay; clipboard-write; encrypted-media; gyroscope; picture-in-picture; web-share"" referrerpolicy=""strict-origin-when-cross-origin"" allowfullscreen></iframe>",Entertainment
68,2026-07-02T11:00:10Z,UCFPfloFwa6X2UddqRH83rAA,Why the Most Boring Money Habits Quietly Build the Biggest Wealth (I Know You Skip These!),"The money habits that build the biggest wealth are usually not exciting. They are quiet, repetitive, and easy to skip. Automating ...","{'default': {'url': 'https://i.ytimg.com/vi/ZFU7eVoxWzU/default.jpg', 'width': 120, 'height': 90}, 'medium': {'url': 'https://i.ytimg.com/vi/ZFU7eVoxWzU/mqdefault.jpg', 'width': 320, 'height': 180}, 'high': {'url': 'https://i.ytimg.com/vi/ZFU7eVoxWzU/hqdefault.jpg', 'width': 480, 'height': 360}}",Alicia Invests,none,2026-07-02T11:00:10Z,ZFU7eVoxWzU,"<iframe width=""480"" height=""270"" src=""//www.youtube.com/embed/ZFU7eVoxWzU"" frameborder=""0"" allow=""accelerometer; autoplay; clipboard-write; encrypted-media; gyroscope; picture-in-picture; web-share"" referrerpolicy=""strict-origin-when-cross-origin"" allowfullscreen></iframe>",Productivity
12,2026-07-02T10:33:38Z,UCLjzzg-cFWpEEjnWCOpXp3Q,Black Power Community Rally,Welcome to this Black Power Community Rally hosted by the International People's Democratic Uhuru Movement (InPDUM).,"{'default': {'url': 'https://i.ytimg.com/vi/r3imnbwdDQc/default.jpg', 'width': 120, 'height': 90}, 'medium': {'url': 'https://i.ytimg.com/vi/r3imnbwdDQc/mqdefault.jpg', 'width': 320, 'height': 180}, 'high': {'url': 'https://i.ytimg.com/vi/r3imnbwdDQc/hqdefault.jpg', 'width': 480, 'height': 360}}",The Burning Spear TV,none,2026-07-02T10:33:38Z,r3imnbwdDQc,"<iframe width=""480"" height=""270"" src=""//www.youtube.com/embed/r3imnbwdDQc"" frameborder=""0"" allow=""accelerometer; autoplay; clipboard-write; encrypted-media; gyroscope; picture-in-picture; web-share"" referrerpolicy=""strict-origin-when-cross-origin"" allowfullscreen></iframe>",Current Events
69,2026-07-01T21:29:50Z,UCHzCimqhvPhCH75h80pXM1Q,"Invest in Yourself: Health, Wealth &amp; Relationships","Neglecting physical health leaves you vulnerable to costly medical systems. True wealth lies not just in finances, but in strong ...","{'default': {'url': 'https://i.ytimg.com/vi/2Q5WrU6YtmY/default.jpg', 'width': 120, 'height': 90}, 'medium': {'url': 'https://i.ytimg.com/vi/2Q5WrU6YtmY/mqdefault.jpg', 'width': 320, 'height': 180}, 'high': {'url': 'https://i.ytimg.com/vi/2Q5WrU6YtmY/hqdefault.jpg', 'width': 480, 'height': 360}}",The Black Business School  ,none,2026-07-01T21:29:50Z,2Q5WrU6YtmY,"<iframe width=""480"" height=""270"" src=""//www.youtube.com/embed/2Q5WrU6YtmY"" frameborder=""0"" allow=""accelerometer; autoplay; clipboard-write; encrypted-media; gyroscope; picture-in-picture; web-share"" referrerpolicy=""strict-origin-when-cross-origin"" allowfullscreen></iframe>",Productivity
74,2026-07-01T18:37:11Z,UCQQbETzZZ86V8gRV63IhRRQ,Whoever told y’all “you’re one of the good ones” was a compliment… lied.,,"{'default': {'url': 'https://i.ytimg.com/vi/Z_s0P3L3PFQ/default.jpg', 'width': 120, 'height': 90}, 'medium': {'url': 'https://i.ytimg.com/vi/Z_s0P3L3PFQ/mqdefault.jpg', 'width': 320, 'height': 180}, 'high': {'url': 'https://i.ytimg.com/vi/Z_s0P3L3PFQ/hqdefault.jpg', 'width': 480, 'height': 360}}",Ashley B,none,2026-07-01T18:37:11Z,Z_s0P3L3PFQ,"<iframe width=""480"" height=""270"" src=""//www.youtube.com/embed/Z_s0P3L3PFQ"" frameborder=""0"" allow=""accelerometer; autoplay; clipboard-write; encrypted-media; gyroscope; picture-in-picture; web-share"" referrerpolicy=""strict-origin-when-cross-origin"" allowfullscreen></iframe>",History
48,2026-07-01T18:00:07Z,UCzo3jVzn-Z9LrFVwAE7iDbw,Ep 111: Pop The Balloon Or Find Love | With Arlette Amuli,Luv or Pop Merch: http://luvorpopmerch.com Fast Thinking Games Form: https://form.jotform.com/261516229510148 Our App Luv ...,"{'default': {'url': 'https://i.ytimg.com/vi/Qkb0sHWv7p8/default.jpg', 'width': 120, 'height': 90}, 'medium': {'url': 'https://i.ytimg.com/vi/Qkb0sHWv7p8/mqdefault.jpg', 'width': 320, 'height': 180}, 'high': {'url': 'https://i.ytimg.com/vi/Qkb0sHWv7p8/hqdefault.jpg', 'width': 480, 'height': 360}}",Pop The Balloon,none,2026-07-01T18:00:07Z,Qkb0sHWv7p8,"<iframe width=""480"" height=""270"" src=""//www.youtube.com/embed/Qkb0sHWv7p8"" frameborder=""0"" allow=""accelerometer; autoplay; clipboard-write; encrypted-media; gyroscope; picture-in-picture; web-share"" referrerpolicy=""strict-origin-when-cross-origin"" allowfullscreen></iframe>",Social Issues
66,2026-07-01T15:32:36Z,UCAk5dFz-FOvYUIUFvWdbRJA,Black-Owned Construction: Building Africa &amp; US Infrastructure #shorts,Build what people need first. Everything else follows. #Afronomicstv #AfricaDevelopment #Infrastructure #Construction ...,"{'default': {'url': 'https://i.ytimg.com/vi/YmqoGjbdndY/default.jpg', 'width': 120, 'height': 90}, 'medium': {'url': 'https://i.ytimg.com/vi/YmqoGjbdndY/mqdefault.jpg', 'width': 320, 'height': 180}, 'high': {'url': 'https://i.ytimg.com/vi/YmqoGjbdndY/hqdefault.jpg', 'width': 480, 'height': 360}}",Afronomics,none,2026-07-01T15:32:36Z,YmqoGjbdndY,"<iframe width=""480"" height=""270"" src=""//www.youtube.com/embed/YmqoGjbdndY"" frameborder=""0"" allow=""accelerometer; autoplay; clipboard-write; encrypted-media; gyroscope; picture-in-picture; web-share"" referrerpolicy=""strict-origin-when-cross-origin"" allowfullscreen></iframe>",Social Issues
55,2026-07-01T12:24:36Z,UCW5NNtTSY5z5mENZ8dt-RCw,Australia&#39;s BeachTown - Gold Coast,"The Gold Coast is known for its beautiful beaches, luxury high-rises, and incredible nightlife, but there's much more to this city than ...","{'default': {'url': 'https://i.ytimg.com/vi/wiKOlLYDcec/default.jpg', 'width': 120, 'height': 90}, 'medium': {'url': 'https://i.ytimg.com/vi/wiKOlLYDcec/mqdefault.jpg', 'width': 320, 'height': 180}, 'high': {'url': 'https://i.ytimg.com/vi/wiKOlLYDcec/hqdefault.jpg', 'width': 480, 'height': 360}}",ACE ,none,2026-07-01T12:24:36Z,wiKOlLYDcec,"<iframe width=""480"" height=""270"" src=""//www.youtube.com/embed/wiKOlLYDcec"" frameborder=""0"" allow=""accelerometer; autoplay; clipboard-write; encrypted-media; gyroscope; picture-in-picture; web-share"" referrerpolicy=""strict-origin-when-cross-origin"" allowfullscreen></iframe>",Travel
56,2026-07-01T01:36:59Z,UCIxrFTHZybtTgq8X7itOAkQ,Trying Not To Get Scammed In London,,"{'default': {'url': 'https://i.ytimg.com/vi/4_P0qGVCEwQ/default.jpg', 'width': 120, 'height': 90}, 'medium': {'url': 'https://i.ytimg.com/vi/4_P0qGVCEwQ/mqdefault.jpg', 'width': 320, 'height': 180}, 'high': {'url': 'https://i.ytimg.com/vi/4_P0qGVCEwQ/hqdefault.jpg', 'width': 480, 'height': 360}}",Blackman Da Traveller,none,2026-07-01T01:36:59Z,4_P0qGVCEwQ,"<iframe width=""480"" height=""270"" src=""//www.youtube.com/embed/4_P0qGVCEwQ"" frameborder=""0"" allow=""accelerometer; autoplay; clipboard-write; encrypted-media; gyroscope; picture-in-picture; web-share"" referrerpolicy=""strict-origin-when-cross-origin"" allowfullscreen></iframe>",Travel
72,2026-07-01T00:57:22Z,UCAvjYgmwadC682OoC4Cc6TQ,LeBron James Is Finally DONE With The Lakers!!,LeBron James Is Finally DONE With The Los Angeles Lakers as The Gil's Arena Crew reacts to LeBron James saying goodbye to ...,"{'default': {'url': 'https://i.ytimg.com/vi/LV8dkrlG_98/default.jpg', 'width': 120, 'height': 90}, 'medium': {'url': 'https://i.ytimg.com/vi/LV8dkrlG_98/mqdefault.jpg', 'width': 320, 'height': 180}, 'high': {'url': 'https://i.ytimg.com/vi/LV8dkrlG_98/hqdefault.jpg', 'width': 480, 'height': 360}}",The Arena,none,2026-07-01T00:57:22Z,LV8dkrlG_98,"<iframe width=""480"" height=""270"" src=""//www.youtube.com/embed/LV8dkrlG_98"" frameborder=""0"" allow=""accelerometer; autoplay; clipboard-write; encrypted-media; gyroscope; picture-in-picture; web-share"" referrerpolicy=""strict-origin-when-cross-origin"" allowfullscreen></iframe>",Sports
33,2026-06-30T23:34:30Z,UCjBw2SidW7wFElbmj9bgDjw,I didn&#39;t realise how TRASH this study was...,"The Abusir El Meleq study, also knows as the Scheunemann and Krause study could be the biggest piece of fraudulent ...","{'default': {'url': 'https://i.ytimg.com/vi/yQh-GdQJdpM/default.jpg', 'width': 120, 'height': 90}, 'medium': {'url': 'https://i.ytimg.com/vi/yQh-GdQJdpM/mqdefault.jpg', 'width': 320, 'height': 180}, 'high': {'url': 'https://i.ytimg.com/vi/yQh-GdQJdpM/hqdefault.jpg', 'width': 480, 'height': 360}}",The Kings Monologue,none,2026-06-30T23:34:30Z,yQh-GdQJdpM,"<iframe width=""480"" height=""270"" src=""//www.youtube.com/embed/yQh-GdQJdpM"" frameborder=""0"" allow=""accelerometer; autoplay; clipboard-write; encrypted-media; gyroscope; picture-in-picture; web-share"" referrerpolicy=""strict-origin-when-cross-origin"" allowfullscreen></iframe>",History
40,2026-06-30T20:15:14Z,UCZEMyEeGRnkGERZTWEGLGPg,This Malcolm X Question Exposes the REAL Problem Today In America,"Black Culture Unlocked is about truth—real history, real stories, and real awareness. We reject rewritten narratives and reclaim ...","{'default': {'url': 'https://i.ytimg.com/vi/8vwZUCGsug0/default.jpg', 'width': 120, 'height': 90}, 'medium': {'url': 'https://i.ytimg.com/vi/8vwZUCGsug0/mqdefault.jpg', 'width': 320, 'height': 180}, 'high': {'url': 'https://i.ytimg.com/vi/8vwZUCGsug0/hqdefault.jpg', 'width': 480, 'height': 360}}",Black Culture Unlocked,none,2026-06-30T20:15:14Z,8vwZUCGsug0,"<iframe width=""480"" height=""270"" src=""//www.youtube.com/embed/8vwZUCGsug0"" frameborder=""0"" allow=""accelerometer; autoplay; clipboard-write; encrypted-media; gyroscope; picture-in-picture; web-share"" referrerpolicy=""strict-origin-when-cross-origin"" allowfullscreen></iframe>",Social Issues
6,2026-06-30T17:38:32Z,UC1ettU5YSf_nIOJWffCKGQw,dr. essop pahad silences journalist pushing white south african agenda,"Things take a drastic turn after journalist constantly asks about white people, Dr. Essop Pahad [1939-2013] speaks on ...","{'default': {'url': 'https://i.ytimg.com/vi/mwoSjX53WLg/default.jpg', 'width': 120, 'height': 90}, 'medium': {'url': 'https://i.ytimg.com/vi/mwoSjX53WLg/mqdefault.jpg', 'width': 320, 'height': 180}, 'high': {'url': 'https://i.ytimg.com/vi/mwoSjX53WLg/hqdefault.jpg', 'width': 480, 'height': 360}}",LuiSpot,none,2026-06-30T17:38:32Z,mwoSjX53WLg,"<iframe width=""480"" height=""360"" src=""//www.youtube.com/embed/mwoSjX53WLg"" frameborder=""0"" allow=""accelerometer; autoplay; clipboard-write; encrypted-media; gyroscope; picture-in-picture; web-share"" referrerpolicy=""strict-origin-when-cross-origin"" allowfullscreen></iframe>",Current Events
49,2026-06-30T16:28:47Z,UCxon93J-q95HA-V5TzTauig,"Michael Ward: Success, Fame... Then This? A Gifted Actor, A Devastating Fall","Did Michael Ward throw away his blessings? In today's video, I discuss the serious charges that actor Michael Ward is facing and ...","{'default': {'url': 'https://i.ytimg.com/vi/M2OHbdGYRoE/default.jpg', 'width': 120, 'height': 90}, 'medium': {'url': 'https://i.ytimg.com/vi/M2OHbdGYRoE/mqdefault.jpg', 'width': 320, 'height': 180}, 'high': {'url': 'https://i.ytimg.com/vi/M2OHbdGYRoE/hqdefault.jpg', 'width': 480, 'height': 360}}",The Drazzy Show,none,2026-06-30T16:28:47Z,M2OHbdGYRoE,"<iframe width=""480"" height=""270"" src=""//www.youtube.com/embed/M2OHbdGYRoE"" frameborder=""0"" allow=""accelerometer; autoplay; clipboard-write; encrypted-media; gyroscope; picture-in-picture; web-share"" referrerpolicy=""strict-origin-when-cross-origin"" allowfullscreen></iframe>",Social Issues
27,2026-06-30T16:22:16Z,UC12lU5ymIvSpgl8KntDQUQA,They&#39;re Bringing Back The Art But Losing The Knowledge,Patreon: https://www.patreon.com/HomeTeamHistory African Kings Book: ...,"{'default': {'url': 'https://i.ytimg.com/vi/_gwY5y7QnD4/default.jpg', 'width': 120, 'height': 90}, 'medium': {'url': 'https://i.ytimg.com/vi/_gwY5y7QnD4/mqdefault.jpg', 'width': 320, 'height': 180}, 'high': {'url': 'https://i.ytimg.com/vi/_gwY5y7QnD4/hqdefault.jpg', 'width': 480, 'height': 360}}",HomeTeam History,none,2026-06-30T16:22:16Z,_gwY5y7QnD4,"<iframe width=""480"" height=""270"" src=""//www.youtube.com/embed/_gwY5y7QnD4"" frameborder=""0"" allow=""accelerometer; autoplay; clipboard-write; encrypted-media; gyroscope; picture-in-picture; web-share"" referrerpolicy=""strict-origin-when-cross-origin"" allowfullscreen></iframe>",History
64,2026-06-29T16:57:22Z,UC2-nif4wvOqT6QVsBX3NOpA,Countries Locking Up Americans In Mass,You better know before you go! Americans are used to moving through the world like the rules are the same everywhere — but ...,"{'default': {'url': 'https://i.ytimg.com/vi/TdWB89Isjmc/default.jpg', 'width': 120, 'height': 90}, 'medium': {'url': 'https://i.ytimg.com/vi/TdWB89Isjmc/mqdefault.jpg', 'width': 320, 'height': 180}, 'high': {'url': 'https://i.ytimg.com/vi/TdWB89Isjmc/hqdefault.jpg', 'width': 480, 'height': 360}}",The Yarbros,none,2026-06-29T16:57:22Z,TdWB89Isjmc,"<iframe width=""480"" height=""270"" src=""//www.youtube.com/embed/TdWB89Isjmc"" frameborder=""0"" allow=""accelerometer; autoplay; clipboard-write; encrypted-media; gyroscope; picture-in-picture; web-share"" referrerpolicy=""strict-origin-when-cross-origin"" allowfullscreen></iframe>",Travel
71,2026-06-28T18:19:28Z,UCsY17ZnXg_Gmt9bWz49HoWw,"Control the Narrative, Celebrate Real Impact #substack #shorts",This is a clip from https://19keys.substack.com/p/the-real-why-the-nba-hate-jaylen?utm_source=youtube_shorts See the full video: ...,"{'default': {'url': 'https://i.ytimg.com/vi/DIRewxZjhgs/default.jpg', 'width': 120, 'height': 90}, 'medium': {'url': 'https://i.ytimg.com/vi/DIRewxZjhgs/mqdefault.jpg', 'width': 320, 'height': 180}, 'high': {'url': 'https://i.ytimg.com/vi/DIRewxZjhgs/hqdefault.jpg', 'width': 480, 'height': 360}}",19KEYS NETWORK,none,2026-06-28T18:19:28Z,DIRewxZjhgs,"<iframe width=""480"" height=""270"" src=""//www.youtube.com/embed/DIRewxZjhgs"" frameborder=""0"" allow=""accelerometer; autoplay; clipboard-write; encrypted-media; gyroscope; picture-in-picture; web-share"" referrerpolicy=""strict-origin-when-cross-origin"" allowfullscreen></iframe>",Productivity
65,2026-06-28T17:27:42Z,UClwrpH_Np9zk8uMwnMwu8Nw,I Visited the African Country You&#39;ve Never Heard Of 🇸🇹 (São Tomé &amp; Príncipe),The Image of AFRICA has been DISTORTED around the WORLD & We are CHANGING the NARRATIVE via YOUTUBE videos ...,"{'default': {'url': 'https://i.ytimg.com/vi/1XPdXAnwB7c/default.jpg', 'width': 120, 'height': 90}, 'medium': {'url': 'https://i.ytimg.com/vi/1XPdXAnwB7c/mqdefault.jpg', 'width': 320, 'height': 180}, 'high': {'url': 'https://i.ytimg.com/vi/1XPdXAnwB7c/hqdefault.jpg', 'width': 480, 'height': 360}}",WODE MAYA,none,2026-06-28T17:27:42Z,1XPdXAnwB7c,"<iframe width=""480"" height=""270"" src=""//www.youtube.com/embed/1XPdXAnwB7c"" frameborder=""0"" allow=""accelerometer; autoplay; clipboard-write; encrypted-media; gyroscope; picture-in-picture; web-share"" referrerpolicy=""strict-origin-when-cross-origin"" allowfullscreen></iframe>",Travel
31,2026-06-28T13:50:39Z,UC11aHtNnc5bEPLI4jf6mnYg,Dante #12 (Final): Purgatory Cantos 26-33,,"{'default': {'url': 'https://i.ytimg.com/vi/Sa5kffYLvBE/default.jpg', 'width': 120, 'height': 90}, 'medium': {'url': 'https://i.ytimg.com/vi/Sa5kffYLvBE/mqdefault.jpg', 'width': 320, 'height': 180}, 'high': {'url': 'https://i.ytimg.com/vi/Sa5kffYLvBE/hqdefault.jpg', 'width': 480, 'height': 360}}",Predictive History,none,2026-06-28T13:50:39Z,Sa5kffYLvBE,"<iframe width=""480"" height=""270"" src=""//www.youtube.com/embed/Sa5kffYLvBE"" frameborder=""0"" allow=""accelerometer; autoplay; clipboard-write; encrypted-media; gyroscope; picture-in-picture; web-share"" referrerpolicy=""strict-origin-when-cross-origin"" allowfullscreen></iframe>",History
23,2026-06-28T07:00:01Z,UCJa58Tf70HC5q2oQDNBrJ2g,UK vs Nigeria: The CRAZY Difference in Saying SORRY! #shorts,"Explore diverse apology customs, share personal travel and food adventures, and discover the joy of serving others and leaving a ...","{'default': {'url': 'https://i.ytimg.com/vi/cPt2RrkTmzM/default.jpg', 'width': 120, 'height': 90}, 'medium': {'url': 'https://i.ytimg.com/vi/cPt2RrkTmzM/mqdefault.jpg', 'width': 320, 'height': 180}, 'high': {'url': 'https://i.ytimg.com/vi/cPt2RrkTmzM/hqdefault.jpg', 'width': 480, 'height': 360}}",Obehi Ewanfoh,none,2026-06-28T07:00:01Z,cPt2RrkTmzM,"<iframe width=""480"" height=""270"" src=""//www.youtube.com/embed/cPt2RrkTmzM"" frameborder=""0"" allow=""accelerometer; autoplay; clipboard-write; encrypted-media; gyroscope; picture-in-picture; web-share"" referrerpolicy=""strict-origin-when-cross-origin"" allowfullscreen></iframe>",History
67,2026-06-27T17:39:05Z,UCy8BPJpTwXNLyL2vGCZu21Q,Relationships Have Too Many People In Them…,Huge thanks to Nourish for sponsoring today's video! Learn more and book your first appointment here: ...,"{'default': {'url': 'https://i.ytimg.com/vi/ye_LCW8MgtY/default.jpg', 'width': 120, 'height': 90}, 'medium': {'url': 'https://i.ytimg.com/vi/ye_LCW8MgtY/mqdefault.jpg', 'width': 320, 'height': 180}, 'high': {'url': 'https://i.ytimg.com/vi/ye_LCW8MgtY/hqdefault.jpg', 'width': 480, 'height': 360}}",Janae Danyiel,none,2026-06-27T17:39:05Z,ye_LCW8MgtY,"<iframe width=""480"" height=""270"" src=""//www.youtube.com/embed/ye_LCW8MgtY"" frameborder=""0"" allow=""accelerometer; autoplay; clipboard-write; encrypted-media; gyroscope; picture-in-picture; web-share"" referrerpolicy=""strict-origin-when-cross-origin"" allowfullscreen></iframe>",Social Issues
61,2026-06-27T17:00:10Z,UCpEf2jEfyAEbQesGgl1HOWA,I LEFT GHANA FOR SWITZERLAND!,switzerland #europe #livinginghana I left Ghana to explore Switzerland. I spent sometime exploring Lucerne and Zurich.Hope you ...,"{'default': {'url': 'https://i.ytimg.com/vi/sG2qYNzyZ4U/default.jpg', 'width': 120, 'height': 90}, 'medium': {'url': 'https://i.ytimg.com/vi/sG2qYNzyZ4U/mqdefault.jpg', 'width': 320, 'height': 180}, 'high': {'url': 'https://i.ytimg.com/vi/sG2qYNzyZ4U/hqdefault.jpg', 'width': 480, 'height': 360}}",Jasmine Ama,none,2026-06-27T17:00:10Z,sG2qYNzyZ4U,"<iframe width=""480"" height=""270"" src=""//www.youtube.com/embed/sG2qYNzyZ4U"" frameborder=""0"" allow=""accelerometer; autoplay; clipboard-write; encrypted-media; gyroscope; picture-in-picture; web-share"" referrerpolicy=""strict-origin-when-cross-origin"" allowfullscreen></iframe>",Travel
9,2026-06-24T05:27:27Z,UCMe6CgCi6TSZX1tUxuUvCGg,YOUTH VOICES COMING UP LIVE TONIGHT ON  PAN-AFRICAN DAILY TV,AFRICA'S AGENDA 2063 & THE ROLE OF AFRICA'S YOUTH The Africa We Want will not happen by accident. It will happen ...,"{'default': {'url': 'https://i.ytimg.com/vi/yxJAhizV1Gs/default.jpg', 'width': 120, 'height': 90}, 'medium': {'url': 'https://i.ytimg.com/vi/yxJAhizV1Gs/mqdefault.jpg', 'width': 320, 'height': 180}, 'high': {'url': 'https://i.ytimg.com/vi/yxJAhizV1Gs/hqdefault.jpg', 'width': 480, 'height': 360}}",Pan-African Daily TV official with Dr Susan Tatah ,none,2026-06-24T05:27:27Z,yxJAhizV1Gs,"<iframe width=""480"" height=""270"" src=""//www.youtube.com/embed/yxJAhizV1Gs"" frameborder=""0"" allow=""accelerometer; autoplay; clipboard-write; encrypted-media; gyroscope; picture-in-picture; web-share"" referrerpolicy=""strict-origin-when-cross-origin"" allowfullscreen></iframe>",Current Events
41,2026-06-23T13:45:06Z,UCWCreFX8bTVLJ6Y9lh6eZ5A,Louis Farrakhan — 150 Crimes Against Black America They Never Answered FOR,HELP SAVE THIS CHANNEL. They demonetized us for telling the truth.,"{'default': {'url': 'https://i.ytimg.com/vi/h7A-qWScRiM/default.jpg', 'width': 120, 'height': 90}, 'medium': {'url': 'https://i.ytimg.com/vi/h7A-qWScRiM/mqdefault.jpg', 'width': 320, 'height': 180}, 'high': {'url': 'https://i.ytimg.com/vi/h7A-qWScRiM/hqdefault.jpg', 'width': 480, 'height': 360}}",Black Journals,none,2026-06-23T13:45:06Z,h7A-qWScRiM,"<iframe width=""480"" height=""270"" src=""//www.youtube.com/embed/h7A-qWScRiM"" frameborder=""0"" allow=""accelerometer; autoplay; clipboard-write; encrypted-media; gyroscope; picture-in-picture; web-share"" referrerpolicy=""strict-origin-when-cross-origin"" allowfullscreen></iframe>",Social Issues
22,2026-06-21T17:00:39Z,UCJmmxwdAsR7lD8fBA_qbEMw,Why Idi Amin Shot His Own Army Chief,"In the early hours of Sunday, March 24, 1974, something unusual was happening on Radio Uganda. The country's only radio ...","{'default': {'url': 'https://i.ytimg.com/vi/HjS-r6bZBrI/default.jpg', 'width': 120, 'height': 90}, 'medium': {'url': 'https://i.ytimg.com/vi/HjS-r6bZBrI/mqdefault.jpg', 'width': 320, 'height': 180}, 'high': {'url': 'https://i.ytimg.com/vi/HjS-r6bZBrI/hqdefault.jpg', 'width': 480, 'height': 360}}",African Biographics,none,2026-06-21T17:00:39Z,HjS-r6bZBrI,"<iframe width=""480"" height=""270"" src=""//www.youtube.com/embed/HjS-r6bZBrI"" frameborder=""0"" allow=""accelerometer; autoplay; clipboard-write; encrypted-media; gyroscope; picture-in-picture; web-share"" referrerpolicy=""strict-origin-when-cross-origin"" allowfullscreen></iframe>",History
38,2026-06-20T16:46:53Z,UC4lH-odQ5ll-85fkpWxDYmA,i went behind the U.S-Mexico border wall… see what America is hiding,"In today's episode, I visited the U.S-Mexico border crossing to show you the tech the U.S. Customs and Border Protection is using ...","{'default': {'url': 'https://i.ytimg.com/vi/TVP8vPkZDUY/default.jpg', 'width': 120, 'height': 90}, 'medium': {'url': 'https://i.ytimg.com/vi/TVP8vPkZDUY/mqdefault.jpg', 'width': 320, 'height': 180}, 'high': {'url': 'https://i.ytimg.com/vi/TVP8vPkZDUY/hqdefault.jpg', 'width': 480, 'height': 360}}",Steven Ndukwu,none,2026-06-20T16:46:53Z,TVP8vPkZDUY,"<iframe width=""480"" height=""270"" src=""//www.youtube.com/embed/TVP8vPkZDUY"" frameborder=""0"" allow=""accelerometer; autoplay; clipboard-write; encrypted-media; gyroscope; picture-in-picture; web-share"" referrerpolicy=""strict-origin-when-cross-origin"" allowfullscreen></iframe>",Productivity
34,2026-06-15T04:07:32Z,UCIwGnOXoSXEI7Tooz3iKq5w,Hunting for one WHITE Pharaoh,Thirty dynasties. Three thousand years. And one question: can we find even one ancient Egyptian king from the true dynastic ...,"{'default': {'url': 'https://i.ytimg.com/vi/CvZ86mgb1hQ/default.jpg', 'width': 120, 'height': 90}, 'medium': {'url': 'https://i.ytimg.com/vi/CvZ86mgb1hQ/mqdefault.jpg', 'width': 320, 'height': 180}, 'high': {'url': 'https://i.ytimg.com/vi/CvZ86mgb1hQ/hqdefault.jpg', 'width': 480, 'height': 360}}",Without History,none,2026-06-15T04:07:32Z,CvZ86mgb1hQ,"<iframe width=""480"" height=""270"" src=""//www.youtube.com/embed/CvZ86mgb1hQ"" frameborder=""0"" allow=""accelerometer; autoplay; clipboard-write; encrypted-media; gyroscope; picture-in-picture; web-share"" referrerpolicy=""strict-origin-when-cross-origin"" allowfullscreen></iframe>",History
