,publishedAt,channelId,title,description,thumbnails,channelTitle,liveBroadcastContent,publishTime,videID,embeds,category
39,2024-05-30T17:51:26Z,UC2rmgVaijnf92nixlIZWGmg,We Celebrated Blues Legend Taj Mahal Bday In Senegal. #senegal #dakar #bday,Cash App: $amirdynast Please Subscribe Patreon: https://www.patreon.com/searchforuhuru Instagram: Searchforuhuru ...,"{'default': {'url': 'https://i.ytimg.com/vi/xVyCrpxMHdg/default.jpg', 'width': 120, 'height': 90}, 'medium': {'url': 'https://i.ytimg.com/vi/xVyCrpxMHdg/mqdefault.jpg', 'width': 320, 'height': 180}, 'high': {'url': 'https://i.ytimg.com/vi/xVyCrpxMHdg/hqdefault.jpg', 'width': 480, 'height': 360}}",Search For Uhuru,none,2024-05-30T17:51:26Z,xVyCrpxMHdg,"<iframe width=""480"" height=""270"" src=""//www.youtube.com/embed/xVyCrpxMHdg"" frameborder=""0"" allow=""accelerometer; autoplay; clipboard-write; encrypted-media; gyroscope; picture-in-picture; web-share"" referrerpolicy=""strict-origin-when-cross-origin"" allowfullscreen></iframe>",Travel
24,2024-05-30T15:02:15Z,UCwZ2vurIl_X8rv0Dv4mu12A,Converting A Mixed Number Into An Improper Fraction | All This Math,Become A 'I Never Knew Tv' Youtube Member: https://www.youtube.com/channel/UCwZ2vurIl_X8rv0Dv4mu12A/join Akil Parker is ...,"{'default': {'url': 'https://i.ytimg.com/vi/7mV4jsfgMr8/default.jpg', 'width': 120, 'height': 90}, 'medium': {'url': 'https://i.ytimg.com/vi/7mV4jsfgMr8/mqdefault.jpg', 'width': 320, 'height': 180}, 'high': {'url': 'https://i.ytimg.com/vi/7mV4jsfgMr8/hqdefault.jpg', 'width': 480, 'height': 360}}",I Never Knew Tv,none,2024-05-30T15:02:15Z,7mV4jsfgMr8,"<iframe width=""480"" height=""270"" src=""//www.youtube.com/embed/7mV4jsfgMr8"" frameborder=""0"" allow=""accelerometer; autoplay; clipboard-write; encrypted-media; gyroscope; picture-in-picture; web-share"" referrerpolicy=""strict-origin-when-cross-origin"" allowfullscreen></iframe>",Social Issues
40,2024-05-30T12:00:08Z,UCDsOKnUQnQek7-G7Xc5kB8Q,"AUTOMATE Your Online Business By Doing THESE Steps!!! - David, Donni &amp; Runway Billionaire #466",Learn How To Automate Your Social Media Channel: ...,"{'default': {'url': 'https://i.ytimg.com/vi/9dnVpU0s2NU/default.jpg', 'width': 120, 'height': 90}, 'medium': {'url': 'https://i.ytimg.com/vi/9dnVpU0s2NU/mqdefault.jpg', 'width': 320, 'height': 180}, 'high': {'url': 'https://i.ytimg.com/vi/9dnVpU0s2NU/hqdefault.jpg', 'width': 480, 'height': 360}}",Social Proof,none,2024-05-30T12:00:08Z,9dnVpU0s2NU,"<iframe width=""480"" height=""270"" src=""//www.youtube.com/embed/9dnVpU0s2NU"" frameborder=""0"" allow=""accelerometer; autoplay; clipboard-write; encrypted-media; gyroscope; picture-in-picture; web-share"" referrerpolicy=""strict-origin-when-cross-origin"" allowfullscreen></iframe>",Productivity
29,2024-05-30T09:18:22Z,UC1ettU5YSf_nIOJWffCKGQw,Barbados PM shuts down BBC reporter over working with China,Barbados Prime Minister Mia Mottley bodies BEEB'S journalist asking why they work with China despite being in United states ...,"{'default': {'url': 'https://i.ytimg.com/vi/e4TQqdao8zE/default.jpg', 'width': 120, 'height': 90}, 'medium': {'url': 'https://i.ytimg.com/vi/e4TQqdao8zE/mqdefault.jpg', 'width': 320, 'height': 180}, 'high': {'url': 'https://i.ytimg.com/vi/e4TQqdao8zE/hqdefault.jpg', 'width': 480, 'height': 360}}",LuiSpot,none,2024-05-30T09:18:22Z,e4TQqdao8zE,"<iframe width=""480"" height=""270"" src=""//www.youtube.com/embed/e4TQqdao8zE"" frameborder=""0"" allow=""accelerometer; autoplay; clipboard-write; encrypted-media; gyroscope; picture-in-picture; web-share"" referrerpolicy=""strict-origin-when-cross-origin"" allowfullscreen></iframe>",Current Events
11,2024-05-29T23:30:04Z,UCTNr0N__QwstBhgCtvQcjhA,Crockett vs. Mace: White Privilege Debate,"Welcome to an intense showdown: Crockett vs. Mace: White Privilege Debate! In this video, we see a heated debate between ...","{'default': {'url': 'https://i.ytimg.com/vi/RvcxuXTB9Bc/default.jpg', 'width': 120, 'height': 90}, 'medium': {'url': 'https://i.ytimg.com/vi/RvcxuXTB9Bc/mqdefault.jpg', 'width': 320, 'height': 180}, 'high': {'url': 'https://i.ytimg.com/vi/RvcxuXTB9Bc/hqdefault.jpg', 'width': 480, 'height': 360}}",Black Discoveries,none,2024-05-29T23:30:04Z,RvcxuXTB9Bc,"<iframe width=""480"" height=""270"" src=""//www.youtube.com/embed/RvcxuXTB9Bc"" frameborder=""0"" allow=""accelerometer; autoplay; clipboard-write; encrypted-media; gyroscope; picture-in-picture; web-share"" referrerpolicy=""strict-origin-when-cross-origin"" allowfullscreen></iframe>",History
23,2024-05-29T18:20:41Z,UC12lU5ymIvSpgl8KntDQUQA,Why No Plato Of Africa?,Patreon: https://www.patreon.com/HomeTeamHistory.,"{'default': {'url': 'https://i.ytimg.com/vi/slSZ6x8ya-0/default.jpg', 'width': 120, 'height': 90}, 'medium': {'url': 'https://i.ytimg.com/vi/slSZ6x8ya-0/mqdefault.jpg', 'width': 320, 'height': 180}, 'high': {'url': 'https://i.ytimg.com/vi/slSZ6x8ya-0/hqdefault.jpg', 'width': 480, 'height': 360}}",HomeTeam History,none,2024-05-29T18:20:41Z,slSZ6x8ya-0,"<iframe width=""480"" height=""270"" src=""//www.youtube.com/embed/slSZ6x8ya-0"" frameborder=""0"" allow=""accelerometer; autoplay; clipboard-write; encrypted-media; gyroscope; picture-in-picture; web-share"" referrerpolicy=""strict-origin-when-cross-origin"" allowfullscreen></iframe>",History
52,2024-05-29T04:26:14Z,UCIwGnOXoSXEI7Tooz3iKq5w,Alexander’s dad was …,,"{'default': {'url': 'https://i.ytimg.com/vi/4zx6h0r0Y_4/default.jpg', 'width': 120, 'height': 90}, 'medium': {'url': 'https://i.ytimg.com/vi/4zx6h0r0Y_4/mqdefault.jpg', 'width': 320, 'height': 180}, 'high': {'url': 'https://i.ytimg.com/vi/4zx6h0r0Y_4/hqdefault.jpg', 'width': 480, 'height': 360}}",Without History,none,2024-05-29T04:26:14Z,4zx6h0r0Y_4,"<iframe width=""480"" height=""270"" src=""//www.youtube.com/embed/4zx6h0r0Y_4"" frameborder=""0"" allow=""accelerometer; autoplay; clipboard-write; encrypted-media; gyroscope; picture-in-picture; web-share"" referrerpolicy=""strict-origin-when-cross-origin"" allowfullscreen></iframe>",History
53,2024-05-28T19:27:36Z,UClwrpH_Np9zk8uMwnMwu8Nw,You Wont Believe How I Hiked To The Peak Of Jamaica 🇯🇲,The Image of AFRICA has been DISTORTED around the WORLD & We are CHANGING the NARRATIVE via YOUTUBE videos ...,"{'default': {'url': 'https://i.ytimg.com/vi/AZzGFZ1S3Qw/default.jpg', 'width': 120, 'height': 90}, 'medium': {'url': 'https://i.ytimg.com/vi/AZzGFZ1S3Qw/mqdefault.jpg', 'width': 320, 'height': 180}, 'high': {'url': 'https://i.ytimg.com/vi/AZzGFZ1S3Qw/hqdefault.jpg', 'width': 480, 'height': 360}}",WODE MAYA,none,2024-05-28T19:27:36Z,AZzGFZ1S3Qw,"<iframe width=""480"" height=""270"" src=""//www.youtube.com/embed/AZzGFZ1S3Qw"" frameborder=""0"" allow=""accelerometer; autoplay; clipboard-write; encrypted-media; gyroscope; picture-in-picture; web-share"" referrerpolicy=""strict-origin-when-cross-origin"" allowfullscreen></iframe>",Travel
36,2024-05-28T12:55:25Z,UCF71yDQwxfw0QcYb2JnkB5Q,In Kenya Now and I’m Lost! What Should I Do? #shorts,,"{'default': {'url': 'https://i.ytimg.com/vi/6sBTsMqH24U/default.jpg', 'width': 120, 'height': 90}, 'medium': {'url': 'https://i.ytimg.com/vi/6sBTsMqH24U/mqdefault.jpg', 'width': 320, 'height': 180}, 'high': {'url': 'https://i.ytimg.com/vi/6sBTsMqH24U/hqdefault.jpg', 'width': 480, 'height': 360}}",PassportHeavy,none,2024-05-28T12:55:25Z,6sBTsMqH24U,"<iframe width=""480"" height=""270"" src=""//www.youtube.com/embed/6sBTsMqH24U"" frameborder=""0"" allow=""accelerometer; autoplay; clipboard-write; encrypted-media; gyroscope; picture-in-picture; web-share"" referrerpolicy=""strict-origin-when-cross-origin"" allowfullscreen></iframe>",Travel
28,2024-05-26T19:12:19Z,UCHbmePHjGH3pklvSla6szWw,The Life of Carter G. Woodson: The Importance of History &amp; Education,In this video we dive deep into the life of the African American Scholar Dr Carter G. Woodson and the importance of History and ...,"{'default': {'url': 'https://i.ytimg.com/vi/4WUTHbcFTEQ/default.jpg', 'width': 120, 'height': 90}, 'medium': {'url': 'https://i.ytimg.com/vi/4WUTHbcFTEQ/mqdefault.jpg', 'width': 320, 'height': 180}, 'high': {'url': 'https://i.ytimg.com/vi/4WUTHbcFTEQ/hqdefault.jpg', 'width': 480, 'height': 360}}",KueliMika,none,2024-05-26T19:12:19Z,4WUTHbcFTEQ,"<iframe width=""480"" height=""270"" src=""//www.youtube.com/embed/4WUTHbcFTEQ"" frameborder=""0"" allow=""accelerometer; autoplay; clipboard-write; encrypted-media; gyroscope; picture-in-picture; web-share"" referrerpolicy=""strict-origin-when-cross-origin"" allowfullscreen></iframe>",History
38,2024-05-25T08:10:03Z,UCCfgU1Dgpz0MzA-4vP_gRuQ,Morocco,Support us on Patreon: https://www.patreon.com/risenafrica Stay tuned and remember to subscribe.,"{'default': {'url': 'https://i.ytimg.com/vi/i8EZiHZBQ5w/default.jpg', 'width': 120, 'height': 90}, 'medium': {'url': 'https://i.ytimg.com/vi/i8EZiHZBQ5w/mqdefault.jpg', 'width': 320, 'height': 180}, 'high': {'url': 'https://i.ytimg.com/vi/i8EZiHZBQ5w/hqdefault.jpg', 'width': 480, 'height': 360}}",Risen Africa,none,2024-05-25T08:10:03Z,i8EZiHZBQ5w,"<iframe width=""480"" height=""270"" src=""//www.youtube.com/embed/i8EZiHZBQ5w"" frameborder=""0"" allow=""accelerometer; autoplay; clipboard-write; encrypted-media; gyroscope; picture-in-picture; web-share"" referrerpolicy=""strict-origin-when-cross-origin"" allowfullscreen></iframe>",Current Events
27,2024-05-22T16:20:46Z,UC__wkIWEfbnTAYVT8j6gfPg,Gram Hancock on Black African Origin of ancient Egypt #GramHancock #JoeRogan #BlackEgypt,,"{'default': {'url': 'https://i.ytimg.com/vi/HVqqABsnvP0/default.jpg', 'width': 120, 'height': 90}, 'medium': {'url': 'https://i.ytimg.com/vi/HVqqABsnvP0/mqdefault.jpg', 'width': 320, 'height': 180}, 'high': {'url': 'https://i.ytimg.com/vi/HVqqABsnvP0/hqdefault.jpg', 'width': 480, 'height': 360}}",Know Thyself,none,2024-05-22T16:20:46Z,HVqqABsnvP0,"<iframe width=""480"" height=""270"" src=""//www.youtube.com/embed/HVqqABsnvP0"" frameborder=""0"" allow=""accelerometer; autoplay; clipboard-write; encrypted-media; gyroscope; picture-in-picture; web-share"" referrerpolicy=""strict-origin-when-cross-origin"" allowfullscreen></iframe>",History
32,2024-05-15T16:09:28Z,UCh2ANLALdN1OZUJKmvchkkg,Why Greeks Became So Powerful?,WATCH FULL VIDEO HERE: https://youtu.be/ahxLfwLkFTIg #imhotepfacts.,"{'default': {'url': 'https://i.ytimg.com/vi/2aruE07iMWc/default.jpg', 'width': 120, 'height': 90}, 'medium': {'url': 'https://i.ytimg.com/vi/2aruE07iMWc/mqdefault.jpg', 'width': 320, 'height': 180}, 'high': {'url': 'https://i.ytimg.com/vi/2aruE07iMWc/hqdefault.jpg', 'width': 480, 'height': 360}}",Mr. Imhotep,none,2024-05-15T16:09:28Z,2aruE07iMWc,"<iframe width=""480"" height=""270"" src=""//www.youtube.com/embed/2aruE07iMWc"" frameborder=""0"" allow=""accelerometer; autoplay; clipboard-write; encrypted-media; gyroscope; picture-in-picture; web-share"" referrerpolicy=""strict-origin-when-cross-origin"" allowfullscreen></iframe>",History
31,2024-05-15T12:59:49Z,UC4YZVeGnDXzEfjGcZG-d6oQ,What Do Lab Grown Diamonds Have To Do With Epstein Island? Pt 2.,Whistle-blower tells the truth about incinerators used for babies to make diamonds.,"{'default': {'url': 'https://i.ytimg.com/vi/BWGcTl0CYzg/default.jpg', 'width': 120, 'height': 90}, 'medium': {'url': 'https://i.ytimg.com/vi/BWGcTl0CYzg/mqdefault.jpg', 'width': 320, 'height': 180}, 'high': {'url': 'https://i.ytimg.com/vi/BWGcTl0CYzg/hqdefault.jpg', 'width': 480, 'height': 360}}",meandepiphany,none,2024-05-15T12:59:49Z,BWGcTl0CYzg,"<iframe width=""480"" height=""270"" src=""//www.youtube.com/embed/BWGcTl0CYzg"" frameborder=""0"" allow=""accelerometer; autoplay; clipboard-write; encrypted-media; gyroscope; picture-in-picture; web-share"" referrerpolicy=""strict-origin-when-cross-origin"" allowfullscreen></iframe>",Social Issues
51,2024-05-08T17:11:13Z,UCXyHjFIKz9D8ofxObOuYBbg,"Man, Bear, or Pig",WeNeedToTalk #BlackLove To support our ministry: https://cash.app/$wnttalk Please SUBSCRIBE for more content!,"{'default': {'url': 'https://i.ytimg.com/vi/9U3UjSin5dM/default.jpg', 'width': 120, 'height': 90}, 'medium': {'url': 'https://i.ytimg.com/vi/9U3UjSin5dM/mqdefault.jpg', 'width': 320, 'height': 180}, 'high': {'url': 'https://i.ytimg.com/vi/9U3UjSin5dM/hqdefault.jpg', 'width': 480, 'height': 360}}",WeNeedToTalk,none,2024-05-08T17:11:13Z,9U3UjSin5dM,"<iframe width=""480"" height=""270"" src=""//www.youtube.com/embed/9U3UjSin5dM"" frameborder=""0"" allow=""accelerometer; autoplay; clipboard-write; encrypted-media; gyroscope; picture-in-picture; web-share"" referrerpolicy=""strict-origin-when-cross-origin"" allowfullscreen></iframe>",Social Issues
3,2024-04-25T23:00:06Z,UCTTQWaoGloNuhunZevQ2F6g,"Kuubwa Transforming African Businesses: Fabric Weaver, Fish Farmers","Kuubwa Transforms African Businesses: Fish Farmers, Fabric Manufacturers and more.","{'default': {'url': 'https://i.ytimg.com/vi/gC02Wht1UQQ/default.jpg', 'width': 120, 'height': 90}, 'medium': {'url': 'https://i.ytimg.com/vi/gC02Wht1UQQ/mqdefault.jpg', 'width': 320, 'height': 180}, 'high': {'url': 'https://i.ytimg.com/vi/gC02Wht1UQQ/hqdefault.jpg', 'width': 480, 'height': 360}}",Africa Business Channel TV,none,2024-04-25T23:00:06Z,gC02Wht1UQQ,"<iframe width=""480"" height=""270"" src=""//www.youtube.com/embed/gC02Wht1UQQ"" frameborder=""0"" allow=""accelerometer; autoplay; clipboard-write; encrypted-media; gyroscope; picture-in-picture; web-share"" referrerpolicy=""strict-origin-when-cross-origin"" allowfullscreen></iframe>",Productivity
15,2024-04-21T18:00:21Z,UCMMTYgqKEgCgy1pR6Axlf0A,He moved to Ghana and built a 2 bedroom house |Breakdown of costs to build this home|Exploring Asebu,"You could spend $10000 to $15000 to build a similar home, without Ron's specifications, according to the builder. Exploring ...","{'default': {'url': 'https://i.ytimg.com/vi/_j99iYQFiMs/default.jpg', 'width': 120, 'height': 90}, 'medium': {'url': 'https://i.ytimg.com/vi/_j99iYQFiMs/mqdefault.jpg', 'width': 320, 'height': 180}, 'high': {'url': 'https://i.ytimg.com/vi/_j99iYQFiMs/hqdefault.jpg', 'width': 480, 'height': 360}}",Build with Amoaa,none,2024-04-21T18:00:21Z,_j99iYQFiMs,"<iframe width=""480"" height=""270"" src=""//www.youtube.com/embed/_j99iYQFiMs"" frameborder=""0"" allow=""accelerometer; autoplay; clipboard-write; encrypted-media; gyroscope; picture-in-picture; web-share"" referrerpolicy=""strict-origin-when-cross-origin"" allowfullscreen></iframe>",Travel
42,2024-04-11T05:04:02Z,UCuvO0y2EU_kRfYzlhGJNOKA,How Did America&#39;s Wealthy Elite Re Write World History,"The United States was supposed to be a democratically run country. However, that has not been the case since the turn of the ...","{'default': {'url': 'https://i.ytimg.com/vi/RPSnS-ucmOA/default.jpg', 'width': 120, 'height': 90}, 'medium': {'url': 'https://i.ytimg.com/vi/RPSnS-ucmOA/mqdefault.jpg', 'width': 320, 'height': 180}, 'high': {'url': 'https://i.ytimg.com/vi/RPSnS-ucmOA/hqdefault.jpg', 'width': 480, 'height': 360}}",Straight UP,none,2024-04-11T05:04:02Z,RPSnS-ucmOA,"<iframe width=""480"" height=""270"" src=""//www.youtube.com/embed/RPSnS-ucmOA"" frameborder=""0"" allow=""accelerometer; autoplay; clipboard-write; encrypted-media; gyroscope; picture-in-picture; web-share"" referrerpolicy=""strict-origin-when-cross-origin"" allowfullscreen></iframe>",History
43,2024-04-11T05:04:02Z,UCuvO0y2EU_kRfYzlhGJNOKA,How Did America&#39;s Wealthy Elite Re Write World History,"The United States was supposed to be a democratically run country. However, that has not been the case since the turn of the ...","{'default': {'url': 'https://i.ytimg.com/vi/RPSnS-ucmOA/default.jpg', 'width': 120, 'height': 90}, 'medium': {'url': 'https://i.ytimg.com/vi/RPSnS-ucmOA/mqdefault.jpg', 'width': 320, 'height': 180}, 'high': {'url': 'https://i.ytimg.com/vi/RPSnS-ucmOA/hqdefault.jpg', 'width': 480, 'height': 360}}",Straight UP,none,2024-04-11T05:04:02Z,RPSnS-ucmOA,"<iframe width=""480"" height=""270"" src=""//www.youtube.com/embed/RPSnS-ucmOA"" frameborder=""0"" allow=""accelerometer; autoplay; clipboard-write; encrypted-media; gyroscope; picture-in-picture; web-share"" referrerpolicy=""strict-origin-when-cross-origin"" allowfullscreen></iframe>",History
10,2024-03-18T19:44:38Z,UC2xX2FI6s4i9xz3t9qjayhg,Gamal Abdel Nasser issues his support for Palestine,,"{'default': {'url': 'https://i.ytimg.com/vi/_LX3AlOaJw4/default.jpg', 'width': 120, 'height': 90}, 'medium': {'url': 'https://i.ytimg.com/vi/_LX3AlOaJw4/mqdefault.jpg', 'width': 320, 'height': 180}, 'high': {'url': 'https://i.ytimg.com/vi/_LX3AlOaJw4/hqdefault.jpg', 'width': 480, 'height': 360}}",AfroMarxist,none,2024-03-18T19:44:38Z,_LX3AlOaJw4,"<iframe width=""480"" height=""270"" src=""//www.youtube.com/embed/_LX3AlOaJw4"" frameborder=""0"" allow=""accelerometer; autoplay; clipboard-write; encrypted-media; gyroscope; picture-in-picture; web-share"" referrerpolicy=""strict-origin-when-cross-origin"" allowfullscreen></iframe>",History
33,2024-03-07T16:28:34Z,UCJH-fn0wLu5uwXX33jNToQw,Life in post-apartheid South Africa | Thabo Makhetha-Kwinana,"southafrica #apartheid #segregation #africanpodcast #africantopics Lesotho-born, South Africa raised fashion designer, Thabo ...","{'default': {'url': 'https://i.ytimg.com/vi/NbWALkH-3Ks/default.jpg', 'width': 120, 'height': 90}, 'medium': {'url': 'https://i.ytimg.com/vi/NbWALkH-3Ks/mqdefault.jpg', 'width': 320, 'height': 180}, 'high': {'url': 'https://i.ytimg.com/vi/NbWALkH-3Ks/hqdefault.jpg', 'width': 480, 'height': 360}}",NewAfrica,none,2024-03-07T16:28:34Z,NbWALkH-3Ks,"<iframe width=""480"" height=""270"" src=""//www.youtube.com/embed/NbWALkH-3Ks"" frameborder=""0"" allow=""accelerometer; autoplay; clipboard-write; encrypted-media; gyroscope; picture-in-picture; web-share"" referrerpolicy=""strict-origin-when-cross-origin"" allowfullscreen></iframe>",Current Events
49,2024-03-03T20:37:39Z,UC2-nif4wvOqT6QVsBX3NOpA,The Black American Tribe They Tried to Hide,"They beat the US, burned down their captors plantations, walked the Trail of Tears, forced their own emancipation and then ...","{'default': {'url': 'https://i.ytimg.com/vi/ErU7KghYgY0/default.jpg', 'width': 120, 'height': 90}, 'medium': {'url': 'https://i.ytimg.com/vi/ErU7KghYgY0/mqdefault.jpg', 'width': 320, 'height': 180}, 'high': {'url': 'https://i.ytimg.com/vi/ErU7KghYgY0/hqdefault.jpg', 'width': 480, 'height': 360}}",The Yarbros,none,2024-03-03T20:37:39Z,ErU7KghYgY0,"<iframe width=""480"" height=""270"" src=""//www.youtube.com/embed/ErU7KghYgY0"" frameborder=""0"" allow=""accelerometer; autoplay; clipboard-write; encrypted-media; gyroscope; picture-in-picture; web-share"" referrerpolicy=""strict-origin-when-cross-origin"" allowfullscreen></iframe>",Travel
9,2024-02-18T12:24:50Z,UCbvE_5m8kmm9U58gDHtzYrA,Sebastien Haller’s story is one of one!,,"{'default': {'url': 'https://i.ytimg.com/vi/7fWV5yJGqAU/default.jpg', 'width': 120, 'height': 90}, 'medium': {'url': 'https://i.ytimg.com/vi/7fWV5yJGqAU/mqdefault.jpg', 'width': 320, 'height': 180}, 'high': {'url': 'https://i.ytimg.com/vi/7fWV5yJGqAU/hqdefault.jpg', 'width': 480, 'height': 360}}",AfroBallers,none,2024-02-18T12:24:50Z,7fWV5yJGqAU,"<iframe width=""480"" height=""270"" src=""//www.youtube.com/embed/7fWV5yJGqAU"" frameborder=""0"" allow=""accelerometer; autoplay; clipboard-write; encrypted-media; gyroscope; picture-in-picture; web-share"" referrerpolicy=""strict-origin-when-cross-origin"" allowfullscreen></iframe>",Sports
8,2023-10-24T10:46:00Z,UCl6to6J7oVltnhHEVm1s87A,"On 1859, Dangerfield Newby died in Virginia. He was a member of the John Brown raiders.",theperspective #africanhistory #africanews #africax5 This is the actual man on which the movie D'Jango Unchained is loosely ...,"{'default': {'url': 'https://i.ytimg.com/vi/Ax87yi9Zn1E/default.jpg', 'width': 120, 'height': 90}, 'medium': {'url': 'https://i.ytimg.com/vi/Ax87yi9Zn1E/mqdefault.jpg', 'width': 320, 'height': 180}, 'high': {'url': 'https://i.ytimg.com/vi/Ax87yi9Zn1E/hqdefault.jpg', 'width': 480, 'height': 360}}",Africax5 Network,none,2023-10-24T10:46:00Z,Ax87yi9Zn1E,"<iframe width=""480"" height=""360"" src=""//www.youtube.com/embed/Ax87yi9Zn1E"" frameborder=""0"" allow=""accelerometer; autoplay; clipboard-write; encrypted-media; gyroscope; picture-in-picture; web-share"" referrerpolicy=""strict-origin-when-cross-origin"" allowfullscreen></iframe>",Social Issues
