,publishedAt,channelId,title,description,thumbnails,channelTitle,liveBroadcastContent,publishTime,videoID,embeds,category
50,2024-10-25T21:30:05Z,UCXyHjFIKz9D8ofxObOuYBbg,It&#39;s NOT our fault ft. @JRWisdom  [The Table Episode 6],blacklove #weneedtotalk To support our ministry: https://cash.app/$wnttalk Please SUBSCRIBE for more content!! Shot by: ...,"{'default': {'url': 'https://i.ytimg.com/vi/hLxo05fPKtU/default.jpg', 'width': 120, 'height': 90}, 'medium': {'url': 'https://i.ytimg.com/vi/hLxo05fPKtU/mqdefault.jpg', 'width': 320, 'height': 180}, 'high': {'url': 'https://i.ytimg.com/vi/hLxo05fPKtU/hqdefault.jpg', 'width': 480, 'height': 360}}",WeNeedToTalk,none,2024-10-25T21:30:05Z,hLxo05fPKtU,"<iframe width=""480"" height=""270"" src=""//www.youtube.com/embed/hLxo05fPKtU"" frameborder=""0"" allow=""accelerometer; autoplay; clipboard-write; encrypted-media; gyroscope; picture-in-picture; web-share"" referrerpolicy=""strict-origin-when-cross-origin"" allowfullscreen></iframe>",Social Issues
35,2024-10-25T20:15:57Z,UCF71yDQwxfw0QcYb2JnkB5Q,The Ultimate Yacht Experience – Your chance to Join a Passport Heavy Trip 🛥️,,"{'default': {'url': 'https://i.ytimg.com/vi/f-XFLhU4fgw/default.jpg', 'width': 120, 'height': 90}, 'medium': {'url': 'https://i.ytimg.com/vi/f-XFLhU4fgw/mqdefault.jpg', 'width': 320, 'height': 180}, 'high': {'url': 'https://i.ytimg.com/vi/f-XFLhU4fgw/hqdefault.jpg', 'width': 480, 'height': 360}}",PassportHeavy,none,2024-10-25T20:15:57Z,f-XFLhU4fgw,"<iframe width=""480"" height=""270"" src=""//www.youtube.com/embed/f-XFLhU4fgw"" frameborder=""0"" allow=""accelerometer; autoplay; clipboard-write; encrypted-media; gyroscope; picture-in-picture; web-share"" referrerpolicy=""strict-origin-when-cross-origin"" allowfullscreen></iframe>",Travel
28,2024-10-25T10:45:11Z,UC1ettU5YSf_nIOJWffCKGQw,fearless ipu president shuts the west over visit to russia,IPU president From Tanzania Dr. Tulia Ackson shuts down western stooges in her defence for visiting russia and shaking hands ...,"{'default': {'url': 'https://i.ytimg.com/vi/TWUqAYOFUMo/default.jpg', 'width': 120, 'height': 90}, 'medium': {'url': 'https://i.ytimg.com/vi/TWUqAYOFUMo/mqdefault.jpg', 'width': 320, 'height': 180}, 'high': {'url': 'https://i.ytimg.com/vi/TWUqAYOFUMo/hqdefault.jpg', 'width': 480, 'height': 360}}",LuiSpot,none,2024-10-25T10:45:11Z,TWUqAYOFUMo,"<iframe width=""480"" height=""270"" src=""//www.youtube.com/embed/TWUqAYOFUMo"" frameborder=""0"" allow=""accelerometer; autoplay; clipboard-write; encrypted-media; gyroscope; picture-in-picture; web-share"" referrerpolicy=""strict-origin-when-cross-origin"" allowfullscreen></iframe>",Current Events
19,2024-10-25T08:00:06Z,UCF-A_4x9-bLrxXrmgBOWuJA,EFF Podcast Episode 51| Parliamentary Sovereignty| Two-Pot System| Papa Joy.,"EFF CCT Member and Member of Parliament Commissar Sinawo Thambo joins Tshungu Titus in this week's episode, reflecting ...","{'default': {'url': 'https://i.ytimg.com/vi/ojj7tSc_MxE/default.jpg', 'width': 120, 'height': 90}, 'medium': {'url': 'https://i.ytimg.com/vi/ojj7tSc_MxE/mqdefault.jpg', 'width': 320, 'height': 180}, 'high': {'url': 'https://i.ytimg.com/vi/ojj7tSc_MxE/hqdefault.jpg', 'width': 480, 'height': 360}}",Economic Freedom Fighters,none,2024-10-25T08:00:06Z,ojj7tSc_MxE,"<iframe width=""480"" height=""270"" src=""//www.youtube.com/embed/ojj7tSc_MxE"" frameborder=""0"" allow=""accelerometer; autoplay; clipboard-write; encrypted-media; gyroscope; picture-in-picture; web-share"" referrerpolicy=""strict-origin-when-cross-origin"" allowfullscreen></iframe>",Current Events
6,2024-10-24T22:00:40Z,UCJa58Tf70HC5q2oQDNBrJ2g,Building Collective Narratives With Our Stories - The Diaspora Storytelling Series,"Building collective narratives with our stories is vital for the African diaspora, as it fosters unity and a shared identity. By sharing ...","{'default': {'url': 'https://i.ytimg.com/vi/q9VsUNzp94w/default.jpg', 'width': 120, 'height': 90}, 'medium': {'url': 'https://i.ytimg.com/vi/q9VsUNzp94w/mqdefault.jpg', 'width': 320, 'height': 180}, 'high': {'url': 'https://i.ytimg.com/vi/q9VsUNzp94w/hqdefault.jpg', 'width': 480, 'height': 360}}",African Diaspora Storytelling,none,2024-10-24T22:00:40Z,q9VsUNzp94w,"<iframe width=""480"" height=""270"" src=""//www.youtube.com/embed/q9VsUNzp94w"" frameborder=""0"" allow=""accelerometer; autoplay; clipboard-write; encrypted-media; gyroscope; picture-in-picture; web-share"" referrerpolicy=""strict-origin-when-cross-origin"" allowfullscreen></iframe>",History
39,2024-10-24T19:00:16Z,UCDsOKnUQnQek7-G7Xc5kB8Q,How To Sell A Curriculum To Schools,"David sits down with Joel Boyce, a high school assistant principal and curriculum developer, to dive deep into the world of ...","{'default': {'url': 'https://i.ytimg.com/vi/U1MyBqW0mi0/default.jpg', 'width': 120, 'height': 90}, 'medium': {'url': 'https://i.ytimg.com/vi/U1MyBqW0mi0/mqdefault.jpg', 'width': 320, 'height': 180}, 'high': {'url': 'https://i.ytimg.com/vi/U1MyBqW0mi0/hqdefault.jpg', 'width': 480, 'height': 360}}",Social Proof,none,2024-10-24T19:00:16Z,U1MyBqW0mi0,"<iframe width=""480"" height=""270"" src=""//www.youtube.com/embed/U1MyBqW0mi0"" frameborder=""0"" allow=""accelerometer; autoplay; clipboard-write; encrypted-media; gyroscope; picture-in-picture; web-share"" referrerpolicy=""strict-origin-when-cross-origin"" allowfullscreen></iframe>",Productivity
4,2024-10-24T18:00:39Z,UCJmmxwdAsR7lD8fBA_qbEMw,Meet Mozambique&#39;s New Leader Daniel Chapo | Mozambique Elections,"As Mozambique prepares for a political transition, the nation is set to see the rise of a new leader: Daniel Chapo. The 47-year-old ...","{'default': {'url': 'https://i.ytimg.com/vi/zGDVwDz1ffQ/default.jpg', 'width': 120, 'height': 90}, 'medium': {'url': 'https://i.ytimg.com/vi/zGDVwDz1ffQ/mqdefault.jpg', 'width': 320, 'height': 180}, 'high': {'url': 'https://i.ytimg.com/vi/zGDVwDz1ffQ/hqdefault.jpg', 'width': 480, 'height': 360}}",African Biographics,none,2024-10-24T18:00:39Z,zGDVwDz1ffQ,"<iframe width=""480"" height=""270"" src=""//www.youtube.com/embed/zGDVwDz1ffQ"" frameborder=""0"" allow=""accelerometer; autoplay; clipboard-write; encrypted-media; gyroscope; picture-in-picture; web-share"" referrerpolicy=""strict-origin-when-cross-origin"" allowfullscreen></iframe>",History
51,2024-10-23T21:15:28Z,UCIwGnOXoSXEI7Tooz3iKq5w,The 8th WONDER of the WORLD.,,"{'default': {'url': 'https://i.ytimg.com/vi/AIrdZGmbvKI/default.jpg', 'width': 120, 'height': 90}, 'medium': {'url': 'https://i.ytimg.com/vi/AIrdZGmbvKI/mqdefault.jpg', 'width': 320, 'height': 180}, 'high': {'url': 'https://i.ytimg.com/vi/AIrdZGmbvKI/hqdefault.jpg', 'width': 480, 'height': 360}}",Without History,none,2024-10-23T21:15:28Z,AIrdZGmbvKI,"<iframe width=""480"" height=""270"" src=""//www.youtube.com/embed/AIrdZGmbvKI"" frameborder=""0"" allow=""accelerometer; autoplay; clipboard-write; encrypted-media; gyroscope; picture-in-picture; web-share"" referrerpolicy=""strict-origin-when-cross-origin"" allowfullscreen></iframe>",History
44,2024-10-23T17:30:24Z,UCLjzzg-cFWpEEjnWCOpXp3Q,Sister Betty Davis says get your letters in by October 30th,Sister Betty Davis of the New Abolitionist Movement is calling on you to get your letters in by the new deadline October 30th.,"{'default': {'url': 'https://i.ytimg.com/vi/x1fN9oRn2OQ/default.jpg', 'width': 120, 'height': 90}, 'medium': {'url': 'https://i.ytimg.com/vi/x1fN9oRn2OQ/mqdefault.jpg', 'width': 320, 'height': 180}, 'high': {'url': 'https://i.ytimg.com/vi/x1fN9oRn2OQ/hqdefault.jpg', 'width': 480, 'height': 360}}",The Burning Spear TV,none,2024-10-23T17:30:24Z,x1fN9oRn2OQ,"<iframe width=""480"" height=""270"" src=""//www.youtube.com/embed/x1fN9oRn2OQ"" frameborder=""0"" allow=""accelerometer; autoplay; clipboard-write; encrypted-media; gyroscope; picture-in-picture; web-share"" referrerpolicy=""strict-origin-when-cross-origin"" allowfullscreen></iframe>",Current Events
40,2024-10-23T16:34:24Z,UC4lH-odQ5ll-85fkpWxDYmA,This will change your mind about visiting Egypt 🇪🇬 FOREVER,"Download the Egypt Travel Guide https://bit.ly/egypttravelguide In today's episode, I visited the ancient country of Egypt, known for ...","{'default': {'url': 'https://i.ytimg.com/vi/V-rqY9doiC0/default.jpg', 'width': 120, 'height': 90}, 'medium': {'url': 'https://i.ytimg.com/vi/V-rqY9doiC0/mqdefault.jpg', 'width': 320, 'height': 180}, 'high': {'url': 'https://i.ytimg.com/vi/V-rqY9doiC0/hqdefault.jpg', 'width': 480, 'height': 360}}",Steven Ndukwu,none,2024-10-23T16:34:24Z,V-rqY9doiC0,"<iframe width=""480"" height=""270"" src=""//www.youtube.com/embed/V-rqY9doiC0"" frameborder=""0"" allow=""accelerometer; autoplay; clipboard-write; encrypted-media; gyroscope; picture-in-picture; web-share"" referrerpolicy=""strict-origin-when-cross-origin"" allowfullscreen></iframe>",Productivity
36,2024-10-23T14:30:06Z,UCPk29gUc_ltOGQ6f3Lh5kCg,P. Diddy Documentary (2001) | Sean Combs Puff Daddy Brother Love,Cable TV documentary from 2001 about the charismatic yet embattled rap mogul. ----- ##### Please support this channel by ...,"{'default': {'url': 'https://i.ytimg.com/vi/-2qd7xbjPL4/default.jpg', 'width': 120, 'height': 90}, 'medium': {'url': 'https://i.ytimg.com/vi/-2qd7xbjPL4/mqdefault.jpg', 'width': 320, 'height': 180}, 'high': {'url': 'https://i.ytimg.com/vi/-2qd7xbjPL4/hqdefault.jpg', 'width': 480, 'height': 360}}",Reelblack One,none,2024-10-23T14:30:06Z,-2qd7xbjPL4,"<iframe width=""480"" height=""270"" src=""//www.youtube.com/embed/-2qd7xbjPL4"" frameborder=""0"" allow=""accelerometer; autoplay; clipboard-write; encrypted-media; gyroscope; picture-in-picture; web-share"" referrerpolicy=""strict-origin-when-cross-origin"" allowfullscreen></iframe>",Entertainment
22,2024-10-18T16:00:42Z,UC12lU5ymIvSpgl8KntDQUQA,Prejudice In Medieval West Africa,Patreon: https://www.patreon.com/HomeTeamHistory.,"{'default': {'url': 'https://i.ytimg.com/vi/_lnXuuCUbxI/default.jpg', 'width': 120, 'height': 90}, 'medium': {'url': 'https://i.ytimg.com/vi/_lnXuuCUbxI/mqdefault.jpg', 'width': 320, 'height': 180}, 'high': {'url': 'https://i.ytimg.com/vi/_lnXuuCUbxI/hqdefault.jpg', 'width': 480, 'height': 360}}",HomeTeam History,none,2024-10-18T16:00:42Z,_lnXuuCUbxI,"<iframe width=""480"" height=""270"" src=""//www.youtube.com/embed/_lnXuuCUbxI"" frameborder=""0"" allow=""accelerometer; autoplay; clipboard-write; encrypted-media; gyroscope; picture-in-picture; web-share"" referrerpolicy=""strict-origin-when-cross-origin"" allowfullscreen></iframe>",History
53,2024-10-11T03:31:36Z,UCx5Y5d5KgibkG9KAyknCdFA,YG sends Nipsey off right,,"{'default': {'url': 'https://i.ytimg.com/vi/4weyjPzcvHo/default.jpg', 'width': 120, 'height': 90}, 'medium': {'url': 'https://i.ytimg.com/vi/4weyjPzcvHo/mqdefault.jpg', 'width': 320, 'height': 180}, 'high': {'url': 'https://i.ytimg.com/vi/4weyjPzcvHo/hqdefault.jpg', 'width': 480, 'height': 360}}",Afromation Digital,none,2024-10-11T03:31:36Z,4weyjPzcvHo,"<iframe width=""480"" height=""270"" src=""//www.youtube.com/embed/4weyjPzcvHo"" frameborder=""0"" allow=""accelerometer; autoplay; clipboard-write; encrypted-media; gyroscope; picture-in-picture; web-share"" referrerpolicy=""strict-origin-when-cross-origin"" allowfullscreen></iframe>",Social Issues
9,2024-08-31T16:32:50Z,UC2xX2FI6s4i9xz3t9qjayhg,The San Quentin Six (1972),"A documentary on the six Black and Chicano prisoners who, following George Jackson's death, were charged on charges of ...","{'default': {'url': 'https://i.ytimg.com/vi/E-4CUaaSo4I/default.jpg', 'width': 120, 'height': 90}, 'medium': {'url': 'https://i.ytimg.com/vi/E-4CUaaSo4I/mqdefault.jpg', 'width': 320, 'height': 180}, 'high': {'url': 'https://i.ytimg.com/vi/E-4CUaaSo4I/hqdefault.jpg', 'width': 480, 'height': 360}}",AfroMarxist,none,2024-08-31T16:32:50Z,E-4CUaaSo4I,"<iframe width=""480"" height=""360"" src=""//www.youtube.com/embed/E-4CUaaSo4I"" frameborder=""0"" allow=""accelerometer; autoplay; clipboard-write; encrypted-media; gyroscope; picture-in-picture; web-share"" referrerpolicy=""strict-origin-when-cross-origin"" allowfullscreen></iframe>",History
8,2024-08-27T12:00:29Z,UCbvE_5m8kmm9U58gDHtzYrA,How to became a top AGENT  #nba #basketballplayer #fibawc #fiba #nbaplayer #agent,Agent Todd Ramasar sits down with Afroballers to discuss what it takes to become a top AGENT like him.,"{'default': {'url': 'https://i.ytimg.com/vi/YgVMn29mVxw/default.jpg', 'width': 120, 'height': 90}, 'medium': {'url': 'https://i.ytimg.com/vi/YgVMn29mVxw/mqdefault.jpg', 'width': 320, 'height': 180}, 'high': {'url': 'https://i.ytimg.com/vi/YgVMn29mVxw/hqdefault.jpg', 'width': 480, 'height': 360}}",AfroBallers,none,2024-08-27T12:00:29Z,YgVMn29mVxw,"<iframe width=""480"" height=""270"" src=""//www.youtube.com/embed/YgVMn29mVxw"" frameborder=""0"" allow=""accelerometer; autoplay; clipboard-write; encrypted-media; gyroscope; picture-in-picture; web-share"" referrerpolicy=""strict-origin-when-cross-origin"" allowfullscreen></iframe>",Sports
31,2024-08-25T18:19:19Z,UCh2ANLALdN1OZUJKmvchkkg,The INSANE True Story of Cleopatra in Pop Culture | Documentary,"Cleopatra is one of the most iconic figures associated with ancient Egypt, but our perception of the queen is not correct.","{'default': {'url': 'https://i.ytimg.com/vi/dwSSQFS-OQY/default.jpg', 'width': 120, 'height': 90}, 'medium': {'url': 'https://i.ytimg.com/vi/dwSSQFS-OQY/mqdefault.jpg', 'width': 320, 'height': 180}, 'high': {'url': 'https://i.ytimg.com/vi/dwSSQFS-OQY/hqdefault.jpg', 'width': 480, 'height': 360}}",Mr. Imhotep,none,2024-08-25T18:19:19Z,dwSSQFS-OQY,"<iframe width=""480"" height=""270"" src=""//www.youtube.com/embed/dwSSQFS-OQY"" frameborder=""0"" allow=""accelerometer; autoplay; clipboard-write; encrypted-media; gyroscope; picture-in-picture; web-share"" referrerpolicy=""strict-origin-when-cross-origin"" allowfullscreen></iframe>",History
14,2024-08-25T18:00:03Z,UCMMTYgqKEgCgy1pR6Axlf0A,"Ex-model moved to Ghana to build a 5 bedroom home, set up 7 businesses and live her dream life",Our guest today left behind her 15 year career in the modelling industry to move to Ghana and start a new life here. This amazing ...,"{'default': {'url': 'https://i.ytimg.com/vi/6TMZcRoGZi4/default.jpg', 'width': 120, 'height': 90}, 'medium': {'url': 'https://i.ytimg.com/vi/6TMZcRoGZi4/mqdefault.jpg', 'width': 320, 'height': 180}, 'high': {'url': 'https://i.ytimg.com/vi/6TMZcRoGZi4/hqdefault.jpg', 'width': 480, 'height': 360}}",Build with Amoaa,none,2024-08-25T18:00:03Z,6TMZcRoGZi4,"<iframe width=""480"" height=""270"" src=""//www.youtube.com/embed/6TMZcRoGZi4"" frameborder=""0"" allow=""accelerometer; autoplay; clipboard-write; encrypted-media; gyroscope; picture-in-picture; web-share"" referrerpolicy=""strict-origin-when-cross-origin"" allowfullscreen></iframe>",Travel
37,2024-08-14T15:00:22Z,UCCfgU1Dgpz0MzA-4vP_gRuQ,Africa&#39;s Last Emperor | Jean-Bédel Bokassa,Jean-Bédel Bokassa will perhaps mostly be remembered chiefly for an oversized Napoleon complex and his love for everything ...,"{'default': {'url': 'https://i.ytimg.com/vi/LbXKaOqyUiE/default.jpg', 'width': 120, 'height': 90}, 'medium': {'url': 'https://i.ytimg.com/vi/LbXKaOqyUiE/mqdefault.jpg', 'width': 320, 'height': 180}, 'high': {'url': 'https://i.ytimg.com/vi/LbXKaOqyUiE/hqdefault.jpg', 'width': 480, 'height': 360}}",Risen Africa,none,2024-08-14T15:00:22Z,LbXKaOqyUiE,"<iframe width=""480"" height=""270"" src=""//www.youtube.com/embed/LbXKaOqyUiE"" frameborder=""0"" allow=""accelerometer; autoplay; clipboard-write; encrypted-media; gyroscope; picture-in-picture; web-share"" referrerpolicy=""strict-origin-when-cross-origin"" allowfullscreen></iframe>",Current Events
7,2024-07-12T12:15:30Z,UCl6to6J7oVltnhHEVm1s87A,AFRICAN ORIGIN OF MORDEN HAIRSTYLES,theperspective #africanhistory #africanews #africax5 Traditional African hairstyles are back in fashion and making a real ...,"{'default': {'url': 'https://i.ytimg.com/vi/AGyMe_XB3mQ/default.jpg', 'width': 120, 'height': 90}, 'medium': {'url': 'https://i.ytimg.com/vi/AGyMe_XB3mQ/mqdefault.jpg', 'width': 320, 'height': 180}, 'high': {'url': 'https://i.ytimg.com/vi/AGyMe_XB3mQ/hqdefault.jpg', 'width': 480, 'height': 360}}",Africax5 Network,none,2024-07-12T12:15:30Z,AGyMe_XB3mQ,"<iframe width=""480"" height=""360"" src=""//www.youtube.com/embed/AGyMe_XB3mQ"" frameborder=""0"" allow=""accelerometer; autoplay; clipboard-write; encrypted-media; gyroscope; picture-in-picture; web-share"" referrerpolicy=""strict-origin-when-cross-origin"" allowfullscreen></iframe>",Social Issues
20,2024-07-12T02:11:29Z,UCOhiR-6Y-MZtMERKRENrcRw,"&quot;Blacks’ property taxes are higher than whites, its a new program,  assessor explains&quot;","This channel is to bring the awareness to the world of the beautiful continent of Africa. My intentions are to show the development, ...","{'default': {'url': 'https://i.ytimg.com/vi/Mq2MimT88KQ/default.jpg', 'width': 120, 'height': 90}, 'medium': {'url': 'https://i.ytimg.com/vi/Mq2MimT88KQ/mqdefault.jpg', 'width': 320, 'height': 180}, 'high': {'url': 'https://i.ytimg.com/vi/Mq2MimT88KQ/hqdefault.jpg', 'width': 480, 'height': 360}}",GoBlack2Africa ,none,2024-07-12T02:11:29Z,Mq2MimT88KQ,"<iframe width=""480"" height=""270"" src=""//www.youtube.com/embed/Mq2MimT88KQ"" frameborder=""0"" allow=""accelerometer; autoplay; clipboard-write; encrypted-media; gyroscope; picture-in-picture; web-share"" referrerpolicy=""strict-origin-when-cross-origin"" allowfullscreen></iframe>",Travel
26,2024-07-11T18:11:16Z,UC__wkIWEfbnTAYVT8j6gfPg,@metatronyt vs Know Thyself Debate: Disingenuous arguments made by Metatron #blackegypt #Kemet,,"{'default': {'url': 'https://i.ytimg.com/vi/msKLkd7vQnA/default.jpg', 'width': 120, 'height': 90}, 'medium': {'url': 'https://i.ytimg.com/vi/msKLkd7vQnA/mqdefault.jpg', 'width': 320, 'height': 180}, 'high': {'url': 'https://i.ytimg.com/vi/msKLkd7vQnA/hqdefault.jpg', 'width': 480, 'height': 360}}",Know Thyself,none,2024-07-11T18:11:16Z,msKLkd7vQnA,"<iframe width=""480"" height=""270"" src=""//www.youtube.com/embed/msKLkd7vQnA"" frameborder=""0"" allow=""accelerometer; autoplay; clipboard-write; encrypted-media; gyroscope; picture-in-picture; web-share"" referrerpolicy=""strict-origin-when-cross-origin"" allowfullscreen></iframe>",History
27,2024-07-08T12:10:25Z,UCHbmePHjGH3pklvSla6szWw,You Wouldn&#39;t Survive In Ancient Egypt | REACTION - KueliMika,Today we are reacting to the video You Wouldn't Survive In Ancient Egypt.,"{'default': {'url': 'https://i.ytimg.com/vi/qFbr17zUKYE/default.jpg', 'width': 120, 'height': 90}, 'medium': {'url': 'https://i.ytimg.com/vi/qFbr17zUKYE/mqdefault.jpg', 'width': 320, 'height': 180}, 'high': {'url': 'https://i.ytimg.com/vi/qFbr17zUKYE/hqdefault.jpg', 'width': 480, 'height': 360}}",KueliMika,none,2024-07-08T12:10:25Z,qFbr17zUKYE,"<iframe width=""480"" height=""270"" src=""//www.youtube.com/embed/qFbr17zUKYE"" frameborder=""0"" allow=""accelerometer; autoplay; clipboard-write; encrypted-media; gyroscope; picture-in-picture; web-share"" referrerpolicy=""strict-origin-when-cross-origin"" allowfullscreen></iframe>",History
3,2024-04-25T23:00:06Z,UCTTQWaoGloNuhunZevQ2F6g,"Kuubwa Transforming African Businesses: Fabric Weaver, Fish Farmers","Kuubwa Transforms African Businesses: Fish Farmers, Fabric Manufacturers and more.","{'default': {'url': 'https://i.ytimg.com/vi/gC02Wht1UQQ/default.jpg', 'width': 120, 'height': 90}, 'medium': {'url': 'https://i.ytimg.com/vi/gC02Wht1UQQ/mqdefault.jpg', 'width': 320, 'height': 180}, 'high': {'url': 'https://i.ytimg.com/vi/gC02Wht1UQQ/hqdefault.jpg', 'width': 480, 'height': 360}}",Africa Business Channel TV,none,2024-04-25T23:00:06Z,gC02Wht1UQQ,"<iframe width=""480"" height=""270"" src=""//www.youtube.com/embed/gC02Wht1UQQ"" frameborder=""0"" allow=""accelerometer; autoplay; clipboard-write; encrypted-media; gyroscope; picture-in-picture; web-share"" referrerpolicy=""strict-origin-when-cross-origin"" allowfullscreen></iframe>",Productivity
41,2024-04-11T05:04:02Z,UCuvO0y2EU_kRfYzlhGJNOKA,How Did America&#39;s Wealthy Elite Re Write World History,"The United States was supposed to be a democratically run country. However, that has not been the case since the turn of the ...","{'default': {'url': 'https://i.ytimg.com/vi/RPSnS-ucmOA/default.jpg', 'width': 120, 'height': 90}, 'medium': {'url': 'https://i.ytimg.com/vi/RPSnS-ucmOA/mqdefault.jpg', 'width': 320, 'height': 180}, 'high': {'url': 'https://i.ytimg.com/vi/RPSnS-ucmOA/hqdefault.jpg', 'width': 480, 'height': 360}}",Straight UP,none,2024-04-11T05:04:02Z,RPSnS-ucmOA,"<iframe width=""480"" height=""270"" src=""//www.youtube.com/embed/RPSnS-ucmOA"" frameborder=""0"" allow=""accelerometer; autoplay; clipboard-write; encrypted-media; gyroscope; picture-in-picture; web-share"" referrerpolicy=""strict-origin-when-cross-origin"" allowfullscreen></iframe>",History
42,2024-04-11T05:04:02Z,UCuvO0y2EU_kRfYzlhGJNOKA,How Did America&#39;s Wealthy Elite Re Write World History,"The United States was supposed to be a democratically run country. However, that has not been the case since the turn of the ...","{'default': {'url': 'https://i.ytimg.com/vi/RPSnS-ucmOA/default.jpg', 'width': 120, 'height': 90}, 'medium': {'url': 'https://i.ytimg.com/vi/RPSnS-ucmOA/mqdefault.jpg', 'width': 320, 'height': 180}, 'high': {'url': 'https://i.ytimg.com/vi/RPSnS-ucmOA/hqdefault.jpg', 'width': 480, 'height': 360}}",Straight UP,none,2024-04-11T05:04:02Z,RPSnS-ucmOA,"<iframe width=""480"" height=""270"" src=""//www.youtube.com/embed/RPSnS-ucmOA"" frameborder=""0"" allow=""accelerometer; autoplay; clipboard-write; encrypted-media; gyroscope; picture-in-picture; web-share"" referrerpolicy=""strict-origin-when-cross-origin"" allowfullscreen></iframe>",History
32,2024-03-07T16:28:34Z,UCJH-fn0wLu5uwXX33jNToQw,Life in post-apartheid South Africa | Thabo Makhetha-Kwinana,"southafrica #apartheid #segregation #africanpodcast #africantopics Lesotho-born, South Africa raised fashion designer, Thabo ...","{'default': {'url': 'https://i.ytimg.com/vi/NbWALkH-3Ks/default.jpg', 'width': 120, 'height': 90}, 'medium': {'url': 'https://i.ytimg.com/vi/NbWALkH-3Ks/mqdefault.jpg', 'width': 320, 'height': 180}, 'high': {'url': 'https://i.ytimg.com/vi/NbWALkH-3Ks/hqdefault.jpg', 'width': 480, 'height': 360}}",NewAfrica,none,2024-03-07T16:28:34Z,NbWALkH-3Ks,"<iframe width=""480"" height=""270"" src=""//www.youtube.com/embed/NbWALkH-3Ks"" frameborder=""0"" allow=""accelerometer; autoplay; clipboard-write; encrypted-media; gyroscope; picture-in-picture; web-share"" referrerpolicy=""strict-origin-when-cross-origin"" allowfullscreen></iframe>",Current Events
