,publishedAt,channelId,title,description,thumbnails,channelTitle,liveBroadcastContent,publishTime,videoID,embeds,category
5,2026-05-07T15:02:42Z,UCF-A_4x9-bLrxXrmgBOWuJA,Honoring Mothers in the Revolution,"This Mother's Day, we sit down with a trailblazing activist who's fought for justice and equality. She shares her journey, the power ...","{'default': {'url': 'https://i.ytimg.com/vi/K88C2NDlHiI/default_live.jpg', 'width': 120, 'height': 90}, 'medium': {'url': 'https://i.ytimg.com/vi/K88C2NDlHiI/mqdefault_live.jpg', 'width': 320, 'height': 180}, 'high': {'url': 'https://i.ytimg.com/vi/K88C2NDlHiI/hqdefault_live.jpg', 'width': 480, 'height': 360}}",Economic Freedom Fighters,upcoming,2026-05-07T15:02:42Z,K88C2NDlHiI,"<iframe width=""480"" height=""270"" src=""//www.youtube.com/embed/K88C2NDlHiI"" frameborder=""0"" allow=""accelerometer; autoplay; clipboard-write; encrypted-media; gyroscope; picture-in-picture; web-share"" referrerpolicy=""strict-origin-when-cross-origin"" allowfullscreen></iframe>",Current Events
11,2026-05-07T15:00:06Z,UCCfgU1Dgpz0MzA-4vP_gRuQ,Xenophobia | South Africa&#39;s Rejection of Black Africans,"South Africa is supposed to be the country that made it out. A country that had pulled off the impossible, to against all odds fight off ...","{'default': {'url': 'https://i.ytimg.com/vi/1wEyUK3Zsvk/default.jpg', 'width': 120, 'height': 90}, 'medium': {'url': 'https://i.ytimg.com/vi/1wEyUK3Zsvk/mqdefault.jpg', 'width': 320, 'height': 180}, 'high': {'url': 'https://i.ytimg.com/vi/1wEyUK3Zsvk/hqdefault.jpg', 'width': 480, 'height': 360}}",Risen Africa,none,2026-05-07T15:00:06Z,1wEyUK3Zsvk,"<iframe width=""480"" height=""270"" src=""//www.youtube.com/embed/1wEyUK3Zsvk"" frameborder=""0"" allow=""accelerometer; autoplay; clipboard-write; encrypted-media; gyroscope; picture-in-picture; web-share"" referrerpolicy=""strict-origin-when-cross-origin"" allowfullscreen></iframe>",Current Events
56,2026-05-07T14:00:06Z,UCIxrFTHZybtTgq8X7itOAkQ,I Ignored Western Media &amp; Investigated This Community,"I Ignored Western Media & Investigated This Community During my time in Karachi, I heard rumors about a hidden Hindu ...","{'default': {'url': 'https://i.ytimg.com/vi/BelsxUSSr0I/default.jpg', 'width': 120, 'height': 90}, 'medium': {'url': 'https://i.ytimg.com/vi/BelsxUSSr0I/mqdefault.jpg', 'width': 320, 'height': 180}, 'high': {'url': 'https://i.ytimg.com/vi/BelsxUSSr0I/hqdefault.jpg', 'width': 480, 'height': 360}}",Blackman Da Traveller,none,2026-05-07T14:00:06Z,BelsxUSSr0I,"<iframe width=""480"" height=""270"" src=""//www.youtube.com/embed/BelsxUSSr0I"" frameborder=""0"" allow=""accelerometer; autoplay; clipboard-write; encrypted-media; gyroscope; picture-in-picture; web-share"" referrerpolicy=""strict-origin-when-cross-origin"" allowfullscreen></iframe>",Travel
42,2026-05-07T14:00:06Z,UCwbP4USYrniJGROwQNiwH-Q,Corey Holcomb Was Right About Dr. Cheyenne Bryant | EXPOSED By Real Therapists!,"Dr. Cheyenne Bryant EXPOSED By Real Therapist | Corey Holcomb Was Right! NEW Singles ""I Get You"" "" GIRLY GIRL"" ""BROWN ...","{'default': {'url': 'https://i.ytimg.com/vi/TvYwSRPojRg/default.jpg', 'width': 120, 'height': 90}, 'medium': {'url': 'https://i.ytimg.com/vi/TvYwSRPojRg/mqdefault.jpg', 'width': 320, 'height': 180}, 'high': {'url': 'https://i.ytimg.com/vi/TvYwSRPojRg/hqdefault.jpg', 'width': 480, 'height': 360}}",DeeDeesReactions,none,2026-05-07T14:00:06Z,TvYwSRPojRg,"<iframe width=""480"" height=""270"" src=""//www.youtube.com/embed/TvYwSRPojRg"" frameborder=""0"" allow=""accelerometer; autoplay; clipboard-write; encrypted-media; gyroscope; picture-in-picture; web-share"" referrerpolicy=""strict-origin-when-cross-origin"" allowfullscreen></iframe>",Social Issues
55,2026-05-07T12:21:15Z,UCW5NNtTSY5z5mENZ8dt-RCw,The Little Africa Of Australia,"In this video, I visit a community in Melbourne called Footscray, known for its strong presence of African immigrants and often ...","{'default': {'url': 'https://i.ytimg.com/vi/BVX_K-WYa2Y/default.jpg', 'width': 120, 'height': 90}, 'medium': {'url': 'https://i.ytimg.com/vi/BVX_K-WYa2Y/mqdefault.jpg', 'width': 320, 'height': 180}, 'high': {'url': 'https://i.ytimg.com/vi/BVX_K-WYa2Y/hqdefault.jpg', 'width': 480, 'height': 360}}",ACE ,none,2026-05-07T12:21:15Z,BVX_K-WYa2Y,"<iframe width=""480"" height=""270"" src=""//www.youtube.com/embed/BVX_K-WYa2Y"" frameborder=""0"" allow=""accelerometer; autoplay; clipboard-write; encrypted-media; gyroscope; picture-in-picture; web-share"" referrerpolicy=""strict-origin-when-cross-origin"" allowfullscreen></iframe>",Travel
68,2026-05-07T11:00:00Z,UCFPfloFwa6X2UddqRH83rAA,"Why Millionaires Drive $30,000 Cars (And It&#39;s Why They&#39;re Millionaires!)","Many millionaires drive surprisingly ordinary cars, not because they cannot afford luxury vehicles, but because they understand ...","{'default': {'url': 'https://i.ytimg.com/vi/bp7_pl0sPdw/default.jpg', 'width': 120, 'height': 90}, 'medium': {'url': 'https://i.ytimg.com/vi/bp7_pl0sPdw/mqdefault.jpg', 'width': 320, 'height': 180}, 'high': {'url': 'https://i.ytimg.com/vi/bp7_pl0sPdw/hqdefault.jpg', 'width': 480, 'height': 360}}",Alicia Invests,none,2026-05-07T11:00:00Z,bp7_pl0sPdw,"<iframe width=""480"" height=""270"" src=""//www.youtube.com/embed/bp7_pl0sPdw"" frameborder=""0"" allow=""accelerometer; autoplay; clipboard-write; encrypted-media; gyroscope; picture-in-picture; web-share"" referrerpolicy=""strict-origin-when-cross-origin"" allowfullscreen></iframe>",Productivity
33,2026-05-07T05:50:47Z,UCIwGnOXoSXEI7Tooz3iKq5w,You will be unstoppable,,"{'default': {'url': 'https://i.ytimg.com/vi/4avzQ65C5Co/default.jpg', 'width': 120, 'height': 90}, 'medium': {'url': 'https://i.ytimg.com/vi/4avzQ65C5Co/mqdefault.jpg', 'width': 320, 'height': 180}, 'high': {'url': 'https://i.ytimg.com/vi/4avzQ65C5Co/hqdefault.jpg', 'width': 480, 'height': 360}}",Without History,none,2026-05-07T05:50:47Z,4avzQ65C5Co,"<iframe width=""480"" height=""270"" src=""//www.youtube.com/embed/4avzQ65C5Co"" frameborder=""0"" allow=""accelerometer; autoplay; clipboard-write; encrypted-media; gyroscope; picture-in-picture; web-share"" referrerpolicy=""strict-origin-when-cross-origin"" allowfullscreen></iframe>",History
30,2026-05-07T05:23:09Z,UC11aHtNnc5bEPLI4jf6mnYg,Game Theory #23:  The WWIII Chessboard,"In this Thursday, May 7, 2026 lecture to his Beijing high school students, Professor Jiang explains the worldview and strategy of ...","{'default': {'url': 'https://i.ytimg.com/vi/6aNh6sBpqvQ/default.jpg', 'width': 120, 'height': 90}, 'medium': {'url': 'https://i.ytimg.com/vi/6aNh6sBpqvQ/mqdefault.jpg', 'width': 320, 'height': 180}, 'high': {'url': 'https://i.ytimg.com/vi/6aNh6sBpqvQ/hqdefault.jpg', 'width': 480, 'height': 360}}",Predictive History,none,2026-05-07T05:23:09Z,6aNh6sBpqvQ,"<iframe width=""480"" height=""270"" src=""//www.youtube.com/embed/6aNh6sBpqvQ"" frameborder=""0"" allow=""accelerometer; autoplay; clipboard-write; encrypted-media; gyroscope; picture-in-picture; web-share"" referrerpolicy=""strict-origin-when-cross-origin"" allowfullscreen></iframe>",History
9,2026-05-07T04:58:40Z,UCMe6CgCi6TSZX1tUxuUvCGg,THE  AFRICA  WE  WANT  IS  US,COMING UP LIVE NOW ON PAN-AFRICAN DAILY TV 🎙️ New to streaming or looking to level up? Check out StreamYard and ...,"{'default': {'url': 'https://i.ytimg.com/vi/PfuWz5_KUsc/default.jpg', 'width': 120, 'height': 90}, 'medium': {'url': 'https://i.ytimg.com/vi/PfuWz5_KUsc/mqdefault.jpg', 'width': 320, 'height': 180}, 'high': {'url': 'https://i.ytimg.com/vi/PfuWz5_KUsc/hqdefault.jpg', 'width': 480, 'height': 360}}",Pan-African Daily TV official ,none,2026-05-07T04:58:40Z,PfuWz5_KUsc,"<iframe width=""480"" height=""270"" src=""//www.youtube.com/embed/PfuWz5_KUsc"" frameborder=""0"" allow=""accelerometer; autoplay; clipboard-write; encrypted-media; gyroscope; picture-in-picture; web-share"" referrerpolicy=""strict-origin-when-cross-origin"" allowfullscreen></iframe>",Current Events
17,2026-05-06T22:01:05Z,UCv8G-xZ_BBGufjbN6jbvLMQ,I Hated Leftovers - Comedian Brandon Reaves - Chocolate Sundaes Stand Up Comedy,Leftovers hit different as an adult. Follow Brandon Reaves on social media @kingb_reaves Filmed 3/15/26 Videographer: Ivan ...,"{'default': {'url': 'https://i.ytimg.com/vi/sVVfbBpbK7Y/default.jpg', 'width': 120, 'height': 90}, 'medium': {'url': 'https://i.ytimg.com/vi/sVVfbBpbK7Y/mqdefault.jpg', 'width': 320, 'height': 180}, 'high': {'url': 'https://i.ytimg.com/vi/sVVfbBpbK7Y/hqdefault.jpg', 'width': 480, 'height': 360}}",Chocolate Sundaes Comedy,none,2026-05-06T22:01:05Z,sVVfbBpbK7Y,"<iframe width=""480"" height=""270"" src=""//www.youtube.com/embed/sVVfbBpbK7Y"" frameborder=""0"" allow=""accelerometer; autoplay; clipboard-write; encrypted-media; gyroscope; picture-in-picture; web-share"" referrerpolicy=""strict-origin-when-cross-origin"" allowfullscreen></iframe>",Entertainment
58,2026-05-06T21:50:26Z,UCvHeh__RFFonMM8vaKda82Q,Live in South Africa czech in effect,Made with Restream. Livestream on 30+ platforms at once via https://restream.io live in South Africa.,"{'default': {'url': 'https://i.ytimg.com/vi/KM61uKU8jPg/default.jpg', 'width': 120, 'height': 90}, 'medium': {'url': 'https://i.ytimg.com/vi/KM61uKU8jPg/mqdefault.jpg', 'width': 320, 'height': 180}, 'high': {'url': 'https://i.ytimg.com/vi/KM61uKU8jPg/hqdefault.jpg', 'width': 480, 'height': 360}}",Czech in effect,none,2026-05-06T21:50:26Z,KM61uKU8jPg,"<iframe width=""480"" height=""270"" src=""//www.youtube.com/embed/KM61uKU8jPg"" frameborder=""0"" allow=""accelerometer; autoplay; clipboard-write; encrypted-media; gyroscope; picture-in-picture; web-share"" referrerpolicy=""strict-origin-when-cross-origin"" allowfullscreen></iframe>",Travel
50,2026-05-06T20:45:00Z,UCPQsrvUJzs1INc2hroy3nHw,What is your best position...She Asked?,Welcome back to another episode of the Pan African Dating Show. CONNECT WITH US * Instagram: ...,"{'default': {'url': 'https://i.ytimg.com/vi/OdA5g4z44Mk/default.jpg', 'width': 120, 'height': 90}, 'medium': {'url': 'https://i.ytimg.com/vi/OdA5g4z44Mk/mqdefault.jpg', 'width': 320, 'height': 180}, 'high': {'url': 'https://i.ytimg.com/vi/OdA5g4z44Mk/hqdefault.jpg', 'width': 480, 'height': 360}}",The Pan African Dating Show (The-PDS),none,2026-05-06T20:45:00Z,OdA5g4z44Mk,"<iframe width=""480"" height=""270"" src=""//www.youtube.com/embed/OdA5g4z44Mk"" frameborder=""0"" allow=""accelerometer; autoplay; clipboard-write; encrypted-media; gyroscope; picture-in-picture; web-share"" referrerpolicy=""strict-origin-when-cross-origin"" allowfullscreen></iframe>",Social Issues
69,2026-05-06T03:08:55Z,UCHzCimqhvPhCH75h80pXM1Q,Democrats Got Trump Elected? Killer Mike&#39;s Bold Claim,Black men did not elect Trump. The data shows they supported Democrats more than white women or men. The real culprits?,"{'default': {'url': 'https://i.ytimg.com/vi/pIJ3RJe8344/default.jpg', 'width': 120, 'height': 90}, 'medium': {'url': 'https://i.ytimg.com/vi/pIJ3RJe8344/mqdefault.jpg', 'width': 320, 'height': 180}, 'high': {'url': 'https://i.ytimg.com/vi/pIJ3RJe8344/hqdefault.jpg', 'width': 480, 'height': 360}}",The Black Business School  ,none,2026-05-06T03:08:55Z,pIJ3RJe8344,"<iframe width=""480"" height=""270"" src=""//www.youtube.com/embed/pIJ3RJe8344"" frameborder=""0"" allow=""accelerometer; autoplay; clipboard-write; encrypted-media; gyroscope; picture-in-picture; web-share"" referrerpolicy=""strict-origin-when-cross-origin"" allowfullscreen></iframe>",Productivity
19,2026-05-06T01:00:06Z,UCLuYADJ6hESLHX87JnsGbjA,"Spirit Shutdown: Stranded, Stuck &amp; Scrambling",Check out https://joshjohnsoncomedy.com/tour for dates and to sign up for the waitlist to be notified when I'm performing in your ...,"{'default': {'url': 'https://i.ytimg.com/vi/GbH3z_4odxo/default.jpg', 'width': 120, 'height': 90}, 'medium': {'url': 'https://i.ytimg.com/vi/GbH3z_4odxo/mqdefault.jpg', 'width': 320, 'height': 180}, 'high': {'url': 'https://i.ytimg.com/vi/GbH3z_4odxo/hqdefault.jpg', 'width': 480, 'height': 360}}",Josh Johnson,none,2026-05-06T01:00:06Z,GbH3z_4odxo,"<iframe width=""480"" height=""270"" src=""//www.youtube.com/embed/GbH3z_4odxo"" frameborder=""0"" allow=""accelerometer; autoplay; clipboard-write; encrypted-media; gyroscope; picture-in-picture; web-share"" referrerpolicy=""strict-origin-when-cross-origin"" allowfullscreen></iframe>",Entertainment
64,2026-05-06T00:14:06Z,UC2-nif4wvOqT6QVsBX3NOpA,"Escape, Before It&#39;s Too Late | 7 Destinations To Go",Our Favorite Slow Travel Destinations in 4k with our explanations. They aren't politically correct but they are honest and ours.,"{'default': {'url': 'https://i.ytimg.com/vi/s45L9lQqZz4/default.jpg', 'width': 120, 'height': 90}, 'medium': {'url': 'https://i.ytimg.com/vi/s45L9lQqZz4/mqdefault.jpg', 'width': 320, 'height': 180}, 'high': {'url': 'https://i.ytimg.com/vi/s45L9lQqZz4/hqdefault.jpg', 'width': 480, 'height': 360}}",The Yarbros,none,2026-05-06T00:14:06Z,s45L9lQqZz4,"<iframe width=""480"" height=""270"" src=""//www.youtube.com/embed/s45L9lQqZz4"" frameborder=""0"" allow=""accelerometer; autoplay; clipboard-write; encrypted-media; gyroscope; picture-in-picture; web-share"" referrerpolicy=""strict-origin-when-cross-origin"" allowfullscreen></iframe>",Travel
0,2026-05-05T20:24:45Z,UCG7uFJVZsxQRwDssom9Pavw,Ethiopians Celebrate the 85th Anniversary of the Defeat of Fascist Italy  During  ‘Victory Day’,Thousands of Ethiopians gathered at the Miazia 27 Square in Addis Ababa on Tuesday to mark the 85th anniversary of Patriots' ...,"{'default': {'url': 'https://i.ytimg.com/vi/CT3c5C3itks/default.jpg', 'width': 120, 'height': 90}, 'medium': {'url': 'https://i.ytimg.com/vi/CT3c5C3itks/mqdefault.jpg', 'width': 320, 'height': 180}, 'high': {'url': 'https://i.ytimg.com/vi/CT3c5C3itks/hqdefault.jpg', 'width': 480, 'height': 360}}",2nacheki,none,2026-05-05T20:24:45Z,CT3c5C3itks,"<iframe width=""480"" height=""270"" src=""//www.youtube.com/embed/CT3c5C3itks"" frameborder=""0"" allow=""accelerometer; autoplay; clipboard-write; encrypted-media; gyroscope; picture-in-picture; web-share"" referrerpolicy=""strict-origin-when-cross-origin"" allowfullscreen></iframe>",Current Events
6,2026-05-05T18:39:01Z,UC1ettU5YSf_nIOJWffCKGQw,why a european assembly turned christianity white - dr. henrik clarke,"dr. john henrik clarke warns black people particularly those who trust the bible, follow the white religion without understanding ...","{'default': {'url': 'https://i.ytimg.com/vi/prihYDD097k/default.jpg', 'width': 120, 'height': 90}, 'medium': {'url': 'https://i.ytimg.com/vi/prihYDD097k/mqdefault.jpg', 'width': 320, 'height': 180}, 'high': {'url': 'https://i.ytimg.com/vi/prihYDD097k/hqdefault.jpg', 'width': 480, 'height': 360}}",LuiSpot,none,2026-05-05T18:39:01Z,prihYDD097k,"<iframe width=""480"" height=""270"" src=""//www.youtube.com/embed/prihYDD097k"" frameborder=""0"" allow=""accelerometer; autoplay; clipboard-write; encrypted-media; gyroscope; picture-in-picture; web-share"" referrerpolicy=""strict-origin-when-cross-origin"" allowfullscreen></iframe>",Current Events
53,2026-05-05T17:21:56Z,UCTis64XH8HrxE7GhEkA6YmA,"TOTTENHAM RELEGATION OR SEVILLA, WHAT’S WORSE 😵‍💫 #tottenham #sevilla #spurs #sevillafc #football",,"{'default': {'url': 'https://i.ytimg.com/vi/lFdSsfwGgK8/default.jpg', 'width': 120, 'height': 90}, 'medium': {'url': 'https://i.ytimg.com/vi/lFdSsfwGgK8/mqdefault.jpg', 'width': 320, 'height': 180}, 'high': {'url': 'https://i.ytimg.com/vi/lFdSsfwGgK8/hqdefault.jpg', 'width': 480, 'height': 360}}",5ASIDE Media,none,2026-05-05T17:21:56Z,lFdSsfwGgK8,"<iframe width=""480"" height=""270"" src=""//www.youtube.com/embed/lFdSsfwGgK8"" frameborder=""0"" allow=""accelerometer; autoplay; clipboard-write; encrypted-media; gyroscope; picture-in-picture; web-share"" referrerpolicy=""strict-origin-when-cross-origin"" allowfullscreen></iframe>",Sports
21,2026-05-04T19:39:27Z,UCNekbFtp9zsI-lE_OCHpq_w,How parents act as they start getting older,"Instagram: https://www.instagram.com/trarags2/ . . . 1 Peter 4:8 Above all, love each other deeply, because love covers over a ...","{'default': {'url': 'https://i.ytimg.com/vi/TnLLDo0NXgY/default.jpg', 'width': 120, 'height': 90}, 'medium': {'url': 'https://i.ytimg.com/vi/TnLLDo0NXgY/mqdefault.jpg', 'width': 320, 'height': 180}, 'high': {'url': 'https://i.ytimg.com/vi/TnLLDo0NXgY/hqdefault.jpg', 'width': 480, 'height': 360}}",Tra Rags,none,2026-05-04T19:39:27Z,TnLLDo0NXgY,"<iframe width=""480"" height=""270"" src=""//www.youtube.com/embed/TnLLDo0NXgY"" frameborder=""0"" allow=""accelerometer; autoplay; clipboard-write; encrypted-media; gyroscope; picture-in-picture; web-share"" referrerpolicy=""strict-origin-when-cross-origin"" allowfullscreen></iframe>",Entertainment
43,2026-05-04T17:43:28Z,UCwZ2vurIl_X8rv0Dv4mu12A,This Bible Story Still Controls How Black People See Themselves,INVEST IN INDEPENDENT BLACK MEDIA → Watch the FULL UNCENSORED interview with Bro. Sabubu Plata at ...,"{'default': {'url': 'https://i.ytimg.com/vi/50kW_05jI8k/default.jpg', 'width': 120, 'height': 90}, 'medium': {'url': 'https://i.ytimg.com/vi/50kW_05jI8k/mqdefault.jpg', 'width': 320, 'height': 180}, 'high': {'url': 'https://i.ytimg.com/vi/50kW_05jI8k/hqdefault.jpg', 'width': 480, 'height': 360}}",I Never Knew Tv,none,2026-05-04T17:43:28Z,50kW_05jI8k,"<iframe width=""480"" height=""270"" src=""//www.youtube.com/embed/50kW_05jI8k"" frameborder=""0"" allow=""accelerometer; autoplay; clipboard-write; encrypted-media; gyroscope; picture-in-picture; web-share"" referrerpolicy=""strict-origin-when-cross-origin"" allowfullscreen></iframe>",Social Issues
13,2026-05-04T11:16:47Z,UCLjzzg-cFWpEEjnWCOpXp3Q,African Workers of the World - Unite and Organize!,"Welcome to ""African Workers of the World - Unite and Organize!"" the Black Power Community Rally, hosted by the International ...","{'default': {'url': 'https://i.ytimg.com/vi/f5EGkrGJJoM/default.jpg', 'width': 120, 'height': 90}, 'medium': {'url': 'https://i.ytimg.com/vi/f5EGkrGJJoM/mqdefault.jpg', 'width': 320, 'height': 180}, 'high': {'url': 'https://i.ytimg.com/vi/f5EGkrGJJoM/hqdefault.jpg', 'width': 480, 'height': 360}}",The Burning Spear TV,none,2026-05-04T11:16:47Z,f5EGkrGJJoM,"<iframe width=""480"" height=""270"" src=""//www.youtube.com/embed/f5EGkrGJJoM"" frameborder=""0"" allow=""accelerometer; autoplay; clipboard-write; encrypted-media; gyroscope; picture-in-picture; web-share"" referrerpolicy=""strict-origin-when-cross-origin"" allowfullscreen></iframe>",Current Events
22,2026-05-03T16:01:15Z,UCJmmxwdAsR7lD8fBA_qbEMw,He Freed Zambia… Then Looted It?,London. 2007. A British judge is delivering a judgment against a former president of Zambia. The case is about money taken from ...,"{'default': {'url': 'https://i.ytimg.com/vi/m2iYKO3umuU/default.jpg', 'width': 120, 'height': 90}, 'medium': {'url': 'https://i.ytimg.com/vi/m2iYKO3umuU/mqdefault.jpg', 'width': 320, 'height': 180}, 'high': {'url': 'https://i.ytimg.com/vi/m2iYKO3umuU/hqdefault.jpg', 'width': 480, 'height': 360}}",African Biographics,none,2026-05-03T16:01:15Z,m2iYKO3umuU,"<iframe width=""480"" height=""270"" src=""//www.youtube.com/embed/m2iYKO3umuU"" frameborder=""0"" allow=""accelerometer; autoplay; clipboard-write; encrypted-media; gyroscope; picture-in-picture; web-share"" referrerpolicy=""strict-origin-when-cross-origin"" allowfullscreen></iframe>",History
65,2026-05-02T18:37:27Z,UClwrpH_Np9zk8uMwnMwu8Nw,I Finally Met Davido In Zambia 🇿🇲,,"{'default': {'url': 'https://i.ytimg.com/vi/yhIn9JzHL6A/default.jpg', 'width': 120, 'height': 90}, 'medium': {'url': 'https://i.ytimg.com/vi/yhIn9JzHL6A/mqdefault.jpg', 'width': 320, 'height': 180}, 'high': {'url': 'https://i.ytimg.com/vi/yhIn9JzHL6A/hqdefault.jpg', 'width': 480, 'height': 360}}",WODE MAYA,none,2026-05-02T18:37:27Z,yhIn9JzHL6A,"<iframe width=""480"" height=""270"" src=""//www.youtube.com/embed/yhIn9JzHL6A"" frameborder=""0"" allow=""accelerometer; autoplay; clipboard-write; encrypted-media; gyroscope; picture-in-picture; web-share"" referrerpolicy=""strict-origin-when-cross-origin"" allowfullscreen></iframe>",Travel
61,2026-05-02T17:00:45Z,UCpEf2jEfyAEbQesGgl1HOWA,EXPLORING A TOWN WITH PERFECT BEACHES IN THE WESTERN REGION OF GHANA,livinginghana #takoradi #westernregion #ghana Busua is a beach resort and fishing village in the Ahanta West District of the ...,"{'default': {'url': 'https://i.ytimg.com/vi/ZwvGvhHy62Y/default.jpg', 'width': 120, 'height': 90}, 'medium': {'url': 'https://i.ytimg.com/vi/ZwvGvhHy62Y/mqdefault.jpg', 'width': 320, 'height': 180}, 'high': {'url': 'https://i.ytimg.com/vi/ZwvGvhHy62Y/hqdefault.jpg', 'width': 480, 'height': 360}}",Jasmine Ama,none,2026-05-02T17:00:45Z,ZwvGvhHy62Y,"<iframe width=""480"" height=""270"" src=""//www.youtube.com/embed/ZwvGvhHy62Y"" frameborder=""0"" allow=""accelerometer; autoplay; clipboard-write; encrypted-media; gyroscope; picture-in-picture; web-share"" referrerpolicy=""strict-origin-when-cross-origin"" allowfullscreen></iframe>",Travel
47,2026-05-01T22:28:24Z,UCyRi9CRrBDeTITC211YfcMg,Africans vs Africans? They Took the Land… Now We Fight Each Other,What's happening in South Africa right now isn't just about immigration — it's something deeper. Scenes of violence against ...,"{'default': {'url': 'https://i.ytimg.com/vi/F50Nc1evpOY/default.jpg', 'width': 120, 'height': 90}, 'medium': {'url': 'https://i.ytimg.com/vi/F50Nc1evpOY/mqdefault.jpg', 'width': 320, 'height': 180}, 'high': {'url': 'https://i.ytimg.com/vi/F50Nc1evpOY/hqdefault.jpg', 'width': 480, 'height': 360}}",Pan African Updates & Reactions,none,2026-05-01T22:28:24Z,F50Nc1evpOY,"<iframe width=""480"" height=""270"" src=""//www.youtube.com/embed/F50Nc1evpOY"" frameborder=""0"" allow=""accelerometer; autoplay; clipboard-write; encrypted-media; gyroscope; picture-in-picture; web-share"" referrerpolicy=""strict-origin-when-cross-origin"" allowfullscreen></iframe>",Social Issues
32,2026-04-29T23:53:27Z,UCjBw2SidW7wFElbmj9bgDjw,He Criticised van Sertima&#39;s work... we&#39;re responding! Ft.@kamjiverse,Join us as we review and critique the latest refutation of Ivan van Sertima by Dr. John Aden with @kamjiverse.,"{'default': {'url': 'https://i.ytimg.com/vi/vKLoEcxARRg/default.jpg', 'width': 120, 'height': 90}, 'medium': {'url': 'https://i.ytimg.com/vi/vKLoEcxARRg/mqdefault.jpg', 'width': 320, 'height': 180}, 'high': {'url': 'https://i.ytimg.com/vi/vKLoEcxARRg/hqdefault.jpg', 'width': 480, 'height': 360}}",The Kings Monologue,none,2026-04-29T23:53:27Z,vKLoEcxARRg,"<iframe width=""480"" height=""270"" src=""//www.youtube.com/embed/vKLoEcxARRg"" frameborder=""0"" allow=""accelerometer; autoplay; clipboard-write; encrypted-media; gyroscope; picture-in-picture; web-share"" referrerpolicy=""strict-origin-when-cross-origin"" allowfullscreen></iframe>",History
52,2026-04-27T01:51:48Z,UCXyHjFIKz9D8ofxObOuYBbg,The Fear of Women is the Beginning of Wisdom,read that again.,"{'default': {'url': 'https://i.ytimg.com/vi/32MCxFRbnok/default.jpg', 'width': 120, 'height': 90}, 'medium': {'url': 'https://i.ytimg.com/vi/32MCxFRbnok/mqdefault.jpg', 'width': 320, 'height': 180}, 'high': {'url': 'https://i.ytimg.com/vi/32MCxFRbnok/hqdefault.jpg', 'width': 480, 'height': 360}}",WeNeedToTalk,none,2026-04-27T01:51:48Z,32MCxFRbnok,"<iframe width=""480"" height=""270"" src=""//www.youtube.com/embed/32MCxFRbnok"" frameborder=""0"" allow=""accelerometer; autoplay; clipboard-write; encrypted-media; gyroscope; picture-in-picture; web-share"" referrerpolicy=""strict-origin-when-cross-origin"" allowfullscreen></iframe>",Social Issues
41,2026-04-26T18:45:02Z,UCWCreFX8bTVLJ6Y9lh6eZ5A,&quot;Repent Or Lose EVERYTHING&quot; — Farrakhan&#39;s Final Warning To Trump,"Louis Farrakhan didn't curse Trump. He didn't mock him. He stood up and said: 'I'm warning you, Mr. Trump, in the name of God ...","{'default': {'url': 'https://i.ytimg.com/vi/wmNvdAjamN8/default.jpg', 'width': 120, 'height': 90}, 'medium': {'url': 'https://i.ytimg.com/vi/wmNvdAjamN8/mqdefault.jpg', 'width': 320, 'height': 180}, 'high': {'url': 'https://i.ytimg.com/vi/wmNvdAjamN8/hqdefault.jpg', 'width': 480, 'height': 360}}",Black Journals,none,2026-04-26T18:45:02Z,wmNvdAjamN8,"<iframe width=""480"" height=""270"" src=""//www.youtube.com/embed/wmNvdAjamN8"" frameborder=""0"" allow=""accelerometer; autoplay; clipboard-write; encrypted-media; gyroscope; picture-in-picture; web-share"" referrerpolicy=""strict-origin-when-cross-origin"" allowfullscreen></iframe>",Social Issues
14,2026-04-25T19:47:50Z,UC-4h1XQ47sf0vbFwJvuBhEA,South Africa&#39;s Xenophobia Problem Just Got Worse—Ghana Demands Answers,South Africa's Xenophobia Problem Just Got Worse—Ghana Demands Answers - A growing crisis is unfolding in South Africa as ...,"{'default': {'url': 'https://i.ytimg.com/vi/Daxmfo4m-eI/default.jpg', 'width': 120, 'height': 90}, 'medium': {'url': 'https://i.ytimg.com/vi/Daxmfo4m-eI/mqdefault.jpg', 'width': 320, 'height': 180}, 'high': {'url': 'https://i.ytimg.com/vi/Daxmfo4m-eI/hqdefault.jpg', 'width': 480, 'height': 360}}",The New Africa Channel,none,2026-04-25T19:47:50Z,Daxmfo4m-eI,"<iframe width=""480"" height=""270"" src=""//www.youtube.com/embed/Daxmfo4m-eI"" frameborder=""0"" allow=""accelerometer; autoplay; clipboard-write; encrypted-media; gyroscope; picture-in-picture; web-share"" referrerpolicy=""strict-origin-when-cross-origin"" allowfullscreen></iframe>",Current Events
