,publishedAt,channelId,title,description,thumbnails,channelTitle,liveBroadcastContent,publishTime,videoID,embeds,category
46,2026-05-08T04:00:10Z,UCbB_WVM-e7nuhWd_FB_8KBQ,“B*tch!” - Oprah To Yaya DaCosta | One54 Africa Podcast,She called me the b-word… in character!” - Yaya #yayadacosta #oprahwinfrey #one54 FULL EPISODE: ...,"{'default': {'url': 'https://i.ytimg.com/vi/AIEZT1AWKTk/default.jpg', 'width': 120, 'height': 90}, 'medium': {'url': 'https://i.ytimg.com/vi/AIEZT1AWKTk/mqdefault.jpg', 'width': 320, 'height': 180}, 'high': {'url': 'https://i.ytimg.com/vi/AIEZT1AWKTk/hqdefault.jpg', 'width': 480, 'height': 360}}",One54 Africa,none,2026-05-08T04:00:10Z,AIEZT1AWKTk,"<iframe width=""480"" height=""270"" src=""//www.youtube.com/embed/AIEZT1AWKTk"" frameborder=""0"" allow=""accelerometer; autoplay; clipboard-write; encrypted-media; gyroscope; picture-in-picture; web-share"" referrerpolicy=""strict-origin-when-cross-origin"" allowfullscreen></iframe>",Social Issues
72,2026-05-08T03:30:20Z,UCAvjYgmwadC682OoC4Cc6TQ,Gil&#39;s Arena CRASHES OUT over Embiid and KAT 🤣,"Gil's Arena CRASHES OUT over a debate around Sixers star Joel Embiid's health and how with Embiid being hampered, Knicks ...","{'default': {'url': 'https://i.ytimg.com/vi/W_0XVkx5ivs/default.jpg', 'width': 120, 'height': 90}, 'medium': {'url': 'https://i.ytimg.com/vi/W_0XVkx5ivs/mqdefault.jpg', 'width': 320, 'height': 180}, 'high': {'url': 'https://i.ytimg.com/vi/W_0XVkx5ivs/hqdefault.jpg', 'width': 480, 'height': 360}}",The Arena,none,2026-05-08T03:30:20Z,W_0XVkx5ivs,"<iframe width=""480"" height=""270"" src=""//www.youtube.com/embed/W_0XVkx5ivs"" frameborder=""0"" allow=""accelerometer; autoplay; clipboard-write; encrypted-media; gyroscope; picture-in-picture; web-share"" referrerpolicy=""strict-origin-when-cross-origin"" allowfullscreen></iframe>",Sports
1,2026-05-08T03:08:51Z,UCKZGcrxRAhdUi58Mdr565mw,America&#39;s Gatekeepers Are Failing: A Disruption Explodes!,"African Diaspora News Channel, founded by Phillip Scott, is human-led, Black-centered media committed to speaking truth to ...","{'default': {'url': 'https://i.ytimg.com/vi/lV5MU6FF_lI/default.jpg', 'width': 120, 'height': 90}, 'medium': {'url': 'https://i.ytimg.com/vi/lV5MU6FF_lI/mqdefault.jpg', 'width': 320, 'height': 180}, 'high': {'url': 'https://i.ytimg.com/vi/lV5MU6FF_lI/hqdefault.jpg', 'width': 480, 'height': 360}}",African Diaspora News Channel,none,2026-05-08T03:08:51Z,lV5MU6FF_lI,"<iframe width=""480"" height=""270"" src=""//www.youtube.com/embed/lV5MU6FF_lI"" frameborder=""0"" allow=""accelerometer; autoplay; clipboard-write; encrypted-media; gyroscope; picture-in-picture; web-share"" referrerpolicy=""strict-origin-when-cross-origin"" allowfullscreen></iframe>",Current Events
12,2026-05-08T02:59:31Z,UCeUtB7lGgo5ZVIVzqELT-1A,"IRAN HITS DRONE, SAUDI STOPS TRUMP,  MJ BETRAYED, DATA CENTER ALERT, GOP FUNDING, KILLER MIKE SHAMED",Website: https://sabbysabs.com/ Patreon: https://www.patreon.com/SabrinaSalvati PayPal: ...,"{'default': {'url': 'https://i.ytimg.com/vi/A6IzEvadp1c/default.jpg', 'width': 120, 'height': 90}, 'medium': {'url': 'https://i.ytimg.com/vi/A6IzEvadp1c/mqdefault.jpg', 'width': 320, 'height': 180}, 'high': {'url': 'https://i.ytimg.com/vi/A6IzEvadp1c/hqdefault.jpg', 'width': 480, 'height': 360}}",Sabby Sabs,none,2026-05-08T02:59:31Z,A6IzEvadp1c,"<iframe width=""480"" height=""270"" src=""//www.youtube.com/embed/A6IzEvadp1c"" frameborder=""0"" allow=""accelerometer; autoplay; clipboard-write; encrypted-media; gyroscope; picture-in-picture; web-share"" referrerpolicy=""strict-origin-when-cross-origin"" allowfullscreen></iframe>",Current Events
44,2026-05-08T02:57:51Z,UC4YZVeGnDXzEfjGcZG-d6oQ,The True Process of Making Zombies,Erika Mukisa's Testimony https://youtu.be/Rq8NNOqTuaU?si=la17g8o1-6p_rNRg Join All Access on Patreon ...,"{'default': {'url': 'https://i.ytimg.com/vi/ZTumI_tf2NY/default.jpg', 'width': 120, 'height': 90}, 'medium': {'url': 'https://i.ytimg.com/vi/ZTumI_tf2NY/mqdefault.jpg', 'width': 320, 'height': 180}, 'high': {'url': 'https://i.ytimg.com/vi/ZTumI_tf2NY/hqdefault.jpg', 'width': 480, 'height': 360}}",meandepiphany,none,2026-05-08T02:57:51Z,ZTumI_tf2NY,"<iframe width=""480"" height=""270"" src=""//www.youtube.com/embed/ZTumI_tf2NY"" frameborder=""0"" allow=""accelerometer; autoplay; clipboard-write; encrypted-media; gyroscope; picture-in-picture; web-share"" referrerpolicy=""strict-origin-when-cross-origin"" allowfullscreen></iframe>",Social Issues
74,2026-05-08T02:34:44Z,UCQQbETzZZ86V8gRV63IhRRQ,"This country’s founding contradiction was compromise, not confusion.",,"{'default': {'url': 'https://i.ytimg.com/vi/u9ijhBtY2Tw/default.jpg', 'width': 120, 'height': 90}, 'medium': {'url': 'https://i.ytimg.com/vi/u9ijhBtY2Tw/mqdefault.jpg', 'width': 320, 'height': 180}, 'high': {'url': 'https://i.ytimg.com/vi/u9ijhBtY2Tw/hqdefault.jpg', 'width': 480, 'height': 360}}",Ashley B,none,2026-05-08T02:34:44Z,u9ijhBtY2Tw,"<iframe width=""480"" height=""270"" src=""//www.youtube.com/embed/u9ijhBtY2Tw"" frameborder=""0"" allow=""accelerometer; autoplay; clipboard-write; encrypted-media; gyroscope; picture-in-picture; web-share"" referrerpolicy=""strict-origin-when-cross-origin"" allowfullscreen></iframe>",History
3,2026-05-08T01:55:59Z,UCL0u5uz7KZ9q-pe-VC8TY-w,Vote for Thomas Massie! 🇺🇸,,"{'default': {'url': 'https://i.ytimg.com/vi/TjK_1O7nm8U/default.jpg', 'width': 120, 'height': 90}, 'medium': {'url': 'https://i.ytimg.com/vi/TjK_1O7nm8U/mqdefault.jpg', 'width': 320, 'height': 180}, 'high': {'url': 'https://i.ytimg.com/vi/TjK_1O7nm8U/hqdefault.jpg', 'width': 480, 'height': 360}}",Candace Owens,none,2026-05-08T01:55:59Z,TjK_1O7nm8U,"<iframe width=""480"" height=""270"" src=""//www.youtube.com/embed/TjK_1O7nm8U"" frameborder=""0"" allow=""accelerometer; autoplay; clipboard-write; encrypted-media; gyroscope; picture-in-picture; web-share"" referrerpolicy=""strict-origin-when-cross-origin"" allowfullscreen></iframe>",Current Events
36,2026-05-08T01:50:23Z,UCDsOKnUQnQek7-G7Xc5kB8Q,YOUR MONEY NEEDS A JOB #socialproofpodcast,,"{'default': {'url': 'https://i.ytimg.com/vi/_Re7IzSp5cQ/default.jpg', 'width': 120, 'height': 90}, 'medium': {'url': 'https://i.ytimg.com/vi/_Re7IzSp5cQ/mqdefault.jpg', 'width': 320, 'height': 180}, 'high': {'url': 'https://i.ytimg.com/vi/_Re7IzSp5cQ/hqdefault.jpg', 'width': 480, 'height': 360}}",Social Proof,none,2026-05-08T01:50:23Z,_Re7IzSp5cQ,"<iframe width=""480"" height=""270"" src=""//www.youtube.com/embed/_Re7IzSp5cQ"" frameborder=""0"" allow=""accelerometer; autoplay; clipboard-write; encrypted-media; gyroscope; picture-in-picture; web-share"" referrerpolicy=""strict-origin-when-cross-origin"" allowfullscreen></iframe>",Productivity
63,2026-05-08T01:13:20Z,UC2rmgVaijnf92nixlIZWGmg,Why Sahel States Are Accusing Algeria &amp; Mauritania of Backing Jihadists,"Tensions are rising across the Sahel as leaders in Mali, Burkina Faso, and Niger increasingly accuse neighboring countries ...","{'default': {'url': 'https://i.ytimg.com/vi/PBzX-v3sFKM/default.jpg', 'width': 120, 'height': 90}, 'medium': {'url': 'https://i.ytimg.com/vi/PBzX-v3sFKM/mqdefault.jpg', 'width': 320, 'height': 180}, 'high': {'url': 'https://i.ytimg.com/vi/PBzX-v3sFKM/hqdefault.jpg', 'width': 480, 'height': 360}}",Search For Uhuru,none,2026-05-08T01:13:20Z,PBzX-v3sFKM,"<iframe width=""480"" height=""270"" src=""//www.youtube.com/embed/PBzX-v3sFKM"" frameborder=""0"" allow=""accelerometer; autoplay; clipboard-write; encrypted-media; gyroscope; picture-in-picture; web-share"" referrerpolicy=""strict-origin-when-cross-origin"" allowfullscreen></iframe>",Travel
70,2026-05-08T01:00:55Z,UCQoxJOkwaCgyzQtiuAIDcuw,Sukihana: “Jerry Springer genuinely loved black people.” I CLUB SHAY SHAY,"Sukihana: “Jerry Springer genuinely loved black people.” ""Jerry Springer was a time. Rest in peace to Jerry Springer because I'm ...","{'default': {'url': 'https://i.ytimg.com/vi/oGFJP9tYG-E/default.jpg', 'width': 120, 'height': 90}, 'medium': {'url': 'https://i.ytimg.com/vi/oGFJP9tYG-E/mqdefault.jpg', 'width': 320, 'height': 180}, 'high': {'url': 'https://i.ytimg.com/vi/oGFJP9tYG-E/hqdefault.jpg', 'width': 480, 'height': 360}}",Club Shay Shay,none,2026-05-08T01:00:55Z,oGFJP9tYG-E,"<iframe width=""480"" height=""270"" src=""//www.youtube.com/embed/oGFJP9tYG-E"" frameborder=""0"" allow=""accelerometer; autoplay; clipboard-write; encrypted-media; gyroscope; picture-in-picture; web-share"" referrerpolicy=""strict-origin-when-cross-origin"" allowfullscreen></iframe>",Social Issues
4,2026-05-08T00:03:09Z,UCzuqE7-t13O4NIDYJfakrhw,Supreme Court kicks off &quot;gerrymandering arms race&quot; with Voting Right Act decision,"""The country's most important civil rights law no longer effectively exists, and that's going to have ramifications on American ...","{'default': {'url': 'https://i.ytimg.com/vi/_oSt-FgLvtM/default.jpg', 'width': 120, 'height': 90}, 'medium': {'url': 'https://i.ytimg.com/vi/_oSt-FgLvtM/mqdefault.jpg', 'width': 320, 'height': 180}, 'high': {'url': 'https://i.ytimg.com/vi/_oSt-FgLvtM/hqdefault.jpg', 'width': 480, 'height': 360}}",Democracy Now!,none,2026-05-08T00:03:09Z,_oSt-FgLvtM,"<iframe width=""480"" height=""270"" src=""//www.youtube.com/embed/_oSt-FgLvtM"" frameborder=""0"" allow=""accelerometer; autoplay; clipboard-write; encrypted-media; gyroscope; picture-in-picture; web-share"" referrerpolicy=""strict-origin-when-cross-origin"" allowfullscreen></iframe>",Current Events
18,2026-05-07T23:16:40Z,UCABZ7Z6SBTp4IsARDceOq7w,Americans ‘Respond’ To ‘Hantavirus’ Cruise Ship &amp; Passengers: “Leave Them Out There!” - HP News,https://hypersclub.com - Currently a cruise ship en-route to the Canary Islands would experience a Hantavirus outbreak after 3 of ...,"{'default': {'url': 'https://i.ytimg.com/vi/wkFRiQTKnzU/default.jpg', 'width': 120, 'height': 90}, 'medium': {'url': 'https://i.ytimg.com/vi/wkFRiQTKnzU/mqdefault.jpg', 'width': 320, 'height': 180}, 'high': {'url': 'https://i.ytimg.com/vi/wkFRiQTKnzU/hqdefault.jpg', 'width': 480, 'height': 360}}",HYPE+,none,2026-05-07T23:16:40Z,wkFRiQTKnzU,"<iframe width=""480"" height=""270"" src=""//www.youtube.com/embed/wkFRiQTKnzU"" frameborder=""0"" allow=""accelerometer; autoplay; clipboard-write; encrypted-media; gyroscope; picture-in-picture; web-share"" referrerpolicy=""strict-origin-when-cross-origin"" allowfullscreen></iframe>",Entertainment
20,2026-05-07T23:15:12Z,UC4m46pCBkMEyy8gk26WKqbA,"BROKEN PLAY | NAVV GREENE FT. JOJO ALONSO, &amp; REGGIE BALL  | S04 | EP 35",Subscribe To Our Streaming Service Channel 85 https://bit.ly/SubscribeToChannel85 Shop Our Merch! https://bit.ly/85Jetlife2024.,"{'default': {'url': 'https://i.ytimg.com/vi/6utE9MIxH4o/default.jpg', 'width': 120, 'height': 90}, 'medium': {'url': 'https://i.ytimg.com/vi/6utE9MIxH4o/mqdefault.jpg', 'width': 320, 'height': 180}, 'high': {'url': 'https://i.ytimg.com/vi/6utE9MIxH4o/hqdefault.jpg', 'width': 480, 'height': 360}}",The 85 South Comedy Show,none,2026-05-07T23:15:12Z,6utE9MIxH4o,"<iframe width=""480"" height=""270"" src=""//www.youtube.com/embed/6utE9MIxH4o"" frameborder=""0"" allow=""accelerometer; autoplay; clipboard-write; encrypted-media; gyroscope; picture-in-picture; web-share"" referrerpolicy=""strict-origin-when-cross-origin"" allowfullscreen></iframe>",Entertainment
15,2026-05-07T22:31:16Z,UCehBVAPy-bxmnbNARF-_tvA,Who REALLY Killed Spirit Airlines?,"The government regulated airlines like a public utility until 1978, when they were massively deregulated. Since deregulation the ...","{'default': {'url': 'https://i.ytimg.com/vi/xRXDhRSIRiM/default.jpg', 'width': 120, 'height': 90}, 'medium': {'url': 'https://i.ytimg.com/vi/xRXDhRSIRiM/mqdefault.jpg', 'width': 320, 'height': 180}, 'high': {'url': 'https://i.ytimg.com/vi/xRXDhRSIRiM/hqdefault.jpg', 'width': 480, 'height': 360}}",More Perfect Union,none,2026-05-07T22:31:16Z,xRXDhRSIRiM,"<iframe width=""480"" height=""270"" src=""//www.youtube.com/embed/xRXDhRSIRiM"" frameborder=""0"" allow=""accelerometer; autoplay; clipboard-write; encrypted-media; gyroscope; picture-in-picture; web-share"" referrerpolicy=""strict-origin-when-cross-origin"" allowfullscreen></iframe>",Current Events
2,2026-05-07T22:06:08Z,UCiinSjWS3E0vtAa3DCvp7iA,"BREAKING: US bombs Iran, violating ceasefire","BREAKING: Fox News confirms that the U.S. has carried out strikes on Iran's Bandar Abbas and Qeshm Island, two strategic sites ...","{'default': {'url': 'https://i.ytimg.com/vi/8k9zpXwm5BA/default.jpg', 'width': 120, 'height': 90}, 'medium': {'url': 'https://i.ytimg.com/vi/8k9zpXwm5BA/mqdefault.jpg', 'width': 320, 'height': 180}, 'high': {'url': 'https://i.ytimg.com/vi/8k9zpXwm5BA/hqdefault.jpg', 'width': 480, 'height': 360}}",BreakThrough News,none,2026-05-07T22:06:08Z,8k9zpXwm5BA,"<iframe width=""480"" height=""270"" src=""//www.youtube.com/embed/8k9zpXwm5BA"" frameborder=""0"" allow=""accelerometer; autoplay; clipboard-write; encrypted-media; gyroscope; picture-in-picture; web-share"" referrerpolicy=""strict-origin-when-cross-origin"" allowfullscreen></iframe>",Current Events
25,2026-05-07T22:00:07Z,UCC0XWOgSBcwNstXbPX2cbpg,WHlTE Americans BEGS Black People for F0RGIVNESS After Learning Black People Are Gods CH0SEN PE0PLE,"For copyright matters, takedown, or complaint please contact: historicalafrika@gmail.com The history of the United States is often ...","{'default': {'url': 'https://i.ytimg.com/vi/5wDxPA80_aw/default.jpg', 'width': 120, 'height': 90}, 'medium': {'url': 'https://i.ytimg.com/vi/5wDxPA80_aw/mqdefault.jpg', 'width': 320, 'height': 180}, 'high': {'url': 'https://i.ytimg.com/vi/5wDxPA80_aw/hqdefault.jpg', 'width': 480, 'height': 360}}",Historical Africa,none,2026-05-07T22:00:07Z,5wDxPA80_aw,"<iframe width=""480"" height=""270"" src=""//www.youtube.com/embed/5wDxPA80_aw"" frameborder=""0"" allow=""accelerometer; autoplay; clipboard-write; encrypted-media; gyroscope; picture-in-picture; web-share"" referrerpolicy=""strict-origin-when-cross-origin"" allowfullscreen></iframe>",History
16,2026-05-07T21:53:35Z,UCHvnMsLnyQZscrq-fOckiiw,Charlize Theron &amp; Taron Egerton Reveal the Brutal Reality of Making Netflix’s Apex!,Charlize Theron and Taron Egerton sit down with BlackTree TV's Senior Producer Shawn Edwards to talk about their intense new ...,"{'default': {'url': 'https://i.ytimg.com/vi/U4pjUcEPfAc/default.jpg', 'width': 120, 'height': 90}, 'medium': {'url': 'https://i.ytimg.com/vi/U4pjUcEPfAc/mqdefault.jpg', 'width': 320, 'height': 180}, 'high': {'url': 'https://i.ytimg.com/vi/U4pjUcEPfAc/hqdefault.jpg', 'width': 480, 'height': 360}}",BlackTree TV,none,2026-05-07T21:53:35Z,U4pjUcEPfAc,"<iframe width=""480"" height=""270"" src=""//www.youtube.com/embed/U4pjUcEPfAc"" frameborder=""0"" allow=""accelerometer; autoplay; clipboard-write; encrypted-media; gyroscope; picture-in-picture; web-share"" referrerpolicy=""strict-origin-when-cross-origin"" allowfullscreen></iframe>",Entertainment
49,2026-05-07T21:30:49Z,UCxon93J-q95HA-V5TzTauig,Madness!! &quot;I LOVE My Gang MORE Than My MUM&quot;,Madness #podcast #interview #street #gang #uk #drill #rapper #crime #london.,"{'default': {'url': 'https://i.ytimg.com/vi/3egB5fUYX8E/default.jpg', 'width': 120, 'height': 90}, 'medium': {'url': 'https://i.ytimg.com/vi/3egB5fUYX8E/mqdefault.jpg', 'width': 320, 'height': 180}, 'high': {'url': 'https://i.ytimg.com/vi/3egB5fUYX8E/hqdefault.jpg', 'width': 480, 'height': 360}}",The Drazzy Show,none,2026-05-07T21:30:49Z,3egB5fUYX8E,"<iframe width=""480"" height=""270"" src=""//www.youtube.com/embed/3egB5fUYX8E"" frameborder=""0"" allow=""accelerometer; autoplay; clipboard-write; encrypted-media; gyroscope; picture-in-picture; web-share"" referrerpolicy=""strict-origin-when-cross-origin"" allowfullscreen></iframe>",Social Issues
51,2026-05-07T20:20:20Z,UCHVBLMcvOgDtFEF2bToQLqw,Fred Price Hebrew Israelite Blackwashing,Fred Price Hebrew Israelite Blackwashing.,"{'default': {'url': 'https://i.ytimg.com/vi/GAxaEEjWNCw/default_live.jpg', 'width': 120, 'height': 90}, 'medium': {'url': 'https://i.ytimg.com/vi/GAxaEEjWNCw/mqdefault_live.jpg', 'width': 320, 'height': 180}, 'high': {'url': 'https://i.ytimg.com/vi/GAxaEEjWNCw/hqdefault_live.jpg', 'width': 480, 'height': 360}}",We Woke Now,upcoming,2026-05-07T20:20:20Z,GAxaEEjWNCw,"<iframe width=""480"" height=""270"" src=""//www.youtube.com/embed/GAxaEEjWNCw"" frameborder=""0"" allow=""accelerometer; autoplay; clipboard-write; encrypted-media; gyroscope; picture-in-picture; web-share"" referrerpolicy=""strict-origin-when-cross-origin"" allowfullscreen></iframe>",Social Issues
40,2026-05-07T20:15:01Z,UCZEMyEeGRnkGERZTWEGLGPg,"If You’re Black, Watch This: The Black Story CHINA Doesn&#39;t Want Told","Black Culture Unlocked is about truth—real history, real stories, and real awareness. We reject rewritten narratives and reclaim ...","{'default': {'url': 'https://i.ytimg.com/vi/4Mab8IJMS7Y/default.jpg', 'width': 120, 'height': 90}, 'medium': {'url': 'https://i.ytimg.com/vi/4Mab8IJMS7Y/mqdefault.jpg', 'width': 320, 'height': 180}, 'high': {'url': 'https://i.ytimg.com/vi/4Mab8IJMS7Y/hqdefault.jpg', 'width': 480, 'height': 360}}",Black Culture Unlocked,none,2026-05-07T20:15:01Z,4Mab8IJMS7Y,"<iframe width=""480"" height=""270"" src=""//www.youtube.com/embed/4Mab8IJMS7Y"" frameborder=""0"" allow=""accelerometer; autoplay; clipboard-write; encrypted-media; gyroscope; picture-in-picture; web-share"" referrerpolicy=""strict-origin-when-cross-origin"" allowfullscreen></iframe>",Social Issues
7,2026-05-07T20:02:07Z,UCKLSjhp6XZUEYDT1DMcrj8w,JUST IN: Ghana DEMANDS AU ACTION Against South Africa,Ghana has officially petitioned the African Union to place the issue of xenophobic attacks in South Africa on the agenda of the AU ...,"{'default': {'url': 'https://i.ytimg.com/vi/WM_9J1-VC_Q/default.jpg', 'width': 120, 'height': 90}, 'medium': {'url': 'https://i.ytimg.com/vi/WM_9J1-VC_Q/mqdefault.jpg', 'width': 320, 'height': 180}, 'high': {'url': 'https://i.ytimg.com/vi/WM_9J1-VC_Q/hqdefault.jpg', 'width': 480, 'height': 360}}",Make Afrika Great ,none,2026-05-07T20:02:07Z,WM_9J1-VC_Q,"<iframe width=""480"" height=""270"" src=""//www.youtube.com/embed/WM_9J1-VC_Q"" frameborder=""0"" allow=""accelerometer; autoplay; clipboard-write; encrypted-media; gyroscope; picture-in-picture; web-share"" referrerpolicy=""strict-origin-when-cross-origin"" allowfullscreen></iframe>",Current Events
10,2026-05-07T20:00:26Z,UChq-BD2afpGbtMUtCxq2YFw,Is This Neocolonialism… or a Power Move by Zambia?,Thanks so much for tuning in! Get Sandra's State of Africa 2026 Report: https://sandrababuboateng.com/soa2026/. Connect with ...,"{'default': {'url': 'https://i.ytimg.com/vi/g4_DY1Wt3e8/default.jpg', 'width': 120, 'height': 90}, 'medium': {'url': 'https://i.ytimg.com/vi/g4_DY1Wt3e8/mqdefault.jpg', 'width': 320, 'height': 180}, 'high': {'url': 'https://i.ytimg.com/vi/g4_DY1Wt3e8/hqdefault.jpg', 'width': 480, 'height': 360}}",PanaGenius TV,none,2026-05-07T20:00:26Z,g4_DY1Wt3e8,"<iframe width=""480"" height=""270"" src=""//www.youtube.com/embed/g4_DY1Wt3e8"" frameborder=""0"" allow=""accelerometer; autoplay; clipboard-write; encrypted-media; gyroscope; picture-in-picture; web-share"" referrerpolicy=""strict-origin-when-cross-origin"" allowfullscreen></iframe>",Current Events
73,2026-05-07T19:41:25Z,UCSlLff7uX8i8uUpB1MnhN2Q,Cuts Are Killing Black HIV Outreach #substack #shorts,This is a clip from https://theconsciouslee.substack.com/p/black-women-hiv-and-the-lie-of-the?utm_source=youtube_shorts See ...,"{'default': {'url': 'https://i.ytimg.com/vi/wm9DoyxW4f8/default.jpg', 'width': 120, 'height': 90}, 'medium': {'url': 'https://i.ytimg.com/vi/wm9DoyxW4f8/mqdefault.jpg', 'width': 320, 'height': 180}, 'high': {'url': 'https://i.ytimg.com/vi/wm9DoyxW4f8/hqdefault.jpg', 'width': 480, 'height': 360}}",The Conscious Lee,none,2026-05-07T19:41:25Z,wm9DoyxW4f8,"<iframe width=""480"" height=""270"" src=""//www.youtube.com/embed/wm9DoyxW4f8"" frameborder=""0"" allow=""accelerometer; autoplay; clipboard-write; encrypted-media; gyroscope; picture-in-picture; web-share"" referrerpolicy=""strict-origin-when-cross-origin"" allowfullscreen></iframe>",Social Issues
48,2026-05-07T18:53:10Z,UCzo3jVzn-Z9LrFVwAE7iDbw,Get your initial attraction merch now! Visit Merchlabs.com/ArletteandBM,,"{'default': {'url': 'https://i.ytimg.com/vi/BLnsoWnPbsE/default.jpg', 'width': 120, 'height': 90}, 'medium': {'url': 'https://i.ytimg.com/vi/BLnsoWnPbsE/mqdefault.jpg', 'width': 320, 'height': 180}, 'high': {'url': 'https://i.ytimg.com/vi/BLnsoWnPbsE/hqdefault.jpg', 'width': 480, 'height': 360}}",Pop The Balloon,none,2026-05-07T18:53:10Z,BLnsoWnPbsE,"<iframe width=""480"" height=""270"" src=""//www.youtube.com/embed/BLnsoWnPbsE"" frameborder=""0"" allow=""accelerometer; autoplay; clipboard-write; encrypted-media; gyroscope; picture-in-picture; web-share"" referrerpolicy=""strict-origin-when-cross-origin"" allowfullscreen></iframe>",Social Issues
24,2026-05-07T18:00:35Z,UCTNr0N__QwstBhgCtvQcjhA,White Farmers Try to Intimidate Black Workers—But It Doesn’t Work,Join our channel to get access to perks: https://www.youtube.com/channel/UCTNr0N__QwstBhgCtvQcjhA/join This video explores ...,"{'default': {'url': 'https://i.ytimg.com/vi/UBP1FkQFPXU/default.jpg', 'width': 120, 'height': 90}, 'medium': {'url': 'https://i.ytimg.com/vi/UBP1FkQFPXU/mqdefault.jpg', 'width': 320, 'height': 180}, 'high': {'url': 'https://i.ytimg.com/vi/UBP1FkQFPXU/hqdefault.jpg', 'width': 480, 'height': 360}}",Black Discoveries,none,2026-05-07T18:00:35Z,UBP1FkQFPXU,"<iframe width=""480"" height=""270"" src=""//www.youtube.com/embed/UBP1FkQFPXU"" frameborder=""0"" allow=""accelerometer; autoplay; clipboard-write; encrypted-media; gyroscope; picture-in-picture; web-share"" referrerpolicy=""strict-origin-when-cross-origin"" allowfullscreen></iframe>",History
45,2026-05-07T17:01:15Z,UCrPq2ekHx2vZtuyG3wUx0_g,A Blueprint For Black Self Sufficiency | The Tuskegee University Story ,Join this channel to get access to perks: https://www.youtube.com/channel/UCrPq2ekHx2vZtuyG3wUx0_g/join OTSOG Book ...,"{'default': {'url': 'https://i.ytimg.com/vi/vmLB0wvpM7o/default.jpg', 'width': 120, 'height': 90}, 'medium': {'url': 'https://i.ytimg.com/vi/vmLB0wvpM7o/mqdefault.jpg', 'width': 320, 'height': 180}, 'high': {'url': 'https://i.ytimg.com/vi/vmLB0wvpM7o/hqdefault.jpg', 'width': 480, 'height': 360}}",On the Shoulders of Giants ,none,2026-05-07T17:01:15Z,vmLB0wvpM7o,"<iframe width=""480"" height=""360"" src=""//www.youtube.com/embed/vmLB0wvpM7o"" frameborder=""0"" allow=""accelerometer; autoplay; clipboard-write; encrypted-media; gyroscope; picture-in-picture; web-share"" referrerpolicy=""strict-origin-when-cross-origin"" allowfullscreen></iframe>",Social Issues
60,2026-05-07T16:15:06Z,UCi2uaWdy6OTf4Ty7DVC_7lw,LIFE AFTER SORROW ( Village Life in Africa ) !!!,"Hello family MOVING ON AFTER SORROW ( Village Life in Africa ) !!!, welcome to my YouTube channel iam_marwa After BIG ...","{'default': {'url': 'https://i.ytimg.com/vi/LmROPI1rRs4/default.jpg', 'width': 120, 'height': 90}, 'medium': {'url': 'https://i.ytimg.com/vi/LmROPI1rRs4/mqdefault.jpg', 'width': 320, 'height': 180}, 'high': {'url': 'https://i.ytimg.com/vi/LmROPI1rRs4/hqdefault.jpg', 'width': 480, 'height': 360}}",iam_marwa,none,2026-05-07T16:15:06Z,LmROPI1rRs4,"<iframe width=""480"" height=""270"" src=""//www.youtube.com/embed/LmROPI1rRs4"" frameborder=""0"" allow=""accelerometer; autoplay; clipboard-write; encrypted-media; gyroscope; picture-in-picture; web-share"" referrerpolicy=""strict-origin-when-cross-origin"" allowfullscreen></iframe>",Travel
35,2026-05-07T16:01:20Z,UCRVsqvXIdgyPVS-a6fGa1lA,"Jermaine Dupri On Being Part Of 400M Records Sold, Changing Hip Hop Forever &amp; Never Getting Credit",TIMESTAMPS: 00:00 Kris Kross Discovery 01:10 Welcome Jermaine Dupri 02:53 Longevity Staying Relevant 06:08 Publishing ...,"{'default': {'url': 'https://i.ytimg.com/vi/jZ6cVhNtXQo/default.jpg', 'width': 120, 'height': 90}, 'medium': {'url': 'https://i.ytimg.com/vi/jZ6cVhNtXQo/mqdefault.jpg', 'width': 320, 'height': 180}, 'high': {'url': 'https://i.ytimg.com/vi/jZ6cVhNtXQo/hqdefault.jpg', 'width': 480, 'height': 360}}",Earn Your Leisure,none,2026-05-07T16:01:20Z,jZ6cVhNtXQo,"<iframe width=""480"" height=""270"" src=""//www.youtube.com/embed/jZ6cVhNtXQo"" frameborder=""0"" allow=""accelerometer; autoplay; clipboard-write; encrypted-media; gyroscope; picture-in-picture; web-share"" referrerpolicy=""strict-origin-when-cross-origin"" allowfullscreen></iframe>",Productivity
66,2026-05-07T15:25:13Z,UCAk5dFz-FOvYUIUFvWdbRJA,How Do Liberians Say ‘Milk’? #shorts,From food to pronunciation real quick How you say it?   #Afronomics #TasteTest #JollofWars #JollofRice #WestAfricanFood ...,"{'default': {'url': 'https://i.ytimg.com/vi/E62kuv7etqc/default.jpg', 'width': 120, 'height': 90}, 'medium': {'url': 'https://i.ytimg.com/vi/E62kuv7etqc/mqdefault.jpg', 'width': 320, 'height': 180}, 'high': {'url': 'https://i.ytimg.com/vi/E62kuv7etqc/hqdefault.jpg', 'width': 480, 'height': 360}}",Afronomics,none,2026-05-07T15:25:13Z,E62kuv7etqc,"<iframe width=""480"" height=""270"" src=""//www.youtube.com/embed/E62kuv7etqc"" frameborder=""0"" allow=""accelerometer; autoplay; clipboard-write; encrypted-media; gyroscope; picture-in-picture; web-share"" referrerpolicy=""strict-origin-when-cross-origin"" allowfullscreen></iframe>",Social Issues
