,publishedAt,channelId,title,description,thumbnails,channelTitle,liveBroadcastContent,publishTime,videoID,embeds,category
67,2026-04-25T17:37:23Z,UCy8BPJpTwXNLyL2vGCZu21Q,Faces Don’t Move Like They Used To… And It’s Getting Disturbing,Want to work behind the scenes? Apply here!,"{'default': {'url': 'https://i.ytimg.com/vi/15tBrRAKMTg/default.jpg', 'width': 120, 'height': 90}, 'medium': {'url': 'https://i.ytimg.com/vi/15tBrRAKMTg/mqdefault.jpg', 'width': 320, 'height': 180}, 'high': {'url': 'https://i.ytimg.com/vi/15tBrRAKMTg/hqdefault.jpg', 'width': 480, 'height': 360}}",Janae Danyiel,none,2026-04-25T17:37:23Z,15tBrRAKMTg,"<iframe width=""480"" height=""270"" src=""//www.youtube.com/embed/15tBrRAKMTg"" frameborder=""0"" allow=""accelerometer; autoplay; clipboard-write; encrypted-media; gyroscope; picture-in-picture; web-share"" referrerpolicy=""strict-origin-when-cross-origin"" allowfullscreen></iframe>",Social Issues
37,2026-04-23T16:00:00Z,UC4lH-odQ5ll-85fkpWxDYmA,i visited the world’s most powerful city 🇺🇸… here is what I found ,"in today's episode, i visited one of the worlds most powerful capital city. Washington DC to see what life is like. SIGNUP WITH ...","{'default': {'url': 'https://i.ytimg.com/vi/lW7MXgoaJ20/default.jpg', 'width': 120, 'height': 90}, 'medium': {'url': 'https://i.ytimg.com/vi/lW7MXgoaJ20/mqdefault.jpg', 'width': 320, 'height': 180}, 'high': {'url': 'https://i.ytimg.com/vi/lW7MXgoaJ20/hqdefault.jpg', 'width': 480, 'height': 360}}",Steven Ndukwu,none,2026-04-23T16:00:00Z,lW7MXgoaJ20,"<iframe width=""480"" height=""270"" src=""//www.youtube.com/embed/lW7MXgoaJ20"" frameborder=""0"" allow=""accelerometer; autoplay; clipboard-write; encrypted-media; gyroscope; picture-in-picture; web-share"" referrerpolicy=""strict-origin-when-cross-origin"" allowfullscreen></iframe>",Productivity
71,2026-04-21T18:47:53Z,UCsY17ZnXg_Gmt9bWz49HoWw,It is influencing how men see themselves :19keys,Join this channel to get access to perks: https://www.youtube.com/channel/UCsY17ZnXg_Gmt9bWz49HoWw/join.,"{'default': {'url': 'https://i.ytimg.com/vi/lDguftYapuI/default.jpg', 'width': 120, 'height': 90}, 'medium': {'url': 'https://i.ytimg.com/vi/lDguftYapuI/mqdefault.jpg', 'width': 320, 'height': 180}, 'high': {'url': 'https://i.ytimg.com/vi/lDguftYapuI/hqdefault.jpg', 'width': 480, 'height': 360}}",19KEYS NETWORK,none,2026-04-21T18:47:53Z,lDguftYapuI,"<iframe width=""480"" height=""270"" src=""//www.youtube.com/embed/lDguftYapuI"" frameborder=""0"" allow=""accelerometer; autoplay; clipboard-write; encrypted-media; gyroscope; picture-in-picture; web-share"" referrerpolicy=""strict-origin-when-cross-origin"" allowfullscreen></iframe>",Productivity
62,2026-04-21T14:03:16Z,UCF71yDQwxfw0QcYb2JnkB5Q,HELLO MY LIP‼️,"So here's what actually happened. I'm in the jacuzzi at sunrise… and out of nowhere, I get stung right in the lip by a bee.","{'default': {'url': 'https://i.ytimg.com/vi/3zGg-DrxonA/default.jpg', 'width': 120, 'height': 90}, 'medium': {'url': 'https://i.ytimg.com/vi/3zGg-DrxonA/mqdefault.jpg', 'width': 320, 'height': 180}, 'high': {'url': 'https://i.ytimg.com/vi/3zGg-DrxonA/hqdefault.jpg', 'width': 480, 'height': 360}}",PassportHeavy,none,2026-04-21T14:03:16Z,3zGg-DrxonA,"<iframe width=""480"" height=""270"" src=""//www.youtube.com/embed/3zGg-DrxonA"" frameborder=""0"" allow=""accelerometer; autoplay; clipboard-write; encrypted-media; gyroscope; picture-in-picture; web-share"" referrerpolicy=""strict-origin-when-cross-origin"" allowfullscreen></iframe>",Travel
26,2026-03-31T16:30:00Z,UC12lU5ymIvSpgl8KntDQUQA,The Deep Denial Of Traditional African Science 🔭 👁️🌌🧠,African Kings Book: https://mixam.com/print-on-demand/69a6d8e7cc73f0a9e6e8b18c Patreon: ...,"{'default': {'url': 'https://i.ytimg.com/vi/KYPy1D554Xk/default.jpg', 'width': 120, 'height': 90}, 'medium': {'url': 'https://i.ytimg.com/vi/KYPy1D554Xk/mqdefault.jpg', 'width': 320, 'height': 180}, 'high': {'url': 'https://i.ytimg.com/vi/KYPy1D554Xk/hqdefault.jpg', 'width': 480, 'height': 360}}",HomeTeam History,none,2026-03-31T16:30:00Z,KYPy1D554Xk,"<iframe width=""480"" height=""270"" src=""//www.youtube.com/embed/KYPy1D554Xk"" frameborder=""0"" allow=""accelerometer; autoplay; clipboard-write; encrypted-media; gyroscope; picture-in-picture; web-share"" referrerpolicy=""strict-origin-when-cross-origin"" allowfullscreen></iframe>",History
59,2026-03-26T22:49:16Z,UCOhiR-6Y-MZtMERKRENrcRw,"Africa, beyond the History being told. A New Narrative for the world to see","This channel is to bring the awareness to the world of the beautiful continent of Africa. My intentions are to show the development, ...","{'default': {'url': 'https://i.ytimg.com/vi/QcuXUymLtHQ/default.jpg', 'width': 120, 'height': 90}, 'medium': {'url': 'https://i.ytimg.com/vi/QcuXUymLtHQ/mqdefault.jpg', 'width': 320, 'height': 180}, 'high': {'url': 'https://i.ytimg.com/vi/QcuXUymLtHQ/hqdefault.jpg', 'width': 480, 'height': 360}}",GoBlack2Africa ,none,2026-03-26T22:49:16Z,QcuXUymLtHQ,"<iframe width=""480"" height=""270"" src=""//www.youtube.com/embed/QcuXUymLtHQ"" frameborder=""0"" allow=""accelerometer; autoplay; clipboard-write; encrypted-media; gyroscope; picture-in-picture; web-share"" referrerpolicy=""strict-origin-when-cross-origin"" allowfullscreen></iframe>",Travel
23,2026-02-08T16:00:45Z,UC2xX2FI6s4i9xz3t9qjayhg,Maurice Bishop Interview (1983),,"{'default': {'url': 'https://i.ytimg.com/vi/ZpKldrtlZmg/default.jpg', 'width': 120, 'height': 90}, 'medium': {'url': 'https://i.ytimg.com/vi/ZpKldrtlZmg/mqdefault.jpg', 'width': 320, 'height': 180}, 'high': {'url': 'https://i.ytimg.com/vi/ZpKldrtlZmg/hqdefault.jpg', 'width': 480, 'height': 360}}",AfroMarxist,none,2026-02-08T16:00:45Z,ZpKldrtlZmg,"<iframe width=""480"" height=""360"" src=""//www.youtube.com/embed/ZpKldrtlZmg"" frameborder=""0"" allow=""accelerometer; autoplay; clipboard-write; encrypted-media; gyroscope; picture-in-picture; web-share"" referrerpolicy=""strict-origin-when-cross-origin"" allowfullscreen></iframe>",History
39,2025-11-05T22:16:23Z,UCx5Y5d5KgibkG9KAyknCdFA,What People Need to Realize About Charlie Kirk,,"{'default': {'url': 'https://i.ytimg.com/vi/pJ99RTTaV4U/default.jpg', 'width': 120, 'height': 90}, 'medium': {'url': 'https://i.ytimg.com/vi/pJ99RTTaV4U/mqdefault.jpg', 'width': 320, 'height': 180}, 'high': {'url': 'https://i.ytimg.com/vi/pJ99RTTaV4U/hqdefault.jpg', 'width': 480, 'height': 360}}",Afromation Digital,none,2025-11-05T22:16:23Z,pJ99RTTaV4U,"<iframe width=""480"" height=""270"" src=""//www.youtube.com/embed/pJ99RTTaV4U"" frameborder=""0"" allow=""accelerometer; autoplay; clipboard-write; encrypted-media; gyroscope; picture-in-picture; web-share"" referrerpolicy=""strict-origin-when-cross-origin"" allowfullscreen></iframe>",Social Issues
27,2025-09-27T15:41:10Z,UC__wkIWEfbnTAYVT8j6gfPg,Origins of Ancient Egypt #kemet #africanhistory #ancientegypt #history,,"{'default': {'url': 'https://i.ytimg.com/vi/6_GbuDpE_bk/default.jpg', 'width': 120, 'height': 90}, 'medium': {'url': 'https://i.ytimg.com/vi/6_GbuDpE_bk/mqdefault.jpg', 'width': 320, 'height': 180}, 'high': {'url': 'https://i.ytimg.com/vi/6_GbuDpE_bk/hqdefault.jpg', 'width': 480, 'height': 360}}",Know Thyself,none,2025-09-27T15:41:10Z,6_GbuDpE_bk,"<iframe width=""480"" height=""270"" src=""//www.youtube.com/embed/6_GbuDpE_bk"" frameborder=""0"" allow=""accelerometer; autoplay; clipboard-write; encrypted-media; gyroscope; picture-in-picture; web-share"" referrerpolicy=""strict-origin-when-cross-origin"" allowfullscreen></iframe>",History
54,2025-09-01T07:52:17Z,UCbvE_5m8kmm9U58gDHtzYrA,FUT DRAFT TIME!,Afro Ballers!,"{'default': {'url': 'https://i.ytimg.com/vi/UcEVjoHa4zM/default.jpg', 'width': 120, 'height': 90}, 'medium': {'url': 'https://i.ytimg.com/vi/UcEVjoHa4zM/mqdefault.jpg', 'width': 320, 'height': 180}, 'high': {'url': 'https://i.ytimg.com/vi/UcEVjoHa4zM/hqdefault.jpg', 'width': 480, 'height': 360}}",AfroBallers,none,2025-09-01T07:52:17Z,UcEVjoHa4zM,"<iframe width=""480"" height=""270"" src=""//www.youtube.com/embed/UcEVjoHa4zM"" frameborder=""0"" allow=""accelerometer; autoplay; clipboard-write; encrypted-media; gyroscope; picture-in-picture; web-share"" referrerpolicy=""strict-origin-when-cross-origin"" allowfullscreen></iframe>",Sports
8,2025-01-11T16:00:06Z,UCJH-fn0wLu5uwXX33jNToQw,Samora Machel&#39;s Struggle | How Mozambique’s Revolution Ended Portugal&#39;s Empire,"The most beautiful thing about a man's life is his freedom. He may not have any food, and he may not have any clothing, but at ...","{'default': {'url': 'https://i.ytimg.com/vi/wTwI48jN-fY/default.jpg', 'width': 120, 'height': 90}, 'medium': {'url': 'https://i.ytimg.com/vi/wTwI48jN-fY/mqdefault.jpg', 'width': 320, 'height': 180}, 'high': {'url': 'https://i.ytimg.com/vi/wTwI48jN-fY/hqdefault.jpg', 'width': 480, 'height': 360}}",NewAfrica,none,2025-01-11T16:00:06Z,wTwI48jN-fY,"<iframe width=""480"" height=""270"" src=""//www.youtube.com/embed/wTwI48jN-fY"" frameborder=""0"" allow=""accelerometer; autoplay; clipboard-write; encrypted-media; gyroscope; picture-in-picture; web-share"" referrerpolicy=""strict-origin-when-cross-origin"" allowfullscreen></iframe>",Current Events
29,2024-08-25T18:19:19Z,UCh2ANLALdN1OZUJKmvchkkg,The INSANE True Story of Cleopatra in Pop Culture | Documentary,"Cleopatra is one of the most iconic figures associated with ancient Egypt, but our perception of the queen is not correct.","{'default': {'url': 'https://i.ytimg.com/vi/dwSSQFS-OQY/default.jpg', 'width': 120, 'height': 90}, 'medium': {'url': 'https://i.ytimg.com/vi/dwSSQFS-OQY/mqdefault.jpg', 'width': 320, 'height': 180}, 'high': {'url': 'https://i.ytimg.com/vi/dwSSQFS-OQY/hqdefault.jpg', 'width': 480, 'height': 360}}",Mr. Imhotep,none,2024-08-25T18:19:19Z,dwSSQFS-OQY,"<iframe width=""480"" height=""270"" src=""//www.youtube.com/embed/dwSSQFS-OQY"" frameborder=""0"" allow=""accelerometer; autoplay; clipboard-write; encrypted-media; gyroscope; picture-in-picture; web-share"" referrerpolicy=""strict-origin-when-cross-origin"" allowfullscreen></iframe>",History
57,2024-08-25T18:00:03Z,UCMMTYgqKEgCgy1pR6Axlf0A,"Ex-model moved to Ghana to build a 5 bedroom home, set up 7 businesses and live her dream life",Our guest today left behind her 15 year career in the modelling industry to move to Ghana and start a new life here. This amazing ...,"{'default': {'url': 'https://i.ytimg.com/vi/6TMZcRoGZi4/default.jpg', 'width': 120, 'height': 90}, 'medium': {'url': 'https://i.ytimg.com/vi/6TMZcRoGZi4/mqdefault.jpg', 'width': 320, 'height': 180}, 'high': {'url': 'https://i.ytimg.com/vi/6TMZcRoGZi4/hqdefault.jpg', 'width': 480, 'height': 360}}",Build with Amoaa,none,2024-08-25T18:00:03Z,6TMZcRoGZi4,"<iframe width=""480"" height=""270"" src=""//www.youtube.com/embed/6TMZcRoGZi4"" frameborder=""0"" allow=""accelerometer; autoplay; clipboard-write; encrypted-media; gyroscope; picture-in-picture; web-share"" referrerpolicy=""strict-origin-when-cross-origin"" allowfullscreen></iframe>",Travel
38,2024-07-12T12:15:30Z,UCl6to6J7oVltnhHEVm1s87A,AFRICAN ORIGIN OF MORDEN HAIRSTYLES,theperspective #africanhistory #africanews #africax5 Traditional African hairstyles are back in fashion and making a real ...,"{'default': {'url': 'https://i.ytimg.com/vi/AGyMe_XB3mQ/default.jpg', 'width': 120, 'height': 90}, 'medium': {'url': 'https://i.ytimg.com/vi/AGyMe_XB3mQ/mqdefault.jpg', 'width': 320, 'height': 180}, 'high': {'url': 'https://i.ytimg.com/vi/AGyMe_XB3mQ/hqdefault.jpg', 'width': 480, 'height': 360}}",Africax5 Network,none,2024-07-12T12:15:30Z,AGyMe_XB3mQ,"<iframe width=""480"" height=""360"" src=""//www.youtube.com/embed/AGyMe_XB3mQ"" frameborder=""0"" allow=""accelerometer; autoplay; clipboard-write; encrypted-media; gyroscope; picture-in-picture; web-share"" referrerpolicy=""strict-origin-when-cross-origin"" allowfullscreen></iframe>",Social Issues
28,2024-07-08T12:10:25Z,UCHbmePHjGH3pklvSla6szWw,You Wouldn&#39;t Survive In Ancient Egypt | REACTION - KueliMika,Today we are reacting to the video You Wouldn't Survive In Ancient Egypt.,"{'default': {'url': 'https://i.ytimg.com/vi/qFbr17zUKYE/default.jpg', 'width': 120, 'height': 90}, 'medium': {'url': 'https://i.ytimg.com/vi/qFbr17zUKYE/mqdefault.jpg', 'width': 320, 'height': 180}, 'high': {'url': 'https://i.ytimg.com/vi/qFbr17zUKYE/hqdefault.jpg', 'width': 480, 'height': 360}}",KueliMika,none,2024-07-08T12:10:25Z,qFbr17zUKYE,"<iframe width=""480"" height=""270"" src=""//www.youtube.com/embed/qFbr17zUKYE"" frameborder=""0"" allow=""accelerometer; autoplay; clipboard-write; encrypted-media; gyroscope; picture-in-picture; web-share"" referrerpolicy=""strict-origin-when-cross-origin"" allowfullscreen></iframe>",History
34,2024-04-25T23:00:06Z,UCTTQWaoGloNuhunZevQ2F6g,"Kuubwa Transforming African Businesses: Fabric Weaver, Fish Farmers","Kuubwa Transforms African Businesses: Fish Farmers, Fabric Manufacturers and more.","{'default': {'url': 'https://i.ytimg.com/vi/gC02Wht1UQQ/default.jpg', 'width': 120, 'height': 90}, 'medium': {'url': 'https://i.ytimg.com/vi/gC02Wht1UQQ/mqdefault.jpg', 'width': 320, 'height': 180}, 'high': {'url': 'https://i.ytimg.com/vi/gC02Wht1UQQ/hqdefault.jpg', 'width': 480, 'height': 360}}",Africa Business Channel TV,none,2024-04-25T23:00:06Z,gC02Wht1UQQ,"<iframe width=""480"" height=""270"" src=""//www.youtube.com/embed/gC02Wht1UQQ"" frameborder=""0"" allow=""accelerometer; autoplay; clipboard-write; encrypted-media; gyroscope; picture-in-picture; web-share"" referrerpolicy=""strict-origin-when-cross-origin"" allowfullscreen></iframe>",Productivity
31,2024-04-11T05:04:02Z,UCuvO0y2EU_kRfYzlhGJNOKA,How Did America&#39;s Wealthy Elite Re Write World History,"The United States was supposed to be a democratically run country. However, that has not been the case since the turn of the ...","{'default': {'url': 'https://i.ytimg.com/vi/RPSnS-ucmOA/default.jpg', 'width': 120, 'height': 90}, 'medium': {'url': 'https://i.ytimg.com/vi/RPSnS-ucmOA/mqdefault.jpg', 'width': 320, 'height': 180}, 'high': {'url': 'https://i.ytimg.com/vi/RPSnS-ucmOA/hqdefault.jpg', 'width': 480, 'height': 360}}",Straight UP,none,2024-04-11T05:04:02Z,RPSnS-ucmOA,"<iframe width=""480"" height=""270"" src=""//www.youtube.com/embed/RPSnS-ucmOA"" frameborder=""0"" allow=""accelerometer; autoplay; clipboard-write; encrypted-media; gyroscope; picture-in-picture; web-share"" referrerpolicy=""strict-origin-when-cross-origin"" allowfullscreen></iframe>",History
