,publishedAt,channelId,title,description,thumbnails,channelTitle,liveBroadcastContent,publishTime,videoID,embeds,category
60,2026-04-15T16:18:56Z,UCi2uaWdy6OTf4Ty7DVC_7lw,MY BROTHER&#39;s MUILT-MILLION CONDOS CONSTRUCTION PROGRESS !!!,"Hello family , welcome to my YouTube channel iam_marwa, in Today's video my sister's @DeeMwango Multi-million villa has ...","{'default': {'url': 'https://i.ytimg.com/vi/_FV6e3Ld_oA/default.jpg', 'width': 120, 'height': 90}, 'medium': {'url': 'https://i.ytimg.com/vi/_FV6e3Ld_oA/mqdefault.jpg', 'width': 320, 'height': 180}, 'high': {'url': 'https://i.ytimg.com/vi/_FV6e3Ld_oA/hqdefault.jpg', 'width': 480, 'height': 360}}",iam_marwa,none,2026-04-15T16:18:56Z,_FV6e3Ld_oA,"<iframe width=""480"" height=""270"" src=""//www.youtube.com/embed/_FV6e3Ld_oA"" frameborder=""0"" allow=""accelerometer; autoplay; clipboard-write; encrypted-media; gyroscope; picture-in-picture; web-share"" referrerpolicy=""strict-origin-when-cross-origin"" allowfullscreen></iframe>",Travel
66,2026-04-15T14:38:21Z,UCAk5dFz-FOvYUIUFvWdbRJA,The Seeds You Plant Today Matter #shorts,Build bridges before you need them. The way you treat people today can open doors years later. #Afronomics #CareerGrowth ...,"{'default': {'url': 'https://i.ytimg.com/vi/qpCvCIChtr0/default.jpg', 'width': 120, 'height': 90}, 'medium': {'url': 'https://i.ytimg.com/vi/qpCvCIChtr0/mqdefault.jpg', 'width': 320, 'height': 180}, 'high': {'url': 'https://i.ytimg.com/vi/qpCvCIChtr0/hqdefault.jpg', 'width': 480, 'height': 360}}",Afronomics,none,2026-04-15T14:38:21Z,qpCvCIChtr0,"<iframe width=""480"" height=""270"" src=""//www.youtube.com/embed/qpCvCIChtr0"" frameborder=""0"" allow=""accelerometer; autoplay; clipboard-write; encrypted-media; gyroscope; picture-in-picture; web-share"" referrerpolicy=""strict-origin-when-cross-origin"" allowfullscreen></iframe>",Social Issues
5,2026-04-15T14:03:33Z,UC1ettU5YSf_nIOJWffCKGQw,when dr. henrik clarke found out louis farrakhan was compromised.,Dr. John Henrik Clarke speech Lecture on minister Louis Farrakhan. Check Out My Patreon Page for more highly sought rare ...,"{'default': {'url': 'https://i.ytimg.com/vi/7FeEr0hwQfI/default.jpg', 'width': 120, 'height': 90}, 'medium': {'url': 'https://i.ytimg.com/vi/7FeEr0hwQfI/mqdefault.jpg', 'width': 320, 'height': 180}, 'high': {'url': 'https://i.ytimg.com/vi/7FeEr0hwQfI/hqdefault.jpg', 'width': 480, 'height': 360}}",LuiSpot,none,2026-04-15T14:03:33Z,7FeEr0hwQfI,"<iframe width=""480"" height=""270"" src=""//www.youtube.com/embed/7FeEr0hwQfI"" frameborder=""0"" allow=""accelerometer; autoplay; clipboard-write; encrypted-media; gyroscope; picture-in-picture; web-share"" referrerpolicy=""strict-origin-when-cross-origin"" allowfullscreen></iframe>",Current Events
4,2026-04-15T12:17:04Z,UCF-A_4x9-bLrxXrmgBOWuJA,President Julius Malema attends Pre-Sentencing Hearing,"President Julius Malema attends Pre-Sentencing Hearing at East London Magistrates' Court. Wednesday, 15 April 2026.","{'default': {'url': 'https://i.ytimg.com/vi/xswoGG2Oebc/default.jpg', 'width': 120, 'height': 90}, 'medium': {'url': 'https://i.ytimg.com/vi/xswoGG2Oebc/mqdefault.jpg', 'width': 320, 'height': 180}, 'high': {'url': 'https://i.ytimg.com/vi/xswoGG2Oebc/hqdefault.jpg', 'width': 480, 'height': 360}}",Economic Freedom Fighters,none,2026-04-15T12:17:04Z,xswoGG2Oebc,"<iframe width=""480"" height=""270"" src=""//www.youtube.com/embed/xswoGG2Oebc"" frameborder=""0"" allow=""accelerometer; autoplay; clipboard-write; encrypted-media; gyroscope; picture-in-picture; web-share"" referrerpolicy=""strict-origin-when-cross-origin"" allowfullscreen></iframe>",Current Events
68,2026-04-15T11:00:00Z,UCFPfloFwa6X2UddqRH83rAA,"Your Money Strategy is Wrong at $35K, $75K, and $100K+",Most personal finance advice pretends the same rules work equally well for everyone. This video argues the opposite: your ...,"{'default': {'url': 'https://i.ytimg.com/vi/8rUIwB90C9M/default.jpg', 'width': 120, 'height': 90}, 'medium': {'url': 'https://i.ytimg.com/vi/8rUIwB90C9M/mqdefault.jpg', 'width': 320, 'height': 180}, 'high': {'url': 'https://i.ytimg.com/vi/8rUIwB90C9M/hqdefault.jpg', 'width': 480, 'height': 360}}",Alicia Invests,none,2026-04-15T11:00:00Z,8rUIwB90C9M,"<iframe width=""480"" height=""270"" src=""//www.youtube.com/embed/8rUIwB90C9M"" frameborder=""0"" allow=""accelerometer; autoplay; clipboard-write; encrypted-media; gyroscope; picture-in-picture; web-share"" referrerpolicy=""strict-origin-when-cross-origin"" allowfullscreen></iframe>",Productivity
47,2026-04-15T07:45:47Z,UCyRi9CRrBDeTITC211YfcMg,The Document That Explains “The Diaspora Wars”,"For years, tensions between Black Americans and the broader African diaspora have been growing online — but what if it's not ...","{'default': {'url': 'https://i.ytimg.com/vi/9zz714-2bdo/default.jpg', 'width': 120, 'height': 90}, 'medium': {'url': 'https://i.ytimg.com/vi/9zz714-2bdo/mqdefault.jpg', 'width': 320, 'height': 180}, 'high': {'url': 'https://i.ytimg.com/vi/9zz714-2bdo/hqdefault.jpg', 'width': 480, 'height': 360}}",Pan African Updates & Reactions,none,2026-04-15T07:45:47Z,9zz714-2bdo,"<iframe width=""480"" height=""270"" src=""//www.youtube.com/embed/9zz714-2bdo"" frameborder=""0"" allow=""accelerometer; autoplay; clipboard-write; encrypted-media; gyroscope; picture-in-picture; web-share"" referrerpolicy=""strict-origin-when-cross-origin"" allowfullscreen></iframe>",Social Issues
63,2026-04-15T06:57:06Z,UC2rmgVaijnf92nixlIZWGmg,How Women Are Building The Future Of Africa Through Storytelling w/ Kome Otobo,"What does it take to shape the future of Africa through story? In this inspiring conversation, we sit down with Kome Otobo to ...","{'default': {'url': 'https://i.ytimg.com/vi/QR7anMP5I9c/default.jpg', 'width': 120, 'height': 90}, 'medium': {'url': 'https://i.ytimg.com/vi/QR7anMP5I9c/mqdefault.jpg', 'width': 320, 'height': 180}, 'high': {'url': 'https://i.ytimg.com/vi/QR7anMP5I9c/hqdefault.jpg', 'width': 480, 'height': 360}}",Search For Uhuru,none,2026-04-15T06:57:06Z,QR7anMP5I9c,"<iframe width=""480"" height=""270"" src=""//www.youtube.com/embed/QR7anMP5I9c"" frameborder=""0"" allow=""accelerometer; autoplay; clipboard-write; encrypted-media; gyroscope; picture-in-picture; web-share"" referrerpolicy=""strict-origin-when-cross-origin"" allowfullscreen></iframe>",Travel
17,2026-04-15T00:36:08Z,UCABZ7Z6SBTp4IsARDceOq7w,Rickey Smiley &#39;Responds&#39; To &#39;Ashlee Jenae Suspicious Death&#39; After Losing His Son - HP News,"https://hypersclub.com - As he gets ready for a new episode of TV One's 'Uncensored' on April 16th, Rickey Smiley stops back by ...","{'default': {'url': 'https://i.ytimg.com/vi/Gyc1JtkBcW0/default.jpg', 'width': 120, 'height': 90}, 'medium': {'url': 'https://i.ytimg.com/vi/Gyc1JtkBcW0/mqdefault.jpg', 'width': 320, 'height': 180}, 'high': {'url': 'https://i.ytimg.com/vi/Gyc1JtkBcW0/hqdefault.jpg', 'width': 480, 'height': 360}}",HYPE+,none,2026-04-15T00:36:08Z,Gyc1JtkBcW0,"<iframe width=""480"" height=""270"" src=""//www.youtube.com/embed/Gyc1JtkBcW0"" frameborder=""0"" allow=""accelerometer; autoplay; clipboard-write; encrypted-media; gyroscope; picture-in-picture; web-share"" referrerpolicy=""strict-origin-when-cross-origin"" allowfullscreen></iframe>",Entertainment
13,2026-04-14T19:11:50Z,UC-4h1XQ47sf0vbFwJvuBhEA,Kenya’s William Ruto Says African Union Is Not Fit To Lead Africa Into The Future,Kenya is making headlines after President William Ruto delivered a bold statement questioning whether the African Union is truly ...,"{'default': {'url': 'https://i.ytimg.com/vi/HnwXiq2Be54/default.jpg', 'width': 120, 'height': 90}, 'medium': {'url': 'https://i.ytimg.com/vi/HnwXiq2Be54/mqdefault.jpg', 'width': 320, 'height': 180}, 'high': {'url': 'https://i.ytimg.com/vi/HnwXiq2Be54/hqdefault.jpg', 'width': 480, 'height': 360}}",The New Africa Channel,none,2026-04-14T19:11:50Z,HnwXiq2Be54,"<iframe width=""480"" height=""270"" src=""//www.youtube.com/embed/HnwXiq2Be54"" frameborder=""0"" allow=""accelerometer; autoplay; clipboard-write; encrypted-media; gyroscope; picture-in-picture; web-share"" referrerpolicy=""strict-origin-when-cross-origin"" allowfullscreen></iframe>",Current Events
10,2026-04-14T15:30:17Z,UCCfgU1Dgpz0MzA-4vP_gRuQ,Why This River Could Trigger Africa&#39;s Next War,"In the quiet rush of the Orange River, a storm is brewing. Two friendly nations, Namibia and South Africa, are tugging over its ...","{'default': {'url': 'https://i.ytimg.com/vi/ToRlPRAVzNs/default.jpg', 'width': 120, 'height': 90}, 'medium': {'url': 'https://i.ytimg.com/vi/ToRlPRAVzNs/mqdefault.jpg', 'width': 320, 'height': 180}, 'high': {'url': 'https://i.ytimg.com/vi/ToRlPRAVzNs/hqdefault.jpg', 'width': 480, 'height': 360}}",Risen Africa,none,2026-04-14T15:30:17Z,ToRlPRAVzNs,"<iframe width=""480"" height=""270"" src=""//www.youtube.com/embed/ToRlPRAVzNs"" frameborder=""0"" allow=""accelerometer; autoplay; clipboard-write; encrypted-media; gyroscope; picture-in-picture; web-share"" referrerpolicy=""strict-origin-when-cross-origin"" allowfullscreen></iframe>",Current Events
56,2026-04-14T15:00:06Z,UCIxrFTHZybtTgq8X7itOAkQ,Why is Paraguay the least visited country in South America? 🇵🇾,"In this video, I travel deep into the heart of Paraguay and explore one of its most famous local markets in Asunción. From the ...","{'default': {'url': 'https://i.ytimg.com/vi/Dhhfztp6oX8/default.jpg', 'width': 120, 'height': 90}, 'medium': {'url': 'https://i.ytimg.com/vi/Dhhfztp6oX8/mqdefault.jpg', 'width': 320, 'height': 180}, 'high': {'url': 'https://i.ytimg.com/vi/Dhhfztp6oX8/hqdefault.jpg', 'width': 480, 'height': 360}}",Blackman Da Traveller,none,2026-04-14T15:00:06Z,Dhhfztp6oX8,"<iframe width=""480"" height=""270"" src=""//www.youtube.com/embed/Dhhfztp6oX8"" frameborder=""0"" allow=""accelerometer; autoplay; clipboard-write; encrypted-media; gyroscope; picture-in-picture; web-share"" referrerpolicy=""strict-origin-when-cross-origin"" allowfullscreen></iframe>",Travel
51,2026-04-14T12:19:36Z,UCHVBLMcvOgDtFEF2bToQLqw,You are not Jesus Donald Trump ,You are not Jesus Donald Trump #candaceowens #tuckercarlson #kanyewest #piersmorgan #megynkelly.,"{'default': {'url': 'https://i.ytimg.com/vi/ataRQ2To__4/default.jpg', 'width': 120, 'height': 90}, 'medium': {'url': 'https://i.ytimg.com/vi/ataRQ2To__4/mqdefault.jpg', 'width': 320, 'height': 180}, 'high': {'url': 'https://i.ytimg.com/vi/ataRQ2To__4/hqdefault.jpg', 'width': 480, 'height': 360}}",We Woke Now,none,2026-04-14T12:19:36Z,ataRQ2To__4,"<iframe width=""480"" height=""270"" src=""//www.youtube.com/embed/ataRQ2To__4"" frameborder=""0"" allow=""accelerometer; autoplay; clipboard-write; encrypted-media; gyroscope; picture-in-picture; web-share"" referrerpolicy=""strict-origin-when-cross-origin"" allowfullscreen></iframe>",Social Issues
12,2026-04-14T08:23:45Z,UCLjzzg-cFWpEEjnWCOpXp3Q,"Iran Says &quot;No Deal&quot;, Peru&#39;s Elections - One Africa Worldview Ep. 38",We're back with Episode 38 of One Africa Worldview – the Season 4 finale! Our Whirlwind Weekly Update takes a look at the ...,"{'default': {'url': 'https://i.ytimg.com/vi/YBFzMv01ZJA/default.jpg', 'width': 120, 'height': 90}, 'medium': {'url': 'https://i.ytimg.com/vi/YBFzMv01ZJA/mqdefault.jpg', 'width': 320, 'height': 180}, 'high': {'url': 'https://i.ytimg.com/vi/YBFzMv01ZJA/hqdefault.jpg', 'width': 480, 'height': 360}}",The Burning Spear TV,none,2026-04-14T08:23:45Z,YBFzMv01ZJA,"<iframe width=""480"" height=""270"" src=""//www.youtube.com/embed/YBFzMv01ZJA"" frameborder=""0"" allow=""accelerometer; autoplay; clipboard-write; encrypted-media; gyroscope; picture-in-picture; web-share"" referrerpolicy=""strict-origin-when-cross-origin"" allowfullscreen></iframe>",Current Events
16,2026-04-13T22:00:57Z,UCv8G-xZ_BBGufjbN6jbvLMQ,My Colonoscopy Horror Story - Comedian Ryan Conner - Chocolate Sundaes Stand Up Comedy,"Once a man hits a certain age, there is a doctor's appointment that incites nothing but fear. Follow Ryan Conner on social media ...","{'default': {'url': 'https://i.ytimg.com/vi/nccy-omfyIs/default.jpg', 'width': 120, 'height': 90}, 'medium': {'url': 'https://i.ytimg.com/vi/nccy-omfyIs/mqdefault.jpg', 'width': 320, 'height': 180}, 'high': {'url': 'https://i.ytimg.com/vi/nccy-omfyIs/hqdefault.jpg', 'width': 480, 'height': 360}}",Chocolate Sundaes Comedy,none,2026-04-13T22:00:57Z,nccy-omfyIs,"<iframe width=""480"" height=""270"" src=""//www.youtube.com/embed/nccy-omfyIs"" frameborder=""0"" allow=""accelerometer; autoplay; clipboard-write; encrypted-media; gyroscope; picture-in-picture; web-share"" referrerpolicy=""strict-origin-when-cross-origin"" allowfullscreen></iframe>",Entertainment
58,2026-04-13T21:35:06Z,UCvHeh__RFFonMM8vaKda82Q,I Didn’t Expect This in Brazil 🇧🇷-Niteroi,"I Didn't Expect This in Brazil ✈️ Subscribe to Czech In Effect for authentic, boots-on-the-ground travel moments, cultural ...","{'default': {'url': 'https://i.ytimg.com/vi/-5HkMqW6lhA/default.jpg', 'width': 120, 'height': 90}, 'medium': {'url': 'https://i.ytimg.com/vi/-5HkMqW6lhA/mqdefault.jpg', 'width': 320, 'height': 180}, 'high': {'url': 'https://i.ytimg.com/vi/-5HkMqW6lhA/hqdefault.jpg', 'width': 480, 'height': 360}}",Czech in effect,none,2026-04-13T21:35:06Z,-5HkMqW6lhA,"<iframe width=""480"" height=""270"" src=""//www.youtube.com/embed/-5HkMqW6lhA"" frameborder=""0"" allow=""accelerometer; autoplay; clipboard-write; encrypted-media; gyroscope; picture-in-picture; web-share"" referrerpolicy=""strict-origin-when-cross-origin"" allowfullscreen></iframe>",Travel
53,2026-04-13T20:29:24Z,UCTis64XH8HrxE7GhEkA6YmA,ITALY THE NEW BULGARIA AFTER MISSING ANOTHER WORLD CUP?! 🇮🇹🇧🇬 #italy #bulgaria #italian,,"{'default': {'url': 'https://i.ytimg.com/vi/7g8ldxK3e1Q/default.jpg', 'width': 120, 'height': 90}, 'medium': {'url': 'https://i.ytimg.com/vi/7g8ldxK3e1Q/mqdefault.jpg', 'width': 320, 'height': 180}, 'high': {'url': 'https://i.ytimg.com/vi/7g8ldxK3e1Q/hqdefault.jpg', 'width': 480, 'height': 360}}",5ASIDE Media,none,2026-04-13T20:29:24Z,7g8ldxK3e1Q,"<iframe width=""480"" height=""270"" src=""//www.youtube.com/embed/7g8ldxK3e1Q"" frameborder=""0"" allow=""accelerometer; autoplay; clipboard-write; encrypted-media; gyroscope; picture-in-picture; web-share"" referrerpolicy=""strict-origin-when-cross-origin"" allowfullscreen></iframe>",Sports
61,2026-04-13T17:00:51Z,UCpEf2jEfyAEbQesGgl1HOWA,"I LEFT ACCRA FOR THE WESTERN REGION, GHANA | MY FIRST IMPRESSIONS OF TAKORADI GHANA",livinginghana #travel #takoradi Sekondi-Takoradi is a city in Ghana comprising the twin cities of Sekondi and Takoradi. It is the ...,"{'default': {'url': 'https://i.ytimg.com/vi/d3a29fNUEgY/default.jpg', 'width': 120, 'height': 90}, 'medium': {'url': 'https://i.ytimg.com/vi/d3a29fNUEgY/mqdefault.jpg', 'width': 320, 'height': 180}, 'high': {'url': 'https://i.ytimg.com/vi/d3a29fNUEgY/hqdefault.jpg', 'width': 480, 'height': 360}}",Jasmine Ama,none,2026-04-13T17:00:51Z,d3a29fNUEgY,"<iframe width=""480"" height=""270"" src=""//www.youtube.com/embed/d3a29fNUEgY"" frameborder=""0"" allow=""accelerometer; autoplay; clipboard-write; encrypted-media; gyroscope; picture-in-picture; web-share"" referrerpolicy=""strict-origin-when-cross-origin"" allowfullscreen></iframe>",Travel
8,2026-04-12T19:11:26Z,UCMe6CgCi6TSZX1tUxuUvCGg,Ms Joy Reporting for Pan African Daily TV South Sudan on Girl Child Marriage.,"THANKS FOR WATCHING, SUBCRIBE, LIKE & SHARE! This Video is a production of PanAfrican Daily TV, Pan-African DailyTV is ...","{'default': {'url': 'https://i.ytimg.com/vi/7F8mny1IvGo/default.jpg', 'width': 120, 'height': 90}, 'medium': {'url': 'https://i.ytimg.com/vi/7F8mny1IvGo/mqdefault.jpg', 'width': 320, 'height': 180}, 'high': {'url': 'https://i.ytimg.com/vi/7F8mny1IvGo/hqdefault.jpg', 'width': 480, 'height': 360}}",Pan-African Daily TV official ,none,2026-04-12T19:11:26Z,7F8mny1IvGo,"<iframe width=""480"" height=""270"" src=""//www.youtube.com/embed/7F8mny1IvGo"" frameborder=""0"" allow=""accelerometer; autoplay; clipboard-write; encrypted-media; gyroscope; picture-in-picture; web-share"" referrerpolicy=""strict-origin-when-cross-origin"" allowfullscreen></iframe>",Current Events
67,2026-04-11T18:37:15Z,UCy8BPJpTwXNLyL2vGCZu21Q,BBLs Are Leaving Their “Natural Habitat”… and Something’s Off,Head to https://chime.yt.link/kgargf1 to get a $75 bonus and earn 3.00% APY with Chime® Thanks Chime for sponsoring this ...,"{'default': {'url': 'https://i.ytimg.com/vi/ccHdCDya-i0/default.jpg', 'width': 120, 'height': 90}, 'medium': {'url': 'https://i.ytimg.com/vi/ccHdCDya-i0/mqdefault.jpg', 'width': 320, 'height': 180}, 'high': {'url': 'https://i.ytimg.com/vi/ccHdCDya-i0/hqdefault.jpg', 'width': 480, 'height': 360}}",Janae Danyiel,none,2026-04-11T18:37:15Z,ccHdCDya-i0,"<iframe width=""480"" height=""270"" src=""//www.youtube.com/embed/ccHdCDya-i0"" frameborder=""0"" allow=""accelerometer; autoplay; clipboard-write; encrypted-media; gyroscope; picture-in-picture; web-share"" referrerpolicy=""strict-origin-when-cross-origin"" allowfullscreen></iframe>",Social Issues
52,2026-04-11T05:25:26Z,UCXyHjFIKz9D8ofxObOuYBbg,Pro-Black Fatigue II,Is pro-blackness a performance.,"{'default': {'url': 'https://i.ytimg.com/vi/f4zUmYe97mY/default.jpg', 'width': 120, 'height': 90}, 'medium': {'url': 'https://i.ytimg.com/vi/f4zUmYe97mY/mqdefault.jpg', 'width': 320, 'height': 180}, 'high': {'url': 'https://i.ytimg.com/vi/f4zUmYe97mY/hqdefault.jpg', 'width': 480, 'height': 360}}",WeNeedToTalk,none,2026-04-11T05:25:26Z,f4zUmYe97mY,"<iframe width=""480"" height=""270"" src=""//www.youtube.com/embed/f4zUmYe97mY"" frameborder=""0"" allow=""accelerometer; autoplay; clipboard-write; encrypted-media; gyroscope; picture-in-picture; web-share"" referrerpolicy=""strict-origin-when-cross-origin"" allowfullscreen></iframe>",Social Issues
32,2026-04-10T15:26:11Z,UCjBw2SidW7wFElbmj9bgDjw,The EUROPEAN origin of BLACKFACE,,"{'default': {'url': 'https://i.ytimg.com/vi/ACM5Om2-Qfw/default.jpg', 'width': 120, 'height': 90}, 'medium': {'url': 'https://i.ytimg.com/vi/ACM5Om2-Qfw/mqdefault.jpg', 'width': 320, 'height': 180}, 'high': {'url': 'https://i.ytimg.com/vi/ACM5Om2-Qfw/hqdefault.jpg', 'width': 480, 'height': 360}}",The Kings Monologue,none,2026-04-10T15:26:11Z,ACM5Om2-Qfw,"<iframe width=""480"" height=""270"" src=""//www.youtube.com/embed/ACM5Om2-Qfw"" frameborder=""0"" allow=""accelerometer; autoplay; clipboard-write; encrypted-media; gyroscope; picture-in-picture; web-share"" referrerpolicy=""strict-origin-when-cross-origin"" allowfullscreen></iframe>",History
30,2026-04-09T08:36:43Z,UC11aHtNnc5bEPLI4jf6mnYg,Game Theory #20:  Mid-Term Examination,Professor Jiang answers your questions!,"{'default': {'url': 'https://i.ytimg.com/vi/ue8y5e3HnHE/default.jpg', 'width': 120, 'height': 90}, 'medium': {'url': 'https://i.ytimg.com/vi/ue8y5e3HnHE/mqdefault.jpg', 'width': 320, 'height': 180}, 'high': {'url': 'https://i.ytimg.com/vi/ue8y5e3HnHE/hqdefault.jpg', 'width': 480, 'height': 360}}",Predictive History,none,2026-04-09T08:36:43Z,ue8y5e3HnHE,"<iframe width=""480"" height=""270"" src=""//www.youtube.com/embed/ue8y5e3HnHE"" frameborder=""0"" allow=""accelerometer; autoplay; clipboard-write; encrypted-media; gyroscope; picture-in-picture; web-share"" referrerpolicy=""strict-origin-when-cross-origin"" allowfullscreen></iframe>",History
21,2026-04-04T16:00:19Z,UCJmmxwdAsR7lD8fBA_qbEMw,How Lesotho Outsmarted Empires and Survived,I want you to pull up a mental map of Southern Africa for a second. You've got this massive country wrapping around the tip of ...,"{'default': {'url': 'https://i.ytimg.com/vi/8M9dVKF8WqQ/default.jpg', 'width': 120, 'height': 90}, 'medium': {'url': 'https://i.ytimg.com/vi/8M9dVKF8WqQ/mqdefault.jpg', 'width': 320, 'height': 180}, 'high': {'url': 'https://i.ytimg.com/vi/8M9dVKF8WqQ/hqdefault.jpg', 'width': 480, 'height': 360}}",African Biographics,none,2026-04-04T16:00:19Z,8M9dVKF8WqQ,"<iframe width=""480"" height=""270"" src=""//www.youtube.com/embed/8M9dVKF8WqQ"" frameborder=""0"" allow=""accelerometer; autoplay; clipboard-write; encrypted-media; gyroscope; picture-in-picture; web-share"" referrerpolicy=""strict-origin-when-cross-origin"" allowfullscreen></iframe>",History
50,2026-04-02T21:00:06Z,UCPQsrvUJzs1INc2hroy3nHw,Pop The Balloon Or Find Love| Uganda| Ep.4,Welcome to Episode 4 of Pop The Balloon Or Find Love on The Pan African Dating Show (The-PDS)! This thrilling speed dating ...,"{'default': {'url': 'https://i.ytimg.com/vi/SYojbtcGmDE/default.jpg', 'width': 120, 'height': 90}, 'medium': {'url': 'https://i.ytimg.com/vi/SYojbtcGmDE/mqdefault.jpg', 'width': 320, 'height': 180}, 'high': {'url': 'https://i.ytimg.com/vi/SYojbtcGmDE/hqdefault.jpg', 'width': 480, 'height': 360}}",The Pan African Dating Show (The-PDS),none,2026-04-02T21:00:06Z,SYojbtcGmDE,"<iframe width=""480"" height=""270"" src=""//www.youtube.com/embed/SYojbtcGmDE"" frameborder=""0"" allow=""accelerometer; autoplay; clipboard-write; encrypted-media; gyroscope; picture-in-picture; web-share"" referrerpolicy=""strict-origin-when-cross-origin"" allowfullscreen></iframe>",Social Issues
26,2026-03-31T16:30:00Z,UC12lU5ymIvSpgl8KntDQUQA,The Deep Denial Of Traditional African Science 🔭 👁️🌌🧠,African Kings Book: https://mixam.com/print-on-demand/69a6d8e7cc73f0a9e6e8b18c Patreon: ...,"{'default': {'url': 'https://i.ytimg.com/vi/KYPy1D554Xk/default.jpg', 'width': 120, 'height': 90}, 'medium': {'url': 'https://i.ytimg.com/vi/KYPy1D554Xk/mqdefault.jpg', 'width': 320, 'height': 180}, 'high': {'url': 'https://i.ytimg.com/vi/KYPy1D554Xk/hqdefault.jpg', 'width': 480, 'height': 360}}",HomeTeam History,none,2026-03-31T16:30:00Z,KYPy1D554Xk,"<iframe width=""480"" height=""270"" src=""//www.youtube.com/embed/KYPy1D554Xk"" frameborder=""0"" allow=""accelerometer; autoplay; clipboard-write; encrypted-media; gyroscope; picture-in-picture; web-share"" referrerpolicy=""strict-origin-when-cross-origin"" allowfullscreen></iframe>",History
64,2026-03-29T17:33:56Z,UC2-nif4wvOqT6QVsBX3NOpA,War Is At Your Door l Expat Survival Guide,"This is the reality of 2026 - stay ready. With new and ongoing international conflicts, natural disasters, and unexpected events we ...","{'default': {'url': 'https://i.ytimg.com/vi/xjWgWzoT0FM/default.jpg', 'width': 120, 'height': 90}, 'medium': {'url': 'https://i.ytimg.com/vi/xjWgWzoT0FM/mqdefault.jpg', 'width': 320, 'height': 180}, 'high': {'url': 'https://i.ytimg.com/vi/xjWgWzoT0FM/hqdefault.jpg', 'width': 480, 'height': 360}}",The Yarbros,none,2026-03-29T17:33:56Z,xjWgWzoT0FM,"<iframe width=""480"" height=""270"" src=""//www.youtube.com/embed/xjWgWzoT0FM"" frameborder=""0"" allow=""accelerometer; autoplay; clipboard-write; encrypted-media; gyroscope; picture-in-picture; web-share"" referrerpolicy=""strict-origin-when-cross-origin"" allowfullscreen></iframe>",Travel
59,2026-03-26T22:49:16Z,UCOhiR-6Y-MZtMERKRENrcRw,"Africa, beyond the History being told. A New Narrative for the world to see","This channel is to bring the awareness to the world of the beautiful continent of Africa. My intentions are to show the development, ...","{'default': {'url': 'https://i.ytimg.com/vi/QcuXUymLtHQ/default.jpg', 'width': 120, 'height': 90}, 'medium': {'url': 'https://i.ytimg.com/vi/QcuXUymLtHQ/mqdefault.jpg', 'width': 320, 'height': 180}, 'high': {'url': 'https://i.ytimg.com/vi/QcuXUymLtHQ/hqdefault.jpg', 'width': 480, 'height': 360}}",GoBlack2Africa ,none,2026-03-26T22:49:16Z,QcuXUymLtHQ,"<iframe width=""480"" height=""270"" src=""//www.youtube.com/embed/QcuXUymLtHQ"" frameborder=""0"" allow=""accelerometer; autoplay; clipboard-write; encrypted-media; gyroscope; picture-in-picture; web-share"" referrerpolicy=""strict-origin-when-cross-origin"" allowfullscreen></iframe>",Travel
62,2026-03-25T17:00:07Z,UCF71yDQwxfw0QcYb2JnkB5Q,I Went to the Most Hyped Island in the World!,"Most people think of Greece as a luxury destination… beach clubs, champagne, and prices that don't always make sense.","{'default': {'url': 'https://i.ytimg.com/vi/KF5AbfuSSgk/default.jpg', 'width': 120, 'height': 90}, 'medium': {'url': 'https://i.ytimg.com/vi/KF5AbfuSSgk/mqdefault.jpg', 'width': 320, 'height': 180}, 'high': {'url': 'https://i.ytimg.com/vi/KF5AbfuSSgk/hqdefault.jpg', 'width': 480, 'height': 360}}",PassportHeavy,none,2026-03-25T17:00:07Z,KF5AbfuSSgk,"<iframe width=""480"" height=""270"" src=""//www.youtube.com/embed/KF5AbfuSSgk"" frameborder=""0"" allow=""accelerometer; autoplay; clipboard-write; encrypted-media; gyroscope; picture-in-picture; web-share"" referrerpolicy=""strict-origin-when-cross-origin"" allowfullscreen></iframe>",Travel
23,2026-02-08T16:00:45Z,UC2xX2FI6s4i9xz3t9qjayhg,Maurice Bishop Interview (1983),,"{'default': {'url': 'https://i.ytimg.com/vi/ZpKldrtlZmg/default.jpg', 'width': 120, 'height': 90}, 'medium': {'url': 'https://i.ytimg.com/vi/ZpKldrtlZmg/mqdefault.jpg', 'width': 320, 'height': 180}, 'high': {'url': 'https://i.ytimg.com/vi/ZpKldrtlZmg/hqdefault.jpg', 'width': 480, 'height': 360}}",AfroMarxist,none,2026-02-08T16:00:45Z,ZpKldrtlZmg,"<iframe width=""480"" height=""360"" src=""//www.youtube.com/embed/ZpKldrtlZmg"" frameborder=""0"" allow=""accelerometer; autoplay; clipboard-write; encrypted-media; gyroscope; picture-in-picture; web-share"" referrerpolicy=""strict-origin-when-cross-origin"" allowfullscreen></iframe>",History
