,publishedAt,channelId,title,description,thumbnails,channelTitle,liveBroadcastContent,publishTime,videoID,embeds,category
10,2025-02-21T19:00:17Z,UCTNr0N__QwstBhgCtvQcjhA,1919: The Year Alice H. Parker Changed the Furnace Game,"Did you know a Black woman named Alice H. Parker changed how we heat our homes? In 1919, she invented a natural gas ...","{'default': {'url': 'https://i.ytimg.com/vi/Q7rz6ANOAA8/default.jpg', 'width': 120, 'height': 90}, 'medium': {'url': 'https://i.ytimg.com/vi/Q7rz6ANOAA8/mqdefault.jpg', 'width': 320, 'height': 180}, 'high': {'url': 'https://i.ytimg.com/vi/Q7rz6ANOAA8/hqdefault.jpg', 'width': 480, 'height': 360}}",Black Discoveries,none,2025-02-21T19:00:17Z,Q7rz6ANOAA8,"<iframe width=""480"" height=""270"" src=""//www.youtube.com/embed/Q7rz6ANOAA8"" frameborder=""0"" allow=""accelerometer; autoplay; clipboard-write; encrypted-media; gyroscope; picture-in-picture; web-share"" referrerpolicy=""strict-origin-when-cross-origin"" allowfullscreen></iframe>",History
20,2025-02-21T17:46:38Z,UCOhiR-6Y-MZtMERKRENrcRw,Elon Musk explains the private sector take over from Government to Arabs?,"This channel is to bring the awareness to the world of the beautiful continent of Africa. My intentions are to show the development, ...","{'default': {'url': 'https://i.ytimg.com/vi/Kv1aSAbdHdY/default.jpg', 'width': 120, 'height': 90}, 'medium': {'url': 'https://i.ytimg.com/vi/Kv1aSAbdHdY/mqdefault.jpg', 'width': 320, 'height': 180}, 'high': {'url': 'https://i.ytimg.com/vi/Kv1aSAbdHdY/hqdefault.jpg', 'width': 480, 'height': 360}}",GoBlack2Africa ,none,2025-02-21T17:46:38Z,Kv1aSAbdHdY,"<iframe width=""480"" height=""270"" src=""//www.youtube.com/embed/Kv1aSAbdHdY"" frameborder=""0"" allow=""accelerometer; autoplay; clipboard-write; encrypted-media; gyroscope; picture-in-picture; web-share"" referrerpolicy=""strict-origin-when-cross-origin"" allowfullscreen></iframe>",Travel
22,2025-02-21T17:01:12Z,UC12lU5ymIvSpgl8KntDQUQA,The Exploitation Of African Men In The Establishment Of Other Civilizations,Patreon: https://www.patreon.com/HomeTeamHistory.,"{'default': {'url': 'https://i.ytimg.com/vi/ra-D5lQnVmI/default.jpg', 'width': 120, 'height': 90}, 'medium': {'url': 'https://i.ytimg.com/vi/ra-D5lQnVmI/mqdefault.jpg', 'width': 320, 'height': 180}, 'high': {'url': 'https://i.ytimg.com/vi/ra-D5lQnVmI/hqdefault.jpg', 'width': 480, 'height': 360}}",HomeTeam History,none,2025-02-21T17:01:12Z,ra-D5lQnVmI,"<iframe width=""480"" height=""270"" src=""//www.youtube.com/embed/ra-D5lQnVmI"" frameborder=""0"" allow=""accelerometer; autoplay; clipboard-write; encrypted-media; gyroscope; picture-in-picture; web-share"" referrerpolicy=""strict-origin-when-cross-origin"" allowfullscreen></iframe>",History
19,2025-02-21T08:00:06Z,UCF-A_4x9-bLrxXrmgBOWuJA,"EFF PODCAST | Patrick Bond, Tshidi Lecoanca &amp; Duma Gqubule Unpack The Postponed 2025 Budget Speech","The EFF Podcast is joined by Economic Experts Professor Patrick Bond, Budget Analyst Matshidiso Lencoasa and Independent ...","{'default': {'url': 'https://i.ytimg.com/vi/EyJnbRNmsuk/default.jpg', 'width': 120, 'height': 90}, 'medium': {'url': 'https://i.ytimg.com/vi/EyJnbRNmsuk/mqdefault.jpg', 'width': 320, 'height': 180}, 'high': {'url': 'https://i.ytimg.com/vi/EyJnbRNmsuk/hqdefault.jpg', 'width': 480, 'height': 360}}",Economic Freedom Fighters,none,2025-02-21T08:00:06Z,EyJnbRNmsuk,"<iframe width=""480"" height=""270"" src=""//www.youtube.com/embed/EyJnbRNmsuk"" frameborder=""0"" allow=""accelerometer; autoplay; clipboard-write; encrypted-media; gyroscope; picture-in-picture; web-share"" referrerpolicy=""strict-origin-when-cross-origin"" allowfullscreen></iframe>",Current Events
2,2025-02-21T00:30:41Z,UCW5NNtTSY5z5mENZ8dt-RCw,Surviving America&#39;s Drug Zombieland - Kensington Philadelphia,Kensington and Zombie Land—these terms have become synonymous with one of the most infamous areas affected by the opioid ...,"{'default': {'url': 'https://i.ytimg.com/vi/tLrf22klP6o/default.jpg', 'width': 120, 'height': 90}, 'medium': {'url': 'https://i.ytimg.com/vi/tLrf22klP6o/mqdefault.jpg', 'width': 320, 'height': 180}, 'high': {'url': 'https://i.ytimg.com/vi/tLrf22klP6o/hqdefault.jpg', 'width': 480, 'height': 360}}",ACE ,none,2025-02-21T00:30:41Z,tLrf22klP6o,"<iframe width=""480"" height=""270"" src=""//www.youtube.com/embed/tLrf22klP6o"" frameborder=""0"" allow=""accelerometer; autoplay; clipboard-write; encrypted-media; gyroscope; picture-in-picture; web-share"" referrerpolicy=""strict-origin-when-cross-origin"" allowfullscreen></iframe>",Travel
28,2025-02-20T19:12:50Z,UC1ettU5YSf_nIOJWffCKGQw,black people belong to the senior branch of the human race,"Dr. John Henrik Clarke lecture on african and black people's importance of preserving traditions, as they belong to the senior ...","{'default': {'url': 'https://i.ytimg.com/vi/VRuGXvL61qI/default.jpg', 'width': 120, 'height': 90}, 'medium': {'url': 'https://i.ytimg.com/vi/VRuGXvL61qI/mqdefault.jpg', 'width': 320, 'height': 180}, 'high': {'url': 'https://i.ytimg.com/vi/VRuGXvL61qI/hqdefault.jpg', 'width': 480, 'height': 360}}",LuiSpot,none,2025-02-20T19:12:50Z,VRuGXvL61qI,"<iframe width=""480"" height=""270"" src=""//www.youtube.com/embed/VRuGXvL61qI"" frameborder=""0"" allow=""accelerometer; autoplay; clipboard-write; encrypted-media; gyroscope; picture-in-picture; web-share"" referrerpolicy=""strict-origin-when-cross-origin"" allowfullscreen></iframe>",Current Events
40,2025-02-20T17:41:15Z,UC4lH-odQ5ll-85fkpWxDYmA,"Inside this $240,000 Zanzibar villa will surprise you",,"{'default': {'url': 'https://i.ytimg.com/vi/rTMJjlzhjeI/default.jpg', 'width': 120, 'height': 90}, 'medium': {'url': 'https://i.ytimg.com/vi/rTMJjlzhjeI/mqdefault.jpg', 'width': 320, 'height': 180}, 'high': {'url': 'https://i.ytimg.com/vi/rTMJjlzhjeI/hqdefault.jpg', 'width': 480, 'height': 360}}",Steven Ndukwu,none,2025-02-20T17:41:15Z,rTMJjlzhjeI,"<iframe width=""480"" height=""270"" src=""//www.youtube.com/embed/rTMJjlzhjeI"" frameborder=""0"" allow=""accelerometer; autoplay; clipboard-write; encrypted-media; gyroscope; picture-in-picture; web-share"" referrerpolicy=""strict-origin-when-cross-origin"" allowfullscreen></iframe>",Productivity
39,2025-02-20T13:01:06Z,UCDsOKnUQnQek7-G7Xc5kB8Q,How This Entrepreneur Is Helping Kids Overcome Eczema! - @realsocialproof #502,"Our main guest for this episode is Jocelyne Fiume, the founder of Kiyamel Skincare Solutions. Jocelyne shares her inspiring ...","{'default': {'url': 'https://i.ytimg.com/vi/jdcfu5RsIJQ/default.jpg', 'width': 120, 'height': 90}, 'medium': {'url': 'https://i.ytimg.com/vi/jdcfu5RsIJQ/mqdefault.jpg', 'width': 320, 'height': 180}, 'high': {'url': 'https://i.ytimg.com/vi/jdcfu5RsIJQ/hqdefault.jpg', 'width': 480, 'height': 360}}",Social Proof,none,2025-02-20T13:01:06Z,jdcfu5RsIJQ,"<iframe width=""480"" height=""270"" src=""//www.youtube.com/embed/jdcfu5RsIJQ"" frameborder=""0"" allow=""accelerometer; autoplay; clipboard-write; encrypted-media; gyroscope; picture-in-picture; web-share"" referrerpolicy=""strict-origin-when-cross-origin"" allowfullscreen></iframe>",Productivity
50,2025-02-17T14:25:15Z,UCXyHjFIKz9D8ofxObOuYBbg,Managing Expectations,WeNeedToTalk #BlackLove To support our ministry: https://cash.app/$wnttalk Please SUBSCRIBE for more content!,"{'default': {'url': 'https://i.ytimg.com/vi/SGM-Z2dcVI0/default.jpg', 'width': 120, 'height': 90}, 'medium': {'url': 'https://i.ytimg.com/vi/SGM-Z2dcVI0/mqdefault.jpg', 'width': 320, 'height': 180}, 'high': {'url': 'https://i.ytimg.com/vi/SGM-Z2dcVI0/hqdefault.jpg', 'width': 480, 'height': 360}}",WeNeedToTalk,none,2025-02-17T14:25:15Z,SGM-Z2dcVI0,"<iframe width=""480"" height=""270"" src=""//www.youtube.com/embed/SGM-Z2dcVI0"" frameborder=""0"" allow=""accelerometer; autoplay; clipboard-write; encrypted-media; gyroscope; picture-in-picture; web-share"" referrerpolicy=""strict-origin-when-cross-origin"" allowfullscreen></iframe>",Social Issues
53,2025-02-17T03:46:44Z,UCx5Y5d5KgibkG9KAyknCdFA,How Black History Month Is Used Against Us,"Black History Month is celebrated every year, but are we really learning the full story? In this video, we break down how Black ...","{'default': {'url': 'https://i.ytimg.com/vi/6_2bG8U1MdY/default.jpg', 'width': 120, 'height': 90}, 'medium': {'url': 'https://i.ytimg.com/vi/6_2bG8U1MdY/mqdefault.jpg', 'width': 320, 'height': 180}, 'high': {'url': 'https://i.ytimg.com/vi/6_2bG8U1MdY/hqdefault.jpg', 'width': 480, 'height': 360}}",Afromation Digital,none,2025-02-17T03:46:44Z,6_2bG8U1MdY,"<iframe width=""480"" height=""270"" src=""//www.youtube.com/embed/6_2bG8U1MdY"" frameborder=""0"" allow=""accelerometer; autoplay; clipboard-write; encrypted-media; gyroscope; picture-in-picture; web-share"" referrerpolicy=""strict-origin-when-cross-origin"" allowfullscreen></iframe>",Social Issues
34,2025-02-16T21:08:32Z,UCMe6CgCi6TSZX1tUxuUvCGg,Coming up Live tonight Baba Nijala Amhose Bajano Mwata Nubian,"Welcome Baba NIJALA AMHOSE BAJANO MWATA NUBIAN, Panamanian scholar and PanAfricanist. Topic: Neo-Colonialism in ...","{'default': {'url': 'https://i.ytimg.com/vi/pGf_ArFlOAY/default.jpg', 'width': 120, 'height': 90}, 'medium': {'url': 'https://i.ytimg.com/vi/pGf_ArFlOAY/mqdefault.jpg', 'width': 320, 'height': 180}, 'high': {'url': 'https://i.ytimg.com/vi/pGf_ArFlOAY/hqdefault.jpg', 'width': 480, 'height': 360}}","Pan-African Daily TV, PADTV",none,2025-02-16T21:08:32Z,pGf_ArFlOAY,"<iframe width=""480"" height=""270"" src=""//www.youtube.com/embed/pGf_ArFlOAY"" frameborder=""0"" allow=""accelerometer; autoplay; clipboard-write; encrypted-media; gyroscope; picture-in-picture; web-share"" referrerpolicy=""strict-origin-when-cross-origin"" allowfullscreen></iframe>",Current Events
35,2025-02-13T15:00:06Z,UCF71yDQwxfw0QcYb2JnkB5Q,I Thought Cruises Were TRASH… So I Took One to Prove It! Virgin Voyages,"We've avoided cruises our whole lives—overcrowded buffets, tourist traps, and feeling stuck at sea? Not for us. But one of our ...","{'default': {'url': 'https://i.ytimg.com/vi/4XADlrNkg_Q/default.jpg', 'width': 120, 'height': 90}, 'medium': {'url': 'https://i.ytimg.com/vi/4XADlrNkg_Q/mqdefault.jpg', 'width': 320, 'height': 180}, 'high': {'url': 'https://i.ytimg.com/vi/4XADlrNkg_Q/hqdefault.jpg', 'width': 480, 'height': 360}}",PassportHeavy,none,2025-02-13T15:00:06Z,4XADlrNkg_Q,"<iframe width=""480"" height=""270"" src=""//www.youtube.com/embed/4XADlrNkg_Q"" frameborder=""0"" allow=""accelerometer; autoplay; clipboard-write; encrypted-media; gyroscope; picture-in-picture; web-share"" referrerpolicy=""strict-origin-when-cross-origin"" allowfullscreen></iframe>",Travel
45,2025-02-13T11:59:25Z,UCjBw2SidW7wFElbmj9bgDjw,The faces of Thuya and Yuya DECODED,Join us as we recreate the faces of these 18th Dynasty monarchs from over 3000 years ago by using their available artwork as a ...,"{'default': {'url': 'https://i.ytimg.com/vi/Qe2QdsfZvqI/default.jpg', 'width': 120, 'height': 90}, 'medium': {'url': 'https://i.ytimg.com/vi/Qe2QdsfZvqI/mqdefault.jpg', 'width': 320, 'height': 180}, 'high': {'url': 'https://i.ytimg.com/vi/Qe2QdsfZvqI/hqdefault.jpg', 'width': 480, 'height': 360}}",The Kings Monologue,none,2025-02-13T11:59:25Z,Qe2QdsfZvqI,"<iframe width=""480"" height=""270"" src=""//www.youtube.com/embed/Qe2QdsfZvqI"" frameborder=""0"" allow=""accelerometer; autoplay; clipboard-write; encrypted-media; gyroscope; picture-in-picture; web-share"" referrerpolicy=""strict-origin-when-cross-origin"" allowfullscreen></iframe>",History
48,2025-01-13T16:33:06Z,UC2-nif4wvOqT6QVsBX3NOpA,What EVERYONE Needs to Know About NAIROBI,"This is the truth about why you should visit Nairobi. After our first impressions, it was time to explore more of the city. Favorite ...","{'default': {'url': 'https://i.ytimg.com/vi/LaYBojPsJio/default.jpg', 'width': 120, 'height': 90}, 'medium': {'url': 'https://i.ytimg.com/vi/LaYBojPsJio/mqdefault.jpg', 'width': 320, 'height': 180}, 'high': {'url': 'https://i.ytimg.com/vi/LaYBojPsJio/hqdefault.jpg', 'width': 480, 'height': 360}}",The Yarbros,none,2025-01-13T16:33:06Z,LaYBojPsJio,"<iframe width=""480"" height=""270"" src=""//www.youtube.com/embed/LaYBojPsJio"" frameborder=""0"" allow=""accelerometer; autoplay; clipboard-write; encrypted-media; gyroscope; picture-in-picture; web-share"" referrerpolicy=""strict-origin-when-cross-origin"" allowfullscreen></iframe>",Travel
32,2025-01-11T16:00:06Z,UCJH-fn0wLu5uwXX33jNToQw,Samora Machel&#39;s Struggle | How Mozambique’s Revolution Ended Portugal&#39;s Empire,"The most beautiful thing about a man's life is his freedom. He may not have any food, and he may not have any clothing, but at ...","{'default': {'url': 'https://i.ytimg.com/vi/wTwI48jN-fY/default.jpg', 'width': 120, 'height': 90}, 'medium': {'url': 'https://i.ytimg.com/vi/wTwI48jN-fY/mqdefault.jpg', 'width': 320, 'height': 180}, 'high': {'url': 'https://i.ytimg.com/vi/wTwI48jN-fY/hqdefault.jpg', 'width': 480, 'height': 360}}",NewAfrica,none,2025-01-11T16:00:06Z,wTwI48jN-fY,"<iframe width=""480"" height=""270"" src=""//www.youtube.com/embed/wTwI48jN-fY"" frameborder=""0"" allow=""accelerometer; autoplay; clipboard-write; encrypted-media; gyroscope; picture-in-picture; web-share"" referrerpolicy=""strict-origin-when-cross-origin"" allowfullscreen></iframe>",Current Events
26,2024-12-29T11:40:48Z,UC__wkIWEfbnTAYVT8j6gfPg,Modern Egyptian&#39;s DNA results,,"{'default': {'url': 'https://i.ytimg.com/vi/dCUtLFenWGg/default.jpg', 'width': 120, 'height': 90}, 'medium': {'url': 'https://i.ytimg.com/vi/dCUtLFenWGg/mqdefault.jpg', 'width': 320, 'height': 180}, 'high': {'url': 'https://i.ytimg.com/vi/dCUtLFenWGg/hqdefault.jpg', 'width': 480, 'height': 360}}",Know Thyself,none,2024-12-29T11:40:48Z,dCUtLFenWGg,"<iframe width=""480"" height=""270"" src=""//www.youtube.com/embed/dCUtLFenWGg"" frameborder=""0"" allow=""accelerometer; autoplay; clipboard-write; encrypted-media; gyroscope; picture-in-picture; web-share"" referrerpolicy=""strict-origin-when-cross-origin"" allowfullscreen></iframe>",History
8,2024-11-10T05:30:00Z,UCbvE_5m8kmm9U58gDHtzYrA,Nigeria has been named the best Jollof rice maker‼️🇳🇬🍚,,"{'default': {'url': 'https://i.ytimg.com/vi/ZkdyXscEAFI/default.jpg', 'width': 120, 'height': 90}, 'medium': {'url': 'https://i.ytimg.com/vi/ZkdyXscEAFI/mqdefault.jpg', 'width': 320, 'height': 180}, 'high': {'url': 'https://i.ytimg.com/vi/ZkdyXscEAFI/hqdefault.jpg', 'width': 480, 'height': 360}}",AfroBallers,none,2024-11-10T05:30:00Z,ZkdyXscEAFI,"<iframe width=""480"" height=""360"" src=""//www.youtube.com/embed/ZkdyXscEAFI"" frameborder=""0"" allow=""accelerometer; autoplay; clipboard-write; encrypted-media; gyroscope; picture-in-picture; web-share"" referrerpolicy=""strict-origin-when-cross-origin"" allowfullscreen></iframe>",Sports
9,2024-08-31T16:32:50Z,UC2xX2FI6s4i9xz3t9qjayhg,The San Quentin Six (1972),"A documentary on the six Black and Chicano prisoners who, following George Jackson's death, were charged on charges of ...","{'default': {'url': 'https://i.ytimg.com/vi/E-4CUaaSo4I/default.jpg', 'width': 120, 'height': 90}, 'medium': {'url': 'https://i.ytimg.com/vi/E-4CUaaSo4I/mqdefault.jpg', 'width': 320, 'height': 180}, 'high': {'url': 'https://i.ytimg.com/vi/E-4CUaaSo4I/hqdefault.jpg', 'width': 480, 'height': 360}}",AfroMarxist,none,2024-08-31T16:32:50Z,E-4CUaaSo4I,"<iframe width=""480"" height=""360"" src=""//www.youtube.com/embed/E-4CUaaSo4I"" frameborder=""0"" allow=""accelerometer; autoplay; clipboard-write; encrypted-media; gyroscope; picture-in-picture; web-share"" referrerpolicy=""strict-origin-when-cross-origin"" allowfullscreen></iframe>",History
31,2024-08-25T18:19:19Z,UCh2ANLALdN1OZUJKmvchkkg,The INSANE True Story of Cleopatra in Pop Culture | Documentary,"Cleopatra is one of the most iconic figures associated with ancient Egypt, but our perception of the queen is not correct.","{'default': {'url': 'https://i.ytimg.com/vi/dwSSQFS-OQY/default.jpg', 'width': 120, 'height': 90}, 'medium': {'url': 'https://i.ytimg.com/vi/dwSSQFS-OQY/mqdefault.jpg', 'width': 320, 'height': 180}, 'high': {'url': 'https://i.ytimg.com/vi/dwSSQFS-OQY/hqdefault.jpg', 'width': 480, 'height': 360}}",Mr. Imhotep,none,2024-08-25T18:19:19Z,dwSSQFS-OQY,"<iframe width=""480"" height=""270"" src=""//www.youtube.com/embed/dwSSQFS-OQY"" frameborder=""0"" allow=""accelerometer; autoplay; clipboard-write; encrypted-media; gyroscope; picture-in-picture; web-share"" referrerpolicy=""strict-origin-when-cross-origin"" allowfullscreen></iframe>",History
14,2024-08-25T18:00:03Z,UCMMTYgqKEgCgy1pR6Axlf0A,"Ex-model moved to Ghana to build a 5 bedroom home, set up 7 businesses and live her dream life",Our guest today left behind her 15 year career in the modelling industry to move to Ghana and start a new life here. This amazing ...,"{'default': {'url': 'https://i.ytimg.com/vi/6TMZcRoGZi4/default.jpg', 'width': 120, 'height': 90}, 'medium': {'url': 'https://i.ytimg.com/vi/6TMZcRoGZi4/mqdefault.jpg', 'width': 320, 'height': 180}, 'high': {'url': 'https://i.ytimg.com/vi/6TMZcRoGZi4/hqdefault.jpg', 'width': 480, 'height': 360}}",Build with Amoaa,none,2024-08-25T18:00:03Z,6TMZcRoGZi4,"<iframe width=""480"" height=""270"" src=""//www.youtube.com/embed/6TMZcRoGZi4"" frameborder=""0"" allow=""accelerometer; autoplay; clipboard-write; encrypted-media; gyroscope; picture-in-picture; web-share"" referrerpolicy=""strict-origin-when-cross-origin"" allowfullscreen></iframe>",Travel
37,2024-08-14T15:00:22Z,UCCfgU1Dgpz0MzA-4vP_gRuQ,Africa&#39;s Last Emperor | Jean-Bédel Bokassa,Jean-Bédel Bokassa will perhaps mostly be remembered chiefly for an oversized Napoleon complex and his love for everything ...,"{'default': {'url': 'https://i.ytimg.com/vi/LbXKaOqyUiE/default.jpg', 'width': 120, 'height': 90}, 'medium': {'url': 'https://i.ytimg.com/vi/LbXKaOqyUiE/mqdefault.jpg', 'width': 320, 'height': 180}, 'high': {'url': 'https://i.ytimg.com/vi/LbXKaOqyUiE/hqdefault.jpg', 'width': 480, 'height': 360}}",Risen Africa,none,2024-08-14T15:00:22Z,LbXKaOqyUiE,"<iframe width=""480"" height=""270"" src=""//www.youtube.com/embed/LbXKaOqyUiE"" frameborder=""0"" allow=""accelerometer; autoplay; clipboard-write; encrypted-media; gyroscope; picture-in-picture; web-share"" referrerpolicy=""strict-origin-when-cross-origin"" allowfullscreen></iframe>",Current Events
7,2024-07-12T12:15:30Z,UCl6to6J7oVltnhHEVm1s87A,AFRICAN ORIGIN OF MORDEN HAIRSTYLES,theperspective #africanhistory #africanews #africax5 Traditional African hairstyles are back in fashion and making a real ...,"{'default': {'url': 'https://i.ytimg.com/vi/AGyMe_XB3mQ/default.jpg', 'width': 120, 'height': 90}, 'medium': {'url': 'https://i.ytimg.com/vi/AGyMe_XB3mQ/mqdefault.jpg', 'width': 320, 'height': 180}, 'high': {'url': 'https://i.ytimg.com/vi/AGyMe_XB3mQ/hqdefault.jpg', 'width': 480, 'height': 360}}",Africax5 Network,none,2024-07-12T12:15:30Z,AGyMe_XB3mQ,"<iframe width=""480"" height=""360"" src=""//www.youtube.com/embed/AGyMe_XB3mQ"" frameborder=""0"" allow=""accelerometer; autoplay; clipboard-write; encrypted-media; gyroscope; picture-in-picture; web-share"" referrerpolicy=""strict-origin-when-cross-origin"" allowfullscreen></iframe>",Social Issues
27,2024-07-08T12:10:25Z,UCHbmePHjGH3pklvSla6szWw,You Wouldn&#39;t Survive In Ancient Egypt | REACTION - KueliMika,Today we are reacting to the video You Wouldn't Survive In Ancient Egypt.,"{'default': {'url': 'https://i.ytimg.com/vi/qFbr17zUKYE/default.jpg', 'width': 120, 'height': 90}, 'medium': {'url': 'https://i.ytimg.com/vi/qFbr17zUKYE/mqdefault.jpg', 'width': 320, 'height': 180}, 'high': {'url': 'https://i.ytimg.com/vi/qFbr17zUKYE/hqdefault.jpg', 'width': 480, 'height': 360}}",KueliMika,none,2024-07-08T12:10:25Z,qFbr17zUKYE,"<iframe width=""480"" height=""270"" src=""//www.youtube.com/embed/qFbr17zUKYE"" frameborder=""0"" allow=""accelerometer; autoplay; clipboard-write; encrypted-media; gyroscope; picture-in-picture; web-share"" referrerpolicy=""strict-origin-when-cross-origin"" allowfullscreen></iframe>",History
3,2024-04-25T23:00:06Z,UCTTQWaoGloNuhunZevQ2F6g,"Kuubwa Transforming African Businesses: Fabric Weaver, Fish Farmers","Kuubwa Transforms African Businesses: Fish Farmers, Fabric Manufacturers and more.","{'default': {'url': 'https://i.ytimg.com/vi/gC02Wht1UQQ/default.jpg', 'width': 120, 'height': 90}, 'medium': {'url': 'https://i.ytimg.com/vi/gC02Wht1UQQ/mqdefault.jpg', 'width': 320, 'height': 180}, 'high': {'url': 'https://i.ytimg.com/vi/gC02Wht1UQQ/hqdefault.jpg', 'width': 480, 'height': 360}}",Africa Business Channel TV,none,2024-04-25T23:00:06Z,gC02Wht1UQQ,"<iframe width=""480"" height=""270"" src=""//www.youtube.com/embed/gC02Wht1UQQ"" frameborder=""0"" allow=""accelerometer; autoplay; clipboard-write; encrypted-media; gyroscope; picture-in-picture; web-share"" referrerpolicy=""strict-origin-when-cross-origin"" allowfullscreen></iframe>",Productivity
42,2024-04-11T05:04:02Z,UCuvO0y2EU_kRfYzlhGJNOKA,How Did America&#39;s Wealthy Elite Re Write World History,"The United States was supposed to be a democratically run country. However, that has not been the case since the turn of the ...","{'default': {'url': 'https://i.ytimg.com/vi/RPSnS-ucmOA/default.jpg', 'width': 120, 'height': 90}, 'medium': {'url': 'https://i.ytimg.com/vi/RPSnS-ucmOA/mqdefault.jpg', 'width': 320, 'height': 180}, 'high': {'url': 'https://i.ytimg.com/vi/RPSnS-ucmOA/hqdefault.jpg', 'width': 480, 'height': 360}}",Straight UP,none,2024-04-11T05:04:02Z,RPSnS-ucmOA,"<iframe width=""480"" height=""270"" src=""//www.youtube.com/embed/RPSnS-ucmOA"" frameborder=""0"" allow=""accelerometer; autoplay; clipboard-write; encrypted-media; gyroscope; picture-in-picture; web-share"" referrerpolicy=""strict-origin-when-cross-origin"" allowfullscreen></iframe>",History
41,2024-04-11T05:04:02Z,UCuvO0y2EU_kRfYzlhGJNOKA,How Did America&#39;s Wealthy Elite Re Write World History,"The United States was supposed to be a democratically run country. However, that has not been the case since the turn of the ...","{'default': {'url': 'https://i.ytimg.com/vi/RPSnS-ucmOA/default.jpg', 'width': 120, 'height': 90}, 'medium': {'url': 'https://i.ytimg.com/vi/RPSnS-ucmOA/mqdefault.jpg', 'width': 320, 'height': 180}, 'high': {'url': 'https://i.ytimg.com/vi/RPSnS-ucmOA/hqdefault.jpg', 'width': 480, 'height': 360}}",Straight UP,none,2024-04-11T05:04:02Z,RPSnS-ucmOA,"<iframe width=""480"" height=""270"" src=""//www.youtube.com/embed/RPSnS-ucmOA"" frameborder=""0"" allow=""accelerometer; autoplay; clipboard-write; encrypted-media; gyroscope; picture-in-picture; web-share"" referrerpolicy=""strict-origin-when-cross-origin"" allowfullscreen></iframe>",History
