,publishedAt,channelId,title,description,thumbnails,channelTitle,liveBroadcastContent,publishTime,videID,embeds,category
42,2024-05-23T17:18:28Z,UC4lH-odQ5ll-85fkpWxDYmA,How Africa’s Richest Man struggles with Visas in Africa,,"{'default': {'url': 'https://i.ytimg.com/vi/-rSJmJdNzMQ/default.jpg', 'width': 120, 'height': 90}, 'medium': {'url': 'https://i.ytimg.com/vi/-rSJmJdNzMQ/mqdefault.jpg', 'width': 320, 'height': 180}, 'high': {'url': 'https://i.ytimg.com/vi/-rSJmJdNzMQ/hqdefault.jpg', 'width': 480, 'height': 360}}",Steven Ndukwu,none,2024-05-23T17:18:28Z,-rSJmJdNzMQ,"<iframe width=""480"" height=""270"" src=""//www.youtube.com/embed/-rSJmJdNzMQ"" frameborder=""0"" allow=""accelerometer; autoplay; clipboard-write; encrypted-media; gyroscope; picture-in-picture; web-share"" referrerpolicy=""strict-origin-when-cross-origin"" allowfullscreen></iframe>",Productivity
41,2024-05-23T12:00:24Z,UCDsOKnUQnQek7-G7Xc5kB8Q,How To Secure High Value Investors In Real Time!! - David &amp; Donni #466,GRAB YOUR 🎟️ to Podcast Summit '24 https://www.podcastsummit.com Use code ...,"{'default': {'url': 'https://i.ytimg.com/vi/TnqkSuxFVZc/default.jpg', 'width': 120, 'height': 90}, 'medium': {'url': 'https://i.ytimg.com/vi/TnqkSuxFVZc/mqdefault.jpg', 'width': 320, 'height': 180}, 'high': {'url': 'https://i.ytimg.com/vi/TnqkSuxFVZc/hqdefault.jpg', 'width': 480, 'height': 360}}",Social Proof,none,2024-05-23T12:00:24Z,TnqkSuxFVZc,"<iframe width=""480"" height=""270"" src=""//www.youtube.com/embed/TnqkSuxFVZc"" frameborder=""0"" allow=""accelerometer; autoplay; clipboard-write; encrypted-media; gyroscope; picture-in-picture; web-share"" referrerpolicy=""strict-origin-when-cross-origin"" allowfullscreen></iframe>",Productivity
8,2024-05-22T23:16:54Z,UCl6to6J7oVltnhHEVm1s87A,"The Kushite Empire, also known as the Kingdom of Kush","theperspective #africanhistory #africanews #africax5 The Kushite Empire, also known as the Kingdom of Kush, was an ancient ...","{'default': {'url': 'https://i.ytimg.com/vi/6gz7dvGImhM/default.jpg', 'width': 120, 'height': 90}, 'medium': {'url': 'https://i.ytimg.com/vi/6gz7dvGImhM/mqdefault.jpg', 'width': 320, 'height': 180}, 'high': {'url': 'https://i.ytimg.com/vi/6gz7dvGImhM/hqdefault.jpg', 'width': 480, 'height': 360}}",Africax5 Network,none,2024-05-22T23:16:54Z,6gz7dvGImhM,"<iframe width=""480"" height=""360"" src=""//www.youtube.com/embed/6gz7dvGImhM"" frameborder=""0"" allow=""accelerometer; autoplay; clipboard-write; encrypted-media; gyroscope; picture-in-picture; web-share"" referrerpolicy=""strict-origin-when-cross-origin"" allowfullscreen></iframe>",Social Issues
1,2024-05-22T18:56:49Z,UCTis64XH8HrxE7GhEkA6YmA,GREATEST FOOTBALL/SOCCER COMMENTATOR EVER: RAY HUDSON 😂 #football #footy #soccer #futbol,,"{'default': {'url': 'https://i.ytimg.com/vi/v6113e8iu9k/default.jpg', 'width': 120, 'height': 90}, 'medium': {'url': 'https://i.ytimg.com/vi/v6113e8iu9k/mqdefault.jpg', 'width': 320, 'height': 180}, 'high': {'url': 'https://i.ytimg.com/vi/v6113e8iu9k/hqdefault.jpg', 'width': 480, 'height': 360}}",5ASIDE Media,none,2024-05-22T18:56:49Z,v6113e8iu9k,"<iframe width=""480"" height=""270"" src=""//www.youtube.com/embed/v6113e8iu9k"" frameborder=""0"" allow=""accelerometer; autoplay; clipboard-write; encrypted-media; gyroscope; picture-in-picture; web-share"" referrerpolicy=""strict-origin-when-cross-origin"" allowfullscreen></iframe>",Sports
40,2024-05-22T18:55:42Z,UC2rmgVaijnf92nixlIZWGmg,The Best Jollof In The World Can Be Found At Almadies Pointe in Dakar. #dakar #senegal,,"{'default': {'url': 'https://i.ytimg.com/vi/WQTPsA-Zgro/default.jpg', 'width': 120, 'height': 90}, 'medium': {'url': 'https://i.ytimg.com/vi/WQTPsA-Zgro/mqdefault.jpg', 'width': 320, 'height': 180}, 'high': {'url': 'https://i.ytimg.com/vi/WQTPsA-Zgro/hqdefault.jpg', 'width': 480, 'height': 360}}",Search For Uhuru,none,2024-05-22T18:55:42Z,WQTPsA-Zgro,"<iframe width=""480"" height=""270"" src=""//www.youtube.com/embed/WQTPsA-Zgro"" frameborder=""0"" allow=""accelerometer; autoplay; clipboard-write; encrypted-media; gyroscope; picture-in-picture; web-share"" referrerpolicy=""strict-origin-when-cross-origin"" allowfullscreen></iframe>",Travel
52,2024-05-22T18:55:36Z,UCXyHjFIKz9D8ofxObOuYBbg,Diddy give me the ick?,WeNeedToTalk #BlackLove To support our ministry: https://cash.app/$wnttalk Please SUBSCRIBE for more content!,"{'default': {'url': 'https://i.ytimg.com/vi/m3n8sbf8xGg/default.jpg', 'width': 120, 'height': 90}, 'medium': {'url': 'https://i.ytimg.com/vi/m3n8sbf8xGg/mqdefault.jpg', 'width': 320, 'height': 180}, 'high': {'url': 'https://i.ytimg.com/vi/m3n8sbf8xGg/hqdefault.jpg', 'width': 480, 'height': 360}}",WeNeedToTalk,none,2024-05-22T18:55:36Z,m3n8sbf8xGg,"<iframe width=""480"" height=""270"" src=""//www.youtube.com/embed/m3n8sbf8xGg"" frameborder=""0"" allow=""accelerometer; autoplay; clipboard-write; encrypted-media; gyroscope; picture-in-picture; web-share"" referrerpolicy=""strict-origin-when-cross-origin"" allowfullscreen></iframe>",Social Issues
27,2024-05-22T16:20:46Z,UC__wkIWEfbnTAYVT8j6gfPg,Gram Hancock on Black African Origin of ancient Egypt #GramHancock #JoeRogan #BlackEgypt,,"{'default': {'url': 'https://i.ytimg.com/vi/HVqqABsnvP0/default.jpg', 'width': 120, 'height': 90}, 'medium': {'url': 'https://i.ytimg.com/vi/HVqqABsnvP0/mqdefault.jpg', 'width': 320, 'height': 180}, 'high': {'url': 'https://i.ytimg.com/vi/HVqqABsnvP0/hqdefault.jpg', 'width': 480, 'height': 360}}",Know Thyself,none,2024-05-22T16:20:46Z,HVqqABsnvP0,"<iframe width=""480"" height=""270"" src=""//www.youtube.com/embed/HVqqABsnvP0"" frameborder=""0"" allow=""accelerometer; autoplay; clipboard-write; encrypted-media; gyroscope; picture-in-picture; web-share"" referrerpolicy=""strict-origin-when-cross-origin"" allowfullscreen></iframe>",History
13,2024-05-22T16:00:06Z,UCIxrFTHZybtTgq8X7itOAkQ,The Jamaica You&#39;ve Never Seen Before,jamaica #jamaicaculture #kingstonjamaica Explore the hidden gems of Jamaica in this breathtaking video that showcases the ...,"{'default': {'url': 'https://i.ytimg.com/vi/TdR7uBFHvFQ/default.jpg', 'width': 120, 'height': 90}, 'medium': {'url': 'https://i.ytimg.com/vi/TdR7uBFHvFQ/mqdefault.jpg', 'width': 320, 'height': 180}, 'high': {'url': 'https://i.ytimg.com/vi/TdR7uBFHvFQ/hqdefault.jpg', 'width': 480, 'height': 360}}",Blackman Da Traveller,none,2024-05-22T16:00:06Z,TdR7uBFHvFQ,"<iframe width=""480"" height=""270"" src=""//www.youtube.com/embed/TdR7uBFHvFQ"" frameborder=""0"" allow=""accelerometer; autoplay; clipboard-write; encrypted-media; gyroscope; picture-in-picture; web-share"" referrerpolicy=""strict-origin-when-cross-origin"" allowfullscreen></iframe>",Travel
18,2024-05-22T00:39:42Z,UCwbP4USYrniJGROwQNiwH-Q,No One Is Perfect #relationshipadvice #manosphere  #genderwar,Book Your 1-On-1 60-Minute Advice Consultations Here: https://calendly.com/deedeewoods4real Join My Patreon Here: ...,"{'default': {'url': 'https://i.ytimg.com/vi/8tVCHj8tQw4/default.jpg', 'width': 120, 'height': 90}, 'medium': {'url': 'https://i.ytimg.com/vi/8tVCHj8tQw4/mqdefault.jpg', 'width': 320, 'height': 180}, 'high': {'url': 'https://i.ytimg.com/vi/8tVCHj8tQw4/hqdefault.jpg', 'width': 480, 'height': 360}}",DeeDee,none,2024-05-22T00:39:42Z,8tVCHj8tQw4,"<iframe width=""480"" height=""270"" src=""//www.youtube.com/embed/8tVCHj8tQw4"" frameborder=""0"" allow=""accelerometer; autoplay; clipboard-write; encrypted-media; gyroscope; picture-in-picture; web-share"" referrerpolicy=""strict-origin-when-cross-origin"" allowfullscreen></iframe>",Social Issues
46,2024-05-20T04:08:27Z,UCLjzzg-cFWpEEjnWCOpXp3Q,#OmaliTaughtMe Sunday Study: What is the Party? Build and Consolidate the APSP Part III,"This week on #OmaliTaughtMe we conduct Part 3 of the special series, ""What is the Party? Build and Consolidate the APSP.","{'default': {'url': 'https://i.ytimg.com/vi/ukMyDb0MZsQ/default.jpg', 'width': 120, 'height': 90}, 'medium': {'url': 'https://i.ytimg.com/vi/ukMyDb0MZsQ/mqdefault.jpg', 'width': 320, 'height': 180}, 'high': {'url': 'https://i.ytimg.com/vi/ukMyDb0MZsQ/hqdefault.jpg', 'width': 480, 'height': 360}}",The Burning Spear TV,none,2024-05-20T04:08:27Z,ukMyDb0MZsQ,"<iframe width=""480"" height=""270"" src=""//www.youtube.com/embed/ukMyDb0MZsQ"" frameborder=""0"" allow=""accelerometer; autoplay; clipboard-write; encrypted-media; gyroscope; picture-in-picture; web-share"" referrerpolicy=""strict-origin-when-cross-origin"" allowfullscreen></iframe>",Current Events
53,2024-05-19T17:30:06Z,UCIwGnOXoSXEI7Tooz3iKq5w,CRAZY Discovery of The First Ever Coin. | 4K Documentary,"No, the Greeks didn't invent money. In this video we detail how money was invented and where it actually came from. Join this ...","{'default': {'url': 'https://i.ytimg.com/vi/S6ZgKwO2Jgc/default.jpg', 'width': 120, 'height': 90}, 'medium': {'url': 'https://i.ytimg.com/vi/S6ZgKwO2Jgc/mqdefault.jpg', 'width': 320, 'height': 180}, 'high': {'url': 'https://i.ytimg.com/vi/S6ZgKwO2Jgc/hqdefault.jpg', 'width': 480, 'height': 360}}",Without History,none,2024-05-19T17:30:06Z,S6ZgKwO2Jgc,"<iframe width=""480"" height=""270"" src=""//www.youtube.com/embed/S6ZgKwO2Jgc"" frameborder=""0"" allow=""accelerometer; autoplay; clipboard-write; encrypted-media; gyroscope; picture-in-picture; web-share"" referrerpolicy=""strict-origin-when-cross-origin"" allowfullscreen></iframe>",History
32,2024-05-15T16:09:28Z,UCh2ANLALdN1OZUJKmvchkkg,Why Greeks Became So Powerful?,WATCH FULL VIDEO HERE: https://youtu.be/ahxLfwLkFTIg #imhotepfacts.,"{'default': {'url': 'https://i.ytimg.com/vi/2aruE07iMWc/default.jpg', 'width': 120, 'height': 90}, 'medium': {'url': 'https://i.ytimg.com/vi/2aruE07iMWc/mqdefault.jpg', 'width': 320, 'height': 180}, 'high': {'url': 'https://i.ytimg.com/vi/2aruE07iMWc/hqdefault.jpg', 'width': 480, 'height': 360}}",Mr. Imhotep,none,2024-05-15T16:09:28Z,2aruE07iMWc,"<iframe width=""480"" height=""270"" src=""//www.youtube.com/embed/2aruE07iMWc"" frameborder=""0"" allow=""accelerometer; autoplay; clipboard-write; encrypted-media; gyroscope; picture-in-picture; web-share"" referrerpolicy=""strict-origin-when-cross-origin"" allowfullscreen></iframe>",History
31,2024-05-15T12:59:49Z,UC4YZVeGnDXzEfjGcZG-d6oQ,What Do Lab Grown Diamonds Have To Do With Epstein Island? Pt 2.,Whistle-blower tells the truth about incinerators used for babies to make diamonds.,"{'default': {'url': 'https://i.ytimg.com/vi/BWGcTl0CYzg/default.jpg', 'width': 120, 'height': 90}, 'medium': {'url': 'https://i.ytimg.com/vi/BWGcTl0CYzg/mqdefault.jpg', 'width': 320, 'height': 180}, 'high': {'url': 'https://i.ytimg.com/vi/BWGcTl0CYzg/hqdefault.jpg', 'width': 480, 'height': 360}}",meandepiphany,none,2024-05-15T12:59:49Z,BWGcTl0CYzg,"<iframe width=""480"" height=""270"" src=""//www.youtube.com/embed/BWGcTl0CYzg"" frameborder=""0"" allow=""accelerometer; autoplay; clipboard-write; encrypted-media; gyroscope; picture-in-picture; web-share"" referrerpolicy=""strict-origin-when-cross-origin"" allowfullscreen></iframe>",Social Issues
4,2024-05-08T16:00:28Z,UCJmmxwdAsR7lD8fBA_qbEMw,Entebbe Raid : The Israeli Raid that humiliated Idi Amin of Uganda,"In 1976, an airplane hijacking unfolded that would change history. Air France Flight 139, en route from Tel Aviv, Israel to Paris, ...","{'default': {'url': 'https://i.ytimg.com/vi/UTrfYgMxYq0/default.jpg', 'width': 120, 'height': 90}, 'medium': {'url': 'https://i.ytimg.com/vi/UTrfYgMxYq0/mqdefault.jpg', 'width': 320, 'height': 180}, 'high': {'url': 'https://i.ytimg.com/vi/UTrfYgMxYq0/hqdefault.jpg', 'width': 480, 'height': 360}}",African Biographics,none,2024-05-08T16:00:28Z,UTrfYgMxYq0,"<iframe width=""480"" height=""270"" src=""//www.youtube.com/embed/UTrfYgMxYq0"" frameborder=""0"" allow=""accelerometer; autoplay; clipboard-write; encrypted-media; gyroscope; picture-in-picture; web-share"" referrerpolicy=""strict-origin-when-cross-origin"" allowfullscreen></iframe>",History
3,2024-04-25T23:00:06Z,UCTTQWaoGloNuhunZevQ2F6g,"Kuubwa Transforming African Businesses: Fabric Weaver, Fish Farmers","Kuubwa Transforms African Businesses: Fish Farmers, Fabric Manufacturers and more.","{'default': {'url': 'https://i.ytimg.com/vi/gC02Wht1UQQ/default.jpg', 'width': 120, 'height': 90}, 'medium': {'url': 'https://i.ytimg.com/vi/gC02Wht1UQQ/mqdefault.jpg', 'width': 320, 'height': 180}, 'high': {'url': 'https://i.ytimg.com/vi/gC02Wht1UQQ/hqdefault.jpg', 'width': 480, 'height': 360}}",Africa Business Channel TV,none,2024-04-25T23:00:06Z,gC02Wht1UQQ,"<iframe width=""480"" height=""270"" src=""//www.youtube.com/embed/gC02Wht1UQQ"" frameborder=""0"" allow=""accelerometer; autoplay; clipboard-write; encrypted-media; gyroscope; picture-in-picture; web-share"" referrerpolicy=""strict-origin-when-cross-origin"" allowfullscreen></iframe>",Productivity
15,2024-04-21T18:00:21Z,UCMMTYgqKEgCgy1pR6Axlf0A,He moved to Ghana and built a 2 bedroom house |Breakdown of costs to build this home|Exploring Asebu,"You could spend $10000 to $15000 to build a similar home, without Ron's specifications, according to the builder. Exploring ...","{'default': {'url': 'https://i.ytimg.com/vi/_j99iYQFiMs/default.jpg', 'width': 120, 'height': 90}, 'medium': {'url': 'https://i.ytimg.com/vi/_j99iYQFiMs/mqdefault.jpg', 'width': 320, 'height': 180}, 'high': {'url': 'https://i.ytimg.com/vi/_j99iYQFiMs/hqdefault.jpg', 'width': 480, 'height': 360}}",Build with Amoaa,none,2024-04-21T18:00:21Z,_j99iYQFiMs,"<iframe width=""480"" height=""270"" src=""//www.youtube.com/embed/_j99iYQFiMs"" frameborder=""0"" allow=""accelerometer; autoplay; clipboard-write; encrypted-media; gyroscope; picture-in-picture; web-share"" referrerpolicy=""strict-origin-when-cross-origin"" allowfullscreen></iframe>",Travel
43,2024-04-11T05:04:02Z,UCuvO0y2EU_kRfYzlhGJNOKA,How Did America&#39;s Wealthy Elite Re Write World History,"The United States was supposed to be a democratically run country. However, that has not been the case since the turn of the ...","{'default': {'url': 'https://i.ytimg.com/vi/RPSnS-ucmOA/default.jpg', 'width': 120, 'height': 90}, 'medium': {'url': 'https://i.ytimg.com/vi/RPSnS-ucmOA/mqdefault.jpg', 'width': 320, 'height': 180}, 'high': {'url': 'https://i.ytimg.com/vi/RPSnS-ucmOA/hqdefault.jpg', 'width': 480, 'height': 360}}",Straight UP,none,2024-04-11T05:04:02Z,RPSnS-ucmOA,"<iframe width=""480"" height=""270"" src=""//www.youtube.com/embed/RPSnS-ucmOA"" frameborder=""0"" allow=""accelerometer; autoplay; clipboard-write; encrypted-media; gyroscope; picture-in-picture; web-share"" referrerpolicy=""strict-origin-when-cross-origin"" allowfullscreen></iframe>",History
44,2024-04-11T05:04:02Z,UCuvO0y2EU_kRfYzlhGJNOKA,How Did America&#39;s Wealthy Elite Re Write World History,"The United States was supposed to be a democratically run country. However, that has not been the case since the turn of the ...","{'default': {'url': 'https://i.ytimg.com/vi/RPSnS-ucmOA/default.jpg', 'width': 120, 'height': 90}, 'medium': {'url': 'https://i.ytimg.com/vi/RPSnS-ucmOA/mqdefault.jpg', 'width': 320, 'height': 180}, 'high': {'url': 'https://i.ytimg.com/vi/RPSnS-ucmOA/hqdefault.jpg', 'width': 480, 'height': 360}}",Straight UP,none,2024-04-11T05:04:02Z,RPSnS-ucmOA,"<iframe width=""480"" height=""270"" src=""//www.youtube.com/embed/RPSnS-ucmOA"" frameborder=""0"" allow=""accelerometer; autoplay; clipboard-write; encrypted-media; gyroscope; picture-in-picture; web-share"" referrerpolicy=""strict-origin-when-cross-origin"" allowfullscreen></iframe>",History
10,2024-03-18T19:44:38Z,UC2xX2FI6s4i9xz3t9qjayhg,Gamal Abdel Nasser issues his support for Palestine,,"{'default': {'url': 'https://i.ytimg.com/vi/_LX3AlOaJw4/default.jpg', 'width': 120, 'height': 90}, 'medium': {'url': 'https://i.ytimg.com/vi/_LX3AlOaJw4/mqdefault.jpg', 'width': 320, 'height': 180}, 'high': {'url': 'https://i.ytimg.com/vi/_LX3AlOaJw4/hqdefault.jpg', 'width': 480, 'height': 360}}",AfroMarxist,none,2024-03-18T19:44:38Z,_LX3AlOaJw4,"<iframe width=""480"" height=""270"" src=""//www.youtube.com/embed/_LX3AlOaJw4"" frameborder=""0"" allow=""accelerometer; autoplay; clipboard-write; encrypted-media; gyroscope; picture-in-picture; web-share"" referrerpolicy=""strict-origin-when-cross-origin"" allowfullscreen></iframe>",History
33,2024-03-07T16:28:34Z,UCJH-fn0wLu5uwXX33jNToQw,Life in post-apartheid South Africa | Thabo Makhetha-Kwinana,"southafrica #apartheid #segregation #africanpodcast #africantopics Lesotho-born, South Africa raised fashion designer, Thabo ...","{'default': {'url': 'https://i.ytimg.com/vi/NbWALkH-3Ks/default.jpg', 'width': 120, 'height': 90}, 'medium': {'url': 'https://i.ytimg.com/vi/NbWALkH-3Ks/mqdefault.jpg', 'width': 320, 'height': 180}, 'high': {'url': 'https://i.ytimg.com/vi/NbWALkH-3Ks/hqdefault.jpg', 'width': 480, 'height': 360}}",NewAfrica,none,2024-03-07T16:28:34Z,NbWALkH-3Ks,"<iframe width=""480"" height=""270"" src=""//www.youtube.com/embed/NbWALkH-3Ks"" frameborder=""0"" allow=""accelerometer; autoplay; clipboard-write; encrypted-media; gyroscope; picture-in-picture; web-share"" referrerpolicy=""strict-origin-when-cross-origin"" allowfullscreen></iframe>",Current Events
50,2024-03-06T22:13:04Z,UC2-nif4wvOqT6QVsBX3NOpA,They Beat The USA | Some Bad Mo&#39;Fos,Black Seminoles Indians REALLY went through it. Our most trusted travel tools & resources: Nomad Travel Medical Insurance: ...,"{'default': {'url': 'https://i.ytimg.com/vi/ioTA5-CSsJk/default.jpg', 'width': 120, 'height': 90}, 'medium': {'url': 'https://i.ytimg.com/vi/ioTA5-CSsJk/mqdefault.jpg', 'width': 320, 'height': 180}, 'high': {'url': 'https://i.ytimg.com/vi/ioTA5-CSsJk/hqdefault.jpg', 'width': 480, 'height': 360}}",The Yarbros,none,2024-03-06T22:13:04Z,ioTA5-CSsJk,"<iframe width=""480"" height=""270"" src=""//www.youtube.com/embed/ioTA5-CSsJk"" frameborder=""0"" allow=""accelerometer; autoplay; clipboard-write; encrypted-media; gyroscope; picture-in-picture; web-share"" referrerpolicy=""strict-origin-when-cross-origin"" allowfullscreen></iframe>",Travel
28,2024-02-19T00:25:24Z,UCHbmePHjGH3pklvSla6szWw,We React Live to Metatron&#39;s Response to My Video - @kingmono Joins the LIVE!,The King's Monologue and KueliMika join in a LIVE to React to Metatron's Response. We expose the lack of rigor. Here is the ...,"{'default': {'url': 'https://i.ytimg.com/vi/vPb9afzHhCc/default.jpg', 'width': 120, 'height': 90}, 'medium': {'url': 'https://i.ytimg.com/vi/vPb9afzHhCc/mqdefault.jpg', 'width': 320, 'height': 180}, 'high': {'url': 'https://i.ytimg.com/vi/vPb9afzHhCc/hqdefault.jpg', 'width': 480, 'height': 360}}",KueliMika,none,2024-02-19T00:25:24Z,vPb9afzHhCc,"<iframe width=""480"" height=""270"" src=""//www.youtube.com/embed/vPb9afzHhCc"" frameborder=""0"" allow=""accelerometer; autoplay; clipboard-write; encrypted-media; gyroscope; picture-in-picture; web-share"" referrerpolicy=""strict-origin-when-cross-origin"" allowfullscreen></iframe>",History
9,2024-02-18T12:24:50Z,UCbvE_5m8kmm9U58gDHtzYrA,Sebastien Haller’s story is one of one!,,"{'default': {'url': 'https://i.ytimg.com/vi/7fWV5yJGqAU/default.jpg', 'width': 120, 'height': 90}, 'medium': {'url': 'https://i.ytimg.com/vi/7fWV5yJGqAU/mqdefault.jpg', 'width': 320, 'height': 180}, 'high': {'url': 'https://i.ytimg.com/vi/7fWV5yJGqAU/hqdefault.jpg', 'width': 480, 'height': 360}}",AfroBallers,none,2024-02-18T12:24:50Z,7fWV5yJGqAU,"<iframe width=""480"" height=""270"" src=""//www.youtube.com/embed/7fWV5yJGqAU"" frameborder=""0"" allow=""accelerometer; autoplay; clipboard-write; encrypted-media; gyroscope; picture-in-picture; web-share"" referrerpolicy=""strict-origin-when-cross-origin"" allowfullscreen></iframe>",Sports
0,2024-02-02T18:23:12Z,UCG7uFJVZsxQRwDssom9Pavw,Video of Somali President Inviting Back Italians to Somalia is Going Viral,Viral Video of Somali president Hassan Sheikh Mohamud is trending online Claiming he is the First African President to Invite ...,"{'default': {'url': 'https://i.ytimg.com/vi/ytGSxSY1Uhs/default.jpg', 'width': 120, 'height': 90}, 'medium': {'url': 'https://i.ytimg.com/vi/ytGSxSY1Uhs/mqdefault.jpg', 'width': 320, 'height': 180}, 'high': {'url': 'https://i.ytimg.com/vi/ytGSxSY1Uhs/hqdefault.jpg', 'width': 480, 'height': 360}}",2nacheki,none,2024-02-02T18:23:12Z,ytGSxSY1Uhs,"<iframe width=""480"" height=""270"" src=""//www.youtube.com/embed/ytGSxSY1Uhs"" frameborder=""0"" allow=""accelerometer; autoplay; clipboard-write; encrypted-media; gyroscope; picture-in-picture; web-share"" referrerpolicy=""strict-origin-when-cross-origin"" allowfullscreen></iframe>",Current Events
23,2023-11-10T22:43:20Z,UC12lU5ymIvSpgl8KntDQUQA,The Nature Of Slavery In Africa,Patreon: https://www.patreon.com/HomeTeamHistory.,"{'default': {'url': 'https://i.ytimg.com/vi/EREJ-JXY-l8/default.jpg', 'width': 120, 'height': 90}, 'medium': {'url': 'https://i.ytimg.com/vi/EREJ-JXY-l8/mqdefault.jpg', 'width': 320, 'height': 180}, 'high': {'url': 'https://i.ytimg.com/vi/EREJ-JXY-l8/hqdefault.jpg', 'width': 480, 'height': 360}}",HomeTeam History,none,2023-11-10T22:43:20Z,EREJ-JXY-l8,"<iframe width=""480"" height=""270"" src=""//www.youtube.com/embed/EREJ-JXY-l8"" frameborder=""0"" allow=""accelerometer; autoplay; clipboard-write; encrypted-media; gyroscope; picture-in-picture; web-share"" referrerpolicy=""strict-origin-when-cross-origin"" allowfullscreen></iframe>",History
