,publishedAt,channelId,title,description,thumbnails,channelTitle,liveBroadcastContent,publishTime,videoID,embeds,category
19,2025-09-18T03:04:48Z,UCwbP4USYrniJGROwQNiwH-Q,I&#39;m BIG &amp; BEAUTIFUL No Matter How Big I Get! | Women Being Educated Allows Them To Be Big!,I'm BIG & BEAUTIFUL No Matter How Big I Get! | Women Being Educated Allows Them To Be Big! Order Merch Here: ...,"{'default': {'url': 'https://i.ytimg.com/vi/2tCiVYcZUmM/default.jpg', 'width': 120, 'height': 90}, 'medium': {'url': 'https://i.ytimg.com/vi/2tCiVYcZUmM/mqdefault.jpg', 'width': 320, 'height': 180}, 'high': {'url': 'https://i.ytimg.com/vi/2tCiVYcZUmM/hqdefault.jpg', 'width': 480, 'height': 360}}",DeeDee,none,2025-09-18T03:04:48Z,2tCiVYcZUmM,"<iframe width=""480"" height=""270"" src=""//www.youtube.com/embed/2tCiVYcZUmM"" frameborder=""0"" allow=""accelerometer; autoplay; clipboard-write; encrypted-media; gyroscope; picture-in-picture; web-share"" referrerpolicy=""strict-origin-when-cross-origin"" allowfullscreen></iframe>",Social Issues
16,2025-09-18T02:41:16Z,UCL0u5uz7KZ9q-pe-VC8TY-w,"I will not stop investigating what happened to my friend, Charlie Kirk.",,"{'default': {'url': 'https://i.ytimg.com/vi/E4eKUURen_s/default.jpg', 'width': 120, 'height': 90}, 'medium': {'url': 'https://i.ytimg.com/vi/E4eKUURen_s/mqdefault.jpg', 'width': 320, 'height': 180}, 'high': {'url': 'https://i.ytimg.com/vi/E4eKUURen_s/hqdefault.jpg', 'width': 480, 'height': 360}}",Candace Owens,none,2025-09-18T02:41:16Z,E4eKUURen_s,"<iframe width=""480"" height=""270"" src=""//www.youtube.com/embed/E4eKUURen_s"" frameborder=""0"" allow=""accelerometer; autoplay; clipboard-write; encrypted-media; gyroscope; picture-in-picture; web-share"" referrerpolicy=""strict-origin-when-cross-origin"" allowfullscreen></iframe>",Current Events
40,2025-09-18T02:24:20Z,UCDsOKnUQnQek7-G7Xc5kB8Q,PERSISTENCE WINS — ARE YOU A DREAMER OR A BUILDER? #shorts #socialproofpodcast,,"{'default': {'url': 'https://i.ytimg.com/vi/xnTyxtGBreY/default.jpg', 'width': 120, 'height': 90}, 'medium': {'url': 'https://i.ytimg.com/vi/xnTyxtGBreY/mqdefault.jpg', 'width': 320, 'height': 180}, 'high': {'url': 'https://i.ytimg.com/vi/xnTyxtGBreY/hqdefault.jpg', 'width': 480, 'height': 360}}",Social Proof,none,2025-09-18T02:24:20Z,xnTyxtGBreY,"<iframe width=""480"" height=""270"" src=""//www.youtube.com/embed/xnTyxtGBreY"" frameborder=""0"" allow=""accelerometer; autoplay; clipboard-write; encrypted-media; gyroscope; picture-in-picture; web-share"" referrerpolicy=""strict-origin-when-cross-origin"" allowfullscreen></iframe>",Productivity
50,2025-09-18T01:31:46Z,UCHVBLMcvOgDtFEF2bToQLqw,Student Hanged on Campus Homeless Massacre,Student Hanged on Campus Homeless Massacre #briankilmeade #candaceowenspodcast #charliekirk #utahshooting.,"{'default': {'url': 'https://i.ytimg.com/vi/ydbEVPyRH_U/default.jpg', 'width': 120, 'height': 90}, 'medium': {'url': 'https://i.ytimg.com/vi/ydbEVPyRH_U/mqdefault.jpg', 'width': 320, 'height': 180}, 'high': {'url': 'https://i.ytimg.com/vi/ydbEVPyRH_U/hqdefault.jpg', 'width': 480, 'height': 360}}",We Woke Now,none,2025-09-18T01:31:46Z,ydbEVPyRH_U,"<iframe width=""480"" height=""270"" src=""//www.youtube.com/embed/ydbEVPyRH_U"" frameborder=""0"" allow=""accelerometer; autoplay; clipboard-write; encrypted-media; gyroscope; picture-in-picture; web-share"" referrerpolicy=""strict-origin-when-cross-origin"" allowfullscreen></iframe>",Social Issues
32,2025-09-17T23:58:50Z,UC4YZVeGnDXzEfjGcZG-d6oQ,Reading Through the Bible Ep 69 - Deuteronomy 29 - Keep the Covenant,New to streaming or looking to level up? Check out StreamYard and get $10 discount!,"{'default': {'url': 'https://i.ytimg.com/vi/uIQ2094BZ28/default.jpg', 'width': 120, 'height': 90}, 'medium': {'url': 'https://i.ytimg.com/vi/uIQ2094BZ28/mqdefault.jpg', 'width': 320, 'height': 180}, 'high': {'url': 'https://i.ytimg.com/vi/uIQ2094BZ28/hqdefault.jpg', 'width': 480, 'height': 360}}",meandepiphany,none,2025-09-17T23:58:50Z,uIQ2094BZ28,"<iframe width=""480"" height=""270"" src=""//www.youtube.com/embed/uIQ2094BZ28"" frameborder=""0"" allow=""accelerometer; autoplay; clipboard-write; encrypted-media; gyroscope; picture-in-picture; web-share"" referrerpolicy=""strict-origin-when-cross-origin"" allowfullscreen></iframe>",Social Issues
4,2025-09-17T23:55:46Z,UCKZGcrxRAhdUi58Mdr565mw,"We Can’t Cover This Story Here, But We Will Be Live On The App",Welcome to African Diaspora News Channel — Where We Speak Truth to Power. We bring you unapologetic news and ...,"{'default': {'url': 'https://i.ytimg.com/vi/mnkKtya5rjk/default.jpg', 'width': 120, 'height': 90}, 'medium': {'url': 'https://i.ytimg.com/vi/mnkKtya5rjk/mqdefault.jpg', 'width': 320, 'height': 180}, 'high': {'url': 'https://i.ytimg.com/vi/mnkKtya5rjk/hqdefault.jpg', 'width': 480, 'height': 360}}",African Diaspora News Channel,none,2025-09-17T23:55:46Z,mnkKtya5rjk,"<iframe width=""480"" height=""270"" src=""//www.youtube.com/embed/mnkKtya5rjk"" frameborder=""0"" allow=""accelerometer; autoplay; clipboard-write; encrypted-media; gyroscope; picture-in-picture; web-share"" referrerpolicy=""strict-origin-when-cross-origin"" allowfullscreen></iframe>",Current Events
14,2025-09-17T23:32:28Z,UCiinSjWS3E0vtAa3DCvp7iA,"MAGA’s Witch-Hunt: Silence Charlie Kirk Critics, Cancel Free Speech","On The Freedom Side LIVE, Thursday, 9/18 at 3pm ET/12pm PT, Rania Khalek and Eugene Puryear are joined by special guests: ...","{'default': {'url': 'https://i.ytimg.com/vi/cqQqLyiJ7zI/default_live.jpg', 'width': 120, 'height': 90}, 'medium': {'url': 'https://i.ytimg.com/vi/cqQqLyiJ7zI/mqdefault_live.jpg', 'width': 320, 'height': 180}, 'high': {'url': 'https://i.ytimg.com/vi/cqQqLyiJ7zI/hqdefault_live.jpg', 'width': 480, 'height': 360}}",BreakThrough News,upcoming,2025-09-17T23:32:28Z,cqQqLyiJ7zI,"<iframe width=""480"" height=""360"" src=""//www.youtube.com/embed/cqQqLyiJ7zI"" frameborder=""0"" allow=""accelerometer; autoplay; clipboard-write; encrypted-media; gyroscope; picture-in-picture; web-share"" referrerpolicy=""strict-origin-when-cross-origin"" allowfullscreen></iframe>",Current Events
20,2025-09-17T21:51:23Z,UCRVsqvXIdgyPVS-a6fGa1lA,"Fallout After Charlie Kirk: Trump Unleashed, The World Divided, &amp; 10 Ways to Get Rich w/ 19 Keys",,"{'default': {'url': 'https://i.ytimg.com/vi/bbc4PO284ro/default.jpg', 'width': 120, 'height': 90}, 'medium': {'url': 'https://i.ytimg.com/vi/bbc4PO284ro/mqdefault.jpg', 'width': 320, 'height': 180}, 'high': {'url': 'https://i.ytimg.com/vi/bbc4PO284ro/hqdefault.jpg', 'width': 480, 'height': 360}}",Earn Your Leisure,none,2025-09-17T21:51:23Z,bbc4PO284ro,"<iframe width=""480"" height=""270"" src=""//www.youtube.com/embed/bbc4PO284ro"" frameborder=""0"" allow=""accelerometer; autoplay; clipboard-write; encrypted-media; gyroscope; picture-in-picture; web-share"" referrerpolicy=""strict-origin-when-cross-origin"" allowfullscreen></iframe>",Productivity
26,2025-09-17T21:06:11Z,UCi2uaWdy6OTf4Ty7DVC_7lw,LIFE AFTER DISASTER  HITS MY VILLA !!! (Kenya Africa ) !!!,"Hello family , welcome to my YouTube channel iam_marwa ,!!! , I NEED YOUR HELP URGENTLY , DISASTER HITS MY VILLA !","{'default': {'url': 'https://i.ytimg.com/vi/UmlHEuzFE6k/default.jpg', 'width': 120, 'height': 90}, 'medium': {'url': 'https://i.ytimg.com/vi/UmlHEuzFE6k/mqdefault.jpg', 'width': 320, 'height': 180}, 'high': {'url': 'https://i.ytimg.com/vi/UmlHEuzFE6k/hqdefault.jpg', 'width': 480, 'height': 360}}",iam_marwa,none,2025-09-17T21:06:11Z,UmlHEuzFE6k,"<iframe width=""480"" height=""270"" src=""//www.youtube.com/embed/UmlHEuzFE6k"" frameborder=""0"" allow=""accelerometer; autoplay; clipboard-write; encrypted-media; gyroscope; picture-in-picture; web-share"" referrerpolicy=""strict-origin-when-cross-origin"" allowfullscreen></iframe>",Travel
30,2025-09-17T20:09:26Z,UC1ettU5YSf_nIOJWffCKGQw,lady predicts france expulsion from africa infront of macron,"kenyan lady, adelle onyango predicted the french expulsion from africa, warns macron of france exploitative practices.","{'default': {'url': 'https://i.ytimg.com/vi/PAqpcrfA0Zo/default.jpg', 'width': 120, 'height': 90}, 'medium': {'url': 'https://i.ytimg.com/vi/PAqpcrfA0Zo/mqdefault.jpg', 'width': 320, 'height': 180}, 'high': {'url': 'https://i.ytimg.com/vi/PAqpcrfA0Zo/hqdefault.jpg', 'width': 480, 'height': 360}}",LuiSpot,none,2025-09-17T20:09:26Z,PAqpcrfA0Zo,"<iframe width=""480"" height=""270"" src=""//www.youtube.com/embed/PAqpcrfA0Zo"" frameborder=""0"" allow=""accelerometer; autoplay; clipboard-write; encrypted-media; gyroscope; picture-in-picture; web-share"" referrerpolicy=""strict-origin-when-cross-origin"" allowfullscreen></iframe>",Current Events
28,2025-09-17T19:25:17Z,UC__wkIWEfbnTAYVT8j6gfPg,"Ta-Netjer, Land of the Gods #kemet #history #africanhistory #africancivilization #ancientegypt",,"{'default': {'url': 'https://i.ytimg.com/vi/g1eysCQaZqU/default.jpg', 'width': 120, 'height': 90}, 'medium': {'url': 'https://i.ytimg.com/vi/g1eysCQaZqU/mqdefault.jpg', 'width': 320, 'height': 180}, 'high': {'url': 'https://i.ytimg.com/vi/g1eysCQaZqU/hqdefault.jpg', 'width': 480, 'height': 360}}",Know Thyself,none,2025-09-17T19:25:17Z,g1eysCQaZqU,"<iframe width=""480"" height=""270"" src=""//www.youtube.com/embed/g1eysCQaZqU"" frameborder=""0"" allow=""accelerometer; autoplay; clipboard-write; encrypted-media; gyroscope; picture-in-picture; web-share"" referrerpolicy=""strict-origin-when-cross-origin"" allowfullscreen></iframe>",History
41,2025-09-17T19:07:25Z,UC4lH-odQ5ll-85fkpWxDYmA,I tested wealth in the richest west African country,"in today's episode i visited the richest west African country, Ghana and tested the highest level of luxury to see what it cost to live ...","{'default': {'url': 'https://i.ytimg.com/vi/B-MMBv39WX4/default.jpg', 'width': 120, 'height': 90}, 'medium': {'url': 'https://i.ytimg.com/vi/B-MMBv39WX4/mqdefault.jpg', 'width': 320, 'height': 180}, 'high': {'url': 'https://i.ytimg.com/vi/B-MMBv39WX4/hqdefault.jpg', 'width': 480, 'height': 360}}",Steven Ndukwu,none,2025-09-17T19:07:25Z,B-MMBv39WX4,"<iframe width=""480"" height=""270"" src=""//www.youtube.com/embed/B-MMBv39WX4"" frameborder=""0"" allow=""accelerometer; autoplay; clipboard-write; encrypted-media; gyroscope; picture-in-picture; web-share"" referrerpolicy=""strict-origin-when-cross-origin"" allowfullscreen></iframe>",Productivity
17,2025-09-17T19:00:08Z,UCv8G-xZ_BBGufjbN6jbvLMQ,72 Hour Deodorant Shouldn&#39;t Exist | Comedian Bo Dacious,"Just when Bo Dacious thought society couldn't get any nastier, BOOM, 72-hour deodorant hit the market. Follow Bo Dacious on ...","{'default': {'url': 'https://i.ytimg.com/vi/5Rjz_xJAMZ4/default.jpg', 'width': 120, 'height': 90}, 'medium': {'url': 'https://i.ytimg.com/vi/5Rjz_xJAMZ4/mqdefault.jpg', 'width': 320, 'height': 180}, 'high': {'url': 'https://i.ytimg.com/vi/5Rjz_xJAMZ4/hqdefault.jpg', 'width': 480, 'height': 360}}",Chocolate Sundaes Comedy,none,2025-09-17T19:00:08Z,5Rjz_xJAMZ4,"<iframe width=""480"" height=""270"" src=""//www.youtube.com/embed/5Rjz_xJAMZ4"" frameborder=""0"" allow=""accelerometer; autoplay; clipboard-write; encrypted-media; gyroscope; picture-in-picture; web-share"" referrerpolicy=""strict-origin-when-cross-origin"" allowfullscreen></iframe>",Entertainment
31,2025-09-17T18:31:26Z,UCKLSjhp6XZUEYDT1DMcrj8w,Fearless Gen Z Lady SHAKES African Leaders | Boldly EXPOSES RUTO in Public!,A fearless Gen Z lady has shaken the entire African leadership with her unapologetic words that EXPOSED President William ...,"{'default': {'url': 'https://i.ytimg.com/vi/P6iDAWnPKz8/default.jpg', 'width': 120, 'height': 90}, 'medium': {'url': 'https://i.ytimg.com/vi/P6iDAWnPKz8/mqdefault.jpg', 'width': 320, 'height': 180}, 'high': {'url': 'https://i.ytimg.com/vi/P6iDAWnPKz8/hqdefault.jpg', 'width': 480, 'height': 360}}",Make Afrika Great ,none,2025-09-17T18:31:26Z,P6iDAWnPKz8,"<iframe width=""480"" height=""270"" src=""//www.youtube.com/embed/P6iDAWnPKz8"" frameborder=""0"" allow=""accelerometer; autoplay; clipboard-write; encrypted-media; gyroscope; picture-in-picture; web-share"" referrerpolicy=""strict-origin-when-cross-origin"" allowfullscreen></iframe>",Current Events
11,2025-09-17T18:30:47Z,UCTNr0N__QwstBhgCtvQcjhA,White Woman “PISSES OFF” Her Community After Speaking Out About Charlie Kirk,Join our channel to get access to perks: https://www.youtube.com/channel/UCTNr0N__QwstBhgCtvQcjhA/join Today we take a ...,"{'default': {'url': 'https://i.ytimg.com/vi/ZpuMWwvKjSE/default.jpg', 'width': 120, 'height': 90}, 'medium': {'url': 'https://i.ytimg.com/vi/ZpuMWwvKjSE/mqdefault.jpg', 'width': 320, 'height': 180}, 'high': {'url': 'https://i.ytimg.com/vi/ZpuMWwvKjSE/hqdefault.jpg', 'width': 480, 'height': 360}}",Black Discoveries,none,2025-09-17T18:30:47Z,ZpuMWwvKjSE,"<iframe width=""480"" height=""270"" src=""//www.youtube.com/embed/ZpuMWwvKjSE"" frameborder=""0"" allow=""accelerometer; autoplay; clipboard-write; encrypted-media; gyroscope; picture-in-picture; web-share"" referrerpolicy=""strict-origin-when-cross-origin"" allowfullscreen></iframe>",History
47,2025-09-17T17:51:18Z,UC-4h1XQ47sf0vbFwJvuBhEA,Daily Quiz - Which African country is home to the Great Rift Valley?,Daily Quiz - Which African country is home to the Great Rift Valley? ▭▭▭▭▭▭▭▭▭ The New African Channel is an African ...,"{'default': {'url': 'https://i.ytimg.com/vi/U3_rc00ClXI/default.jpg', 'width': 120, 'height': 90}, 'medium': {'url': 'https://i.ytimg.com/vi/U3_rc00ClXI/mqdefault.jpg', 'width': 320, 'height': 180}, 'high': {'url': 'https://i.ytimg.com/vi/U3_rc00ClXI/hqdefault.jpg', 'width': 480, 'height': 360}}",The New Africa Channel,none,2025-09-17T17:51:18Z,U3_rc00ClXI,"<iframe width=""480"" height=""270"" src=""//www.youtube.com/embed/U3_rc00ClXI"" frameborder=""0"" allow=""accelerometer; autoplay; clipboard-write; encrypted-media; gyroscope; picture-in-picture; web-share"" referrerpolicy=""strict-origin-when-cross-origin"" allowfullscreen></iframe>",Current Events
25,2025-09-17T17:37:57Z,UCwZ2vurIl_X8rv0Dv4mu12A,"Nuri Muhammad On Forbidden Sciences, Learning How To Be Loved, and Master Teachings","Take The Challenge! Download your FREE worksheet with action steps, habit tips, and a commitment to supporting Black ...","{'default': {'url': 'https://i.ytimg.com/vi/0OiQZMNp89E/default.jpg', 'width': 120, 'height': 90}, 'medium': {'url': 'https://i.ytimg.com/vi/0OiQZMNp89E/mqdefault.jpg', 'width': 320, 'height': 180}, 'high': {'url': 'https://i.ytimg.com/vi/0OiQZMNp89E/hqdefault.jpg', 'width': 480, 'height': 360}}",I Never Knew Tv,none,2025-09-17T17:37:57Z,0OiQZMNp89E,"<iframe width=""480"" height=""270"" src=""//www.youtube.com/embed/0OiQZMNp89E"" frameborder=""0"" allow=""accelerometer; autoplay; clipboard-write; encrypted-media; gyroscope; picture-in-picture; web-share"" referrerpolicy=""strict-origin-when-cross-origin"" allowfullscreen></iframe>",Social Issues
35,2025-09-17T17:01:09Z,UCrPq2ekHx2vZtuyG3wUx0_g,Justice For Trey Reed!,,"{'default': {'url': 'https://i.ytimg.com/vi/mOtDs81m_fE/default.jpg', 'width': 120, 'height': 90}, 'medium': {'url': 'https://i.ytimg.com/vi/mOtDs81m_fE/mqdefault.jpg', 'width': 320, 'height': 180}, 'high': {'url': 'https://i.ytimg.com/vi/mOtDs81m_fE/hqdefault.jpg', 'width': 480, 'height': 360}}",On the Shoulders of Giants ,none,2025-09-17T17:01:09Z,mOtDs81m_fE,"<iframe width=""480"" height=""270"" src=""//www.youtube.com/embed/mOtDs81m_fE"" frameborder=""0"" allow=""accelerometer; autoplay; clipboard-write; encrypted-media; gyroscope; picture-in-picture; web-share"" referrerpolicy=""strict-origin-when-cross-origin"" allowfullscreen></iframe>",Social Issues
23,2025-09-17T12:20:00Z,UCC0XWOgSBcwNstXbPX2cbpg,They Are INTlMlDATlNG This BOLD Black Lady for REVEALING This F0RBIDDEN WHlTE History - A MUST WATCH,"For copyright matters, takedown, or complaint please contact: historicalafrika@gmail.com SPECIAL CREDIT: TWINSHANGOUT ...","{'default': {'url': 'https://i.ytimg.com/vi/8KkIaFVNvL0/default.jpg', 'width': 120, 'height': 90}, 'medium': {'url': 'https://i.ytimg.com/vi/8KkIaFVNvL0/mqdefault.jpg', 'width': 320, 'height': 180}, 'high': {'url': 'https://i.ytimg.com/vi/8KkIaFVNvL0/hqdefault.jpg', 'width': 480, 'height': 360}}",Historical Africa,none,2025-09-17T12:20:00Z,8KkIaFVNvL0,"<iframe width=""480"" height=""360"" src=""//www.youtube.com/embed/8KkIaFVNvL0"" frameborder=""0"" allow=""accelerometer; autoplay; clipboard-write; encrypted-media; gyroscope; picture-in-picture; web-share"" referrerpolicy=""strict-origin-when-cross-origin"" allowfullscreen></iframe>",History
13,2025-09-17T12:00:05Z,UCIxrFTHZybtTgq8X7itOAkQ,London City What It&#39;s Like Now ( Is Britain Broken!!! ),"London City What It's Like Now ( Is Britain Broken!!! ) London has changed… and you won't believe what it looks like now!, in this ...","{'default': {'url': 'https://i.ytimg.com/vi/zDoPvKWlXjI/default.jpg', 'width': 120, 'height': 90}, 'medium': {'url': 'https://i.ytimg.com/vi/zDoPvKWlXjI/mqdefault.jpg', 'width': 320, 'height': 180}, 'high': {'url': 'https://i.ytimg.com/vi/zDoPvKWlXjI/hqdefault.jpg', 'width': 480, 'height': 360}}",Blackman Da Traveller,none,2025-09-17T12:00:05Z,zDoPvKWlXjI,"<iframe width=""480"" height=""270"" src=""//www.youtube.com/embed/zDoPvKWlXjI"" frameborder=""0"" allow=""accelerometer; autoplay; clipboard-write; encrypted-media; gyroscope; picture-in-picture; web-share"" referrerpolicy=""strict-origin-when-cross-origin"" allowfullscreen></iframe>",Travel
24,2025-09-17T06:10:19Z,UC12lU5ymIvSpgl8KntDQUQA,Honor Codes In Black Men’s Culture,Kickstarter: https://www.kickstarter.com/projects/83432348/home-team-history-presents-kings-of-africa Patreon: ...,"{'default': {'url': 'https://i.ytimg.com/vi/9-03gbn92Wk/default.jpg', 'width': 120, 'height': 90}, 'medium': {'url': 'https://i.ytimg.com/vi/9-03gbn92Wk/mqdefault.jpg', 'width': 320, 'height': 180}, 'high': {'url': 'https://i.ytimg.com/vi/9-03gbn92Wk/hqdefault.jpg', 'width': 480, 'height': 360}}",HomeTeam History,none,2025-09-17T06:10:19Z,9-03gbn92Wk,"<iframe width=""480"" height=""270"" src=""//www.youtube.com/embed/9-03gbn92Wk"" frameborder=""0"" allow=""accelerometer; autoplay; clipboard-write; encrypted-media; gyroscope; picture-in-picture; web-share"" referrerpolicy=""strict-origin-when-cross-origin"" allowfullscreen></iframe>",History
45,2025-09-16T22:30:59Z,UCLjzzg-cFWpEEjnWCOpXp3Q,Omali Yeshitela  On Escalating Political Violence and the Way Forward,"On September 14, 2025, Omali Yeshitela, Chairman of the African People's Socialist Party spoke at the Uhuru Solidarity ...","{'default': {'url': 'https://i.ytimg.com/vi/YXfs0FjKUGI/default.jpg', 'width': 120, 'height': 90}, 'medium': {'url': 'https://i.ytimg.com/vi/YXfs0FjKUGI/mqdefault.jpg', 'width': 320, 'height': 180}, 'high': {'url': 'https://i.ytimg.com/vi/YXfs0FjKUGI/hqdefault.jpg', 'width': 480, 'height': 360}}",The Burning Spear TV,none,2025-09-16T22:30:59Z,YXfs0FjKUGI,"<iframe width=""480"" height=""360"" src=""//www.youtube.com/embed/YXfs0FjKUGI"" frameborder=""0"" allow=""accelerometer; autoplay; clipboard-write; encrypted-media; gyroscope; picture-in-picture; web-share"" referrerpolicy=""strict-origin-when-cross-origin"" allowfullscreen></iframe>",Current Events
10,2025-09-16T20:15:00Z,UCZEMyEeGRnkGERZTWEGLGPg,Farrakhan UNCENSORED: Watch This Immediately If You Are Black,Black Culture Unlocked is a movement focused on bringing the raw truth and real history to the culture. Our mission is to write our ...,"{'default': {'url': 'https://i.ytimg.com/vi/AclcQSetOng/default.jpg', 'width': 120, 'height': 90}, 'medium': {'url': 'https://i.ytimg.com/vi/AclcQSetOng/mqdefault.jpg', 'width': 320, 'height': 180}, 'high': {'url': 'https://i.ytimg.com/vi/AclcQSetOng/hqdefault.jpg', 'width': 480, 'height': 360}}",Black Culture Unlocked,none,2025-09-16T20:15:00Z,AclcQSetOng,"<iframe width=""480"" height=""270"" src=""//www.youtube.com/embed/AclcQSetOng"" frameborder=""0"" allow=""accelerometer; autoplay; clipboard-write; encrypted-media; gyroscope; picture-in-picture; web-share"" referrerpolicy=""strict-origin-when-cross-origin"" allowfullscreen></iframe>",Social Issues
18,2025-09-16T18:22:53Z,UCABZ7Z6SBTp4IsARDceOq7w,Dame Dash Calls Charlemagne Tha God “Gay” During Interview After Being Called ‘Broke’ - HP News,https://hypersclub.com/ - Dame Dash would stop by 'The Breakfast Club' and as expected has caused many people to react.,"{'default': {'url': 'https://i.ytimg.com/vi/AvTUFxcJCvc/default.jpg', 'width': 120, 'height': 90}, 'medium': {'url': 'https://i.ytimg.com/vi/AvTUFxcJCvc/mqdefault.jpg', 'width': 320, 'height': 180}, 'high': {'url': 'https://i.ytimg.com/vi/AvTUFxcJCvc/hqdefault.jpg', 'width': 480, 'height': 360}}",HYPE+,none,2025-09-16T18:22:53Z,AvTUFxcJCvc,"<iframe width=""480"" height=""270"" src=""//www.youtube.com/embed/AvTUFxcJCvc"" frameborder=""0"" allow=""accelerometer; autoplay; clipboard-write; encrypted-media; gyroscope; picture-in-picture; web-share"" referrerpolicy=""strict-origin-when-cross-origin"" allowfullscreen></iframe>",Entertainment
44,2025-09-16T17:43:21Z,UC4m46pCBkMEyy8gk26WKqbA,#Greensboro Live 85 South Sept 21st!,,"{'default': {'url': 'https://i.ytimg.com/vi/X_lsCTH5fZQ/default.jpg', 'width': 120, 'height': 90}, 'medium': {'url': 'https://i.ytimg.com/vi/X_lsCTH5fZQ/mqdefault.jpg', 'width': 320, 'height': 180}, 'high': {'url': 'https://i.ytimg.com/vi/X_lsCTH5fZQ/hqdefault.jpg', 'width': 480, 'height': 360}}",The 85 South Comedy Show,none,2025-09-16T17:43:21Z,X_lsCTH5fZQ,"<iframe width=""480"" height=""270"" src=""//www.youtube.com/embed/X_lsCTH5fZQ"" frameborder=""0"" allow=""accelerometer; autoplay; clipboard-write; encrypted-media; gyroscope; picture-in-picture; web-share"" referrerpolicy=""strict-origin-when-cross-origin"" allowfullscreen></iframe>",Entertainment
54,2025-09-16T14:03:23Z,UCHvnMsLnyQZscrq-fOckiiw,Jamie Lee Curtis: Why The Lost Bus Is the Most Important Project of Her Life,"In this special BlackTree TV interview, Jamaal Finkley sits down with the legendary Jamie Lee Curtis to talk about her role as ...","{'default': {'url': 'https://i.ytimg.com/vi/2HZq1DpyWhA/default.jpg', 'width': 120, 'height': 90}, 'medium': {'url': 'https://i.ytimg.com/vi/2HZq1DpyWhA/mqdefault.jpg', 'width': 320, 'height': 180}, 'high': {'url': 'https://i.ytimg.com/vi/2HZq1DpyWhA/hqdefault.jpg', 'width': 480, 'height': 360}}",BlackTree TV,none,2025-09-16T14:03:23Z,2HZq1DpyWhA,"<iframe width=""480"" height=""270"" src=""//www.youtube.com/embed/2HZq1DpyWhA"" frameborder=""0"" allow=""accelerometer; autoplay; clipboard-write; encrypted-media; gyroscope; picture-in-picture; web-share"" referrerpolicy=""strict-origin-when-cross-origin"" allowfullscreen></iframe>",Entertainment
38,2025-09-16T00:23:15Z,UCPk29gUc_ltOGQ6f3Lh5kCg,Riverbend - Los Angeles Premiere Tickets Now On Sale @ AmericanCinematheque.com #moviesyoushouldknow,"Riverbend will screen in Los Angeles, CA in 35mm for the first time ever on October 14th, 2025 at the Aero Theatre in Santa ...","{'default': {'url': 'https://i.ytimg.com/vi/xvakibmsJYM/default.jpg', 'width': 120, 'height': 90}, 'medium': {'url': 'https://i.ytimg.com/vi/xvakibmsJYM/mqdefault.jpg', 'width': 320, 'height': 180}, 'high': {'url': 'https://i.ytimg.com/vi/xvakibmsJYM/hqdefault.jpg', 'width': 480, 'height': 360}}",Reelblack One,none,2025-09-16T00:23:15Z,xvakibmsJYM,"<iframe width=""480"" height=""270"" src=""//www.youtube.com/embed/xvakibmsJYM"" frameborder=""0"" allow=""accelerometer; autoplay; clipboard-write; encrypted-media; gyroscope; picture-in-picture; web-share"" referrerpolicy=""strict-origin-when-cross-origin"" allowfullscreen></iframe>",Entertainment
5,2025-09-15T22:45:05Z,UCJa58Tf70HC5q2oQDNBrJ2g,Africans and the matter of ANCESTRY:- The Forgotten Roots:- The African Diaspora Storytelling,"In this video, we explore the rich history and significance of African traditional religion and spirituality, often misunderstood and ...","{'default': {'url': 'https://i.ytimg.com/vi/R-taiESlpJo/default.jpg', 'width': 120, 'height': 90}, 'medium': {'url': 'https://i.ytimg.com/vi/R-taiESlpJo/mqdefault.jpg', 'width': 320, 'height': 180}, 'high': {'url': 'https://i.ytimg.com/vi/R-taiESlpJo/hqdefault.jpg', 'width': 480, 'height': 360}}",AClasses Media,none,2025-09-15T22:45:05Z,R-taiESlpJo,"<iframe width=""480"" height=""270"" src=""//www.youtube.com/embed/R-taiESlpJo"" frameborder=""0"" allow=""accelerometer; autoplay; clipboard-write; encrypted-media; gyroscope; picture-in-picture; web-share"" referrerpolicy=""strict-origin-when-cross-origin"" allowfullscreen></iframe>",History
0,2025-09-15T21:39:45Z,UCTis64XH8HrxE7GhEkA6YmA,"WILL POGBA MAKE FRANCE WORLD CUP SQUAD, AND WHO WILL HE REPLACE? IS THIS GALATASARAY BEST TEAM EVER?","In a clip from Episode 94, the guys talk about if Pogba will make the France World Cup squad, who he would replace, and if this ...","{'default': {'url': 'https://i.ytimg.com/vi/Jf-fUJxJqFg/default.jpg', 'width': 120, 'height': 90}, 'medium': {'url': 'https://i.ytimg.com/vi/Jf-fUJxJqFg/mqdefault.jpg', 'width': 320, 'height': 180}, 'high': {'url': 'https://i.ytimg.com/vi/Jf-fUJxJqFg/hqdefault.jpg', 'width': 480, 'height': 360}}",5ASIDE Media,none,2025-09-15T21:39:45Z,Jf-fUJxJqFg,"<iframe width=""480"" height=""270"" src=""//www.youtube.com/embed/Jf-fUJxJqFg"" frameborder=""0"" allow=""accelerometer; autoplay; clipboard-write; encrypted-media; gyroscope; picture-in-picture; web-share"" referrerpolicy=""strict-origin-when-cross-origin"" allowfullscreen></iframe>",Sports
